index,dayId,date,name,traffic,newsTitle,newsSnippet
51136,20170214,2017-02-14,Valentine S Day 2017,"100,000+",Valentines Day 2017 ideas for couples Plan the perfect date with these cheap,Its finally Valentines Day  the most romantic day of the year The most romantic 24hours of the year has developed a reputation for consumers splashing out on fancy candy OTT gifts and pricey flowers  but there are ways to accomplish all of these
51137,20170214,2017-02-14,Valentines Card Messages,"2,000+",Valentines Day Puns  Poems to Put In Your Cards 2017,Happy Valentines Day Whether you are celebrating with friends lovers or significant others you may be trying to think of the right words to put inside your Valentines Day cards From poems to cheeky puns check out our top picks for what to write
51138,20170214,2017-02-14,Valentines Day Cards,"2,000+",Retired mailman 89 flooded with Valentines Day cards from strangers,Gaboardi received over 350 cards from across the nation after the Facebook post was shared over 100 times Now the Valentines Day greetings are rolling in A teacher in Arizona who is friends with HenriquesParker had her thirdgrade students make
51139,20170214,2017-02-14,Valentines Day Images,"5,000+",Valentines Day 2017 5 romantic party themes and how to decorate your home,Source Thinkstock Images With Valentines Day here everyone is going gaga over how to get it right to make the day extra special for their partner From choosing the best gifts to getting the right look and prepping for each day of the week well
51140,20170214,2017-02-14,Valentines Greetings,"10,000+",Who says shovelling cant be romantic Snow storm Valentines Day greetings,Romantic gestures have a different meaning in Newfoundland and Labrador when theres a snow storm on the way Plowing your beloveds driveway salting their stairs and sharing a bag of alldressed storm chips are just some of the ways you can show
51141,20170214,2017-02-14,Valentines Picture,"2,000+",Football presenter tweets picture to put you off Valentines Day for life,Happy Valentines Day to everyone  but heres a pic to put you off Valentines Day for life  tweeted Kamara to his 17 Twitter followers Youre a legend for this one Kammy Possibly the creepiest Valentines message ever replied one person
51142,20170214,2017-02-14,bouquet of flowers,"2,000+",Ask The Pharmacist Give your Valentine a healing bouquet of flowers,Not just any flowers flowers with medicinal power You see many of these beautiful and sweetsmelling plants are also powerful healers that deserve a place on your natural medicine cabinet You can put together a healing bouquet of remedies made
51143,20170214,2017-02-14,love letter,"2,000+",What a love letter looks like in 2017,Love letters have been dead so long its not worth giving them a eulogy Gone are the days of living vicariously through the saccharine letters exchanged between Ronald and Nancy Reagan And gone is the paper trail that gave us way too much insight
51144,20170214,2017-02-14,roses,"2,000+",Valentines Day flowers to woo your loved one  where to get the best same day,THIS Valentines Day A BUNCH of 12 red roses is the quintessential gift giving retailers the chance to pump up the price of bouquets around this time of year But there are still deals to be found with some supermarkets selling a bunch of red roses
51145,20170215,2017-02-15,Anti Semitic,"2,000+",Japan hotel operator under fire for antiSemitic remarks,The operator of a Japanese hotel chain is already in hot water for denying a Japanese World War II atrocity has come under fire for reported antiSemitic remarks Toshio Motoya is CEO of APA Group which calls itself Japans largest hotel chain and
51146,20170215,2017-02-15,Derrick Williams,"2,000+",Cleveland Cavaliers finally have Derrick Williams and some memories Terry,CLEVELAND Ohio  Once upon a time there was talk about Derrick Williams playing for the Cavaliers The year was 2011 Plain Dealer reporter Ginger Christ and I reflect back on the 2011 NBA draft and it was a franchise changing moment Just think if
51147,20170215,2017-02-15,Everything Everything,"5,000+",The Everything Everything trailer is here and its everything,That lifelong grounding is the plight of Maddy the protagonist of the upcoming movie Everything Everything adapted from the YA novel of the same name by awardwinning author Nicola Yoon Allergic to everything 18yearold Maddy Amandla Stenberg
51148,20170215,2017-02-15,Ivanka Trump,"2,000+",US ethics watchdog urges probe into Conways promotion of Ivanka Trumps,The US governments ethics watchdog urged the White House to investigate and possibly discipline President Donald Trumps counsellor Kellyanne Conway for comments she made about Ivanka Trumps fashion line according to a letter made public
51149,20170215,2017-02-15,Nokia 3310,"2,000+",Who needs a smartphone The resilient Nokia 3310 is coming back,A new version of the Nokia 3310 one of a line of seemingly indestructible cell phones from the Finnish manufacturer will be announced at an industry conference later this month according to VentureBeats Evan Blass Released in 2000 the 3310 will
51150,20170215,2017-02-15,PewDiePie,"2,000+",PewDiePies BusinessDeal Implosions Show That Digital Celebrities Are Now,PewDiePie has lost his deals with Disneys Maker Studios and YouTube in the wake of his illadvised pranks to pay random strangers to spout antiSemitic sentiments Perhaps counterintuitively one of the key takeaways from the turmoil is this Digital
51151,20170215,2017-02-15,Serge Ibaka,"2,000+",How Does the Serge Ibaka Trade Shake Things Up In the NBA Eastern Conference,Soon after the Toronto Raptors traded guard Terrence Ross and a 2017 first round pick in exchange for Orlandos Serge Ibaka The forward addressed a glaring hole on Torontos roster which was a starting forward who can easily defend the pickandroll
51152,20170216,2017-02-16,A Cure For Wellness,"2,000+",A Cure For Wellness is about as weird as modern Hollywood movies get,It isnt every week month or even year that Hollywood bankrolls a movie as ambitiously bugfuck as A Cure For Wellness Equal parts baroque fairytale atmospheric mystery and hideous bodyhorror nightmare the film puts what could have been a
51153,20170216,2017-02-16,Amandla Stenberg,"2,000+",Amandla Stenberg on Shaving Her Head SelfAcceptance Has Nothing To Do With,Amandla Stenberg is fierce and freshfaced on the cover of the latest issue of Dazed magazine available February 16th The 18yearold actress also shared the cover with actor Ashton Sanders where they opened up about movie roles using their
51154,20170216,2017-02-16,Kate Upton,"2,000+",Kate Upton Its OK not to love yourself every second of every day,This may be the third time Kate Upton is gracing the Sports Illustrated Swimsuit Issue cover but shes now has a new approach to her sizzling spread This year I had a completely different mindset about my body and instead of always trying to fit in
51155,20170216,2017-02-16,Kim Jong Nam,"2,000+",Kim Jongnam the Hunted Heir to a Dictator Who Met Death in Exile,The absence of Kim Jongnam  the eldest son of the family who was bound by Korean tradition to preside over the funeral  was all the evidence outside analysts needed to see how isolated he had become from the center of power in North Korea the
51156,20170216,2017-02-16,Nick Robinson,"2,000+",BBCs Nick Robinson forced to APOLOGISE over Father Christmas blunder,A number of listeners replied to Robinsons tweet with some festive puns of their own menhealuk posted Thanks for being a saint Nick and Share prices in tinsel temporarily dropped But they have now recovered Phew JennieBaillie added Phew
51157,20170216,2017-02-16,Yoo Ah In,"2,000+",Yoo Ah Ins Agency Clarifies Reports About His Diagnosis,Yoo Ah In who was recently diagnosed with a benign bone tumor has provided more details on his recent diagnosis However despite the clarifications misunderstandings have also risen due to misleading reports On February 16 a source from Yoo Ah In
51158,20170216,2017-02-16,pedophile,"2,000+",Goodbye Brian victims to pedophile priest,Damien Sheridan was a homesick young boarding student who was just looking for counselling from a trusted school chaplain But what he endured at the hands of notorious pedophile priest Brian Spillane was to ruin his life Now in his 40s Mr Sheridan
51159,20170217,2017-02-17,How Would You Feel Ed Sheeran,"5,000+",What is Ed Sheerans new single How Would You Feel Paean when is album,What is Ed Sheerans new single How Would You Feel Paean Ed Sheerans latest song to be released from his new Divide album is called How Would You Feel Paean The Grammy winner teased his 173million Twitter followers a day before the launch
51160,20170217,2017-02-17,Scarlett Byrne,"2,000+",It starts with equal pay and goes to free the nipple Harry Potters,She caused shockwaves after posing naked for the renewed Playboy celebrating the magazines return to nudity And Harry Potter actress Scarlett Byrne continues to stun as she posed for another snap from the sizzling shoot this time as she sported
51161,20170218,2017-02-18,Logan,"2,000+",Review Logan Could Be First Superhero Movie To Get Best Picture Nomination,The superhero genre gets one of its alltime great entries as Hugh Jackman returns a final time to the role that made him a superstar in director James Mangolds Logan The supposed last chapter in the superhero Wolverines cinematic saga Logan
51162,20170218,2017-02-18,Nba All Star 2017,"10,000+",NBA AllStar Game 2017 TV Schedule Odds Rosters and Predictions,The NBA AllStar Game marks the culmination of a weekend of celebration for a sport that continues to gain in popularity around the globe After the dunk and threepoint shooting contests on Saturday night the best players in the association take over
51163,20170218,2017-02-18,Terrence Romeo Engagement,"2,000+",Is Terrence Romeo engaged GlobalPort star says hes officially off the market,The 24year old GlobalPort Batang Pier guard announced his engagement via a post he made on Instagram last Wednesday Thank you Lord I was able to find my true love in this lifetime Romeo wrote on the caption of his Valentines Day post Im
51164,20170218,2017-02-18,Zealandia,"2,000+",Scientists tab new continent Zealandia,The researchers used recent and detailed satellitebased elevation along with gravity maps of the ancient seafloor to show that Zealandia is part of one unified region GSA Today Science Online Ahead of Print Zealandia Earths Hidden Continent
51165,20170219,2017-02-19,Lotto Result Feb 18 2017,"2,000+",LOTTERY RESULTS LIVE Watch the Lottery Lotto draw for Saturday February 18 2017,What would you do with that amount of money New home car luxury foreign holiday Although the odds might be slim if youve got a ticket for tonight then you are in it to win it As ever the take home the lifechanging prize you have to match
51166,20170220,2017-02-20,DeMarcus Cousins,"20,000+",11 winners and losers of the DeMarcus Cousins trade,It happened DeMarcus Boogie Cousins was traded from the Sacramento Kings It wasnt the deal many thought theyd get however as the Kings managed to acquire only a package based around young guard Buddy Hield and a protected firstround pick
51167,20170220,2017-02-20,Sam Shoaf,"2,000+",Sam Shoaf as MC Hammer wins Week 7 of Your Face Kids,MANILA  Sam Shoaf was named this weeks winner of the kiddie edition of Your Face Sounds Familiar on Sunday Shoaf is the only contestant to have won twice since the series started seven weeks ago as he received a perfect score of 24 points from
51168,20170220,2017-02-20,Tanay Rizal Accident,"10,000+",Driver in Rizals fatal bus crash loses two limbs dies,A report to Superintendent Christopher Dela Pena chief of the Tanay police said Lacorda was driving the bus with 58 riders around 845 am when the bus lost its brakes and bumped into an electric post near Magnetic Hill in front of Peligigrino Farm
51169,20170221,2017-02-21,Ginebra,"2,000+",Ginebra overcomes rival Star in Game 7 for PH Cup Finals berth,MANILA Philippines  Before a massive rowdy crowd of 20 221 people Barangay Ginebra San Miguel took care of business against rival Star Hotshots 8976 in Game 7 of the 2017 PBA Philippine Cup semifinals on Tuesday February 21 at the Mall of
51170,20170221,2017-02-21,Juliana Gomez,"2,000+",WATCH Richard Gomez and Lucy Torres daughter Juliana named Prom Queen,The 16yearold daughter of celebrity couple Richard Gomez and Lucy Torres has turned into a royalty Juliana Gomez was hailed as Prom Queen at her schools ball last night February 20 Makeup for the beautiful gomezjuliana
51171,20170221,2017-02-21,Kurt Cobain,"2,000+",Kurt Cobains mother says musician would be smugly proud of daughter,Frances Bean 24 posted a screenshot of a text message from Mrs Cobain on Instagram which read You were such a caring loving little girl and have turned into such a beautiful young woman He would be so smugly proud of you saying Hey thats MY
51172,20170221,2017-02-21,Lascanas,"2,000+",Catholic priest approached me for Lascanas confessionTrillanes,MANILA  Senator Antonio Trillanes IV revealed on Tuesday that a Catholic priest approached him to facilitate the presentation of retired SPO3 Arthur Lascañas to the public There was a priest a Catholic priest who approached me about this but you
51173,20170221,2017-02-21,NBA trades,"2,000+",Big questions lots of answers before NBA trade deadline,If theres a lesson of the last halfdecade of NBA trades its this When theres a rangy or athletic wing that has even a 10 percent chance of being decent try to grab that player as a throwin to a larger deal Think about how teams landed Crowder
51174,20170222,2017-02-22,Corey Brewer,"5,000+",Sources Lakers send Lou Williams to Rockets for Corey Brewer pick,HOUSTON  The Los Angeles Lakers have agreed to trade sixth man Lou Williams to the Houston Rockets in exchange for swingman Corey Brewer and an unprotected firstround pick sources told ESPN confirming multiple reports Williams brings
51175,20170222,2017-02-22,White,"2,000+",Olympic champs Meryl Davis Charlie White announce they will not compete in,WXYZ  Michigans hometown hereoes on the ice finally answered the question thats been hanging over their heads for years Meryl Davis and Charlie White will not be competing for the 2018 Olympic Games The ice dancing pair announced the news on
51176,20170223,2017-02-23,Davao Earthquake,"5,000+",2 hurt as magnitude 46 quake hits parts of Davao region,TAGUM CITY Davao del Norte  Two persons were injured when a waiting shed collapsed during a magnitude 46 quake that struck parts of Southern Mindanao on Thursday morning The tremor which was of tectonic origin occurred at around 950 am
51177,20170223,2017-02-23,De Lima,"5,000+",Lawyer congratulates De Lima as shes set to be Dutertes first political,Leila de Lima considers herself the first political prisoner under the Duterte administration according to Jose Manuel Chel Diokno a human rights lawyer who chair the Free Legal Aid Group FLAG Diokno spoke to reporters about this shortly after a
51178,20170223,2017-02-23,Exoplanet discovery,"500,000+",Exoplanet discovery Seven Earthsize exoplanets may have water,A nearby star has seven temperate Earthsize planets within a stones throw of each other  each offering its own chance for atmospheres oceans and life to emerge The exoplanet discovery suggests such Russiandoll systems of nested small worlds may
51179,20170223,2017-02-23,Leila de Lima,"5,000+",EXPLAINER What is Leila de Lima being accused of,MANILA Philippines  The Muntinlupa City Regional Trial Court RTC Branch 204 ordered the arrest of Senator Leila de Lima on Thursday February 23 over one of 3 criminal charges filed against her The cases stemmed from her alleged link to the drug
51180,20170223,2017-02-23,Ocean Adventure,"2,000+",Ocean Adventure In Subic Bay Taken Over By Armed Men Updates,The Ocean Adventure theme park in Subic Bay is now taken over by around seventy armed men A group of former investors led by foreign national Scott Niel Sharpe is said to be behind the attack hindering employees from entering the park
51181,20170223,2017-02-23,Poppy,"2,000+",Puppy Poppy beats the odds,A tiny puppy has beat all the odds to survive after being found lifeless in a field near Odiham Eight week old Poppy was discovered alongside two other dead dogs in North Warnborough and was struggling to breath after being heartlessly dumped by her
51182,20170223,2017-02-23,Something Just Like This,"2,000+",The Chainsmokers and Coldplay Team Up for New Single Something Just Like This,At Wednesdays BRIT Awards unstoppable DJ duo The Chainsmokers and British rockers Coldplay debuted a collaboration in the form of a new single Something Just Like This The surprise live performance convened the musicians for a track that meshes
51183,20170223,2017-02-23,The Big One,"2,000+",Canadian Forces on guard for Big One earthquake in BC,The Canadian Armed Forces is prepared to deploy thousands of armed forces members in response to a catastrophic earthquake colloquially known as The Big One that could strike anytime on the West Coast The military plan for response to such an
51184,20170223,2017-02-23,The Big One Earthquake,"2,000+",Canadian Forces on guard for Big One earthquake in BC,The Canadian Armed Forces is prepared to deploy thousands of armed forces members in response to a catastrophic earthquake colloquially known as The Big One that could strike anytime on the West Coast The military plan for response to such an
51185,20170223,2017-02-23,earthquake,"5,000+",Magnitude 44 earthquake hits off Vancouver Island,A magnitude 44 earthquake rumbled off the coast of Vancouver Island late Wednesday night Natural Resources Canada says it struck southwest of Port Alice BC at a depth of about 10 kilometres The federal agency says there are no reports of damage
51186,20170224,2017-02-24,7 New Planets,"2,000+",CNET UK podcast 515 Why new planets phones excite us again,On this weeks show Andrew Hoyle is joined by Rich Trenholm and special guest exCNET writer Nate Lanxon They discuss just why NASAs discovery of seven exoplanets orbiting close together around a nearby sun is so exciting Nate may or may not get
51187,20170224,2017-02-24,Amir Khan,"2,000+",Manny Pacquiao vs Amir Khan will be THE fight of 2017,Add to that the sense of this being Khans last chance to produce the careerdefining fight he believes is his destiny  and its simply unmissable While Floyd Mayweather has always been the Brits prize target  the Pacquaio fight has the potential
51188,20170224,2017-02-24,Deron Williams,"2,000+",The Mavericks let Deron Williams go and hes most likely Clevelandbound,A person with knowledge of the situation tells The Associated Press that Williams plans to join up with LeBron James to give the Cavs the backup point guard they need The person spoke on condition of anonymity Thursday because Williams has to clear
51189,20170224,2017-02-24,Google account,"5,000+",Gmail issue Why you shouldnt worry if you get unexpectedly signed out of,gmail google gmail error gmail issue google error google issue So if you have been unexpectedly signed out of you Gmail account on your desktop or smartphone all you need to do is follow some steps instead of worrying about it It is not a
51190,20170224,2017-02-24,How to Get Away With Murder,"2,000+",How to Get Away With Murder Season Finale Recap Who Killed Wes,Who killed Wes Its the question that has plagued us all season and we finally got the answer in last nights finale And it was an answer no one could have predicted If you guessed that Laurels father paid a goon to kill Wes and blow up Annalises
51191,20170224,2017-02-24,Jamby Madrigal,"2,000+",Aguirre names Madrigal solon in P100M bribe try,JUSTICE Secretary Vitaliano Aguirre II yesterday identified former Senator Jamby Madrigal and Laguna Representative Marlyn Len AlonteNaguiat as the persons who allegedly offered P100 million to highprofile inmates at the Armed Forces of the
51192,20170224,2017-02-24,NBA Trade Deadline,"2,000+",As NBA Trade Deadline Passes Major Players Stay Put,In the absence of any blockbuster deals before the NBAs trade deadline on Thursday afternoon several teams made moves that seemed unlikely to upend the leagues power structure The splashiest deal happened Sunday when the Sacramento Kings
51193,20170224,2017-02-24,Paul George,"2,000+",New Lakers Regime Now Faces Difficult but Doable Path to Paul George,LOS ANGELES  There wasnt enough time left in the seasonor talent left on the rosterfor the Boston Celtics to confidently deal for Paul George at Thursdays NBA trade deadline The Indiana Pacers meanwhile failed to acquire anything whatsoever
51194,20170224,2017-02-24,atheist,"2,000+",Pope Francis suggests better to be atheist than hypocritical Catholic,Pope Francis delivered another criticism of some members of his own Church on Thursday suggesting it is better to be an atheist than one of many Catholics who he said lead a hypocritical double life In improvised comments in the sermon of his
51195,20170225,2017-02-25,How To Get Away With A Murderer,"2,000+",Is Charles Mahoney Innocent On How To Get Away With Murder The Season 3,For a while there it looked like the How To Get Away With Murder Season 3 finale would end exactly the same way Season 2s finale did With a Mahoney man gunned down in the street But things didnt exactly turn out that way So is HTGAWMs Charles
51196,20170225,2017-02-25,Panagbenga 2017,"2,000+",Panagbenga 2017 Colors of Cordillera featured on street parade,BAGUIO CITYDark red for strawberries and vivid yellow for sunflowersthese were just some of the colors that stood out during Panagbenga 2017s Grand Street Parade On Saturday select elementary and high school students performed before a sea of
51197,20170225,2017-02-25,Sam Mangubat,"5,000+",Tawag Ng Tanghalan Feb 24 Finalists Carlmalone Montecido Sam Mangubat,Carlmalone Montecido and Sam Mangubat are the latest winners to join the roster of grand finalists of the popular noontime contest Seven semifinalists showcased their vocal chops throughout this week The voting results from the audience gave the top
51198,20170225,2017-02-25,Tawag Ng Tanghalan,"2,000+",Tawag Ng Tanghalan Feb 25 Episode Quarter 4 Round 6 SemiFinals Awit Ng Buhay,POPCORN TIME LIVE BLOG Before we close in on the largely anticipated Tawag Ng Tanghalan Quarter 4 semifinals the seven semifinalists Sam Mangubat Carlmalone Montecido Joylaine Canonio Jex De Castro Froilan Canlas Julia Faith Joaquin and
51199,20170226,2017-02-26,Dragon Ball Super Episode 80,"2,000+",Dragon Ball Super Episode 80 ReviewRecap Gohan vs Lavender,The second exhibition match between Universe 7 vs Universe 9 went underway this week in episode 80 of Dragon Ball Super Gohan has to step up to the plate to face off against the wolflike being called Lavender This episode also told us more about
51200,20170226,2017-02-26,Jim Paredes,"20,000+",Tensions erupt between Duterte Youth and Jim Paredes at EDSA 31 celebration,Musician and vocal Duterte critic Jim Paredes confronted members of the Duterte Youth whom he accused of trying to disrupt the EDSA 31 commemoration He said members of Duterte Youth should have gone to Luneta where Duterte supporters were
51201,20170226,2017-02-26,LG G6,"2,000+",LG G6 release date news and features,The LG G6 is the South Korean firms flagship smartphone for 2017 taking over from the innovativebutunsuccessful G5 The LG G5 certainly wasnt boring though With two rear cameras and an accessory slot that allowed you to modify the hardware it
51202,20170226,2017-02-26,Oscars 2017,"10,000+",Oscars 2017 how to watch the Academy Awards online,Its Oscars time everyone Football teams have gone back into hibernation and the fools gold that is the Golden Globes has become a little more than faded memory Tonight its time for the big leagues the 89th Academy Awards as Hollywood rolls out
51203,20170226,2017-02-26,TRANSPORT STRIKE,"5,000+",TRANSPORT STRIKE TOOL KIT  Special trips number coding lifting class,In view of the transport strike set for tomorrow Monday classes are suspended for public schools in all levels Suspension of classes for private schools is at the discretion of the school administration Number Coding is lifted ONLY for PUVs that
51204,20170226,2017-02-26,Transport Strike Feb 27,"10,000+",TRANSPORT STRIKE TOOL KIT  Special trips number coding lifting class,In view of the transport strike set for tomorrow Monday classes are suspended for public schools in all levels Suspension of classes for private schools is at the discretion of the school administration Number Coding is lifted ONLY for PUVs that
51205,20170227,2017-02-27,Auli I Cravalho,"2,000+",Moana star Aulii Cravalho laughs off flag incident during Oscar performance,Aulii Cravalho laughed off Sunday nights Oscars hiccup when a flag grazed her head during her performance of a song from Disneys Moana Im glad someone noticed it Cravalho said today on ABC News Good Morning America I did get a little
51206,20170227,2017-02-27,Bill Paxton,"20,000+",Bill Paxton Star of Big Love and Movie Blockbusters Dies at 61,Bill Paxton is remembered as a nice guy who was in good films you can watch with your family He costarred in a string of 1990s blockbusters and later played the lead in the critically acclaimed television drama Big Love By ELSA BUTLER on Publish
51207,20170227,2017-02-27,Casey Affleck,"10,000+",Casey Affleck Wins Best Actor Oscar for Manchester by the Sea,The wins came despite 2010 sexual harassment allegations that resurfaced as Afflecks Oscar prospects gathered steam Two civil lawsuits alleging unwanted advances were filed by female crew members on another movie and were settled out of court for
