index,dayId,date,name,traffic,newsTitle,newsSnippet
52249,20170106,2017-01-06,Daniel Chima Chukwu,"5,000+",Daniel Chima Chukwu Nigdy nie zapomnę kibiców Legii,Chukwu twierdzi że czynnikiem decydującym o wyborze Legii nie było to że stołeczny zespół dobrze zaprezentował się w Lidze Mistrzów i wystąpi w 116 finału Ligi Europy  To nie jest główny powód dla którego tu przyszedłem Wpłynęło na to wsparcie
52250,20170106,2017-01-06,Ed Sheeran,"20,000+",Ed Sheeran zaskoczył wszystkich Dwa nowe single wokalisty w sieci,To była jedna z najbardziej elektryzujących muzycznych wiadomości 2017 roku 1 stycznia za pośrednictwem social mediów Ed Sheeran zapowiedział że 6 stycznia zaprezentuje nową muzykę Zgodnie z obietnicami tego dnia w sieci pojawiły się jego dwa
52251,20170106,2017-01-06,Maciej Kot,"10,000+",Maciej Kot to dziwne uczucie bo nagle wylądowałem za podium,Maciej Kot skorzystał na tym że słabsze skoki w piątek oddali Austriak Stefan Kraft oraz Niemiec Markus Eisenbichler i niespodziewanie zajął czwarte miejsce w Turnieju Czterech Skoczni  To dziwne uczucie bo dzięki ich słabym skokom nagle
52252,20170106,2017-01-06,Myrcha,"5,000+",Kontrowersje wokół finansów KOD Arkadiusz Myrcha komentuje,To są pieniądze członków KODu kierownictwo musi się z tego rozliczyć życzę im by zrobili to w sposób absolutnie transparentny klarowny tak by nie było wątpliwości co do jakiejkolwiek złotówki  powiedział Myrcha który był gościem TVP Info
52253,20170106,2017-01-06,Po prostu przyjaźń,"20,000+",Po prostu przyjaźń czy Assasins Creed  na co do kina,Po prostu przyjaźń w reżyserii Filipa Zylbera to film o grupie przyjaciół których relacje w obliczu różnych życiowych zawirowań wystawione są na próbę  Zarys może się kojarzyć z takimi produkcjami jak Listy do M czy To tylko miłość Tu
52254,20170106,2017-01-06,Powidoki,"5,000+",Przedpremierowe pokazy filmu Powidoki,Bohaterem filmu Powidoki jest Władysław Strzemiński artysta który nie poddał się socrealizmowi i doświadczył dramatycznych skutków swoich wyborów artystycznych To film o tym jak socjalistyczna władza zniszczyła charyzmatycznego niepokornego
52255,20170106,2017-01-06,Puchar Świata W Skokach Narciarskich 2017,"10,000+",Kot zakończył Turniej Czterech Skoczni na 4 miejscu,Maciej Kot skoczył w drugiej serii ostatniego konkursu Turnieju Czterech Skoczni 135 metrów co dało mu 5 miejsce w Bischofshofen Polak TCS zakończył na 4 miejscu a do trzeciego Daniela Andre Tandego zabrakło mu jedynie 6 punktów Puchar Świata
52256,20170106,2017-01-06,Skoki,"20,000+",Matthias Prodinger  człowiek na wagę złota,Kamil Stoch wygrał  jako drugi Polak po Adamie Małyszu  Turniej Czterech Skoczni Piotr Żyła zajął drugie miejsce a czwarty był jeszcze Maciej Kot To był najlepszy występ BiałoCzerwonych w historii tej imprezy Za sukcesami naszych skoczków stoi
52257,20170106,2017-01-06,Stefan Horngacher,"5,000+",Stefan Horngacher przeżyłem wielki stres w Innsbrucku myślałem,Kiedy jednak pierwszy raz zobaczyłem go w budzie myślałem że turniej już się dla niego zakończył  mówił Stefan Horngacher trener polskiej kadry skoczków narciarskich po wielkim sukcesie BiałoCzerwonej ekipy na Turnieju Czterech Skoczni
52258,20170106,2017-01-06,TVP Sport,"20,000+",Hiszpania  Polska na żywo Transmisja TV stream online Gdzie,Hiszpania  Polska na żywo Transmisja TV stream online Gdzie oglądać Turniej w Irun Mecz piłkarzy ręcznych Hiszpania  Polska na żywo można obejrzeć w TVP Sport a także za darmo w internecie Relacja live w WP SportoweFakty Kuba Kaczmarek
52259,20170106,2017-01-06,TVP1,"5,000+",TVP1 spada z pozycji lidera Rządzi Polsat A przed telewizorami,Największą widownię w 2016 roku zgromadziła transmisja meczu PolskaPortugalia którą na antenie TVP1 oglądało 807 mln widzów To samo spotkanie w Polsacie śledziło 688 mln osób Na drugim miejscu znalazł się mecz Polaków z Niemcami  na
52260,20170106,2017-01-06,Temperatura,"10,000+",Mroźna noc w Radomskiem Temperatura spadnie nawet do 20,Instytut Meteorologii i Gospodarki Wodnej prognozuje temperaturę minimalną w nocy z 6 na 7 stycznia od 20C na wschodzie do 15C na zachodzie województwa mazowieckiego Temperatura maksymalna w dzień 7 stycznia wyniesie od 14C na
52261,20170106,2017-01-06,Trzej Królowie,"5,000+",Trzej Królowie w Hajduckim Betlejem,W towarzystwie Orkiestry Dętej Tramwajów Śląskich dotarli na plac kościelny Przed kościołem NSPJ Trzej Królowie złożyli pokłon Dzieciątku Jezus Uczestnicy marszu usłyszeli też fragment Ewangelii o złożeniu darów przez Mędrców przybyłych ze Wschody
52262,20170106,2017-01-06,Tvp Program,"5,000+",Tyle darów rok nam przyniósł Charytatywny koncert w TVP,kolędy i czcić chwałę Pana Każdego dnia dostajemy masę propozycji wzięcia udziału w akcjach charytatywnych jak najbardziej się w nie angażujemy  powiedziała na antenie TVP Info Anna Karwan wokalistka i finalistka programu The Voice of Poland
52263,20170106,2017-01-06,skoki narciarskie,"50,000+",Matthias Prodinger  człowiek na wagę złota,Kamil Stoch wygrał  jako drugi Polak po Adamie Małyszu  Turniej Czterech Skoczni Piotr Żyła zajął drugie miejsce a czwarty był jeszcze Maciej Kot To był najlepszy występ BiałoCzerwonych w historii tej imprezy Za sukcesami naszych skoczków stoi
52264,20170107,2017-01-07,Amber Cup 2017,"2,000+",Amber Cup 2017 Lechia obroniła trofeum Zadecydowały rzuty karne,Dla gdańszczan udział w turnieju Amber Cup zapoczątkował okres przygotowawczy Lechia po jesieni zajmuje 2 miejsce i ma wielką szansę walki o mistrzostwo Lechiści prestiżowo potraktowali występ w Ergo Arenie a trener Piotr Nowak skompletował
52265,20170107,2017-01-07,Anita Włodarczyk,"10,000+",Anita Włodarczyk sportowcem roku 2016,Anita Włodarczyk zwyciężyła w 82 Plebiscycie na Sportowca Roku organizowanym przez Przegląd Sportowy i TVP Najlepsza młociarka świata wyprzedziła Roberta Lewandowskiego i Piotra Małachowskiego Superczempiona za całokształt otrzymał
52266,20170107,2017-01-07,Arsenal,"2,000+",Preston  Arsenal na żywo Transmisja TV live stream online Gdzie,Mecz Preston  Arsenal odbędzie się w 132 finału FA Cup Zwycięzca awansuje do kolejnej rundy a w przypadku remisu odbędzie się jeszcze jedno spotkanie Ostatni raz obie drużyny rywalizowały ze sobą w 1999 roku w 116 finału Pucharu Anglii Arsenal
52267,20170107,2017-01-07,Dominik Nagy,"2,000+",LOTTO Ekstraklasa Dominik Nagy dołączył do Legii Warszawa,Dominik Nagy to kolejny nowy zawodnik Legii Warszawa  poinformowali mistrzowie Polski na swojej oficjalnej stronie Węgier podpisał kontrakt ze stołecznym klubem latem ubiegłego roku jednak w myśl jego ustaleń w rundzie jesiennej występował jeszcze
52268,20170107,2017-01-07,Ewa Chodakowska,"5,000+",Ewa Chodakowska jest W CIĄŻY Lefteris będzie wspaniałym tatą,Trenerka fitness jest od prawie 4 lat mężatką i nieraz już plotkowano na temat planów macierzyńskich Ewy Chodakowskiej Czy rzeczywiście gwiazda jest w ciąży A może Ewa Chodakowska planuje dziecko w 2017 roku Na te pytania Ewa odpowiedziała
52269,20170107,2017-01-07,Gala Mistrzów Sportu 2017,"5,000+",Gala Mistrzów Sportu 2017 Przemysław Krajewski z Azotów Puławy,Przemysław Krajewski został najlepszym sportowcem 2016 roku w woj lubelskim Piłkarz ręczny Azotów Puławy wygrał w 55 plebiscycie Kuriera Lubelskiego Wyniki ogłosiliśmy w piątek podczas 11 Wojewódzkiej Gali Mistrzów Sportu w hali Globus w
52270,20170107,2017-01-07,HGTV,"5,000+",Ruszyła polska wersja kanału HGTV Oto co znajdziemy w ramówce,HGTV Home  Garden to polska wersja amerykańskiej telewizji o domu i ogrodzie uruchomiona przez Grupę TVN Na początek na antenie stacji znajdą się 4 premierowe polskie programy oraz pozycje zagraniczne z biblioteki Scripps Networks Interactive
52271,20170107,2017-01-07,Jerzy Kossela,"20,000+",Nie żyje współzałożyciel Czerwonych gitar Jerzy Kossela zmarł w,Jerzy Kossela nie żyje Współzałożyciel zespołu Czerwone gitary kompozytor wokalista gitarzysta i autor wielu tekstów zmarł w wieku 74 lat To on napisał słowa piosenek nuconych od lat 60 aż do dziś takich jak Matura czy Historia jednej
52272,20170107,2017-01-07,Kamil Stoch Żona,"5,000+",Kamil Stoch ze szczególnym wsparciem żony ZDJĘCIA,Kamil Stoch w piątek wygrał finałowy konkurs Turnieju Czterech Skoczni w Bischofshofen oraz klasyfikację generalną jubileuszowego turnieju Pod skocznią oprócz wsparcia dużej grupy polskich kibiców mógł liczyć również na doping swojej żony Ewy
52273,20170107,2017-01-07,Karolina Szostak,"5,000+",Karolina Szostak w bikini,Karolina Szostak to telewizyjna prezenterka kojarzona głównie ze sportem który jest jej wielką pasją W minionym roku przeszła wielką przemianę i teraz jej figura zmieniła się nie do poznania Nic więc dziwnego że od jakiegoś czasu nie stroni od
52274,20170107,2017-01-07,Maria Andrejczyk,"2,000+",Maria Andrejczyk z tytułem Odkrycie Roku,To był bardzo dobry wybór  mówiła Maria Andrejczyk i dodawała  Pierwsze razy smakują najlepiej w każdej dziedzinie życia ten smakuje niesamowicie Zawodniczka Hańczy Suwałki podziękowała również trenerowi Karolowi Sikorskiemu i rodzicom za
52275,20170107,2017-01-07,Natalia Partyka,"5,000+",Natalia Partyka Niepełnosprawnym Sportowcem Roku,W finale Polki grały oczywiście z Chinkami Grając do dwóch zwycięstw Partyka i Pęk zaczęły od porażki w deblu Na 11 wyrównała Natalia a decydujący cios zadała Karolina zwyciężając 31 Partyka w Rio wystąpiła też w zawodach pełnosprawnych  już
52276,20170107,2017-01-07,Plebiscyt Przeglądu Sportowego,"2,000+",Plebiscyt PS najlepszy sportowiec 2016 roku wybrany,W Teatrze Polskim w Warszawie miało miejsce rozstrzygnięcie 82 Plebiscytu Przeglądu Sportowego i TVP Na uroczystości wybrano 10 najlepszych sportowców Polski w roku 2016 Decyzją czytelników oraz telewidzów główna nagroda trafiła do
52277,20170107,2017-01-07,PlusLiga,"2,000+",PlusLiga zgodne zwycięstwa Asseco Resovii Rzeszów i,PlusLiga zgodne zwycięstwa Asseco Resovii Rzeszów i Jastrzębskiego Węgla Siatkarze Asseco Resovii Rzeszów rozbili beniaminka Espadon Szczecin 30 w 17 kolejce PlusLigi Zwycięstwa odniosły też Jastrzębski Węgiel BBTS BielskoBiała i Cuprum
52278,20170107,2017-01-07,Sandford Fleming,"1,000,000+",Sandford Fleming Kim jest kanadyjski wynalazca bohater Google Doodle,Sandford Fleming to kanadyjski inżynier i wynalazca który zasłynął z wprowadzenia czasu uniwersalnego i stref czasowych Fleming był twórcą pierwszego kanadyjskiego znaczka pocztowego Zainicjował szeroko zakrojone projekty miernicze i
52279,20170107,2017-01-07,Wielka Orkiestra Świątecznej Pomocy,"2,000+",Jak wyglądałyby szpitale bez pomocy Wielkiej Orkiestry Świątecznej,Gościem Dzień Dobry TVN był kardiochirurg Bohdan Maruszewski współtwórca WOŚP Jak zrodził się pomysł zbiórki pieniędzy na sprzęt medyczny w Klinice Kardiochirurgii w Centrum Zdrowia Dziecka w Warszawie Jak Maruszewski wspominał początki
52280,20170108,2017-01-08,Alarm smogowy,"10,000+",Alarm smogowy w Polsce Bardzo zła jakość powietrza w wielu,Warszawski Alarm Smogowy informuje z koleiże Zaleca się unikanie lub ograniczenie do minimum czasu przebywania na powietrzu zwłaszcza przez kobiety w ciąży dzieci i osoby starsze oraz przez osoby z astmą chorobami alergicznymi skóry oczu i
52281,20170108,2017-01-08,David Bowie,"5,000+",David Bowie Dziś obchodziłby 70 urodziny,David Robert Jones urodził się w Brixton w 1947 roku Jako nastolatek uczył się grać na saksofonie udzielał się także w kilku zespołach  The KonRads The King Bees The Mannish Boys i The Lower Third W roku 1966 narodził się David Bowie Pierwsze
52282,20170108,2017-01-08,FC Barcelona,"10,000+",Hiszpania FC Barcelona zagubiona ale Messi uratował punkt,Hit 17 kolejki Primera Division przyniósł sporą niespodziankę Barcelona męczyła się w Villarrealu i zremisowała zaledwie 11 Sytuacja klubu z Camp Nou byłaby jeszcze gorsza gdyby Leo Messi nie trafił przepięknie z rzutu wolnego w samej końcówce
52283,20170108,2017-01-08,Justyna Kowalczyk,"2,000+",Zwycięstwo Justyny Kowalczyk Polka najlepsza w biegu na 10 km,Polka triumfowała z przewagą ponad dwudziestu sekund nad Hanną Falk Szwedka potrafiła już wygrywać zawody pucharowe ale w sprincie który jest jej koronną konkurencją W biegu dystansowym Falk musiała uznać wyższość Kowalczyk Na najniższym
52284,20170108,2017-01-08,Kontakt,"5,000+",Zmiażdżona toyota po zderzeniu Kierowca wymusił pierwszeństwo,Kierowca toyoty nie ustąpił pierwszeństwa i zderzył się ze skodą na krajowej 53 w Łodziskach koło Ostrołęki woj mazowieckie  informuje policja Zdjęcia z miejsca zdarzenia otrzymaliśmy na Kontakt 24 od serwisu mojaostrolekapl Moja Ostrołęka
52285,20170108,2017-01-08,Kraina jutra,"5,000+",Program TV Cud purymowy Kraina jutra i Chinatown 080117,Kraina jutra to science fiction ale w wersji przygodowej nie naukowej Jego główną bohaterką jest nieprzystosowana nastolatka która wraz z byłym dziecięcym geniuszem spróbuje naprawić przyszłość Wartość dodana George Clooney znów jako aktor
52286,20170108,2017-01-08,Maikelele,"10,000+",Team Izak vs Team Maikelele  już dziś o 1915,W wywiadzie udzielonym po wczorajszym meczu Izak nie znając jeszcze swojego przeciwnika w finale oznajmił iż chciałby w finale zmierzyć się z Maikelele Jego prośba została spełniona i już dziś o 1800 obie formacje zagrają o trofeum turnieju ASUS
52287,20170108,2017-01-08,Marta Walczykiewicz,"2,000+",Marta Walczykiewicz w 10 najlepszych sportowców w Polsce,Na medal olimpijski czekałam dwadzieścia lat na tę statuetkę sześć  mówiła Marta Walczykiewicz po odebraniu Czempiona z rąk Moniki Pyrek dziękując wszystkim którzy przyczynili się do jej sukcesów Przypomnijmy że w minionym roku kaliska
52288,20170108,2017-01-08,Natalia Kukulska,"10,000+",Natalia Kukulska urodziła Pokazała nagranie z powitania córki w,Natalia Kukulska już wcześniej zdradziła że spodziewa się córki dla której przyszli rodzice wybrali imię Laura Jak poinformowała gwiazda na Instagramie dziewczynka urodziła 5 stycznia o godzinie 940 Informacji towarzyszy nagranie z powitania
52289,20170108,2017-01-08,PLK,"2,000+",Hit PLK dla Stelmetu Twarde Pierniki z pierwszą porażką w sezonie,Trudno mu się dziwić bo gra lidera PLK wyglądała fatalnie Stelmetowi z kolei wszystko wychodziło w tej części gry Fantastyczne zawody rozgrywał Vladimir Dragicević który zbierał punktował i asystował  był prawdziwym liderem obrońców tytułu
52290,20170108,2017-01-08,Przemysław Wałęsa,"100,000+",Przemysław Wałęsa nie żyje Syn byłego prezydenta miał 43 lata,Informację o śmierci syna byłego prezydenta jako pierwszy podał RMF FM Według stacji ciało Przemysława Wałęsy znalazł wieczorem w mieszkaniu w Gdańsku jeden z członków rodziny Na miejscu są funkcjonariusze policji i prokurator Według Polsat
52291,20170108,2017-01-08,Real Madryt,"10,000+",Real Madryt zdominuje jedenastkę FIFPro,Przed nami gala FIFA największe piłkarskie wydarzenie tego roku Na niej wyróżniony zostanie najlepszy piłkarz globu ale też najlepsza jedenastka ostatnich dwunastu miesięcy Według informacji dziennika AS w niej znajdzie się aż pięciu piłkarzy
52292,20170108,2017-01-08,Smog Warszawa,"10,000+",Olbrzymi smog w Warszawie Jest tragicznie Ostrzegajcie,Dziś w Warszawie stacje pomiarowe wskazują bardzo wysoki poziom stężenia zanieczyszczeń w powietrzu Po tym jak od rana za pośrednictwem mediów społecznościowych o smogu informowali mieszkańcy stolicy odpowiednie ostrzeżenia wydał także
52293,20170108,2017-01-08,Smog w Polsce,"5,000+",Rekord smogowy w Polsce Co robić podczas wysokich stężeń,Smog w Polsce tej zimy jeszcze nigdy nie był tak wysoki W Warszawie normy najgroźniejszych pyłów PM 25 przekraczają 1000 proc Tak samo niebezpiecznie jest w całej Małopolsce i środkowej części kraju Jak się zachować podczas alarmu smogowego
52294,20170108,2017-01-08,Studniówka 2017,"2,000+",Studniówki 2017 Katolickie Liceum Ogólnokształcące imienia Filipa,Studniówki 2017 Katolickie Liceum Ogólnokształcące imienia Filipa Neri w Radomiu jp Echo Dnia Radomskie 8 stycznia 2017 08012017 Aktualizacja 8 stycznia 2017 2128 08012017 2128 Echo Dnia Radomskie 0
52295,20170108,2017-01-08,WOŚP,"10,000+",15 stycznia jednoczymy ponad wszystkimi układami politycznymi,Szef WOŚP przypomniał że trwa budowa miasteczka medialnego pod Pałacem Kultury i Nauki w Warszawie  To będzie zupełna nowość też ogromne wyzwanie żeby zrobić studio telewizyjne można powiedzieć w szczerym polu Na wielkim Placu Defilad
52296,20170108,2017-01-08,Zbigniew Cybulski,"10,000+",Zbigniew Cybulski zginął 8 stycznia 1967 roku Mija 50 lat,Zbigniew Cybulski był jednym z najbardziej obiecujących aktorów powojennego kina Grał u takich reżyserów jak Andrzej Wajda czy Wojciech Has Jego nagła i tragiczna śmierć wstrząsnęła polskim kinem Zbigniew Cybulski zmarł 8 stycznia 1967 roku
52297,20170108,2017-01-08,jakość powietrza,"5,000+",Bardzo zła jakość powietrza Zalecamy nie wychodzić,Dobowe normy zanieczyszczenia powietrza nie zostały przekroczone dlatego Wojewódzki Inspektorat Ochrony Środowiska nie wprowadza alertu smogowego Ale jego przedstawiciel przyznaje że jakość powietrza jest bardzo zła dlatego w niedzielę radzi
52298,20170108,2017-01-08,smog,"10,000+",Jak i kiedy powstaje smog,Smog londyński w skład którego wchodzą tlenek siarkiIV tlenki azotu tlenki węgla sadza oraz trudno opadające pyły Pokrywa miasta przeważnie w okresie od listopada do stycznia podczas inwersji temperatur w umiarkowanej strefie klimatycznej
52299,20170108,2017-01-08,zanieczyszczenia powietrza,"10,000+",Bardzo zła jakość powietrza Zalecamy nie wychodzić,Dobowe normy zanieczyszczenia powietrza nie zostały przekroczone dlatego Wojewódzki Inspektorat Ochrony Środowiska nie wprowadza alertu smogowego Ale jego przedstawiciel przyznaje że jakość powietrza jest bardzo zła dlatego w niedzielę radzi
52300,20170109,2017-01-09,Golden Globes 2017,"10,000+",Złote Globy 2017 wyniki ogłoszone przez Zobacz kto wręcza Golden Globes 2017,Zwycięzcy Golden GLobes 2017 odbiorą statuetki z rąk równie wielkich gwiazd kina Sprawdźcie listę wręczających Złote Globy 2017 Zdjęcie z artykułu Złote Globy 2017 wyniki ogłoszone przez Zobacz Złote Globy 2016  Leonardo DiCaprio
52301,20170109,2017-01-09,Iwona Cygan,"2,000+",Podejrzany o zabójstwo Iwony Cygan zatrzymany,Policjanci zatrzymali w Austrii Pawła K podejrzanego o zabójstwo Iwony Cygan ze Szczucina woj małopolskie 17latka zginęła w pobliżu swojego domu w 1998 roku Po osiemnastu latach śledczym udało się przełamać zmowę milczenia w sprawie
52302,20170109,2017-01-09,Kia Stinger,"2,000+",Kia Stinger sedan na sportowo,Podczas Salonu Samochodowego w Detroit Kia zaprezentowała zupełnie nowy model Stinger Jest to sedan o drapieżnej linii nadwozia który ma przyciągać kierowców sportowym charakterem W ten sposób koreańskie auto ma wyróżnić się na tle
52303,20170109,2017-01-09,Lech Walesa,"5,000+",Lech Wałęsa ma kolejne kłopoty Chodzi o prawie 250 tys zł,Willa Narutowicza to kula u nogi Lecha Wałęsy 4 czerwca 2011 r umowę jej wynajęcia przez władze Województwa Mazowieckiego na rzecz ILW podpisywali marszałek Adam Struzik i były prezydent Lech Wałęsa Ze strony ILW za umowę odpowiadał
52304,20170109,2017-01-09,Maska Antysmogowa,"10,000+",Maseczki antysmogowe Nie warto na nich oszczędzać JAK,Przedstawiciele Krakowskiego Alarmu Smogowego którzy przeprowadzili testy masek antysmogowych podkreślają że wybór maski zawsze będzie wyborem subiektywnym jednym będzie zależeć na bardzo skutecznej ochronie dla innych będzie też ważny
52305,20170109,2017-01-09,Meryl Streep,"10,000+",Mocne słowa Meryl Streep o Trumpie Ten odpowiada równie ostro,Meryl Streep otrzymała na rozdaniu Złotych Globów otrzymała specjalną nagrodę za całokształt twórczości Aktorka słynąca z ciętego języka nie omieszkała skomentować podczas swojej przemowy obecnej sytuacji w Ameryce i skrytykować Donalda Trumpa
52306,20170109,2017-01-09,Moonlight,"10,000+",Gejowski film ze Złotym Globem,Za nami rozdanie Złotych Globów  amerykańskich nagród filmowych i telewizyjnych które są przedsmakiem Oscarów Hollywoodzkie Stowarzyszenie Prasy Zagranicznej doceniło w tym roku film Moonlight Sarę Paulson i Meryl Streep której
52307,20170109,2017-01-09,Mystery Search,"2,000+",Nudzi Cię wyszukiwanie w Google Przetestuj Mystery Serch,Macie wrażenie że w internecie widzieliście już absolutnie wszystko i dobrze wiecie jakich wyników można się spodziewać po wpisaniu do wyszukiwarki danego hasła Jest pewna alternatywa
52308,20170109,2017-01-09,Nokia 6,"2,000+",Powrót kultowej marki Oto Nokia 6,Nokia marka telefonów uznawana przez wielu za kultową wraca na rynek Właśnie zaprezentowała nowy smartfon z systemem operacyjnym Android Na początku ma być dostępny jedynie na rynku chińskim Nokia ogłosiła swój powrót w maju ub roku
52309,20170109,2017-01-09,Oczyszczacz powietrza,"2,000+",Oczyszczacz powietrza  jak pozbyć się smogu z domu,Dane te pokazują jak ważny przy tej ilości wdychanego powietrza jest jego skład i jak duże to ma znaczenie dla naszego zdrowia  odpowiada lek med Magdalena NaporaGrabowska Oczyszczacze powietrza kosztują między 1000 a 2000 zł  zależnie od
52310,20170109,2017-01-09,Reforma edukacji,"5,000+",Reforma edukacji gimnazja do likwidacji Prezydent podpisał ustawy,Prezydent Andrzej Duda podpisał ustawy reformujące system szkolny w Polsce Oznacza to likwidację gimnazjów powrót do 8letnich szkół podstawowych 4letnich liceów ogólnokształcących i 5letnich techników W miejsce zasadniczych szkół
52311,20170109,2017-01-09,Ryan Gosling,"10,000+",Złote Globy 2017 Ryan Gosling dziękuje Evie Mendes i dedykuje nagrodę zmarłemu szwagrowi,Na początku swoich podziękowań Ryan Gosling zażartował sobie sugerując że nagroda należała się jego imiennikowi Ryanowi Reynoldsowi To nie pierwszy raz kiedy zostałem pomylony z Ryanem Reynoldsem ale to wymyka się spod kontroli Ryan
52312,20170109,2017-01-09,Ryan Reynolds,"10,000+",Złote Globy 2017 Ryan Reynolds pocałował Andrew Garfielda,Blake Lively i Ryan Reynolds są zakochani  co do tego nie ma wątpliwości Po tegorocznej gali rozdania Złotych Globów 2017 para zyskała miano najsłodszej w showbiznesie ale show skradł Ryan Reynolds który przy okazji stał się bohaterem
52313,20170109,2017-01-09,Rybnik,"5,000+",Rybnik Uczniowie nie pójdą do szkoły z powodu smogu,Wcześniej prezydent Rybnika zdecydował że w związku ze złą jakością powietrza mieszkańcy w poniedziałek i wtorek będą mogli za darmo korzystać z miejskiej komunikacji Bezpłatny przejazd jest możliwy w poniedziałek od 10 rano na wszystkich liniach
52314,20170109,2017-01-09,Smog Wrocław,"2,000+",Smog we Wrocławiu Władze miasta apelują o pozostanie w domach,W związku z notowanym dziś rano pogorszeniem jakości powietrza we Wrocławiu przekroczeniami norm dopuszczalnych ilości pyłów zawieszonych i benzoapirenu wynikającym min z niskich temperatur i braku wiatru apelujemy do wrocławian
52315,20170109,2017-01-09,Ucho Prezesa,"100,000+",Ucho Prezesa czyli Kaczyński całki,Nie na tym polega jednak sukces pierwszego odcinka Ucha Prezesa Robert Górski zachował się jak rasowy komik który nie epatuje od początku nadmiarem efektów żartów i gagów Górski gra rolę Prezesa z powagą jak profesjonalny aktor który długo
52316,20170109,2017-01-09,WIOŚ,"2,000+",WIOŚ powietrze w Kielcach było wczoraj najgorsze od lat Ale,WIOŚ o dużym zanieczyszczeniu powietrza poinformował służy marszałka jak i Wojewódzkie Centrum Zarządzania Kryzysowego przy wojewodzie Gdyby wskaźnik przekroczył 300 wówczas osiągnąłby stan alarmowy  Wtedy też powoływany jest sztab
52317,20170109,2017-01-09,Wiadomości Onet,"5,000+",Wróg publiczny,Onet jest dziełem człowieka doskonale znanego organom bezpieczeństwa Podobnie było w przypadku zamachowców w Paryżu Brukseli Orlando i wielu innych miastach Uważam że władze odpowiedzialne za bezpieczeństwom przede wszystkim
52318,20170109,2017-01-09,Wstyd,"5,000+",Policjancianioły pilnowali SzczecinaWstyd,Policjancianioły pilnowali SzczecinaWstyd publikacja 09012017 aktualizacja 09012017 1744 Foto Fotorzepa Marian Zubrzycki Orszak Trzech Króli który przeszedł ulicami Szczecina był pilnowany przez funkcjonariusz policji przebranych za
52319,20170109,2017-01-09,Zygmunt Bauman,"20,000+",Profesor Zygmunt Bauman nie żyje Miał 92 lata,W poniedziałek w Leeds zmarł najwybitniejszy polski socjolog i filozof profesor Zygmunt Bauman  twórca koncepcji płynnej nowoczesności Urodził się w 1925 r w Poznaniu w ubogiej rodzinie polskich Żydów Wraz z wybuchem wojny rodzina Baumanów
52320,20170110,2017-01-10,David Bowie,"5,000+",David Bowie The Man Who Sold The World,David Bowie prawdziwa ikona popkultury i jeden z najbardziej uznanych i cenionych artystów w historii muzyki urodził się 8 stycznia 1947 roku w Londynie Na scenie muzycznej zadebiutował w 1964 roku przyjmując pseudonim artystyczny na świat
52321,20170110,2017-01-10,Ferie zimowe 2017 TERMINY,"10,000+",Ferie zimowe 2017 TERMINY Kiedy wypadają ferie zimowe w 2017,Ferie zimowe 2017 TERMINY Początek roku zawsze uczniom kojarzy się ze zbliżającą się przerwą w szkole W tym roku najszybciej z ferii będą mogli skorzystać uczniowie z woj lubelskiego łódzkiego podkarpackiego pomorskiego i śląskiego Najdłużej
