index,dayId,date,name,traffic,newsTitle,newsSnippet
51355,20170330,2017-03-30,Messenger apps,"2,000+",Facebook and Messenger apps may soon stop working on some smartphones,One of the ways we continue to improve is by consistently introducing rich features like voice and video calling games and bots for Messenger Using older versions of apps means that experiences wont work well or sometimes not at all Facebook
51356,20170330,2017-03-30,Nam Ji Hyun,"2,000+",Hello Venuss Nara Joins Ji Chang Wook And Nam Ji Hyun In New SBS Drama,Ji Chang Wook and Nam Ji Hyun were previously reported to star as the main leads in the drama Nara will be playing Cha Yoo Jung a prosecutor who has been reinstated after studying overseas Cha Yoo Jung is also the exgirlfriend of Ji Chang Wooks
51357,20170330,2017-03-30,Oppo F3 Price,"2,000+",OPPO F3 Plus vs OnePlus 3T vs Vivo V5 Plus Price specification and features,We compared the smartphone with its rivals in the subRs 30000 price point including the OnePlus 3T and Vivo V5 Plus Heres how they fare against each other Price The OPPO F3 Plus is the most expensive out of the three smartphones and carries a
51358,20170330,2017-03-30,Spurs Vs Warriors,"2,000+",Spurs vs Warriors 2017 live updates Scores highlights and news,The San Antonio Spurs take on the Golden State Warriors in a nationally televised game with definite playoff implications on Wednesday night Tipoff is scheduled for 930 pm ET and the Western Conference showdown will air on ESPN and can be live
51359,20170330,2017-03-30,postpartum depression,"2,000+",Chrissy Teigen shares struggle with postpartum depression,It wasnt until her doctors visit she realized that the mood swings body pain lack of appetite wanting to stay in bed all day behavior were symptoms of postpartum depression and anxiety While Teigen is a model author and TV host she is most
51360,20170331,2017-03-31,13 Reasons Why,"2,000+",13 Reasons Why review  sex drugs and mixtapes in Netflixs highschool,She leaves behind 13 sides of cassette tape on which she has narrated the wrongdoings of those around her Each side concerns the actions of one of her acquaintances they are supposed to listen then pass the tapes to the next person in order to
51361,20170331,2017-03-31,April Fools,"2,000+",Teachers hilarious April Fools Day prank,The origins of the day initially coined All Fools Day are at the centre of some dispute Some people believe the original April Fools were those who failed to pay attention when much of Europe adopted the Gregorian calendar which we still use today
51362,20170331,2017-03-31,Jobert Sucaldito,"2,000+",Erik Santos also files libel suit against Jobert Sucaldito,In the legal complaint filed in a Quezon City court on Thursday Santos said that Sucaldito had repeatedly smeared his name through a series of Facebook posts which were posted last month In particular Santos alleged that Sucaldito referred to him
51363,20170331,2017-03-31,Kit Barraquias,"50,000+",Pia Wurtzbachs BF Marlon Stockinger Father Of Twins Model ExGirlfriend Kit,Earlier this month there were rumors that Marlon Stockinger was already a father to twins from a past relationship Recently he and Miss Universe 2015 Pia Wurtzbach made their relationship official On March 30 Marlons model exgirlfriend Kit
51364,20170331,2017-03-31,Nba All Time Scoring List,"2,000+",LeBron James Passes Shaq on NBA AllTime Scoring List,Nikola Mirotic tied season highs with 28 points and six 3pointers Jimmy Butler scored 25 and the Chicago Bulls beat the Cavaliers 9993 Thursday on a night when James moved into seventh place on the NBAs career scoring list James passed Shaquille
51365,20170331,2017-03-31,Sergei Diaghilev,"2,000+",Who was Sergei Diaghilev Google Doodle honours ballet pioneer and art critic,Sergei Dighilev was one of the most influential pioneers of modern art in the 20th century The Google doodle created in honour of Sergei Diaghilevs 145th birthday Google 3 The Google doodle created in honour of Sergei Diaghilevs 145th birthday
51366,20170401,2017-04-01,April Fools Day Jokes,"5,000+",April Fools Day pranks 2017 The BEST jokes on April Fools Day 2017,For April Fools Day the Royal Albert Hall has announced it will celebrate with Tweets Live  the greatest tweets ever written performed by the people who wrote them Bookmaker Paddy Power is playing a prank on sports fans by releasing footage of
51367,20170401,2017-04-01,April Fools Meaning,"2,000+",April Fools Day all the best fake news and pranks,April Fools day is usually only observed by children that really hilarious person in your office and journalists who have to write about it And of course the people in charge of press for large companies who spend the days before April Fools
51368,20170401,2017-04-01,April Fools Quotes,"10,000+",April Fools Day 2017 Funniest Quotes  Sayings,April Fools Day is here a day that honors the pranksters and class clowns of the world Whether youve been the victim of an April Fools Day king or you prefer to be a bystander and observe the games from afar its likely that the day will conjure
51369,20170401,2017-04-01,Attack on Titan Season 2,"5,000+",How to Watch Attack on Titan Season 2 This Weekend,Attack on Titan is one of multiple standout anime thats getting a second season this spring Heres a look at a few other anime to binge before their new season begin in the coming week Stay tuned to IGN this weekend for our Attack on Titan Season 2
51370,20170401,2017-04-01,Happy April Fools Day,"2,000+",Happy April Fools Day 2017 Siri iFixit Micro Tech Toolkit AirRings Ms,Today is April 1 2017 otherwise known as April Fools Day and as you are likely aware that means over the next few hours you should be highly wary of anything you see read or hear online As MacRumors has covered over the past few years tech
51371,20170401,2017-04-01,porcupine,"5,000+",Greedy snake writhes in agony after it tries to gobble up a feisty porcupine,YOU might think this snake got what was coming to it after it tried to eat a porcupine A bizarre video has captured the extraordinary spectacle of a boa constrictor squirming after taking on the spiky animal This surely cant be right Things are
51372,20170401,2017-04-01,pregnancy test,"10,000+",Woman urges Government to do right by those prescribed the suspect pregnancy,A woman whose son was born with birth defects after she took a hormonebased pregnancy test is urging the Government not to blow their second chance to do right by the women and children affected Robyn Hughes whose son shared her story with the
51373,20170402,2017-04-02,Rick and Morty season 3,"5,000+",Rick and Morty season 3 episode 1 gets surprise release on April Fools Day,Dan Harmon and Justin Roiland have been playing games with Rick and Morty fans teasing season three without delivering anything of any particular substance The duo went as far as to Rick Roll fans by announcing a first look at season three but
51374,20170403,2017-04-03,Bernie Wrightson,"2,000+",Who Is Bernie Wrightson The Man Behind The Walking Dead Season 7 Finale,Its only fitting that an episode packed with so much drama action and hororrific gore would be dedicated to the one and only Bernie Wrightson In fact this wasnt even the first dedication to Wrightson weve seen on the show But who is Bernie
51375,20170403,2017-04-03,Chris Martin,"2,000+",Leroy Rosenior slams Derby County striker Chris Martin for behaviour during,Former Fulham striker Leroy Rosenior said Chris Martins decision to go on strike while at Craven Cottage was disgusting Derby forward Martin joined Fulham on a seasonlong loan but missed three games over the Christmas period after reportedly
51376,20170403,2017-04-03,Coldplay,"5,000+",Coldplay revs up the crowd by making up hot as hell song on Singapore,Coldplay are on their Head Full Of Dreams Tour which kicked off in Argentina on March 31 last year After Europe and North American it will wrap up in October The lyrics serenading their Singapore fans were a little cheesy but it was obvious the
51377,20170403,2017-04-03,Coldplay Manila,"5,000+",LOOK Coldplay arrives in Manila,COLDPLAY IN MANILA Coldplay lead singer Chris Martin poses for a photo with MMI producer Rhiza Pascua The group is scheduled to perform on Tuesday April 4 Screengrab from Twitteritsarpee MANILA Philippines  British group Coldplay is now in
51378,20170403,2017-04-03,Derrick Rose,"2,000+",Schmeelk Derrick Roses Knee Injury Puts Exclamation Point On Phil Jacksons,The Knicks Derrick Rose drives in the lane on the Nets Trevor Booker and puts up a layup on Nov 9 2016 at Madison Square Garden Photo by Michael ReavesGetty Images Sadly all of these things were easy to predict Joakim Noah missed camp due
51379,20170403,2017-04-03,Fazlur Rahman Khan,"2,000+",Skyscraper pioneer Fazlur Rahman Khan rises in Google Doodle,As a youth my father never imagined that one day he would be building skyscrapers said his daughter Yasmin Sabina Khan A humanitarian in his personal as well as professional life he was inspired by the belief that his work had a positive impact
51380,20170403,2017-04-03,LSD,"5,000+",Meet the evil female cult leaders who drugged children with LSD axed people,MASTER manipulators twisted teachings and demonicstyle killings meet the evil female cult leaders whose horrifying actions have stunned the world From the Australian yoga teacher who pumped children with LSD to the teen girl who hacked
51381,20170403,2017-04-03,Marlon Stockinger,"10,000+",PAALAM NA  Pia Wurtzbach posts breakup song video amid rumored split with,MANILA Philippines  Last Friday March 31 showbiz portal Pepph reported the stunning revelation of model Kit Barraquias that race car driver Marlon Stockinger the current boyfriend of Miss Universe 2015 Pia Wurtzbach is the father of her twin
51382,20170403,2017-04-03,Nikki Bella,"20,000+",WWEs John Cena proposes to Nikki Bella with HUGE diamond,John Cena got down on one knee to propose to girlfriend Nikki Bella in front of a packed stadium of wrestling fans on Sunday night And it was hard not to gawk at the massive rock that the WWE star presented the Total Divas star with during the
51383,20170403,2017-04-03,Undertaker,"5,000+",Roman Reigns pays tribute to WWE legend the Undertaker after retiring him at,Other WWE superstars from past and present took to social media to thank The Undertaker for his 25year service to the industry Mick Foley wrote ThankYouUndertaker  my life has been so much better for having known you The Miz also said If
51384,20170403,2017-04-03,Walking Dead season 7,"5,000+",The Walking Dead 5 Things We Learned From the Season 7 Finale,Remember when The Walking Deads seventh season began last October with Glenn getting his head crushed beneath Negans spiked baseball bat  one of the most devastating and polarizing deaths in the entire run of this corpsestrewn series Weve
51385,20170403,2017-04-03,WrestleMania 33,"20,000+",7 WrestleMania 33 Takeaways What Comes Next for WWE Superstars,WrestleMania 33 must have been born in early June because it was as twofaced as a Gemini The first half of The Ultimate Thrill Ride a term that in the biggest upset of the night was not repeated to the point of insanity was a brisk hybrid of
51386,20170404,2017-04-04,Jeff Hardy,"2,000+",Jeff Hardy picked up his first ever WrestleMania win in Orlando,Lost in the excitement of Matt  Jeff Hardys return to WWE at WrestleMania 33 Sunday night April 2 was an interesting piece of trivia For all his memorable moments at the Showcase of the Immortals including innovating the TLC match along with the
51387,20170404,2017-04-04,Michelle McCool,"2,000+",Michelle McCool Thanks WWE And Fans Wade Barrett On His Wrestling Future,Above is video from WrestleMania 33 Week with Hannibal TVs David Penzer talking to former WWE Superstar Wade Barrett Barrett says he decided to take a year off from pro wrestling as he was unhappy when he left WWE in 2016 Barrett has been
51388,20170404,2017-04-04,Okada Manila,"5,000+",Want to see Okada Manilas The Fountain Heres what you should know,MANILA  Last Fridays official opening of Okada Manilas The Fountain may have been a strictly byinvitation affair but starting April 1 the worlds largest multicolored dancing water feature can be enjoyed by the public for free Located at the
51389,20170404,2017-04-04,PHIVOLCS,"20,000+",Earthquake experienced in Luzon PHIVOLCS reports 54 magnitude,Several parts of Luzon experienced earthquake around 9 pm April 4 Reports of movement were made from Lucena Cavite Laguna and Metro Manila The Philippine Institute of Volcanology and Seismology PHIVOLCS has recorded a magnitude 54
51390,20170404,2017-04-04,Shawn Mendes,"5,000+",Shawn Mendes nearly overshadows John Mayer,Many in Toronto still feel like John Mayer is their man But Shawn Mendes is a close second Mayer playing just the third show on The Search For Everything Tour offered up a little bit of everything not only for the nearcapacity crowd at Torontos
51391,20170404,2017-04-04,earthquake,"20,000+",54 magnitude earthquake hits Batangas,A moderately strong earthquake initially measuring 54magnitude on the Richter scale rattled parts of Metro Manila and nearby areas in Luzon on Tuesday April 4 evening According to the Philippine Institute of Volcanology and Seismology Phivolcs
51392,20170405,2017-04-05,Allen Covert,"2,000+",Sharon Cuneta sells mansion in LA to US comedian Allen Covert,Sharon Cuneta has sold her mansion in Calabasas city in Los Angeles County California to American comedian Allen Covert The Your Face Sounds Familiar judge made the disclosure in a series of Facebook posts on Monday as she emotionally parted
51393,20170405,2017-04-05,Fifth Harmony,"2,000+",Camila Cabellos Long Journey from Cuba to Fifth Harmony to Going Solo,No one could have predicted how well her vision would play outCamila excelling at school in Miami and auditioning in the ninth grade for The X Factor which launched her music career with the wildly popular girl band Fifth Harmony And now after she
51394,20170405,2017-04-05,Gma News,"5,000+",X rated Bliss reclassified R18,The film premiered at the Osaka Film Festival 2017 It details the misfortune that befalls Jane Ciego Iza Calzado an aging actress who decides to produce her own movie Calzado won the Yakushi Pearl Award for her performance in the movie ALG GMA
51395,20170405,2017-04-05,Heath Ledger,"2,000+",I Am Heath Ledger trailer shows heartbreaking raw footage of the actor,A TRAILER for upcoming documentary I Am Heath Ledger has been released online giving a heartbreaking glimpse into the late actors private life The 2minute clip shows intimate footage of Heath on the road and at home along with touching comments
51396,20170405,2017-04-05,Lance Stephenson,"2,000+",Lance Stephenson is exactly as you remembered him,The Lance Stephenson era in Indiana is back as the man himself announced last week and he didnt disappoint Tuesday night in his return I think the thing theyre missing is that energy and that never bowdowntoanyone mentality Stephenson said
51397,20170405,2017-04-05,Lee Joon Gi,"5,000+",Actor Lee Joongi confirms relationship with actress Jeon Hyebin,Popular actor Lee Joongi who also has a large following in other Asian countries is dating actress Jeon Hyebin their talent agency confirmed Tuesday Lee and Jeon developed into a couple in the first half of last year Namoo Actors which
51398,20170405,2017-04-05,News Update,"2,000+",Microsoft details new privacy settings in Windows 10 Creators Update,As Microsoft announced last week the Windows 10 Creators Update will start rolling out to users on April 11 As part of this update the company is also making some changes to the privacy settings in Windows 10 and how it informs its users about the
51399,20170405,2017-04-05,Prison Break,"5,000+",Prison Break Creator Breaks Down Premieres Mysterious Michael Twist,The biggest question on Prison Break fans minds was answered in the premiere episode of the limited series revival well sort of Throughout the hour Michaels brother Lincoln Burrows Dominic Purcell wrestles with the news that his deceased
51400,20170405,2017-04-05,Syria,"2,000+",Russia draws scorn after blaming Syrian rebels for chemical deaths,Russian claims that a suspected chemical weapons attack in Syria was actually the result of an airstrike that hit a rebel chemical weapons depot drew derision Wednesday at an emergency meeting of the UN Security Council There is only one air force
51401,20170405,2017-04-05,Tinder,"2,000+",People are using Nathan Carters photo on Tinder but he doesnt mind if it,EVERY WEEKDAY MORNING DailyEdgeie rounds up the best of the days celebrity dirt from the top to the very bottom Country singer Nathan Carter is responsible for a lot of things Getting Wagon Wheel stuck in your head and forcing you to consider
51402,20170405,2017-04-05,the big one,"2,000+",Fehily I wouldnt swap Blaklion for anything in the big one,Noel Fehily says he would not swap Blaklion for anything else in the Randox Health Grand National as he hoped linking up with a twicesuccessful stable would help him to a first victory on Saturday Bigrace specialist Fehily was booked by trainer
51403,20170406,2017-04-06,Asia S Next Top Model Cycle 5,"2,000+",PHs Anjelica Santillan is eliminated from Asias Next Top Model cycle 5,ELIMINATED Anjelica Santillan of the Philippines is the first contestant eliminated from Asias Next Top Model cycle 5 Photo from FacebookAsias Next Top Model MANILA Philippines  Anjelica Santillan one of the Philippines representatives in
51404,20170406,2017-04-06,BARRY Manilow,"5,000+",Who is Garry Kief Barry Manilows manager and gay partner for 40 years,BARRY Manilow has revealed he is gay and has been with his manager Garry Kief for forty years The man who has remained in the shadows of private Barrys life actually met him way back in 1978 but what do we know about this hidden lover  and
51405,20170406,2017-04-06,Kendall Jenner,"2,000+",Kendall Jenner devastated by Pepsi controversy,MailOnline has contacted a spokesperson for Kendall Jenner for comment In the short film Kendall skips out of a photoshoot to join a throng of young campaigners waving placards with slogans such as Join the Conversation before she approaches a
51406,20170407,2017-04-07,CNN,"2,000+",Damien Hirst stages comeback with monumental sunken treasures,Venice Italy CNN Damien Hirst has been quiet for a few years now and his star has dimmed  as have his prices So at the age of 51 it seems its time for a little bit of reinvention for the British artist Hirst has never been short of self
51407,20170407,2017-04-07,Sign Of The Times Lyrics,"10,000+",Harry Styles Sign Of The Times Lyrics Warn The End Is Near But Are Still,Although there had been years of speculation the world only officially had a mere week to prepare itself for Harry Styles first solo song Sign of the Times While I dont mean to sound ungrateful since I very much appreciate not having to wait
51408,20170407,2017-04-07,The Chainsmokers Memoriesdo Not Open,"5,000+",The Chainsmokers Debut Album MemoriesDo Not Open Has Arrived Listen Now,The Chainsmokers have been dominating radio the charts and dance clubs for the past yearplus but they havent put out a debut album  until now On Friday April 7 the duos first full body of work MemoriesDo Not Open hit retailers and
51409,20170408,2017-04-08,Attack On Titan Season 2 Episode 2,"2,000+",Attack on Titan Season 2 spoilers  and where to watch episode 27,The squad member was important in season 1 as he had a keen sense of smell which made him a valuable Titan tracker However the first episode saw Mike choosing to let his comrades escape danger when a horde of Titans began chasing them within
51410,20170408,2017-04-08,Don Rickles,"2,000+",See Don Rickles last project,Don Rickles didnt just embrace being a senior citizen he incorporated it into his work The comic who died Thursday from kidney failure at 90 completed work on a new show with AARP before his death Dinner with Don had been announced recently as
51411,20170408,2017-04-08,Earthquake Today,"200,000+",Earthquake strikes Philippines near Manila,This was the strongest quake in a series of three earthquakes of magnitude 50 to 59 to hit Batangas in the Luzon province about 55 miles 90km south of Manila around 3pm local time or 7am GMT The USGS said the quakes occurred over a period of
51412,20170408,2017-04-08,News Update,"2,000+",Besiege update to add multiplayer and a level editor,Released at the start of January 2015 its still in early accesshowever theres a big update coming that should breathe new life into the game The updates named rather grandly the Besiege Multiverse and it will add cooperative and competitive
51413,20170408,2017-04-08,Palm Sunday,"2,000+",Palm Sundays palm shortage,Dean of Hobart Reverend Richard Humphrey has not received any offers but said the church had smaller fronds and palm crosses and the celebrations will be going ahead regardless We dont cancel Palm Sunday for lack of foliage he said
51414,20170408,2017-04-08,Produce 101 Season 2,"2,000+",Current Ranking Of Top 22 Produce 101 Season 2 Contestants Based On Votes,Produce 101 Season 2 has revealed the current ranking of contestants based on votes from the general public The results which were unveiled at the end of the first episode on April 7 showed that Maroo Entertainment trainee Park Ji Hoon was ranked
51415,20170408,2017-04-08,Stockholm,"2,000+",Stockholm truck attack suspect known to security services,The attack occurred just before 3pm 1300 GMT when the stolen truck crashed into the corner of the bustling Åhléns department store having driven at speed down the pedestrianised Drottninggatan situated above Stockholms central subway station
51416,20170408,2017-04-08,Syria,"5,000+",Syrian bombing US and Russia one step away from combat,Moscow promised too to bolster Syrias air defences to protect the most sensitive Syrian infrastructure facilities But that prompted analysts to observed that despite a 60 to 90minute warning of Thursdays attack Moscow did not activate its own
51417,20170408,2017-04-08,Uaap Season 79 Women S Volleyball,"10,000+",Nagbigay na ako ng courtesy resignation  NU coach Gorayeb,Tomas in the 79th UAAP womens volleyball tournament at the Big Dome Kailangan yan eh Courtesy resignation yan said Gorayeb who came into the team in the middle of Season 77 to replace Dong Dela Cruz NU closed the season with a three
51418,20170409,2017-04-09,Ateneo Lady Eagles,"2,000+",Ateneo Lady Eagles repeat over rivals DLSU to clinch top seed,MANILA Philippines UPDATED  The Ateneo Lady Eagles have once again prevailed in the muchanticipated contest against rivals De La Salle University as they swept the season series in 4 sets 1225 2520 2521 2519 in the 79th UAAP Womens
51419,20170409,2017-04-09,Kim Young Ae,"2,000+",Veteran actress Kim Youngae dies of pancreatic cancer,Veteran actress Kim Youngae passed away fighting pancreatic cancer according to her agency Starvillage Entertainment She was 65 In 2012 Young Ae underwent surgery for pancreatic cancer and was cured of the disease However the cancer relapsed
51420,20170409,2017-04-09,UFC 210,"10,000+",UFC 210 Results By The Numbers Analysis Attendance Gate Bonus Money And,Cormier again took Anthony Rumble Johnsons best shot wore him out took his back and choked him out again to win the main event of UFC 210 in Buffalo NY and retain the title It was almost a carbon copy of their first fight only this time it didn
51421,20170410,2017-04-10,Alex Aiono,"2,000+",Redfoo Alex Aiono perform on last night of Lubao balloon and music fest,The final night of the Lubao International Balloon and Music Festival ended with YouTube star Alex Aiono singing his hit Drake covers and a few originals and LMFAO vocalist Redfoo performing his hit single Party Rock Anthem Around 15000
51422,20170410,2017-04-10,Anne Hathaway,"2,000+",Why is Anne Hathaway still being asked to explain why she is hated,Anne Hathaway is currently promoting her movie Colossal about how an alcoholic writer appears to have something in common with a Godzillalike monster over the other side of the world The movie is being lauded for its portrayal of toxic masculinity
51423,20170410,2017-04-10,Glorietta Fire,"5,000+",Fire hits Glorietta in Makati City,According to the Makati Fire Department the fire started at around 613 pm and was declared fire out at 636 pm The management of Glorietta in a statement said the fire occured at the malls roof deck OFFICIAL STATEMENT RE Glorietta Roof Deck
51424,20170410,2017-04-10,Holy Week,"5,000+",Govt on heightened alert for Holy Week exodus,In this Apr 3 2017 file photo Land Transportation Franchising and Regulatory Board member Aileen Lizada inspects a passenger bus along Edsa in Cubao Quezon City in preparation for the Holy Week INQUIRER FILE PHOTO  NINO JESUS ORBETA
51425,20170410,2017-04-10,Russell Westbrook,"2,000+",Russell Westbrooks tripledoubles are him showing up not showing off,DENVER  This is how Russell Westbrook was meant to make history and break the Big Os record Nitpick some of the rebounds if you want to be a nerd and a partypooper but Westbrook making tripledoubles routine this season has not been about stat
51426,20170410,2017-04-10,Thor Ragnarok,"2,000+",Thor Ragnarok  watch the first trailer for the Marvel superhero sequel,As yet Thors fate is unclear but what is clear from the first teaser trailer is that Ragnarok will continue to display the blend of exuberant action and comic chops of the franchises first two films Also spotted in the trailer is new antagonist
51427,20170411,2017-04-11,Inabanga Bohol,"20,000+",Suspected Abus cornered in Bohol clash fatalities reported,MANILA UPDATED  Government forces clashed with suspected Abu Sayyaf terrorists in Inabanga Bohol Tuesday just two days after the US Embassy warned its citizens about unsubstantiated yet credible reports of kidnappings in Central Visayas
