index,dayId,date,name,traffic,newsTitle,newsSnippet
65418,20170321,2017-03-21,문재인 아들,"2,000+",취업 특혜 의혹 문재인子 문준용씨 졸업작품 눈길세계 3대 디자인 학교 뉴욕 파슨스 유학도,문재인 전 더불어민주당 대표의 아들 문준용씨가 취업 특혜 의혹을 받고 있는 가운데 그의 졸업작품 영상이 알려져 눈길을 끌고 있다 21일 인터넷상에서는 문준용씨의 2010년 졸업작품 Augmented Shadow증강 그림자를 담은 유튜브 영상이 화제가 됐다
65419,20170321,2017-03-21,박근혜,"10,000+",박근혜 소환 조사첫 담화부터 7차례왜도 무엇도 빠진 송구만 되풀이,박근혜최순실 게이트가 처음 불거지고 검찰 조사를 받기 위해 출석할 때까지 박근혜 전 대통령의 대국민사과 발언을 모아보면 그렇다 박 전 대통령은 지난해 10월25일 최순실 국정농단 사태가 불거지자 1차 대국민담화를 했다 이날은 최순실씨 소유의
65420,20170321,2017-03-21,삼성채용,"5,000+",삼성채용 오늘 마감입사 기회를 잡아라,삼성그룹 채용이 오늘 마감된다 삼성은 21일 오후 5시 2017년 상반기 3급 신입사원 채용 지원서 접수를 마감한다 삼성은 지난 15일부터 지원서를 받기 시작했으며 오늘 정해진 시간까지만 지원서를 받고 마감한다 삼성채용 접수는 삼성채용홈페이지에서 할
65421,20170321,2017-03-21,정유라,"2,000+",정유라 범죄자의 친구 별명 스타 변호사 선임한국 강제송환 저지 총력전,정유라 씨의 덴마크 현지 변호사가 17일 덴마크 자택에서 숨지면서 후임으로 선임된 마이클 줄 에릭센 변호사토미 V 크리스티안 법률사무소 홈페이지 캡처 덴마크 검찰로부터 한국 강제송환 결정을 받은 최순실씨의 딸 정유라씨 측이 범죄자의 가장 친한 친구
65422,20170321,2017-03-21,홍상수 부인,"2,000+",홍상수 부인 지옥속에 빠트려놓고 남편은 행복한 표정,홍상수 감독과 배우 김민희가 불륜관계에 대해 최근 사랑하는 사이라고 밝힌 가운데 홍 감독의 부인이 심경을 밝혔다 20일 방송된 MBC 리얼스토리 눈은 홍상수 김민희 불륜도 사랑이 되나요라는 주제로 홍 감독과 홍 감독의 부인 A씨를 인터뷰했다 A씨는
65423,20170322,2017-03-22,김고은,"2,000+",공식입장 신하균김고은 결별 인정좋은 선후배로 남기로,신하균과 김고은 소속사 호두앤유 엔터테인먼트 측 관계자는 22일 오전 OSEN에 결별한 건 사실이라며 2월 말 정도에 결별했다고 하더라 바쁜 스케줄 때문에 자연스럽게 사이가 소원해졌다 같은 회사에 몸 담고 있기 때문에 좋은 선후배 관계를 유지할 것고
65424,20170322,2017-03-22,민주당 경선,"2,000+",민주당 대선후보경선 투표결과 유출된 듯당 선관위 대응 부심 안희정캠프 강력 항의,22일 오전 서울 영등포구 선거관리위원회에 마련된 투표소에서 더불어민주당 제19대 대선후보 선출을 위한 투표가 실시되고 있다 민주당은 이날 각 시군구의 총 250개의 투표소에서 오전 7시부터 오후 6시까지 투표를 한다 대상 투표자는 선거인단을 신청
65425,20170322,2017-03-22,세월호 인양,"10,000+",세월호 인양시험인양 1m 올리는데 5시간 반 걸려본인양 밤샘 작업,세월호 시험인양 작업이 진행 중인 22일 오전 전남 진도군 조도면 동거차도 인근 해양에서 세월호 참사 가족협의회 깃발을 단 소형 배 한 척이 작업 지역으로 들어서자 해양경찰청 소속 경비정이 막고 있다 사진공동취재단
65426,20170322,2017-03-22,애플,"2,000+",애플이 프로덕트 레드 아이폰7을 출시한다 사진,글로벌 에이즈 퇴치 프로젝트인 프로덕트 레드는 U2 보노 등의 제안으로 2006년 시작됐으며 애플을 비롯해 전 세계 유수 기업들이 참여해왔다 프로덕트 레드 상표를 달고 판매되는 모든 제품의 수익금 중 일부는 에이즈 퇴치 활동을 위한 기금으로 사용된다
65427,20170323,2017-03-23,Jtbc,"5,000+",인터뷰 세월호 절단 시 화물 쏟아져사건현장 보존 중요,세월호를 수면 13m 위로 끌어올리는 1단계 작업이 예정보다 더뎌지고 있는데요 4시경에 저희가 들은 바로는 그로부터 34시간 뒤면 13m에 도달하지 않겠느냐는 얘기가 해수부로부터 나왔는데 아직까지는 특별한 소식이 들려오지 않고 있습니다 현장에 있는
65428,20170323,2017-03-23,세월호 구름,"5,000+",세월호 리본 구름은 합성이 아니라 진짜였다,세월호가 수면 위로 모습을 드러낸 23일 강원도 원주 일대에 등장한 세월호 리본 모양의 구름을 촬영한 사진이 소셜미디어를 통해 공유됐다 합성사진이라는 의혹이 강하게 제기됐으나 한겨레 경인일보 등의 보도에 따르면 이 사진은 합성이 아니다 default
65429,20170323,2017-03-23,세월호 시신,"5,000+",세월호 인양 뒤 시신 수습유품정리는 어떻게,23일 오전 세월호 선체가 물 밖으로 모습을 드러내면서 유가족이나 미수습자 가족 국민들은 앞으로 시신 수습과 남아 있는 유품 정리 등의 절차가 어떻게 진행될지에 관심을 집중하고 있다 해양수산부는 24일까지 세월호 선체를 반잠수식 선박 위에 거치한다는
65430,20170323,2017-03-23,세월호인양,"5,000+",세월호 인양에 대한 정치권 인사들의 소셜 미디어 반응,세월호가 침몰 1073일만인 23일 새벽 수면 위로 모습을 드러냈다 정치권 인사들은 소셜 미디어 계정을 통해 세월호 인양에 대해 다양한 반응을 보였다 News Feed appfacebook 유승민 on Wednesday 안녕하십니까 세월호 인양이 마지막 단계에 들어섰
65431,20170323,2017-03-23,월드컵 최종예선,"2,000+",러시아월드컵 최종예선한국 중국에 1 대 0 패배,울리 슈틸리케 감독이 이끄는 한국 축구대표팀은 23일 중국 창사의 허룽스타디움에서 열린 월드컵 최종예선 6차전 원정경기에서 전반 35분 위다바오에게 헤딩 결승골을 내주며 석패했다 한국이 중국에 패한 건 지난 2010년 2월 동아시아선수권대회 0 대 3 패배
65432,20170323,2017-03-23,정다래,"5,000+",수영선수 정다래 엄청난 주량 공개아시안게임 금메달 이후 부담감 너무 컸다,국가대표 수영선수로 활약했던 정다래가 라디오스타에 출연해 화제다 22일 방송된 MBC 황금어장라디오스타에 출연한 정다래는 소주 6병이라는 자신의 놀라운 주량에 대해 고백했다 이날 방송에서 정다래는 그동안 숨겨왔던 입담과 늘씬한 몸매 그리고
65433,20170323,2017-03-23,주간아이돌 하이라이트,"5,000+",주간아이돌 하이라이트 LED손전등 발랄 자기소개,스포츠조선닷컴 김영록 기자주간아이돌 하이라이트가 새로운 자기 소개를 선보였다 22일 MBC에브리원 주간아이돌에는 5인조로 새로 태어난 그룹 하이라이트가 출연했다 MC데프콘과 정형돈은 하이라이트에게 신인그룹인 만큼 새로운 자기 소개를 해야
65434,20170323,2017-03-23,축구,"5,000+",IFC2017사드 긴장감 글쎄요한중 축구전 보며 만찬,공교롭게도 이날 한국과 중국간 축구가 열렸다 2018년 러시아 월드컵 아시아 지역 최종예선 A조 6차전인 한국과 중국 축구국가대표팀 간 경기가 이날 오후 8시30분 중국 후난성湖南省 창사長沙 허룽스타디움에서 진행됐다 만찬 장소인 메리어트호텔
65435,20170324,2017-03-24,장희진,"5,000+",MBC 측 장희진 현재 촬영 중 정상 방송 위해 노력 공식,드라마 관계자는 장희진은 그동안 여러 작품을 통해 다양한 연기를 선보이며 연기력을 입증한 배우라며 아직 극 초반이기 때문에 중간 투입에도 극에 잘 녹아들어 남은 긴 호흡에 충분히 큰 활력이 돼줄 것이라 생각한다 현재 촬영이 진행 중에 있고 이번 주말
65436,20170324,2017-03-24,차주혁,"5,000+",대마초 흡연 차주혁 불구속 기소 국과수 감정 결과 대마엑스터시케타민 등 검출,아이돌 그룹 남녀공학 출신 배우 차주혁26본명 박주혁이 국내에서 대마초를 흡연한 혐의로 불구속 기소됐다 서울중앙지검 강력부부장 이용일은 24일 차씨를 마약류관리에 관한 법률위반 혐의로 불구속 기소했다고 밝혔다 검찰에 따르면 차씨는 지난해 3
65437,20170324,2017-03-24,한중축구,"2,000+",IFC2017사드 긴장감 글쎄요한중 축구전 보며 만찬,이날 환영 만찬으로 막을 올린 국제금융컨퍼런스에는 한중 주요 인사 150여명이 참석했다 이번 국제금융컨퍼런스가 금융 40한중 금융산업의 미래와 도전을 주제로 열리는 만큼 만찬에서부터 참석자들은 4차 산업혁명시대에 급변하는 국제 금융질서 속에서
65438,20170325,2017-03-25,김지수,"5,000+",나혼자 김지수 우리가 몰랐던 40대 배우의 아픔,우리가 몰랐던 김지수의 매력이 쏟아졌다 썸남에 대한 고백부터 결혼과 나이에 대한 고민까지 솔직하고 친근한 매력에 빠져들게 됐다 지난 24일 오후 방송된 MBC 예능프로그램 나 혼자 산다에서는 데뷔 22년 차 배우 김지수의 일상이 전부 공개됐다
65439,20170325,2017-03-25,스윙스,"2,000+",MC그리 기 살려주려 이동민에게 돼지라고 막말한 스윙스제시 영상,인사이트 황규정 기자  고등래퍼 멘토 스윙스와 제시가 MC그리의 기를 살려주려고 도리어 이동민에게 돼지라고 칭하며 면박을 줘 논란이다 지난 24일 방송된 Mnet 고등래퍼에서는 파이널 무대를 두고 일대일 배틀을 벌이는 MC그리와 이동민의 모습이
65440,20170325,2017-03-25,윤식당,"10,000+",윰블리의 탄생정유미 윤식당의 살림꾼,지난 24일 첫 방송을 시작한 tvN 새 예능 윤식당에서 정유미는 인도네시아 발리의 인근 섬에서 윤식당을 오픈하고 불고기를 메인으로 한 음식 장사를 시작했다 윤식당의 사장인 윤여정과 상무 이서진의 옆에서 시종일관 밝은 모습은 물론 두 선배를 알뜰살뜰
65441,20170326,2017-03-26,강예원,"2,000+",강예원 언니쓰 안무 연습 열중 노력형 걸그룹,강예원 소속사 SM CC 공식 페이스북에는 3일 연속 연습실 출근 중이라는 글과 함께 안무 트레이너와 함께 연습 중인 강예원의 모습이 공개됐다 강예원은 현재 KBS2 언니들의 슬램덩크에서 걸그룹에 도전하고 있다 방송에서도 때와 장소를 가리지 않고
65442,20170326,2017-03-26,로또747당첨번호,"20,000+",747회 로또 당첨번호 7 9 12 14 23 28 1등 19억원씩,나눔로또는 제747회 로또복권 추첨에서 7 9 12 14 23 28이 1등 당첨번호로 뽑혔다고 25일 밝혔다 2등 보너스 번호는 17이다 당첨번호 6개를 모두 맞힌 1등 당첨자는 9명으로 19억321만원씩 받는다 당첨번호 5개와 보너스 번호가 일치한 2등은 59명으로
65443,20170326,2017-03-26,스타크래프트 리마스터,"20,000+",에볼루션 컴플리트한국 나이 20살 스타크래프트 리마스터 올 여름 출시,출시 19주년 한국 나이로 20살이 된 스타크래프트가 3년간의 새로운 작업을 통해 스타크래프트 리마스터로 새롭게 거듭난다 블리자드 엔터테인먼트는 26일 서울 코엑스 3층 오디토리엄에서 열린 아이 러브 스타크래프트 행사를 통해 스타크래프트 리마스터
65444,20170326,2017-03-26,아는형님 걸스데이,"5,000+",리뷰IS 아는 형님 걸스데이 리스펙트 부르는 리액션 천재들,이어 유라는 형님들에게 죽기 전에 하고 싶은 말이 무엇일까라고 물었다 잘 살았다 지금까지 걸스데이였습니다 죽기 전에 내가 한 명은 데리고 가야지 등 형님들의 예측 불가능한 오답이 이어졌다 정답은 죽기 전에 살고 싶어라는 다소 엉뚱한 말
65445,20170326,2017-03-26,이은하,"2,000+",이은하 척추전방전위증 투병 몰라보게 달라진 모습 공개 내가 못 알아볼 정도,이은하가 앓고 있는 척추전방전위증은 허리디스크나 척추관협착증으로 오해하기 쉬운 질환으로 인구의 48가 앓고 있는 질환이다 척추가 어긋나 앞쪽으로 밀린 상태를 말하며 허리뼈의 뒷 부분 특히 척추의 관절과 관절 사이 결함이 나타나면서 발생한다
65446,20170326,2017-03-26,터널,"5,000+",연쇄 살인사건 파헤치는 시그널급 수사물 터널 첫방부터 터졌다,그러나 1회 방송 이후 주인공이 직접 미래로 향한다는 점 시공을 자유자재로 오갈 수 없다는 점 미래에서 주인공이 한 일이 과거에 영향을 미칠 수 없다는 것 등 시그널과 차별화된 설정으로 터널만의 정체성을 확립했다는 평이 쏟아지고 있다 한편 터널은
65447,20170327,2017-03-27,구자명,"2,000+",직격인터뷰 구자명 1표차 가왕 놓친 복면가왕 아쉽지 않아,가수 구자명27이 단 1표 차이로 아쉽게 가왕의 자리를 놓쳤다 3년 만에 무대에 선 그는 벅차오르는 감정을 주체하지 못하며 눈시울을 붉혔다 편견을 모두 내려놓고 오로지 노래로만 승부한 구자명 흠잡을 곳 없는 파워풀한 가창력이 단연 돋보였던 무대였다
65448,20170327,2017-03-27,윤현민,"5,000+",윤현민백진희 열애설 이후 재조명되고 있는 데이트 인증샷,최근 온라인 커뮤니티에는 지난해 윤현민과 백진희가 함께 미국 여행을 다녀온 것으로 추정되는 데이트 사진이 급속도로 퍼지고 있다 해당 사진은 각각 윤현민의 카카오톡 프로필과 백진희의 SNS에 올라온 것으로 배경과 분위기가 매우 흡사하다 특히 돗자리
65449,20170328,2017-03-28,걸스데이,"5,000+",컴백 걸스데이의 자신감7년차 징크스는 없다,섹시함과 발랄함을 겸비한 걸그룹 걸스데이민아 유라 혜리 소진가 완전체로 돌아왔다 걸스데이는 27일 오후 2시 서울 청담동 일지아트홀에서 컴백 쇼케이스를 열고 오랜만에 팬들 앞에 선 소감을 전했다 걸스데이는 이날 낮 12시 주요 온라인 음원 사이트를
65450,20170328,2017-03-28,귓속말,"5,000+",이보영이상윤의 귓속말 139로 출발간발의 차로 1위,귓속말의 시청률 1위는 간발의 차였다 막강했던 피고인이 물러나면서 경쟁작들의 시청률이 일제히 상승했기 때문이다 이날 귓속말과 대결한 MBC TV 역적은 138로 귓속말에 불과 01포인트 뒤졌다 역적은 전회의 88에서 5포인트 급등했다
65451,20170328,2017-03-28,리니지2 레볼루션,"2,000+",리니지2 레볼루션 업데이트 후 접속 장애30만 아데나 보상,사진설명 넷마블게임즈는 리니지2 레볼루션 업데이트 과정에서 문제점이 발생하자 서버 점검을 기존 계획보다 연장했다 이에 이용자들로부터 불만이 나오자 게임 머니를 지급하기로 결정했다 사진 제공  넷마블게임즈 리니지2 레볼루션이 업데이트 및 정기
65452,20170328,2017-03-28,월드컵 최종예선,"2,000+",월드컵 최종예선 호주 아랍에리미트에 20 승 B조 대혼전,매경닷컴 MK스포츠 이상철 기자 호주가 2018 러시아 월드컵 최종예선에서 아랍에미리트를 꺾고 5경기 만에 웃었다 호주는 28일 호주 시드니의 시드니 풋볼 스타디움에서 열린 2018 러시아월드컵 아시아지역 최종예선 B조 7차전서 아랍에미리트를 20으로
65453,20170328,2017-03-28,축구,"2,000+",중화권 축구팬 10만명 내년 러시아월드컵 관람 간다,베이징 산카이스포츠의 펑타오 최고경영자CEO는 27일 기자회견에서 내년 러시아월드컵을 관람하는 중화권 축구팬이 2014년 브라질 월드컵 당시 추정 관람객 수 5천 명을 크게 웃돌 것으로 기대한다며 역량이 된다면 러시아월드컵에 10만 명을 데려갈
65454,20170329,2017-03-29,공각기동대,"2,000+",새 영화 할리우드판 공각기동대,결론부터 말하자면 겉모습은 화려하게 재연했지만 고스트는 가져오지 못했다 걸작 애니메이션을 실사화한 할리우드 블록버스터 공각기동대고스트 인 더 쉘 이야기다 원작에 충성도가 높은 세대보다는 요즘 젊은 관객층을 겨냥한 결과로 보인다 마니아라면
65455,20170329,2017-03-29,김소연,"2,000+",결혼 김소연  이상우 신뢰 바탕평생 동반자 약속,배우 김소연37과 이상우37가 오는 6월 결혼을 발표하며 사랑과 신뢰를 바탕으로 평생의 동반자가 되기로 약속했다고 밝혔다 김소연의 소속사 나무엑터스와 이상우의 소속사 HM엔터테인먼트 측은 28일 보도자료를 내고 이상우 김소연이 좋은 만남의
65456,20170329,2017-03-29,정미홍,"2,000+",정미홍 우원재 게시물 공유세월호 성역화됐다,정미홍 전 KBS 아나운서가 세월호가 성역화 되었다는 논지를 전개한 우원재 칼럼니스트의 게시물을 공유하며 세월호 관련 자신의 입장을 굳히고 있는 것으로 나타났다 정미홍 전 아나운서는 지난 25일 자신의 페이스북을 통해 우원재 칼럼니스트의 게시물을
65457,20170329,2017-03-29,차예련,"2,000+",예비신부 차예련 MBC 나누면 행복 재능기부 마음도 착해,차예련이 내레이션을 진행한 나누면 행복 313회 초록우산 어린이재단 특집에서는 희소병과 장애를 가진 국내 아동 3명의 투병 사연이 소개된다 뒤셴 근이영양증을 갖고 태어나 7세에는 심정지로 인해 뇌 손상까지 입게 된 한윤수 군17세 비스코트 알드리
65458,20170329,2017-03-29,할례,"5,000+",미국에서도 여성 할례 은밀 성행FBI 수사 나서,로스앤젤레스연합뉴스 김종우 특파원  미국 내에서도 여성 할례割禮가 은밀하게 이뤄지고 있는 가운데 연방수사국FBI이 단속에 나섰다 28일현지시간 폭스뉴스 등에 따르면 FBI는 여성 할례를 국제적 인권침해 범죄로 규정하고 소녀들에게 할례를 시술
65459,20170329,2017-03-29,현대자동차 채용,"2,000+",현대자동차 채용 29일 서류 합격자 발표 평균 연봉에헉,지난달 28일 서류전형을 시작해 오늘 29일 서류 합격자를 발표한 현대자동차 채용은 다음달 1일 HMAT인적성검사와 역사에세이 검사를 거쳐 4월 1825일 1차 면접을 진행한다 모집 분야는 RD Manufacturing부문 전략지원 부문으로1차 면접은 핵심연량
65460,20170330,2017-03-30,갤럭시S8,"20,000+",외신이 평가한 갤럭시S8  삼성이 가장 잘하는 걸 해냈다,삼성은 오늘 공개된 갤럭시S8과 S8플러스로 사람들이 노트7 대실패의 기억을 잊어버릴 수 있도록 해야 한다 그럴 가능성은 꽤 높다 이 제품들은 매우 훌륭하기 때문이다 중략  이 제품들의 가장 큰 매력은 아름다운 디자인에 있다 겉모습만 아름다운 게
65461,20170330,2017-03-30,박지만,"5,000+",박지만 4년만에 누나 찾아와 눈물 쏟았다,박근혜 전 대통령이 30일 구속 전 피의자심문영장실질심사을 받으러 법원으로 떠난 뒤 동생 박지만오른쪽 EG 회장과 부인 서향희 변호사 내외가 삼성동 박 전 대통령의 자택을 나서고 있다 이들은 박 전 대통령을 만난 건 4년 만이다 연합뉴스 박근혜 전
65462,20170331,2017-03-31,강부영판사,"2,000+",박 前대통령 구속영장 발부한 강부영 판사는 누구,박근혜 전 대통령에 대한 구속영장을 발부한 강부영 서울중앙지법 영장전담 판사43에게 관심이 집중되고 있다 강 판사는 31일 주요 혐의가 소명되고 증거인멸의 염려가 있어 구속의 사유와 필요성 상당성이 인정됐다며 박 전 대통령에 대한 구속영장을 발부
65463,20170331,2017-03-31,기상청,"10,000+",오늘 날씨 전국 봄비 기온 기상청 출근길 우산 챙기세요,금요일인 31일 오늘 날씨는 전국적으로 봄비가 내리면서 일부지역에는 비가 눈으로 바뀔 가능성이 있겠다 이날 기상청에 따르면 전국 대부분 지역에 520의 비가 올 것으로 예측됐다 지역별 예상 강수량은 강원 영동 2060 강원 영서와 경북 북부
65464,20170331,2017-03-31,박근혜 구속,"5,000+",박근혜 前 대통령 구속 수감된 날 최순실 무덤덤 표정으로 재판 받아 최씨 측 변호인 아마 죽을 노릇일 것,최순실61씨가 박근혜 전 대통령이 구속 수감된 31일 법정에서 평소와 다름 없이 무덤덤한 모습으로 재판을 받았다 최씨는 이날 오전 10시부터 서울중앙지법 형사합의22부재판장 김세윤 심리로 열린 자신과 조카 장시호씨 김종 문화체육관광부 제2차관의
65465,20170331,2017-03-31,서울구치소,"2,000+",박근혜 전 대통령 최순실과 마주칠 가능성 원천 차단,정계 재계인사들이 많이 수감돼 범털사회적 지위가 높은 수용자를 뜻하는 은어 집합소라 불린다지만 서울구치소에 이번처럼 많은 역대급 미결수가 몰린 적은 없다 무엇보다 이날 부로 미결수가 된 박 전 대통령이 자신을 망가뜨린 40년 지기이자 수감 선배인
65466,20170331,2017-03-31,큐넷,"2,000+",큐넷 기능사 시험 합격자 발표 홈페지이서 확인 가능,31일 큐넷은 2017년 제1회 기능사 시험 합격자를 발표했다 기능사 시험은 지난 1월 필기시험이 진행됐으며 이후 지난 11일부터 25일까지 실기시험을 실시했다 합격 여부는 큐넷 홈페이지를 통해 확인 가능하며 회별마다 시행종목이 다르니 반드시 회별 시행
65467,20170331,2017-03-31,프로야구,"2,000+",프로야구 개막전서 칼군무 선보인 프로듀스 101 시즌2 연습생 직캠 영상,국민 보이그룹 육성 프로그램 Mnet 프로듀스 101 시즌2 연습생들의 야구장 칼군무가 공개됐다 프로듀스 101 시즌2 연습생들은 31일 오후 서울 구로구 고척스카이돔에서 열린 2017 프로야구 개막전 LG 트윈스 대 넥센 히어로즈 경기 전 축하 공연을 했다
65468,20170331,2017-03-31,홍준표,"2,000+",변방 독고다이 홍준표는 어떻게 대선후보가 됐나,더욱이 홍준표는 이회창이명박박근혜로 이어지는 한나라당새누리당 흐름 속에서 늘 핵심 자리에선 약간 비껴났으나 범주류에 머물렀다 내부 정보를 어느 정도 알고 있는데다 자신을 섭섭하게 대하는 당 주류에 비판적 자세를 취했다 또 말을 시원시원하고
65469,20170401,2017-04-01,만우절,"10,000+",1년에 딱 하루 만우절에만 갈 수 있는 나라,사진설명 벽화가 빼곡히 들어선 우주피스공화국 거짓말처럼 1년에 딱 하루 만우절날만 나타났다 사라진다 사진 제공  우주피스공화국 페이스북 궁금한 것 못참는 여행 셜록입니다 오늘은 1년에 딱 한번 만우절에만 여행할 수 있는 희안한 나라를 소개해
65470,20170401,2017-04-01,머그샷,"2,000+",K스타 박근혜 머그샷 관심 후끈공개될까,서울구치소에 수감된 박근혜 전 대통령의 머그샷에 대한 관심이 뜨겁다 법원이 구속영장을 발부한 지 1시간 반쯤 지난 오늘31일 오전 4시 반 박 전 대통령은 서울중앙지검 청사를 떠나 경기도 의왕에 위치한 서울구치소로 옮겨졌다 KBS 보도에 따르면 박 전
65471,20170401,2017-04-01,야구,"2,000+",프로야구 한현희 546일 만에 1군 등판1이닝 무실점,매경닷컴 MK스포츠고척 황석조 기자 길었던 재활을 끝내고 한현희24넥센가 고척 스카이돔 마운드에 올랐다 두 차례나 홀드왕을 차지했던 사이드암 한현희는 지난 몇 년간 넥센 허리진의 핵심 중 핵심이었다 선발로도 등판하며 넥센 대표투수로 성장했다
65472,20170401,2017-04-01,조윤선,"2,000+",5주 영치금 113만원 쓴 조윤선귤만 먹었다고,법무부에서 제출 받은 서울구치소 반입물품 내역 자료를 이용주 국민의당 의원이 분석한 결과 조윤선 전 장관은 지난달 20일부터 약 5주 동안 113만원의 영치금을 사용했다 주로 식료품과 생활용품을 구입하는데 소비한 것으로 확인됐다 앞서 지난해 조윤선
65473,20170402,2017-04-02,로또748회당첨번호,"20,000+",로또 당첨번호 3 10 13 22 31 32 1등 19억3천만원씩,당첨번호 5개와 보너스 번호가 일치한 2등은 59명으로 4902만원씩 당첨번호 5개를 맞힌 3등은 1937명으로 149만원씩 받는다 당첨번호 4개를 맞힌 4등고정 당첨금 5만원은 9만9448명 당첨번호 3개가 일치한 5등고정 당첨금 5000원은 165만2756명이다
