index,dayId,date,name,traffic,newsTitle,newsSnippet
53623,20170327,2017-03-27,Piotr Zieliński,"2,000+",Piotr Zieliński Premier League Jest mi dobrze w Neapolu,Manchester United Liverpool i Chelsea Londyn  te kluby najczęściej wymieniają włoskie i brytyjskie media w kontekście transferu Piotra Zielińskiego do Premier League Polski pomocnik ma w kontrakcie zapisaną klauzulę odstępnego w wysokości 70 mln
53624,20170327,2017-03-27,Strajk Nauczycieli,"5,000+",Minister edukacji ma nadzieję że nie dojdzie do strajku nauczycieli,Minister edukacji narodowej ma nadzieję że nie dojdzie do strajku nauczycieli Związek Nauczycielstwa Polskiego zapowiedział protest pracowników oświaty i nauczycieli na piątek Nie jestem stroną w tym sporze tylko dyrektorzy szkół  powiedziała w
53625,20170327,2017-03-27,Szczecin,"20,000+",Szczecin drukarki 3D pomagają w radioterapii pacjentów,Specjaliści z Zakładu Fizyki Medycznej Zachodniopomorskiego Centrum Onkologii w Szczecinie opracowali metodę wykorzystania druku 3D w procesie planowania i przeprowadzania leczenia pacjentów ze zmianami nowotworowymi na skórze lub płytko
53626,20170327,2017-03-27,Szyszko,"2,000+",Czy Jan Szyszko popełnił przestępstwo strzelając do bażantów,Co właściwie wydarzyło się 11 lutego tego roku gdy minister środowiska Jan Szyszko wybrał się do Grodna pod Toruniem aby strzelać do bażantów Od strony prawnej jest to intrygująca łamigłówka Jak podaje Wirtualna Polska zostało wówczas
53627,20170327,2017-03-27,Tomasz Hajto,"5,000+",Tomasz Hajto podbił INTERNET Jego komentarz meczu z,Były reprezentant Polski  Tomasz Hajto przez lata kariery świetnie nauczył się piłkarskiego żargonu który teraz wykorzystuje jako komentator i podbija Internet Podczas meczu białoczerwonych z Czarnogórą bawił kibiców rewelacyjnymi tekstami jak
53628,20170327,2017-03-27,Ucho Prezesa 10,"20,000+",PiS boli Ucho Prezesa czyli partia główkuje skąd spadki w,To jest niewątpliwie dzwonek alarmowy  tak wicepremier Jarosław Gowin mówił w sobotę w Radiu ZET o sondażach w których PO dogania PiS To jeden z nielicznych oficjalnych głosów w partii wzywający do refleksji Bo zgodę na bagatelizowanie spadku
53629,20170327,2017-03-27,Waszczykowski,"2,000+",Waszczykowski trzeba było skorzystać z odwilży na Białorusi,To od nich zależy Oczywiście jeśli oni wycofają się z tych represji  a pewne sygnały mamy że chcą  to wrócimy do rozmowy  mówił w Jeden na jeden minister spraw zagranicznych Witold Waszczykowski Na pytanie czy Polska nie zgrzeszyła naiwnością
53630,20170327,2017-03-27,Wynik Meczu,"5,000+",Polacy rozczarowują w ostatnim teście przed EURO U21 Czesi,Reprezentacja Polski do lat 21 przegrała w Kielcach z Czechami 12 w ostatnim meczu przed Młodzieżowymi Mistrzostwami Europy które latem tego roku odbędą się na naszych boiskach Gdy wydawało się że remis dla białoczerwonych uratował snajper
53631,20170327,2017-03-27,Zieliński,"2,000+",Piotr Zieliński Premier League Jest mi dobrze w Neapolu,Manchester United Liverpool i Chelsea Londyn  te kluby najczęściej wymieniają włoskie i brytyjskie media w kontekście transferu Piotra Zielińskiego do Premier League Polski pomocnik ma w kontrakcie zapisaną klauzulę odstępnego w wysokości 70 mln
53632,20170327,2017-03-27,Łukasz Fabiański,"2,000+",Fabiański mieliśmy spokój i wiarę,Pokonać dał się raz na szczęście koledzy z pola postarali się o dwa gole więc Polska wraca z Czarnogóry z trzema punktami przybliżającymi ją do mistrzostw świata 2018  Po raz kolejny pokazaliśmy charakter  stwierdził po spotkaniu w Podgoricy
53633,20170328,2017-03-28,28 marca,"5,000+",Informacja o jakości powietrza  28 marca 2017 r,Zgodnie z prognozami we wtorek 28 marca jakość powietrza ze względu na poziom pyłu zawieszonego w aglomeracji górnośląskiej rybnickojastrzębskiej w środkowej części województwa w BielskuBiałej oraz w Kotlinie Żywieckiej jest umiarkowana
53634,20170328,2017-03-28,Alicia Vikander,"5,000+",Alicia Vikander jako Lara Croft w filmie Tomb Raider,Kiedy szwedzka aktorka Alicia Vikander oficjalnie potwierdziła swój udział w najnowszej ekranizacji serii Tomb Raider mieliśmy mieszane uczucia Nie można odebrać jej talentu i urody lecz do magnetyzmu Angeliny Jolie na pewno jej daleko W sieci
53635,20170328,2017-03-28,Chivalry Medieval Warfare,"5,000+",Chivalry Medieval Warfare za darmo na Steamie,Mirage Arcane Warfare wchodzi dziś w fazę zamkniętej bety i właśnie z tej okazji twórcy udostępniają za darmo swoją poprzednią produkcję  Chivalry Medieval Warfare Grę można przypisać do swojej biblioteki Steam do godziny 1900
53636,20170328,2017-03-28,Dalida,"5,000+",Recenzja filmu Dalida Skazana na miłość reż Lisa Azuelos,Dla włoskiej modelki Svevy Alviti niemającej jak dotąd szczęścia w branży filmowej propozycja zagrania Dalidy  młodszej od Piaf o 18 lat legendarnej artystki estradowej śpiewającej w ośmiu językach  to spełnienie marzeń Raczej bez nadziei na
53637,20170328,2017-03-28,Eurokorpus,"5,000+",Polska opuści Eurokorpus Antoni Macierewicz dementuje,Eurokorpus ang European Corps to jednostka wojskowa szybkiego reagowania która powstała w 1992 roku z inicjatywy Francji i Niemiec Jednostka może brać udział w operacjach kryzysowych humanitarnych ratunkowych i pokojowych W sumie w
53638,20170328,2017-03-28,Francja Hiszpania,"2,000+",Francja  Hiszpania w meczu towarzyskim NA ŻYWO,To nie będzie mecz roku ale prawie  mówił natomiast przed spotkanie napastnik Francji Antoine Griezmann Ostatni raz obie ekipy mierzyły się w 2014 roku Górą byli wtedy Francuzi którzy zwyciężyli 10 Już w piątej minucie meczu świetną okazję
53639,20170328,2017-03-28,Grupa Wyszehradzka,"2,000+",Onet24 Grupa Wyszehradzka o uchodźcach,Grupa Wyszehradzka nie zgodzi się na szantaż ws uchodźców a dotychczasowa polityka migracyjna nie zdała egzaminu To komentarz premier Beaty Szydło Od kilkunastu tygodni nie ma możliwości nadawania tytułów profesora Cyklon Debbie który
53640,20170328,2017-03-28,Kelly Family,"2,000+",Angelo Kelly z The Kelly Family gwiazdorstwo bywa niezdrowe,Był najmłodszym z dwanaściorga rodzeństwa stanowiącego trzon grupy The Kelly Family zaprzecza jednak że niestandardowy styl życia tworzącej ją rodziny odebrał mu dzieciństwo  Pisali o nas ludzie którzy nigdy nas nie spotkali nie rozmawiali z nami
53641,20170328,2017-03-28,Magdalena Boczarska,"2,000+",Magdalena Boczarska o przyszłości 28 marca 2017,Za długo żyłam polityką i może wcześniej powinnam była odkryć inną drogę Gotowanie bardzo mnie relaksuje Kocham karmić swoich bliskich Hanna Lis o nowej pasji 28 marca 2017  To nie jest żadna pieprzona delikatna i romantyczna piosenka
53642,20170328,2017-03-28,Papież Franciszek,"5,000+",Papież Franciszek Świat bez broni nuklearnej jest możliwy,Papież Franciszek stwierdził że świat bez broni nuklearnej jest możliwy Pieniądze na jej produkcję można by przeznaczyć na rozwój  podkreślił w przesłaniu na trwającą w Nowym Jorku konferencję na temat poszukiwania prawnych narzędzi zakazu tej
53643,20170328,2017-03-28,Sting,"5,000+",Sting w Warszawie Sto minut perfekcji ZDJĘCIA RELACJA,Jest wiele prawd o Gordonie Sumnerze znanym kilku pokoleniom fanów jako Sting Robi dokładnie to na co ma ochotę ma na koncie tyle przebojów że mógłby nimi wypełnić kilka wieczorów i bardzo lubi grać w Polsce  koncert na Torwarze był w tej
53644,20170328,2017-03-28,a2mobile,"2,000+",Ile można Znowu operator chwali się internetem bez limitu który,Aero2 ma nową propozycję dla użytkowników a2mobile Oferta na kartę została odświeżona i wprowadzono do niej Niewyczerpalne pakiety To kolejny operator który obiecuje nielimitowany internet i to z trzypoziomowym lejkiem Na polskim rynku
53645,20170328,2017-03-28,symbol hitlerowski,"2,000+",Google klasyfikuje znak Polski Walczącej jakosymbol hitlerowski,Dziennikarze Rzeczpospolitej sprawdzili że po wpisaniu w popularną wyszukiwarkę internetową haseł takich jak znaki hitlerowskie symbol hitlerowski czy symbole hitlerowskie i wybraniu zakładki Grafika użytkownik oprócz symboli swastyki zobaczy
53646,20170329,2017-03-29,29 marca,"2,000+",Z kartek kalendarza  29 marca Żabiałowicz przed Błaszakiem i,W 1987 roku dodatkowy bieg zdecydował o miejscach na podium w VI Kryterium Asów Polskich Lig Żużlowych Szczęśliwym zwycięzcą został Wojciech Żabiałowicz Eugeniusz Błaszak minął linię mety na drugiej pozycji a Ryszard Dołomisiewicz na trzeciej
53647,20170329,2017-03-29,Agata Steczkowska,"2,000+",Uduchowiona Agata Steczkowska w Dzień Dobry TVN Kamera,Uduchowiona Agata Steczkowska w Dzień Dobry TVN Kamera nas kocha Agencja FORUMAgata Steczkowska najstarsza i najmniej do tej pory znana z sióstr Steczkowskich od kilku tygodni bryluje w mediach Wszystko za sprawą rodzinnej opowieści
53648,20170329,2017-03-29,Amber Heard,"2,000+",Amber Heard zagra w nowym filmie Agnieszki Holland,Jak się okazuje w filmie Agnieszki Holland główną rolę ma zagrać Amber Heard Aktorka najbardziej znana jest z roli w filmie Dziennik zakrapiany rumem na planie którego poznała Johnnyego Deppa Przypomnijmy że para rozwiodła się po tym jak
53649,20170329,2017-03-29,Bartosz Kownacki,"2,000+",Bartosz Kownacki wskazuje faworyta w przetargu na polską tarczę antyrakietową,Wiceminister obrony narodowej Bartosz Kownacki był gościem Andrzeja Stankiewicza w programie Onet Opinie gdzie wypowiadał się między innymi na temat kosztów systemu obrony rakietowej na który trwa przetarg  W pierwszej kolejności patrzymy na
53650,20170329,2017-03-29,Brexit,"5,000+",Brexit to problem Wyspiarzy,Choć byli i tacy którzy łudzili się że Brexit jakimś cudem zostanie odwleczony od początku należało to traktować jako zwykłą iluzję Brytyjczycy z radością czy bez zaakceptowali wynik powszechnego głosowania i zaczęli przygotowania do procedury
53651,20170329,2017-03-29,Bulterier,"2,000+",Bulterier pogryzł trzyletnią dziewczynkę Ma liczne rany kąsane jest,Z ustaleń funkcjonariuszy wynika że 7letni bulterier w 2016 roku nie był szczepiony Dlatego o sprawie powiadomiono Powiatowy Inspektorat Weterynarii w Strzelcach Opolskich Pies jest poddany obserwacji Przebywa w kojcu na posesji właściciela
53652,20170329,2017-03-29,Daredevil,"2,000+",Film Daredevil Heros pokonany przez własnych twórców,Za Daredevila oberwał od widzów tak mocno że by odczepić metkę mniej utalentowanego kolegi Matta Damona musiał sam sobie napisać i wyreżyserować główną rolę w Mieście złodziei a potem poprawić świetnym Argo Wszyscy myśleli że Ben
53653,20170329,2017-03-29,Hashimoto,"2,000+",Kinga Rusin była chora na Hashimoto,Kinga Rusin prezenterka programu Dzień Dobry TVN dziś jest szczęśliwą kobietą Okazuje się że wcale nie zawsze było tak kolorowo O jej rozwodowym dramacie z Tomaszem Lisem wiedzieli wszyscy Ale to nie koniec jej problemów W tym samym czasie
53654,20170329,2017-03-29,IT,"2,000+",IT  pierwszy zwiastun nowej ekranizacji powieści Stephena Kinga,Zgodnie z wczorajszymi zapowiedziami do sieci trafił pierwszy zwiastun filmu pt IT Trzeba przyznać że zapowiada się niezły horror Produkcja zadebiutuje w kinach 8 września Zwiastun znajdziecie poniżej
53655,20170329,2017-03-29,Messi,"2,000+",FC Barcelona zdumiona i oburzona zawieszeniem Lionela Messiego,Kara została wprowadzona natychmiast Messi nie zagrał już we wtorek w meczu z Boliwią 02 nie będzie mógł także wystąpić w spotkaniach eliminacyjnych mistrzostw świata z Urugwajem Wenezuelą i Peru Szczególnie ważny będzie brak Messiego w
53656,20170329,2017-03-29,Michał Kamiński,"2,000+",Michał Kamiński gościem w dzieńdobryWP,Po kolejnej wpadne Witolda Waszczykowskiego ruszyła giełda nazwisk jego ewentualnych następców Oprócz Konrada Szymańskiego mówi się o Ryszardzie Czarneckim czy Adamie Bielanie Opozycja zawsze domaga się dymisji ministrów ale widać
53657,20170329,2017-03-29,OBWE,"5,000+",Ziobro o opinii OBWE pełna błędów,Opinia biura OBWE o rządowym projekcie noweli ustawy o Krajowej Radzie Sądownictwa jest skrajnie nieprofesjonalna i pełna merytorycznych błędów  ocenia minister sprawiedliwości Zbigniew Ziobro MS zestawiło te błędy Zapowiada też odpowiedź
53658,20170329,2017-03-29,Pierwsza Miłość Streszczenia,"5,000+",Pierwsza miłość online odcinek 2470 na iplatv w internecie za,Pierwsza miłość odcinek 2470 w internecie online za darmo jest dostępny Pierwsza miłość online odcinek 2470 można obejrzeć na iplatv przed emisją w telewizji Pierwsza miłość odcinek 2470 premiera w telewizji Polsat w środę 29032017 o godz
53659,20170329,2017-03-29,Ranking FIFA,"20,000+",Ranking FIFA Polska awansuje na historyczne 11 miejsce,W kwietniu reprezentacja Polski zanotuje kolejny awans w rankingu FIFA Dzięki pokonaniu Czarnogóry a także porażce Urugwaju białoczerwoni wskoczą na 11 miejsce Mogliśmy być nawet w pierwszej dziesiątce ale Hiszpania popsuła nam święto
53660,20170329,2017-03-29,Rekrutacja Przedszkole 2017,"5,000+",Rekrutacja do przedszkoli 20172018 Sprawdź jak zapisać dziecko,Każdy rodzic dziecka w wieku okołoprzedszkolnym powinien wiedzieć że właśnie nadeszła pora zapisów do przedszkoli Znalezienie miejsca w tym przez siebie wybranym często może graniczyć niemal z cudem dlatego dobrze wiedzieć kiedy i jak należy
53661,20170329,2017-03-29,Restaurant Week,"2,000+",Restaurant Week w Łodzi 2130 kwietnia Rezerwuj,Pierwszą polską edycję Restaurant Week zorganizowano w Warszawie w listopadzie 2014 roku Wzięły w niej udział 32 Restauracje i prawie 11 tys gości W listopadzie 2016 roku miał miejsce trzeci festiwal ogólnopolski w którym uczestniczyło już 310
53662,20170329,2017-03-29,Samsung Galaxy S8,"50,000+",Samsung Galaxy S8 vs Samsung Galaxy S7 Najważniejsze zmiany,To najbardziej kontrowersyjna zmiana dla osób które są już przyzwyczajone do stylistyki stosowanej przez Samsunga W Galaxy S8 koncern pozbył się pojemnościowych przycisków nawigacyjnych pod wyświetlaczem a czytnik linii papilarnych przeniósł na
53663,20170329,2017-03-29,Szparagi,"5,000+",Szparagi w 19 Kiedy jubileuszowy odcinek serialu TVN,W jubileuszowym odcinku fani serialu obejrzą huczne otwarcie pubu Oskara które uświetni koncert Szparagów Informacja o występie gwiazd Internetu przyciągnie pod pub tłumy młodych ludzi którzy chcąc zobaczyć swoje idolki zablokują wejście do lokalu
53664,20170329,2017-03-29,Łuck,"10,000+",RZECZoPOLITYCE Klich Łuck Robota Rosjan,Polski konsulat w Łucku został ostrzelany  prawdopodobnie  z granatnika  Nawet gdyby było mało broni na Ukrainie to taki przypadek mógłby się zdarzyć  mówił Klich  To ewidentna robota rosyjska aby podważyć relacje polskoukraińskie  dodał
53665,20170330,2017-03-30,30 marca,"2,000+",Kronika policyjna 30 marca,Policjanci ruchu drogowego we wtorek 28 marca zatrzymali prawo jazdy motocykliście który w terenie zabudowanym przekroczył prędkość o 57 kmh Dbając o bezpieczeństwo w ruchu drogowym na drodze krajowej nr 94 w Bolesławiu policjanci prowadzili
53666,20170330,2017-03-30,Alaska,"5,000+",Alaska rozwinęłaby się lepiej pod kontrolą Moskwy,Alaska dzisiaj mogłaby być bardziej rozwiniętym regionem gdyby była pod kontrolą Rosji Moskwa być może skoncentrowałaby się na rozwoju półwyspu z punktu widzenia zapewnienia bezpieczeństwa narodowego gdyby nie sprzedała Alaski pod koniec
53667,20170330,2017-03-30,Claudia Cardinale,"5,000+",Za brzydka do Cannes Nawet młodą Claudię Cardinale,To zdjęcie Claudii Cardinale nie bez powodu wybrano na plakat promujący jubileuszowy 70 Festiwal Filmowy w Cannes Trudno o lepszą personifikację wszystkiego co najlepsze i najpiękniejsze w europejskiej kinematografii niż Claudia Cardinale
53668,20170330,2017-03-30,Fargo,"2,000+",Fargo  sezon 3 coraz bliżej W rolach głównych Ewan McGregor,To już nie jest Minnesota w której dorastałem  od tego hasła zaczyna się zwiastun trzeciego sezonu Fargo którego amerykańska premiera zaplanowana jest na drugą połowę kwietnia W dwuminutowym klipie jest też sporo śniegu zderzające się
53669,20170330,2017-03-30,Ivanka Trump,"2,000+",Ivanka Trump doradczynią prezydenta,Jamie Gorelick prawnik i doradca Trumpa ds etyki informował wówczas że Ivanka Trump dostanie własny gabinet w zachodnim skrzydle Białego Domu gdzie urzęduje prezydent i najważniejsi urzędnicy służbowe urządzenia komunikacyjne oraz dostęp
53670,20170330,2017-03-30,LG G6,"5,000+",LG G6 na polskich półkach od 4 kwietnia aktualizacja,LG G6 już na dniach będzie dostępny w polskich sklepach Smartfon trafi do rodzimych sklepów już 4 kwietnia To oznacza że będzie go można zakupić na kilkanaście dni przed premierą Galaxy S8 który w rękach pierwszych klientów ma pojawić się w
53671,20170330,2017-03-30,Popiersie Ronaldo,"10,000+",Popiersie Ronaldo Zobacz jak zareagował Ronaldo YouTube,W środę Cristiano Ronaldo został patronem portu lotniczego na Maderze Od teraz jego nazwa brzmi Lotnisko Madera im Cristiano Ronaldo Najwięcej emocji jednak wywołało popiersie piłkarza które odsłonięto podczas uroczystości Jak zareagował
53672,20170330,2017-03-30,SZTUM,"10,000+",DOM RESTAURACJA SZTUM PO KUCHENNYCH REWOLUCJACH,Jak Magda Gessler odmieniła restaurację Przedzamcze w miejscowości Sztum Jakie w nowym lokalu podawane jest menu Co można z jeść w restauracji Domu Restauracji Sztum  zastanawiają się internauci którzy jeszcze nie odwiedzili
53673,20170330,2017-03-30,UCHO PREZESA 11,"5,000+",UCHO PREZESA 11 za darmo gdzie obejrzeć YOUTUBE Ojciec,UCHO PREZESA  odcinek 11 już dziś w Internecie Można go obejrzeć na wwwshowmaxcom Na Youtube cały odcinek za darmo zobaczymy w poniedziałek 3 kwietnia Ale za darmo na Youtube możemy zobaczyć już zwiastun odcinka W najnowszym
53674,20170330,2017-03-30,hełm,"5,000+",Dzieci przymierzą hełm i ułożą wielkie puzzle Rodzinna Niedziela,Podczas najbliższej Rodzinnej Niedzieli 204 dzieci przekonają się że muzeum nie jest wcale tajemnicze i groźne Zadba o to animatorka Ewelina Sarosiek Liczba miejsc jest ograniczona Dzieci przymierzą hełm i ułożą wielkie puzzle Rodzinna
53675,20170330,2017-03-30,to,"2,000+",Rudzki Pomnik jak to łatwo postawić,Na dobry początek zastanówcie się z czym kojarzy wam się pomnik Mnie z grobowcem To znaczy  takim monumentem który niekoniecznie jest miejscem w jakim przebywa zmarła osoba ale z pewnością mającym jak sama nazwa wskazuje upamiętnić
53676,20170331,2017-03-31,31 marca,"2,000+",Kowalczyk 31 marca kończy się proces likwidacji Ministerstwa,Proces likwidacji Ministerstwa Skarbu Państwa  zgodnie z wcześniejszymi zapowiedziami  kończy się 31 marca br  poinformował w piątek PAP szef Komitetu Stałego Rady Ministrów Henryk Kowalczyk Dodał że jeszcze przez kilka dni będzie trwało
53677,20170331,2017-03-31,Bundesliga,"2,000+",Niemcy Wieśniaki wygrały w Berlinie i są coraz bliżej Ligi Mistrzów,26 kolejka Bundesligi rozpoczęła się od bardzo ciekawego spotkania w Berlinie gdzie piąta w tabeli Hertha podejmowała na Stadionie Olimpijskim czwarte Hoffenheim Gospodarzom bardzo zależało na wygranej gdyż to pozwoliłoby im zmniejszyć stratę w
53678,20170331,2017-03-31,Destiny 2,"2,000+",Destiny 2 już oficjalnie,Opublikowany dziś oficjalny zwiastun zapowiadający Destiny 2 zatytułowany Odezwa daje przedsmak fabuły gry koncentrując się na jej bohaterach W akcji grę będzie można zobaczyć po raz pierwszy 18 maja podczas transmitowanej online globalnie
53679,20170331,2017-03-31,Dorota Szelągowska,"2,000+",Nowa fryzura Szelągowskiej debiutuje na ściance,Dorota Szelągowska w show biznesie zadebiutowała jako córka Katarzyny Grocholi i żona Adama Sztaby Po głośnym rozwodzie z muzykiem celebrytka postawiła na własną karierę Potencjał dostrzegł w niej TVN powierzając jej prowadzenie programów o
53680,20170331,2017-03-31,Ekstraklasa,"10,000+",Ekstraklasa Rekordowe zyski polskich klubów z transferów,Kluby polskiej ekstraklasy piłkarskiej zanotowały rekordowo wysokie wpływy ze sprzedaży zawodników latem 2016 i zimą 2017 roku Otrzymały z tytułu transferów łącznie 336 mln euro o ponad 12 mln więcej niż w najlepszym dotychczas sezonie 201011
53681,20170331,2017-03-31,Escape from Tarkov,"2,000+",Escape from Tarkov  graliśmy już w najładniejszego shootera na,Co można powiedzieć o Escape from Tarkov po kilku partyjkach z tą grą Że wygląda dobrze ale przede wszystkim  że daje świetny feeling ze strzelania a sam klimat jest niesamowity I chociaż to wciąż wersja alpha gra już teraz zdradza ogromny
53682,20170331,2017-03-31,Iwona Cichosz,"2,000+",Taniec z Gwiazdami Iwona Cichosz doznała kontuzji ale nie,Nie da się ukryć że Iwona Cichosz zachwyca w programie Taniec z Gwiazdami Mimo że jest osobą niesłyszącą doskonale radzi sobie w show a jej występy zazwyczaj są wysoko oceniane przez jurorów Niestety od jakiegoś czasu Iwona zmaga się z
53683,20170331,2017-03-31,Lech Poznań,"10,000+",Wisła Kraków  Lech Poznań transmisja meczu Gdzie obejrzeć,Mecz Wisła Kraków  Lech Poznań to zdecydowanie hit 27 kolejki LOTTO Ekstraklasy Kto wyjdzie z górą ze starcia wielkich polskich drużyn Transmisja spotkania Wisła Kraków  Lech Poznań dostępna będzie w TV i online w Internecie Gdzie obejrzeć
53684,20170331,2017-03-31,Monika Mariotti,"5,000+",Taniec z Gwiazdami 2017 odcinek 5 Rafał Maserak UWODZI,W programie Taniec z Gwiazdami 31032017 zatańczą między innymi Monika Mariotti i Rafał Maserak Czy czeka nas gorący romans na parkiecie Rafał Maserak i Monika Mariotti już dwukrotnie byli zagrożeni w wiosennej edycji TzG 2017 Aktorka jak na
53685,20170331,2017-03-31,Paweł Zarzeczny,"20,000+",Sen o Warszawie wybrzmiał po raz ostatni Paweł Zarzeczny byłby,Tym razem nie było wielu anegdot podchwytliwych pytań zagadek opowieści o sobie czasem wręcz przechwalania  to zarezerwowane było dla Pawła Byli natomiast ludzie Ludzie z których Paweł czerpał radość Z niektórymi się spotykał innych po prostu
53686,20170331,2017-03-31,Prima aprilis,"20,000+",Prima aprilis 2017 żarty na 1 kwietnia Sprawdź jak wkręcić,Prima aprilis to ten dzień w roku kiedy bez skrupułów możemy wkręcać bliskich i robić im żarty Jak co roku 1 kwietnia każdy chce zrobić komuś jakiś kawał Jeśli jeszcze nie macie pomysłu na żarty na prima aprilis to mamy dla Was kilka śmiesznych
53687,20170331,2017-03-31,SpaceX,"2,000+",SpaceX udało się ponownie wystrzelić rakietę w przestrzeń,Firma SpaceX druga najpopularniejsza po Tesli spółka Elona Muska ma na koncie nowy sukces Udało się ponownie wystrzelić w przestrzeń kosmiczną rakietę Falcon 9 Niedawno miała ona swój pierwszy lot po czym wróciła na ziemię Teraz poleciała w
53688,20170331,2017-03-31,Veturilo,"2,000+",Tysiące wypożyczeń i nowych użytkowników Imponujące rekordy,Prawie 330 tysięcy razy wypożyczane były miejskie rowery Veturilo w ciągu pierwszego miesiąca tegorocznego sezonu Ponadto w tym czasie w systemie zarejestrowało się blisko 23 tys nowych użytkowników Odnotowano także historyczny rekord dzienny
53689,20170331,2017-03-31,Zosia Majewska,"5,000+",Zosia Majewska córka Szymona Majewskiego w roli modelki Jak,Z pozoru eteryczna blondynka W rzeczywistości zdecydowana 23latka o wysmakowanym guście Zosia Majewska córka Szymona Majewskiego debiutuje na łamach LOFFICIEL POLSKA w wyjątkowej sesji czytamy w opisie jednej z fotografii
53690,20170331,2017-03-31,fotograf,"2,000+",Pączki z nasieniem to dopiero początek Szczeciński fotograf miał,Fotograf wpadł niemal na własne życzenie Nagrywał a następnie udostępniał w sieci filmy które stały się dokumentacją jego bulwersujących działań Widać na nich jak wstrzykuje podejrzaną substancję do pączków ciastek i napojów a następnie częstuje
53691,20170331,2017-03-31,polityka epistolarna,"20,000+",Prezydent Andrzej Duda broni polityki epistolarnej Pisemność,Prezydent odpowiedział w ten sposób na pytanie o wypowiedź prezesa PiS Jarosława Kaczyńskiego dla PAP Kaczyński odnosząc się do współpracy między prezydentem a szefem MON Antonim Macierewiczem podkreślił że nie podoba mu się polityka
53692,20170331,2017-03-31,Śląsk Wrocław,"2,000+",Śląsk zaimponował w meczu z Koroną i wciąż walczy o czołową,Śląsk Wrocław Mariusz Pawełek  Kamil Dankowski Piotr Celeban Adam Kokoszka Mateusz Lewandowski  Joan Roman 89 Mario Engels Aleksandar Kovacevic Sito Riera Ryota Morioka 86 Ostoja Stjepanovic Robert Pich  Łukasz Zwoliński 81
53693,20170401,2017-04-01,1 Liga,"2,000+",Pochwała bałaganu Mecze Nice 1 Ligi nadal będą przekładane,Prawie połowa spotkań 23 kolejki Nice 1 Ligi została przełożona z powodu powołań zawodników do młodzieżowych reprezentacji Piłkarze aż dziesięciu klubów zaplecza ekstraklasy wzięli udział w zgrupowaniach kadr narodowych ale tylko dwóch z nich
53694,20170401,2017-04-01,Anna Lucińska,"2,000+",Anna Lucińska kim jest gwiazda TVP,Gdy Anna Lucińska zamieściła na swoim koncie na Instagramie zdjęcia z wakacji na Bali nie mogła przewidzieć że wszyscy będą o niej mówić Piękne fotografie pokazują że Lucińska ma wszystko czego potrzebuje gwiazda w Polsce Kim jest dziewczyna
53695,20170401,2017-04-01,Arka Gdynia,"5,000+",Arka Gdynia  Górnik Łęczna zabójcza skuteczność gości,Arka już sprawiała wrażenie rozbitej a mimo to podniosła się z kolan W 73 minucie nadzieję gospodarzom przywrócił Dariusz Formella Gdynianie nie poszli jednak za ciosem a w 80 minucie kapitalnym uderzeniem z rzutu wolnego Szymon Drewniak dobił
