index,dayId,date,name,traffic,newsTitle,newsSnippet
51597,20161129,2016-11-29,29 Listopada,"5,000+",Aleja 29 Listopada będzie rozbudowana,We wtorek 29 listopada została podpisana umowa na dofinansowanie rozbudowy jednej z najważniejszych arterii prowadzących do centrum Krakowa  al 29 Listopada Już od przełomu 2019 i 2020 roku kierowcy pojadą poszerzonym odcinkiem tej drogi
51598,20161129,2016-11-29,Alan Ruschel,"20,000+",Ranny w katastrofie w Kolumbii Alan Ruschel w stanie stabilnym,31letni piłkarz Chapecoense Marcos Danilo Padilha który przeżył katastrofę samolotu w pobliżu kolumbijskiej miejscowości Medellin zmarł kilka godzin później w szpitalu Strażacy uratowali za to z wraku jego kolegę z drużyny Neto Alan Ruschel który
51599,20161129,2016-11-29,Arka Gdynia,"5,000+",Puchar Polski awans Arki Gdynia po zwycięstwie nad Drutex,Arka Gdynia pokonała DrutexBytovię Bytów 10 00 w rewanżowym spotkaniu ćwierćfinałowym Pucharu Polski W pierwszym meczu pierwszoligowcy wygrali 21 ale dzięki bramce zdobytej na wyjeździe do kolejnej fazy awansował zespół z Gdyni
51600,20161129,2016-11-29,Brazylia,"2,000+",Brazylia Trzydniowa żałoba narodowa po katastrofie samolotu w,W Brazylii ogłoszono trzydniową żałobę narodową po śmierci 75 osób w katastrofie samolotu pasażerskiego w Kolumbii Wśród ofiar śmiertelnych są min zawodnicy pierwszoligowej brazylijskiej drużyny piłkarskiej Chapecoense Sześć osób przeżyło
51601,20161129,2016-11-29,Chapecoense,"100,000+",Chapecoense wielka tragedia skromnego klubu,W katastrofie samolotu którym na finał Pucharu Copa Sudamericana lecieli piłkarze Chapecoense zginęło 76 osób  To była skromna drużyna ale umiejętnie zarządzana Budowana od podstaw  opowiada nam Bartłomiej Rabij z radiobrazyliapl
51602,20161129,2016-11-29,Cleber Santana,"5,000+",Były piłkarz Atletico Madryt Cleber Santana wśród ofiar katastrofy w,Pięć osób przeżyło katastrofę samolotu z brazylijską drużyną Chapecoense Chapeco występującą w najwyższej klasie rozgrywkowej który rozbił się w Kolumbii  poinformował dziennik Marca Wśród ofiar jest Cleber Santana były zawodnik Atletico Madryt
51603,20161129,2016-11-29,Czarnobyl,"2,000+",Ważąca 29 tys ton arka przykryła reaktor w Czarnobylu Yes,Zniszczony w 1986 r reaktor elektrowni w Czarnobylu został we wtorek zabezpieczony nową konstrukcją arką która ma go izolować co najmniej przez następne 100 lat Ale to nie rozwiązuje problemu na zawsze Na razie brakuje rozwiązań
51604,20161129,2016-11-29,Danilo,"20,000+",Kolumbijskie służby ratunkowe odnalazły szóstą osobę ocalałą z,Już po zakończeniu akcji ratunkowej we wraku rozbitego samolotu odnaleziono szóstą osobę ocalałą po tragedii w której zginęła niemal cała drużyna i pracownicy klubu Bramkarz Marcos Danilo zmarł w szpitalu  poinformowały kolumbijskie media
51605,20161129,2016-11-29,Final Fantasy XV,"5,000+",Final Fantasy XV w zwiastunie inspirowanym Stranger Things,Zwiastun wieńczy wzruszające motto Trzymajcie się razem Final Fantasy XV ma zresztą przywiązywać dużą wagę do motywu przyjaźni i wsparcia jakiego potrzebuje Noctis ze strony swoich kolegów aby odzyskać co mu należne  tron berło i miłość ale
51606,20161129,2016-11-29,Joanna Opozda,"2,000+",Szlachetna i naga pierś Joanny Opozdy na wernisażu,W Pałacu Zamoyskich odbyła się prezentacja Kalendarza Szlachetna Kobieta Pojawiło się na niej wiele gwiazd min Joanna Opozda Magdalena Ogórek Teresa Rosati Monika Zamachowska Paulina Drażba Lidia Popiel czy Rena Dancewicz Zobacz
51607,20161129,2016-11-29,Józef Pinior,"100,000+",Józef Pinior zatrzymany przez CBA Prokuratura zarzuca mu,Józef Pinior zatrzymany został dziś o godz 6 w swoim domu na wrocławskim Ołtaszynie Do godziny 10 trwały tam czynności Jak powiedziała nam osoba która rozmawiała z żoną Piniora agentom towarzyszyć miały kamery jednej z telewizji Po godz
51608,20161129,2016-11-29,Kambo,"2,000+",Prokuratura wstępne przyczyny śmierci uczestniczki warsztatów,Obrzęk mózgu i niewydolność krążeniowooddechowa  to według wstępnych wyników sekcji zwłok przyczyna śmierci kobiety uczestniczki warsztatów Kambo w Grodzisku Mazowieckim pod Warszawą 30latka zmarła po jednym z takich seansów
51609,20161129,2016-11-29,Magdalena Boczarska,"20,000+",Kuba Wojewódzki będzie gościł Magdę Boczarską i Sebastiana,Magda Boczarska jest jedną z gwiazd TVNowskiej produkcji Druga Szansa w której wciela się w popularną aktorkę Sarę Daymer Boczarska zagrała ostatnio także w filmie Marii Sadowskiej Sztuka Kochania w którym wcieliła się w Michalinę Wisłocką
51610,20161129,2016-11-29,Marcin Babko,"10,000+",Marcin Babko nie żyje,Poza tym Babko pisał do katowickiego oddziału Gazety Wyborczej gdzie odkrywał młodych śląskich artystów Pisał również książki biograficzne  min Ziuta Blues o Irku Dudku i Otwórz oczy o Coldplay Zmarł w niedzielę 27 listopada w wieku 41 lat
51611,20161129,2016-11-29,Patryk Grudowicz,"20,000+",Top Model FINAŁ Jest zwycięzca To Patryk Grudowicz,Głosami widzów 100 tys złotych kontrakt z agencją AVANT i okładkę Glamour wygrał Patryk Grudowicz Patryk ma 19lat mieszka z mamą i rodzeństwem Trudna sytuacja rodzinna sprawiła że musiał iść do pracy w młodym wieku Jego pasją jest sport
51612,20161129,2016-11-29,Puchar Polski,"10,000+",Puchar Polski Pogoń Szczecin zgodnie z planem zagra w półfinale,Pogoń Szczecin pokonała Puszczę Niepołomice 20 10 w rewanżowym meczu ćwierćfinału Pucharu Polski Pierwszy mecz wygrali również Portowcy i to oni dzięki wygranej 41 w dwumeczu jako pierwszy zespół awansowali do półfinału tych rozgrywek
51613,20161129,2016-11-29,Riverdale,"2,000+",Riverdale Nowy serial twórców Plotkary,Fabuła serialu będzie osnuta wokół Andrewsa KJ Apa i jego przyjaciół z liceum w Riverdale oraz jego relacjach z dwiema dziewczynami  Betty Cooper Lili Reinhart i Veronici Lodge Camila Mendes Trójka nastolatków niespodziewanie znajdzie się w
51614,20161129,2016-11-29,Slumdog,"5,000+",Program TV  Kapitan Ameryka Slumdog i Whiplash dziś w telewizji,We wtorkowym zestawieniu Movies Room znajdziecie aż 3 wielkie hity ostatnich lat Są to pierwsza część przygód Kapitana Ameryki w ramach Marvel Cinematic Universe oskarowe arcydzieło Slumdog milioner z Ulicy i po raz kolejny jeden z najlepszych
51615,20161129,2016-11-29,wróżby Andrzejkowe,"20,000+",Czy wierzymy we wróżby Andrzejkowe,Źródła historyczne podają że zwyczaje andrzejkowe znane były w Europie już w okresie średniowiecza Pierwotnie na ziemiach polskich w obrzędach andrzejkowych uczestniczyły wyłącznie panny na wydaniu a wróżby dotyczyły przede wszystkim spraw
51616,20161130,2016-11-30,30 listopada,"5,000+",Wydarzenia dnia w skrócie 30 listopada w Wielkopolsce ZDJĘCIA,Wydarzenia dnia w skrócie czyli tym 30 listopada żyła Wielkopolska i Poznań Zobaczcie o czym pisali w środę dziennikarze serwisu Nasze Miasto Oto przegląd najważniejszych i najciekawszych wydarzeń w regionie test
51617,20161130,2016-11-30,Andrzej,"2,000+",Prezydent Andrzej Duda objął honorowym patronatem mistrzostwa,Kancelaria prezydenta RP Andrzeja Dudy przesłała we wtorek na ręce prezesa PZPS Jacka Kasprzyka list z informacją o objęciu przez głowę państwa honorowego patronatu nad mistrzostwami Europy w piłce siatkowej mężczyzn Polska 2017  przekazał
51618,20161130,2016-11-30,Barbórka,"2,000+",Odwołana Barbórka WUG,Z zaplanowanych drugiego grudnia br uroczystości barbórkowych nadzoru górniczego odbędzie się msza św o godz 900 w Kościele Piotra i Pawła w Katowicach przy ul Mikołowskiej Nabożeństwo w intencji pracowników organów nadzoru górniczego i
51619,20161130,2016-11-30,Cheryl Cole,"10,000+",Cheryl Cole nie potwierdziła plotek o ciąży Już nie musi Nowe zdjęcia rozwiały wszystkie wątpliwości,Cheryl Cole i Liam Payne tworzą jeden z najbardziej kontrowersyjnych związków w brytyjskim showbiznesie Para poznała się w 2010 r na planie XFactora gdzie 16letni wówczas wokalista zaczynał swoją karierę a 10 lat starsza Cheryl zasiadała w jury
51620,20161130,2016-11-30,Enzo Zidane,"5,000+",Puchar Króla Gol w debiucie Enzo Zidanea Real Madryt wygrał 61,Tuż po przerwie na boisku pojawił się najstarszy syn Zizou Enzo Zidane dla którego był to debiut w pierwszej drużynie Realu Madryt Kilkanaście minut później obaj Francuzi oszaleli z radości bo 21latek posłał piłkę do siatki Pierwszy mecz
51621,20161130,2016-11-30,FATCA,"2,000+",Myślisz że FATCA cię nie dotyczy Sprawdź bo jutro mogą,Dziś ostatni dzień na złożenie w bankach i innych instytucjach finansowych oświadczeń FATCA Obowiązek ten dotyczy wielu Polaków często nawet tego nie podejrzewających Sprawy nie warto bagatelizować bo brak oświadczenia będzie oznaczał jutro
51622,20161130,2016-11-30,Jagadish Chandra Bose,"1,000,000+",Jagadish Chandra Bose,Jagadish Chandra Bose urodził się 30 listopada 1958 roku i przez całe swoje życie zajmował się różnymi dziedzinami nauki Jego wszechstronne wykształcenie było imponujące posiadał wiedzę naukową z biologii fizyki botaniki archeologii i biofizyki
51623,20161130,2016-11-30,Joanna Krupa,"10,000+",Pojedynek na dekolty w Top Model Wygrała ona,Finał programu Top Model dostarczył wielu emocji nie tylko widzom z Polski Rozpisują się o nim nawet zagraniczne media Wszystko za sprawą dwóch topmodelek  Anny Jagodzińskiej i Joanny Krupy Obie panie miały na sobie tego wieczoru zjawiskowe
51624,20161130,2016-11-30,Lubin,"5,000+",Kryzys KGHM Zagłębia Lubin Musimy pokazać że możemy,KGHM Zagłębie Lubin które na początku sezonu Lotto Ekstraklasy spisywało się bardzo dobrze teraz w tabeli jest już siódme a do prowadzącej Lechii Gdańsk traci dwanaście punktów Miedziowym ciąży przede wszystkim brak zwycięstw na własnym
51625,20161130,2016-11-30,MEN,"10,000+",MEN przedstawia projekt podstawy programowej I czeka na uwagi,MEN rozpoczęło w środę prekonsultacje projektu nowej podstawy programowej kształcenia ogólnego zgodnie z którą uczyć się będą uczniowie w 8letniej szkole podstawowej Jeszcze w grudniu projekt nowej podstawy ma trafić do właściwych konsultacji
51626,20161130,2016-11-30,Marcin Siegieńczuk,"2,000+",Polak z medalem Pucharu Europy,Marcin Siegieńczuk reprezentant Polski w karate zajął trzecie miejsce w zawodach Pucharu Europy odbywających się w miniony weekend w Wałbrzychu W mistrzostwach udział wzięła rekordowa liczba zawodników W turnieju walczyło aż 500 karateków
51627,20161130,2016-11-30,Maria Konarowska,"2,000+",Finał Azja Express Kto wygrał Agnieszka Włodarczyk i Maria,Agnieszka Włodarczyk i Maria Konarowska jako pierwsze dostały się do finału programu Azja Express Czy w ostatnim odcinku też będą najlepsze Zdjęcie z artykułu Finał Azja Express Kto wygrał Agnieszka Włodarczyk i Maria Konarowska Azja Express
51628,20161130,2016-11-30,Paul Walker,"5,000+",Dziś trzecia rocznica tragicznej śmierci Paula Walkera,Gdyby żył Walker miałby dopiero 43 lata Tragicznie zmarły aktor przyszedł na świat 12 września 1973 roku najstarsze z czworga dzieci krawca i fotografa Paula Williama Walkera III oraz modelki Cheryl Ann Crabtree Widzowie na całym świecie pokochali
51629,20161130,2016-11-30,Polkowice,"20,000+",Polkowice Wstrząs w kopalni Rudna Czterech górników nie żyje,Ośmiu górników nie żyje po silnym wstrząsie do jakiego doszło we wtorek późnym wieczorem w należącej do KGHM kopalni Rudna w Polkowicach woj dolnośląskie W strefie zagrożenia pracowało 30 osób Większość udało się ewakuować
51630,20161130,2016-11-30,Puchar Polski 201617,"2,000+",Znamy pary półfinałowe Pucharu Polski,Mecze 1 2 finału Pucharu Polski odbędą się już w 2017 roku Pierwsze spotkania półfinałowe zaplanowano na przełom lutego i marca zaś rewanże rozegrane zostaną w dniach 46 kwietnia Finał rozgrywek o Puchar Polski odbędzie się 2 maja 2017 roku
51631,20161130,2016-11-30,Robert Grey,"2,000+",Wiceminister Robert Grey odwołany Zataił fakt współpracy ze,Wiceminister spraw zagranicznych Robert Grey został pilnie odwołany bo zataił fakt współpracy ze służbami USA mimo że był o to pytany  informuje wyborczapl Resort zdementował te informacje Informację o odwołaniu wiceministra Greya potwierdziła
51632,20161130,2016-11-30,Tamara Arciuch,"5,000+",Tamara Arciuch urodziła,Tamara Arciuch po raz trzeci została mamą Aktorka poinformowała swoich fanów o narodzinach córeczki publikując oświadczenie na koncie instagramowym  Kilka dni temu zostaliśmy szczęśliwymi rodzicami zdrowej córeczki Pragniemy podziękować
51633,20161130,2016-11-30,WYNIKI LOTTO 291116,"10,000+",WYNIKI LOTTO 2911 LOSOWANIE LOTTO WYNIKI 2911 LOTTO,WYNIKI LOTTO 2911 LOTTO LOSOWANIE WYNIKI 291116 WYNIKI LOTTO 291116 LOTTO WYNIKI 291116 Kolejna szansa na wielkie pieniądze Tym razem w KUMULACJI do wygrania jest ok 17 mln zł  LOSOWANIE LOTTO WYNIKI 291116 LOTTO
51634,20161201,2016-12-01,1 grudnia,"5,000+",Wyniki Lotto 1 grudnia 2016 Do wygrania 20 milionów złotych,WYNIKI LOTTO 1 grudnia 2016 Lotto 1122016 Sprawdź wyniki losowania Lotto W ostatnich losowaniach Lotto nie padła główna wygrana Trafiona dzisiaj jedna szóstka może być warta nawet 20 milionów złotych Zaraz po wieczornym losowaniu Lotto
51635,20161201,2016-12-01,Agnieszka Włodarczyk,"2,000+",Agnieszka Włodarczyk Nie mam faceta i robię co chcę,Agnieszka Włodarczyk 36 l mocno przeżyła ubiegłoroczne rozstanie z Mikołajem Krawczykiem 35 l Teraz jednak aktorka w końcu dostrzega zalety bycia singielką Teraz może pozwolić sobie na to z czego rezygnowała będąc w związku Stara się
51636,20161201,2016-12-01,Arrinera Hussarya,"5,000+",Zaprezentowano Arrinera Hussarya GT,Zaprojektowany w Polsce samochód wyścigowy Arrinera Hussarya GT zaprezentowali w piątek przed Ministerstwem Rozwoju w Warszawie twórcy tego auta W wydarzeniu uczestniczył wicepremier minister rozwoju i finansów Mateusz Morawiecki który
51637,20161201,2016-12-01,Chlastawa,"2,000+",Kuchenne rewolucje w Chlastawie Takiej sytuacji jeszcze nie było,Takiej sytuacji jeszcze nie było Ekipa Cykady przeanalizowała odcinki Kuchennych Rewolucji i przygotowała dla Magdy Gessler dania które zawsze chwaliła Czy takie oszustwo ujdzie im na sucho Premiera odcinka w czwartek 1 grudnia o godz
51638,20161201,2016-12-01,GOG,"10,000+",Fani kultowych cRPG do myszek Neverwinter Nights za darmo na,Kapitalną inicjatywą wykazali się włodarze mojej ulubionej platformy cyfrowej dystrybucji  Good Old Games Na GOGcom dodać na stałe do biblioteki i pobrać Neverwinter Nights Diamond Całkowicie za darmo i bez żadnych haczyków Wystarczy konto w
51639,20161201,2016-12-01,Gigi Hadid,"5,000+",Gigi Hadid jest wściekła na siostrę Bella skradła jej cały pokaz,Gigi Hadid nie może darować sobie przede wszystkim tego że według niej to ona ułatwiła siostrze karierę w modelingu Mało tego to jej wszyscy zarzucają że nie wygląda jak prawdziwa top modelka ma nieodpowiednią figurę a wszystko zawdzięcza
51640,20161201,2016-12-01,Grzegorz Krychowiak,"2,000+",Grzegorz Krychowiak ma dla swoich fanów zadanie Chodzi o wybór,Wraz z licznymi propozycjami imion popłynęły również gratulacje od fanów Ci założyli  z pewnością słusznie  że takie pytanie nie może być dziełem przypadku i w ten sposób Krychowiak dzieli się ze światem informacją o powiększeniu rodziny
51641,20161201,2016-12-01,Irina Shayk,"10,000+",Irina Shayk jest w ciąży z Bradleyem Cooperem,30letnia Irina Shayk i 41letni Bradley Cooper spotykają się od 2015 roku Oficjalnie są parą od marca 2016 roku  wtedy pojawili się wspólnie na czerwonym dywanie Według źródła modelka i aktor ostatnio dużo rozmawiali o założeniu wkrótce rodziny i
51642,20161201,2016-12-01,Józef Pinior,"20,000+",Sąd Józef Pinior nie trafi do aresztu,Były senator Józef Pinior wraz z 10 innymi osobami został zatrzymany przez CBA we wtorek rano Jest podejrzany o przyjęcie wiosną zeszłego roku 40 tys zł za załatwienie w instytucjach państwowych i samorządowych korzystnego rozstrzygnięcia spraw
51643,20161201,2016-12-01,Kendall Jenner,"5,000+",Adriana Lima szczerze o tym jak jej się pracuje z Kendall Jenner,Modelka w wywiadzie dla portalu EOnline szczerze przyznała co sądzi na temat młodszej koleżanki po fachu  Kendall Jenner Pracowałam z Kendall na wybiegach już wcześniej Kiedyś jak byłyśmy w Europie szłyśmy razem w pokazie Versace jak
51644,20161201,2016-12-01,Nowa Podstawa Programowa,"5,000+",Kulturalne kibicowanie bez trygonometrii Podstawa programowa,Z nowej podstawy programowej ogłoszonej w środę 30 listopada przez Ministerstwo Edukacji Narodowej wynotowaliśmy kilkanaście najciekawszych założeń Podstawa jako całość jest bowiem zdaniem nauczycieli dość zachowawcza i przypomina z
51645,20161201,2016-12-01,Player Singielka,"5,000+",Singielka Nowe odcinki w Playerpl Natalia zostanie dziennikarką,Singielka znika z TVN Od dziś premierowe odcinki serialu będzie można zobaczyć za darmo tylko na Playerpl Co się wydarzy w premierowych odcinkach serialu Singielka Zobaczymy jak Elka Paulina Chruściel dogaduje się z Tomaszem Mateusz
51646,20161201,2016-12-01,Real Madryt,"10,000+",Trwa kapitalna seria Realu Madryt Zidane coraz bliżej rekordu,Piłkarze Realu Madryt kontynuują swoją fantastyczną passę meczów bez porażki z rzędu Poprzednio Królewscy przegrali w kwietniu tego roku i są coraz bliżej pobicia historycznego rekordu klubu z sezonu 19881989 kiedy to ekipę z Santiago Bernabeu
51647,20161201,2016-12-01,Ronaldinho,"2,000+",To byłoby wielkie wydarzenie Po tragedii brazylijski klub wzmocni,Brazylijczyk Ronaldinho i Argentyńczyk Juan Roman Riquelme mieli wstępnie zgodzić się na występy w klubie ze stanu Santa Catarina Jak podają media nie będą chcieli za to wynagrodzenia  Legendy  komentują media Piotr Bobakowski 01 Grudnia
51648,20161201,2016-12-01,Urszula Dudziak,"2,000+",Piętnuje antykoncepcję o kobietach mówi że są permisywne Ale,Nie czyta prasy poza Naszym Dziennikiem Nie ogląda telewizji z wyjątkiem TV Trwam Nie rozmawia z dziennikarzami z laickich mediów Tak o dr hab Urszuli Dudziak pisze Polityka Dlaczego Teolog związana z KUL piętnuje antykoncepcję
51649,20161201,2016-12-01,Victoria Secret,"10,000+",Aniołki oczarowały publiczność Wielkie show Victorias Secret,Każdy pokaz Victorias Secret gromadzi przed telewizorami miliony widzów na całym świecie Odbywające się od 22 lat imprezy stały się jednymi z najważniejszych wydarzeń kalendarza branży mody Tegoroczny show  po raz pierwszy w historii  odbył się
51650,20161201,2016-12-01,Wigry Suwałki,"2,000+",Puchar Polski remis Wigier Suwałki na miarę awansu do półfinału,Nie było niespodzianki w trzecim ćwierćfinale Pucharu Polski Wigry Suwałki zremisowały 11 10 z GKS 1962 Jastrzębie i dołączyły do grona półfinalistów w dwumeczu zwyciężając 32 Trzecioligowiec pokazał się z bardzo ambitnej strony a ozdobą
51651,20161201,2016-12-01,Wittchen,"10,000+",Torebka Magdaleny Ogórek od Prady kosztuje prawie 4000 zł  podobną kupisz za190 zł Gdzie,Wittchen znowu pojawi się w Lidlu Kolekcja na zimę 2016 będzie zawierać propozycje na prezent torebki portfele oraz paski  dla niej i dla niego Ceny będą oczywiście znacznie niższe od tych które widujemy w salonach Wittchen np małą cielistą
51652,20161202,2016-12-02,2 grudnia,"2,000+",Prognoza pogody dla Pomorza na piątek 2 grudnia WIDEO,Ostrzeżenie Instytutu Meteorologii i Gospodarki Wodnej Prognozuje się wystąpienie silnego wiatru o średniej prędkości od 35 kmh do 55 kmh z porywami do 80 kmh nad morzem do 90 kmh z północnegozachodu Najsilniejsze porywy wiatru wystąpią w
51653,20161202,2016-12-02,Bayern Monachium,"10,000+",Bundesliga dublet Roberta Lewandowskiego w świetnym stylu,Na inaugurację 13 kolejki Bundesligi 1FSV Mainz podejmowało Bayern Monachium Mistrzowie Niemiec wygrali 31 po dwóch golach Roberta Lewandowskiego oraz trafieniu Arjena Robbena i co najmniej do sobotniego wieczora otwierają ligową tabelę
51654,20161202,2016-12-02,Beata MaciejewskaWelfle,"10,000+",Anna Lewandowska wstrząśnięta śmiercią koleżanki Nie żyje,Nie żyje Beata MaciejewskaWelfle mistrzyni Polski w karate w konkurencji Fukugo prywatnie bardzo dobra znajoma Anny Lewandowskiej Zawodniczka przegrała walkę z ciężką chorobą osierociła niespełna dwuletniego synka To właśnie na pomoc w
51655,20161202,2016-12-02,Britney Spears,"2,000+",Britney Spears kończy dziś 35 LAT ZDJĘCIA,Britney Spears od dzieciństwa była kreowana na gwiazdę Pierwsze kroki w show biznesie stawiała w Klubie Myszki Miki obok Christiny Aguilery i Justina Timberlakea Spears zawojowała listy przebojów piosenką Baby One More Time i szybko stała się
51656,20161202,2016-12-02,Death Stranding,"2,000+",Mads Mikkelsen i Guillermo del Toro w zwiastunie Death Stranding  nowej gry Hideo Kojimy,Nowy zwiastun gry Death Stranding imponuje Widzimy w nim mroczną apokaliptyczną przyszłość której jednym z najważniejszych elementów ale jednocześnie najbardziej zagrożonych są dzieci W rolach głównych Mads Mikkelsen gwiazda serialu
51657,20161202,2016-12-02,El Clasico,"2,000+",Niespodzianka na treningu Sytuacja kadrowa Barcy i Realu,Na ostatnich zajęciach przed El Clásico Luis Enrique mógł liczyć na niemal wszystkich piłkarzy pierwszego zespołu w tym na wracających do zdrowia Andrésa Iniestę czy Jordiego Albę Zabrakło jedynie Jérémiego Mathieu któremu kilka dni temu wrócił uraz
51658,20161202,2016-12-02,El Clasico 2016,"2,000+",Niespodzianka na treningu Sytuacja kadrowa Barcy i Realu,Na ostatnich zajęciach przed El Clásico Luis Enrique mógł liczyć na niemal wszystkich piłkarzy pierwszego zespołu w tym na wracających do zdrowia Andrésa Iniestę czy Jordiego Albę Zabrakło jedynie Jérémiego Mathieu któremu kilka dni temu wrócił uraz
51659,20161202,2016-12-02,IMGW,"2,000+",Wietrznie i śnieżnie Ostrzeżenia IMGW,Ostrzeżenie IMGW pierwszego stopnia najniższe w trzystopniowej skali przewiduje wystąpienie niebezpiecznych zjawisk meteorologicznych które mogą powodować szkody materialne możliwe zagrożenie życia Prowadzenie działalności w warunkach
51660,20161202,2016-12-02,KSW 37,"50,000+",KSW 37 karta walk Kto walczy,Walka Pudzianowski  Popek Monster będzie główną atrakcją KSW 37 Łącznie odbędzie się osiem pojedynków z czego trzy o pas mistrzowski Kuba Kaczmarek 02 Grudnia 2016 1619 Udostępnij 1 Tweetnij Skomentuj 0 Newspix  JACEK UFNAL
51661,20161202,2016-12-02,Legia,"20,000+",Legia  Wisła Płock Jacek Magiera łata dziury i zaskakuje,Nie Aleksandar Prijović tylko Nemanja Nikolić rozpocznie piątkowe spotkanie Legii z Wisłą Płock od pierwszej minuty To zaskoczenie bo Szwajcar w poprzednich spotkaniach nie zawodził Jak już to zachwycał Początek meczu o 2030 transmisja w
51662,20161202,2016-12-02,Lenovo Moto Z,"2,000+",Lenovo odpuszcza  nie będzie nowego smartwatcha Moto z,Seria smartwatchy Moto jest nierozerwalnie związana z platformą Android Wear Premiera Moto 360 była sporym wydarzeniem dla rynku smartzegarków przede wszystkim z powodu konstrukcji urządzenia Motoroli  był to pierwszy smartwatch z okrągłym
51663,20161202,2016-12-02,Lion Droga Do Domu,"2,000+",Lion Droga do domu Rooney Mara wspiera Deva Patela,Rooney Mara Dziewczyna z tatuażem partneruje Devowi Patelowi Slumdog Milioner z ulicy Hotel Marigold w filmie zainspirowanym prawdziwą historią o nadzwyczajnej odwadze i wielkiej sile miłości  Lion Droga do domu Film na naszych
51664,20161202,2016-12-02,Metro TV,"2,000+",Metro HD i WP HD w UPC Polska,Od piątku 2 grudnia 2016 roku abonenci telewizji cyfrowej sieci UPC Polska mogą oglądać nowe kanały Metro HD dostępny jest w dekoderach operatora na pozycjach 157 Mediabox oraz 115  Horizon Z kolei kanał WP HD dostępny jest na pozycjach
51665,20161202,2016-12-02,Mila Kunis,"2,000+",Mila Kunis i Ashton Kutcher znów zostali rodzicami Znamy płeć,Mila Kunis i Ashton Kutcher mają powody do radości Jak donosi People para właśnie doczekała się drugiego dziecka W minioną środę aktorka urodziła syna Ponoć oboje właśnie o tym marzyli Oczywiście mówili wszystkim że i tak będą szczęśliwi gdy
51666,20161202,2016-12-02,Milik,"2,000+",Mistrzostwa Europy U21 2017 Milik Zieliński i spółka chcą grać dla,Milik Zieliński Kapustka Linetty Dawidowicz  oni wszyscy czekają na te mistrzostwa Każdy z nich wiele zawdzięcza trenerowi Dornie Gdzie się rozwinął Milik Był królem strzelców poprzedniej edycji eliminacji mistrzostw gdy trenerem był Dorna
51667,20161202,2016-12-02,Miss Supranational 2016,"20,000+",Miss Supranational 2016 oto 71 kandydatek do tytułu,Na gali finałowej Miss Supranational 2016 która odbędzie się w Krynicy Zdrój panie zaprezentują się w sześciu odsłonach w strojach narodowych w czarnych sukniach glamour z kolekcji Kamila Hali kostiumach strojach sportowych białych sukniach
51668,20161202,2016-12-02,Monika Lewczuk,"10,000+",Alvaro Soler i Monika Lewczuk w utworze Libre Zobaczcie teledysk,Współpraca z Alvaro to genialna muzyczna przygoda ale też ogromna przyjemność ponieważ już podczas pierwszego spotkania okazało się ze jest on osobą niesamowicie pozytywną i otwartą  wspomina Monika Przez cały czas kiedy pracowaliśmy
51669,20161202,2016-12-02,Nico Rosberg,"10,000+",Nico Rosberg kończy karierę w Formule 1,Zaledwie kilka dni po zdobyciu swojego pierwszego tytułu mistrza świata Nico Rosberg ogłosił zakończenie kariery w Formule 1 w trybie natychmiastowym Natalia Musiał 02 Grudnia 2016 1446 Udostępnij 458 Tweetnij Skomentuj 27 AFP Tego chyba
