index,dayId,date,name,traffic,newsTitle,newsSnippet
64849,20161129,2016-11-29,국정교과서,"2,000+",국정교과서 4 지지 정권과 함께 사라지게 만들 것,28일 공개된 국정 역사교과서에 대한 전북지역 교육노동인권역사시민사회단체들의 평가다 29일 오전 전북교육연대와 박근혜 정권 퇴진을 위한 전북지역 비상시국회의이하 전북시국회의가 전북교육청 브리핑룸에서 기자회견을 열고 국정 역사교과서에
64850,20161129,2016-11-29,낭만닥터 김사부 7회,"5,000+",낭만닥터 김사부 7회 유연석 눈빛 연기에 여심 자극 시청자들 호평,드라마 낭만닥터 김사부 7회에서 유연석이 눈빛 연기 60분을 가득 채우며 호평을 받았다 SBS 월화드라마 낭만닥터 김사부에서 유연석강동주 역은 눈빛에 담은 감정연기로 극의 몰입도를 최고치로 이끌었다 팽팽한 긴장감 속에서 날 선 눈빛과 로맨스 장면
64851,20161129,2016-11-29,대국민담화,"2,000+",3차 대국민담화 박근혜 대통령 임기단축 포함한 진퇴 문제 국회에 맡기겠다 전문,박 대통령은 이날 오후 청와대 춘추관에서 발표한 대국민담화를 통해 여야 정치권이 논의하여 국정의 혼란과 공백을 최소화하고 안정되게 정권을 이양할 수 있는 방안을 만들어 주시면 그 일정과 법 절차에 따라 대통령 직에서 물러나겠다며 이 같이 말했다
64852,20161129,2016-11-29,박근혜,"20,000+",박근혜 담화는 꼼수촛불이 횃불로 번지나,전국빈민연합은 노점을 철시하고 상가 문을 닫는 것으로 박근혜 정권퇴진 전국 대학생 시국회의는 동맹휴업을 벌인다 노동자 상인 대학생들은 30일 광화문광장과 전국 곳곳에서 동시다발 박근혜 퇴진 촉구 촛불행진을 벌인다 퇴진행동은 12월 3일 주말 6차
64853,20161129,2016-11-29,정승환,"2,000+",정승환 이 바보야 국내 음원 차트 1위 올킬 소감 제 이름을 내건 음반이 나온 것도 신기,29일 오전 정승환은 소속사 안테나를 통해 새벽에 잠들었는데 아침에 일어나니 여기저기서 많은 분이 축하 인사를 보내주셨더라 아직까지 데뷔하고 제 이름을 내건 음반이 나오고 제 목소리를 많은 분이 들어주시게 된 상황도 굉장히 신기하고 믿어지지 않는데
64854,20161129,2016-11-29,태극기,"2,000+",교육부가 국정교과서 홍보 웹툰에 엉터리 태극기를 넣었다,5번째 장면에선 올바른 역사교과서로 공부하면 자랑스러운 우리 역사에 대해 바르게 이해할 수 있어라면서 배경엔 잘못 그린 태극기를 배치했다 8번째 장면에선 우리 민족의 치열한 독립운동과 민주화의 역사도 교과서에 잘 들어있단다라고 서술하며
64855,20161130,2016-11-30,리니지 이터널,"2,000+",리니지 이터널 정통 리니지를 계승한 3번째 시리즈,리니지 이터널은 리니지 IP지적재산권와 세계관을 공유하며 리니지로부터 약 70년 후의의 세계를 배경으로 갖고 있다 기존 리니지 시리즈는 사람과 사람이 마주하는 또 다른 세상을 모토로 가상 공간에서 수많은 실존 역사를 만들어 내며 사용자들로부터 18
64856,20161130,2016-11-30,박영수,"5,000+",박영수 특검 좌고우면 않고 법과 원칙 따라 수사,각오 밝히는 박영수 특검 서울연합뉴스 하사헌 기자  최순실 국정농단 의혹 사건을 수사하게 될 특별검사에 임명된 박영수 전 서울고검장이 30일 오후 서울 서초구 자신의 로펌 사무실에서 기자들에게 좌고우면하지 않고 법과 원칙에 따라 철저히 수사
64857,20161130,2016-11-30,서문시장불,"10,000+",대구 서문시장에 큰불점포 500곳 이상 타종합,서문시장 불대구연합뉴스 30일 오전 2시께 대구시 중구 서문시장에서 큰불이 나 소방당국이 진화 작업을 벌이고 있다 불은 상가 내 1지구와 4지구 사이 점포에서 시작돼 의류상가가 많은 4지구의 1층이 모두 탔다 20161130 대구시소방본부 제공연합뉴스
64858,20161130,2016-11-30,윤복희,"2,000+",빨갱이 사탄 윤복희 시국 발언 논란,윤복희의 노래를 통해 외롭고 힘겨운 현실을 위로 받았던 사람들은 실망감을 감추지 못하고 있다 더구나 윤복희가 1967년 미국에서 귀국하면서 당시로선 엄청난 파격이었던 미니스커트 차림을 선보이는 등 시대의 금기와 억압에 맞서는 저항정신의 상징으로
64859,20161130,2016-11-30,조윤선,"2,000+",조윤선 최순실과 마사지 주장에 추호도 사실 아냐,조윤선 장관 최순실 모른다 서울연합뉴스 황광모 기자  30일 오전 국회에서 열린 박근혜 정부의 최순실 등 민간인에 의한 국정농단 의혹 사건 진상 규명을 위한 국정조사 특별위원회에서 조윤선 문화체육관광부 장관이 최순실과의 관계에 대한 질의에 답
64860,20161130,2016-11-30,현기환,"2,000+",현기환 전 정무수석 2차례 자해병원 후송 생명 지장 없어,현기환 전 청와대 정무수석이 29일 오전 피의자 신분으로 조사를 받기 위해 부산지검 청사로 들어가고 있다 김종호 기자 현기환 전 정무수석 2차례 자해병원 후송 부산 해운대 엘시티LCT 비리사건에 연루된 혐의를 받는 현기환 전 청와대 정무수석이 30일
64861,20161201,2016-12-01,국민의당,"5,000+",기사대체  1일 오후 10시,탄핵소추안 9일 표결을 주장하던 국민의당이 1일 오후 태도를 바꿔 5일 표결을 당론으로 결정해 더불어민주당민주당정의당 등 2개 야당에 제안했다 민주당정의당 측은 일단 이를 긍정적으로 검토해보겠다고 밝혀 2일 오후 본회의 전 탄핵안 발의가 가능
64862,20161201,2016-12-01,신동욱,"2,000+",어저께TV 말하는대로 신동욱의 6년 표류기안방 울렸다,6년 만에 방송에 등장한 배우 신동욱이 그간의 솔직한 이야기들을 가감 없이 털어놓으며 보는 이들의 안타까움과 뭉클함을 동시에 자아냈다 고통의 순간에도 긍정적인 마음을 잃지 않고 버티고 투쟁해온 이야기들이 특히나 인상적이다 지난 30일 밤 방송된
64863,20161201,2016-12-01,윤석열,"2,000+",특검 1호 인선 윤석열검찰 안팎 잘 드는 칼 뽑았다,대검 관계자는 검찰 수사 결과보다 더 많은 성과를 내놓아야 할 특검이 윤석열이라는 잘드는 칼을 뽑아 들었다 60명에 달하는 수사팀을 지휘해 복잡한 수사 내용들을 파헤치기 위해서는 윤 검사가 적격이라고 판단한 것으로 보인다고 했다 윤 검사는 2006년
64864,20161201,2016-12-01,이재명,"5,000+",이재명 친형 박사모 성남지부장 임명인연 끊은 형제 갈등 더욱 깊어질 듯,박사모박근혜를 사랑하는 모임 정광용 중앙회장은 지난달 30일 이재명 성남시장의 형님이신 이재선 공인회계사가 대한민국 박사모 성남지부장이 됐다며 회칙에 의하여 주어진 권한으로 지부장으로 영입 추인한다고 밝혔다 정 회장은 이어 어려운 시기에
64865,20161201,2016-12-01,표창원,"10,000+",탄핵 명단 공개 표창원 트위터 저를 비난하라,두 의원은 할 짓을 해라 장제원 이리로 와 바 왜 표창원 등의 말을 서로 건네며 목소리를 높여 신경전을 벌였다 장 의원은 또 표 의원에게 깡패야 국회의원은 국회의원 품위를 지켜라고 말하자 표 의원은 경찰이다 왜라며 맞받아치기도 했다 두
64866,20161201,2016-12-01,피파온라인3,"5,000+",조각 모아 월드 레전드 선수팩 두번 받자피파온라인3 12월 겨울방학 조각 모음 이벤트 진행,1일 넥슨 온라인 축구게임 피파온라인3에서 다가오는 겨울 방학을 겨냥해 레전드 두 번의 완성 조각 모음 이벤트를 진행한다 이번 이벤트는 1일부터 내년 1월 25일까지 진행되며 집과 PC방에서 참여 가능하다 단 월드 레전드 선수팩을 보상 받기 위해서는 PC
64867,20161202,2016-12-02,MAMA,"2,000+",MAMA 베스트 제작자상 방시혁프로듀서상 블랙아이드필승,홍콩연합뉴스 최현석 특파원  K팝 그룹 방탄소년단 등을 키운 방시혁 빅히트 엔터테인먼트 대표가 2일 홍콩 스카이시티 메리어트 호텔 콘퍼런스 센터에서 열린 2016 엠넷 아시안 뮤직 어워즈MAMA 전문부문 시상식에서 베스트 제작자상을 받았다
64868,20161202,2016-12-02,강정호,"2,000+",성폭행 혐의에 음주운전 은폐강정호의 일탈,강정호는 2일 새벽 혈중알코올농도 0084인 상태로 숙소인 서울 삼성동 G호텔로 향하던 중 삼성역 사거리에서 가드레일을 들이받고 달아났다 블랙박스 조사 결과 동승했던 지인에게 음주 사고를 떠넘기고 숙소로 가버린 사실까지 밝혀졌다 이에 앞서 강정호
64869,20161202,2016-12-02,도깨비,"5,000+",김은숙공유의 만남첫방 도깨비 관전 포인트는,오늘 오후 8시 첫 방송 예정인 도깨비는 도깨비는 불멸의 삶을 끝내기 위해 인간 신부가 필요한 도깨비 김신공유 그와 기묘한 동거를 시작한 기억상실증 저승사자 왕여이동욱 그런 그들 앞에 도깨비 신부라 주장하는 죽었어야 할 운명의 소녀 지은탁
64870,20161202,2016-12-02,이상아,"10,000+",이상아 5년 전 세번째 이혼뒤늦게 고백,서울연합뉴스 윤고은 기자  1980년대 하이틴스타로 각광받았던 배우 이상아44가 세번째 이혼을 한 사실이 뒤늦게 알려졌다 EBS 1TV 리얼극장 행복은 2일 이상아가 최근 녹화에서 지난 5년간 숨겨온 세번째 이혼 사실을 고백했다고 밝혔다 제작진은
64871,20161202,2016-12-02,이세영,"5,000+",아이돌그룹 성추행 혐의 이세영 조사 성실히 임할 것,아이돌 그룹 성추행 논란에 휘말린 희극배우 이세영27이 경찰 조사를 받게 됐다 경찰 관계자는 지난 1일 그룹 비원에이포B1A4의 팬이 전날 국민신문고를 통해 이세영을 성추행 혐의로 조사해달라는 글을 올렸고 현재 사건이 접수된 상태라고 밝혔다
64872,20161202,2016-12-02,정우식,"5,000+",정윤회 아들 정우식은 누구 로맨스가 필요해3야경꾼 일지 출연,아시아투데이 디지털뉴스팀  국정농단 사건으로 구속 수감된 최순실씨의 전 남편 정윤회씨의 아들이 배우 정우식으로 알려지며 정우식에 대해 관심이 집중됐다 1984년생인 정우식은 지난 2013년 SBS 드라마 결혼의 여신을 통해 연예계에 데뷔했다
64873,20161202,2016-12-02,정윤회 아들 배우,"20,000+",정윤회 아들 배우 A 아버지 전화번호도 모른다,서울연합뉴스 윤고은 기자  비선실세 최순실60씨의 전 남편인 정윤회 씨의 친아들이 배우로 활동 중인 사실이 2일 알려지면서 화제가 됐다 2013년 독립영화 족구왕을 통해 영화계에 얼굴이 알려진 A씨는 1984년생으로 최근에는 MBC TV 주말극 옥중화
64874,20161203,2016-12-03,공유,"2,000+",도깨비 공유 그 남자의 특별한 능력 금 나와라 뚝딱,고려시대의 명장 김신이 진짜 정체로 나이만 무려 935세에 달하는 것으로 추측되는 공유는 2회에서 도깨비다운 특별능력을 공개한다 바로 금 나와라 뚝딱이라는 말처럼 금을 만들어내는 도깨비의 재능을 보여주는 것
64875,20161203,2016-12-03,마마,"2,000+",음악중심 마마무 팬들 향해 감기 조심 애드리관련기사,아시아경제 송윤정 인턴기자 쇼 음악중심 마마무가 한 편의 뮤지컬 같은 무대를 선보였다 3일 방송된 MBC 쇼 음악중심에서는 걸그룹 마마무가 출연해 타이틀곡 데칼코마니를 불렀다 오피스룩을 입고 등장한 마마무는 폭풍 가창력과 절도 있는 안무로 눈길
64876,20161203,2016-12-03,박근핵닷컴,"10,000+",박근핵닷컴에서 새누리 의원 4명이 대통령 탄핵에 찬성을 눌렀다,시민들의 청원을 직접 국회의원들에게 이메일로 전달하고 탄핵에 대한 국회의원들의 의사를 수집하는 사이트 박근핵닷컴parkgeunhackcom에 새누리당 의원 4명이 탄핵 찬성으로 표시되어 눈길을 끌고 있다 초록색이 4표가 탄핵 찬성 빨간색 3표가 탄핵
64877,20161203,2016-12-03,윤창중,"2,000+",친박단체 3만 명 맞불 집회윤창중도 등장,촛불집회에 맞불을 놓고 나선 친박단체 집회 소식으로 이어가겠습니다 박사모를 비롯한 친박 단체들은 오늘3일 대통령에 대한 마녀사냥을 중단하라고 요구했습니다 인턴 직원 성추행 의혹으로 물러났던 윤창중 전 청와대 대변인도 그 자리에 나타났습니다
64878,20161203,2016-12-03,이수경,"2,000+",나혼자 이수경 스님패션앞머리 감기 한혜진 화들짝,외출을 한 이수경은 문방구에 들어가 장난감을 뒤적였다 그녀는 액체 괴물을 애타게 찾았다 이에 전현무는 진짜 이상하다 뭐에 쓰려고 그러냐고 물었고 이수경은 주물럭 거리면 좋다고 답했다 전현무는 그럼 호두 같은 거 만지라고 해 웃음을 자아냈다
64879,20161204,2016-12-04,강연재,"2,000+",정청래 강연재 국민의당 부대변인에 盧 더한 욕에도 웃어사과하고 넘기시라,더불어민주당 정청래 전 의원이 친문문빠광신도들의 진실 왜곡 등 발언으로 논란이 된 국민의당 강연재 대변인에게 사과하고 넘어가라며 조언했다 정청래 전 의원은 4일 저는 반말짓거리 함부로 인신 공격 사실 왜곡하는 짓에는 똑같이 응수한다
64880,20161204,2016-12-04,아는형님 아이오아이,"5,000+",아는 형님 IOI 마지막 예능 촬영해체 이후에도 기념일 만들어서 계속 봤으면,아는 형님에 출연한 IOI가 마지막 예능촬영에 임하는 소감을 밝혔다 3일 JTBC 아는 형님에 출연한 IOI는 오늘이 다함께 출연하는 마지막 예능출연이라면서 기념일을 만들어서 해체 후에도 꾸준히 보자는 말로 아쉬움을 대신했다
64881,20161204,2016-12-04,엘클라시코,"5,000+",엘 클라시코의 백미 세르히오 라모스의 극장 골,9만8485명의 엄청난 관중들이 운집한 이번 시즌 첫 번째 엘 클라시코가 끝났다 서로를 너무나 잘 알고 있는 선수들이기에 승리 팀을 예측하기는 어려웠지만 약 11시간 전 서울에서 열린 K리그 슈퍼 매치FC 서울 vs 수원 블루윙즈에 비하면 손에 땀을 쥐게
64882,20161204,2016-12-04,이문열,"2,000+",이문열이 옳다보수는 죽어야 한다,소설가 이문열 씨의 위기의 보수 쇠퇴하고 허물어진 정신의 허울부터 벗어야란 제목의 지난 2일 조선일보 칼럼이 여론의 질타를 받고 있다 이 씨는 위기의 대한민국보수의 길을 묻다는 연재물의 5번째 화자였다 그의 칼럼은 광화문 광장의 촛불 집회를
64883,20161204,2016-12-04,조대위,"2,000+",안민석 세월호 7시간 조 대위 뒤에 검은 손이 있다고 말했다,더불어민주당 안민석 의원은 최근 자신이 지난 2014년 세월호 참사 당일울 청와대에서 근무한 간호장교 조 모 대위를 면담하기 위해 미국을 방문했던 일과 관련 4일 보도자료를 내고 조 대위를 가두는 검은 손이 있다고 말했다 안 의원은 결과적으로 조 대위를
64884,20161204,2016-12-04,한영애,"2,000+",조율 한영애와 사탄 윤복희촛불 앞 엇갈린 운명,이날 청와대 앞 100m까지 허용된 대규모 행진을 앞두고 무대에 오른 한영애는 첫 곡으로 자신의 노래 갈증을 불렀다 노래를 마친 한영애는 지치지 마십시오 힘내십시오 천년의 어둠도 촛불 하나로 바뀔 수 있습니다 오늘 우리의 이 촛불이 또 다른 민주의
64885,20161205,2016-12-05,신주평,"20,000+",정유라 前 남편 신주평 현역 입대 예정과거 장시호가 낙태 강요하기도,최순실 씨60구속 기소 딸 정유라 씨20의 전 남편인 신주평 씨21가 자신을 둘러싼 병역특혜 의혹에 대해 반박했다 정 씨가 임신한 뒤에는 최 씨 일가가 낙태를 강요했다는 사실도 폭로했다 더불어민주당 안민석 의원은 5일 국회에서 열린 최순실 국정
64886,20161205,2016-12-05,양철로봇,"2,000+",어저께TV 복면가왕 양철로봇 알앤비 버전 음악대장 탄생,OSEN이소담 기자 알앤비 버전 음악대장의 탄생을 기대해도 좋을까 원조 디바 가수 김완선부터 2AM 출신 임슬옹 레전드 로커 박완규 신흥 음원강자 가수 김나영까지 다양한 실력자들의 맹공격이 이번 주에도 쏟아졌음에도 불구하고 가왕은 가왕이라는
64887,20161205,2016-12-05,정유라,"10,000+",교육농단 정유라 결국 고교 졸업 취소,금품 제공 당사자인 최순실씨와 특혜 당사자인 정유라씨를 포함해 청담고 관계자 7명 선화예중 관계자 3명 등 총 12명이다 시교육청은 이들에게 규정에 따른 신분상의 처분을 별도로 할 예정이지만 행정 처분은 수사 결과가 확정된 뒤 최종적으로 할 예정이다
64888,20161206,2016-12-06,국회방송,"5,000+",최순실 청문회로 국회방송 시청률 고공행진13관련기사,국회방송은 6일 시청률 조사전문기관인 닐슨코리아를 인용해 5일 국회방송 시청률이 135개 채널 가운데 11위를 기록했다고 밝혔다 국회방송 시청률은 0254로 지난 2월 필리버스터 중계방송 당시시청률 0193 시청순위 18위보다 높은 수준이다
64889,20161206,2016-12-06,서유리,"2,000+",서유리가 고소한 악플 공개 이게 제일 약한 거랍니다,6일 서유리는 자신의 인스타그램에 아무나 고소 안한다는 짧은 글과 함께 악플러의 글 캡처를 덧붙였다 공개된 게시물은 온갖 비속어와 육두문자를 사용하며 서유리를 비하하는 표현들로 가득하다 심지어 천조국미국에서 페미니스트를 했다면 너의 XX는
64890,20161206,2016-12-06,안민석,"2,000+",김성태 위원장안민석 의원 청문회 중 잠시 충돌 흐름 끊지 마라,6일 오후 진행된 박근혜최순실 게이트 청문회에서 의사진행을 놓고 김성태 위원장과 안민석 더불어민주당 의원이 잠시 충돌했다 안민석 더불어민주당 의원은 질문 시간이 돌아오자 이재용 부회장을 향해 삼성 미래전략실장과의 만남 횟수에 대해 질문하기 앞서
64891,20161206,2016-12-06,예정화,"2,000+",어저께TV 예능인력소 마동석  예정화 마블리가 사랑할만 합니다,이날 예정화는 마동석과의 러브스토리부터 섹시 댄스까지 자신의 모든 것을 보여줬다 연인 마동석의 언급을 조심스러워 하는 MC들의 질문에 예정화는 마동석과 사귄 지는 3개월 됐다며 오히려 쿨한 반응을 보였다 마동석의 매력은 무엇이라고 생각하냐는
64892,20161206,2016-12-06,이완영,"5,000+",재벌편 이완영 누리꾼 정몽구가 기특하게 보는듯,누리꾼 ksha는 기업인들 건강은 그만 챙기시고 우리 국민 건강도 좀 챙겨라고 일갈했으며 광야는 나 원래 욕할 줄 모르는 사람인데 국조 보면서 계속 욕 나온다 암 걸리겠다 이 와중에 이완영 의원은 재벌 회장 건강 걱정한다 내가 쓰러질 지경이라는
64893,20161206,2016-12-06,이재용,"20,000+",청문회 이재용 삼성 미래전략실 없애겠다,이재용 삼성전자 부회장이 6일 오전 국회에서 열린 박근혜 정부의 최순실 등 민간인에 의한 국정농단 의혹 사건 진상 규명을 위한 국정조사 특별위원회에 증인으로 출석해 의원질의에 답변하고 있다 왼쪽부터 김신 삼성물산 사장 이재용 부회장 김종중 삼성
64894,20161206,2016-12-06,장제원,"2,000+",장제원 청문회 한화 정유라에게 8억 상당 말 상납 왜 대답이 없죠,6일 장제원 의원은 재벌 총수들을 상대로 한 최순실 국조특위 청문회에서 한화 김승연 회장을 상대로 정유라에게 말 상납에 관한 질문을 했다 장제원 의원은 한화가 2014년 4월 26일 8억3000만 원 상당 명마 두 필을 구입했습니다 이거 어디에 썼죠
64895,20161206,2016-12-06,전경련,"10,000+",삼성SKLG 탈퇴하겠다전경련 청문회서 존폐기로 봉착종합,전경련 해체에 대한 상반된 의견 서울연합뉴스 이정훈 기자  6일 오후 국회에서 열린 박근혜 정부의 최순실 등 민간인에 의한 국정농단 의혹 사건 진상 규명을 위한 국정조사 특별위원회에 증인으로 출석한 일부 재벌 총수들이 민주당 안민석 의원의 전경련
64896,20161206,2016-12-06,정몽구,"5,000+",구본무손경식 조기 귀가정몽구 회장은 병원행,국회의무실 검진 받은 정몽구 서울연합뉴스 황광모 기자  정몽구 현대차그룹 회장이 6일 국회에서 열린 박근혜 정부의 최순실 등 민간인에 의한 국정농단 의혹 사건 진상 규명을 위한 국정조사 특별위원회 오후 회의를 마친 뒤 국회 본청 내 의무실을 들러
64897,20161206,2016-12-06,정유섭,"2,000+",막말파문 새누리 정유섭 의원에 18원 보내기 확산,새누리당 정유섭인천부평갑 국회의원이 지난 5일 국회 국정농단 진상규명 국정조사특위 회의 때 세월호 참사 당시 대통령의 7시간 의혹과 관련해 대통령은 7시간 동안 노셔도 됐다고 한데 대한 인천시민들의 분노가 18원 후원금 보내기 운동으로 확산됐다
64898,20161206,2016-12-06,청문회 생중계,"5,000+",신율의출발새아침 재벌 총수 청문회 생중계 관전 포인트는,재벌도 공범이다 오늘 생중계로 재벌들에 대한 국회 청문회가 진행되는데요 이렇게 많은 수의 재벌가 총수들이 한 번에 모여 청문회를 하는 것 아주 이례적인 경우죠 그래서 이번 청문회의 핵심 쟁점은 무엇일지 관련해서 재벌닷컴 정선섭 대표 전화 연결해
64899,20161206,2016-12-06,황영철,"2,000+",인터뷰 황영철 새누리당 내 탄핵 찬성 의원 최소 35명 예상,대통령의 메시지를 놓고 새누리당이 조금 전까지 의원총회를 열었다고 말씀드렸습니다 여전히 관건은 비박계의 반응이죠 황영철 의원이 비박계로 이뤄진 비상시국위원회의 대변인을 맡고 있는데 직접 스튜디오까지 나와주셨습니다 안녕하십니까 지금 저쪽
64900,20161207,2016-12-07,고영태,"10,000+",청문회 고영태 태블릿 피시 정유라 것이라고 생각했다,7일 오전 국회에서 열린 최순실 국정농단 의혹 진상규명을 위한 국정조사 특위 2차 청문회에 앞서 고영태 전 더블루케이 이사가 국회에 도착해 청문회장으로 향하고 있다 연합뉴스 고영태씨가 7일 열린 국회 국정조사특위 2차 청문회에서 태블릿 피시의 존재는
64901,20161207,2016-12-07,김기춘,"10,000+",청문회 김기춘 김영한 비망록에 내 지시 일부 있다 인정,김기춘 전 청와대 비서실장이 세월호와 관련된 청와대 통제 등을 지시했다고 적혀 있는 김영한 비망록에 대해 일부 내 지시도 있다고 처음으로 인정했다 그동안 김 전 비서실장은 김영한 전 청와대 민정수석의 비망록에 대해 그런 지시를 한 적이 없다 수
64902,20161207,2016-12-07,김재열,"2,000+",김재열 김종 요청으로 장시호에 16억 줘,서울연합뉴스 안용수 박수윤 기자  김재열 제일기획 스포츠사업 총괄사장은 7일 최순실 씨의 조카 장시호 씨가 실소유한 것으로 알려진 한국동계스포츠 영재센터에 대한 지원이 김종 전 문화체육관광부 차관의 압력을 받고 이뤄졌다고 증언했다 김 사장은
64903,20161207,2016-12-07,낭만닥터 김사부 10회,"5,000+",낭만닥터 김사부 최감사 역 김준원 한석규 선배님 감사합니다,김준원은 낭만닥터 김사부의 9회와 10회에 도윤완최진호 분 거대병원 원장의 측근이자 감사팀 직원 최감사로 출연해 김사부 역의 한석규와 극한 대립각을 세워 관심을 모은 바 있다 돌담병원의 위기와 도윤완 원장의 야심을 상징적으로 드러내 보인 인물
64904,20161207,2016-12-07,쓰리노,"5,000+",일산 신종 성매매 쓰리노 여전히 기승,경찰의 단속에도 불구하고 경기 고양시 일산지역 번화가에서 신종 성매매가 여전히 기승을 부리고 있다 경찰과 유흥업계는 7일 이 지역의 일부 노래 클럽 등에서 쓰리노NO 즉석 성매매가 유행하고 있다고 밝혔다 쓰리노는 옷속옷스타킹 3가지가 없다는
64905,20161207,2016-12-07,여명숙,"10,000+",청문회 여명숙 차은택 등이 받은 혜택 종점을 모를 정도,여명숙 위원장은 7일 박근혜 정부의 최순실 등 민간인에 의한 국정농단 의혹사건 진상규명을 위한 국정조사 제2차 청문회에 출석해 문화창조융합벨트 본부장에서 보직 해임 통보를 받은 일에 대한 도종환 더불어민주당 의원의 질의에 형식적으로는 사임이지만
