index,dayId,date,name,traffic,newsTitle,newsSnippet
65191,20170125,2017-01-25,이대호,"2,000+",전설의 오버랩 이대호 이승엽과 무엇이 같고 다른가,전설의 오버랩 24일 롯데와 전격 계약하며 6년 만에 한국 무대로 복귀하는 이대호오른쪽는 5년 전 삼성으로 복귀한 이승엽의 행보와 비슷하다 사진은 삼성으로 복귀한 이승엽이 2012년 오키나와 전지훈련에서 오릭스로 진출한 이대호와 인사를 나누는 모습
65192,20170125,2017-01-25,이재은,"5,000+",리얼극장 이재은 7년 만에 만난 母와 찾은 진짜 행복 종합,24일 밤 방송된 EBS1 리얼극장  행복에서는 일본으로 여행을 떠나 힘들었던 시간과 응어리를 풀어내는 이재은 모녀의 모습이 그려졌다 4살 때 데뷔한 이재은은 어린 시절부터 집안의 가장 역할을 하며 힘든 시간을 보냈다 그는 집안의 기둥이 되어서 내가
65193,20170125,2017-01-25,정규재,"5,000+",박근혜 대통령 정규재TV와 단독 인터뷰,박근혜 대통령이 25일 정규재 한국경제신문 주필이 운영하는 인터넷 팟캐스트 정규재 TV와 단독 인터뷰를 했다 박 대통령은 최순실 국정농단 게이트 등 현안에 관한 자신의 입장을 밝혔다 정규재tv 페이스북은 박 대통령과의 인터뷰는 오후 8시부터 유튜브
65194,20170125,2017-01-25,최순실,"5,000+",민주주의 특검이 아니다라는 최순실에 말을 들은 특검 사무실 청소 관리인의 한 마디,중앙일보의 보도에 따르면 최씨가 호송 교도관들과 작은 승강이를 벌이는 상황에서 최순실의 목소리와 함께 들린 또 다른 목소리가 있었다 염병하네라고 외친 소리였다 염병하네라는 외침은 3번이나 들렸다고 한다 이 목소리의 주인공은 바로 특검 사무
65195,20170126,2017-01-26,김과장,"2,000+",김과장 남궁민 코믹 패션 비하인드컷 공개촌스러움 끝판왕,지난 25일 첫 베일을 벗은 KBS 2TV 새 수목드라마 김과장극본 박재범 연출 이재훈 최윤석제작 로고스필름은 남궁민남상미이준호 등 인물들의 얽히고설킨 흥미진진한 관계와 답답한 현 사회를 꿰뚫는 대사 탄탄한 스토리와 흡인력 있는 연출 그리고 배우
65196,20170126,2017-01-26,새해인사,"2,000+",드림캐쳐 곱게 한복 차려입고 새해인사 전해,해피페이스 엔터테인먼트는 26일 드림캐쳐의 한복 인증샷과 함께 멤버들의 메시지가 담긴 사인지를 공개했다 사진 속 드림캐쳐 멤버들은 곱게 한복을 차려입고 환한 미소를 띄며 카메라를 응시하고 있다
65197,20170126,2017-01-26,이영애,"2,000+",첫방팁 사임당 이영애X송승헌의 안방극장 컴백알고보면 더 재미있는 관전포인트는,사임당 빛의 일기이하 사임당은 한국미술사를 전공한 시간강사 서지윤이영애 분이 이태리에서 우연히 발견한 사임당이영애 분 일기에 얽힌 비밀을 과거와 현재를 넘나들며 풀어내는 퓨전사극이다 일기 속에 숨겨진 천재화가 사임당의 불꽃같은 삶과 조선
65198,20170127,2017-01-27,신사임당,"5,000+",사임당 첫방 기대 폭주신사임당 전시회도 개최,이 대표는 이번 전시회에서 신사임당이 48세에 작고할 때까지 그리 길지 않은 삶 속에 남겨 진 작품들과 위대한 정치가였던 율곡 이이의 어머니로서의 모습을 재조명하여 명작들을 여러 선진 기법을 도입하여 방문객에게 그림에 둘러 쌓여있는 듯한 특별한 경험
65199,20170127,2017-01-27,안희정,"2,000+",안희정이 문재인 대세론을 꺾겠다고 자신하는 이유,더불어민주당 대선주자인 안희정 충남지사는 26일 2017년 민주당 경선에 기적과 돌풍을 몰고 올 자신이 있다고 말했다 안 지사는 이날 KBS 토론회 대선주자에게 듣는다에 출연해 이같이 밝히면서 문재인 전 대표의 대세론을 꺾을 수 있다는 것인가라는
65200,20170127,2017-01-27,포아너,"2,000+",포아너 클로즈 베타 테스트 시작중세시대 배경 TPS 화려한 게임,2월 14일 발매 예정인 포아너는 중세시대를 배경으로 한 TPS 대전 게임이자 MOBA 형식이 덧입혀진 게임으로 상반기 최고의 액션 대작이다 이번 클로즈 베타 테스트에 참가 신청을 완료한 유저들은 한국어로 베타 버전을 플레이할 수 있게 된다 더불어 클로즈
65201,20170127,2017-01-27,한은정,"2,000+",발칙한 동거 한은정 방탄소년들과 동거 원해김구라 방탄소년단이겠지,27일 방송된 MBC 설 파일럿 발칙한 동거 빈방 있음에서는 김구라가 한은정과 동거를 시작하는 모습이 전파를 탔다 이날 김구라는 이삿짐을 실을 차를 타고 한은정의 집을 찾았다 한은정의 집은 깔끔한 인테리어와 탁 트인 조망이 눈길을 끌었다
65202,20170128,2017-01-28,검사외전,"5,000+",그것이 알고싶다우리갑순이 결방새해특선 검사외전뜻밖의 미스터리 여파,2016년 1월 개봉한 영화 검사외전감독 이일형은 황정민 강동원 주연으로 970만 명의 관객을 동원하며 흥행한 작품 살인누명을 쓰고 수감된 검사가 감옥에서 만난 전과 9범 꽃미남 사기꾼의 혐의를 벗겨 밖으로 내보낸 후 그를 움직여 누명을 벗으려는 범죄
65203,20170128,2017-01-28,떡국,"5,000+",황교익 차례상엔 떡국 한그릇만 피자햄버거도 좋다,황교익은 설 차례상을 두고 떡국 하나만 놓으면 된다고 말했다 피자나 치킨을 놓고 싶으면 그렇게 하라고 했다 현대 설 문화에 관한 비판으로 이어졌다 황교익은 본래 봄맞이 축제여야 할 설이 조작된 전통으로 인해 우리에게 고통을 안겨준다고 했다 다만
65204,20170128,2017-01-28,차례상,"5,000+",황교익 차례상엔 떡국 한그릇만 피자햄버거도 좋다,정부는 바람직한 차례상 차림은 얼마짜리라고 홍보해왔다 사실상 정부가 우리 차례상을 통제했다 조금 근본적 차원에서 접근해 볼 필요가 있다 설과 추석은 국경휴일이다 그러나 차례와 관련한 온갖 논쟁이 우리의 생각을 블랙홀처럼 빨아들인다 우리 차례
65205,20170129,2017-01-29,발칙한 동거,"5,000+",발칙한 동거 한은정 YES 김구라는 NO달콤한 설날의 추억,아시아경제 송윤정 인턴기자 발칙한 동거 한은정과 김구라가 엇갈린 선택으로 동거 생활을 마무리 지었다 28일 방송된 MBC 설 특집 발칙한 동거빈방있음에서는 동거 생활 이틀 째에 접어든 한은정과 김구라의 모습이 그려졌다 이날 김구라는 한은정을 위해
65206,20170129,2017-01-29,사운드오브뮤직,"2,000+",도레미송 에델바이스 등 명곡 남긴 명작 사운드 오브 뮤직,사운드 오브 뮤직은 극적인 스토리와 함께 아름다운 알프스를 배경으로 울려 퍼지는 음악이 일품이다 도레미송 에델바이스 등 숱한 명작 OST를 만들어낸 사운드 오브 뮤직은 죽기 전에 봐야 할 영화 100선에 늘 손꼽히는 작품이기도 하다 로버트 와이즈
65207,20170129,2017-01-29,손흥민,"5,000+",멀티골 손흥민 평점 94양팀 통틀어 최고점,서울연합뉴스 이영호 기자  멀티골을 앞세워 토트넘을 잉글랜드 축구협회FA컵 16강에 진출시킨 손흥민23이 평점에서도 최고 평가를 받았다 손흥민은 29일한국시간 영국 런던 화이트 하트 레인에서 열린 잉글랜드 축구협회FA컵 32강 위컴비 원더러스
65208,20170129,2017-01-29,월계수양복점신사들,"2,000+",4회 연장 월계수 양복점 신사들 시청률 40 넘을까,백년의 유산 전설의 마녀를 히트시켰으나 막장 드라마라는 비난에 직면해야 했던 구현숙 작가는 월계수 양복점 신사들에서는 자극적인 소재를 쓰되 그 수위를 낮추고 대신 인물의 감정을 더 살리는 방식으로 드라마를 끌어나가 변신에 성공했다는 평가를
65209,20170130,2017-01-30,김소희,"2,000+",K팝스타6 김소희 여자 아티스트로서의 미래도 보여 심사 3인 극찬,29일 방송된 K팝스타 시즌6 더 라스트 찬스이하 K팝스타6에서는 YG JYP 안테나뮤직이 캐스팅오디션에서 발탁한 참가자들을 내세워 기습배틀을 펼치는 장면이 전파를 탔다 기습 배틀에서 우승한 참가자의 소속사는 TOP10을 결정하는 본선 5라운드 배틀
65210,20170130,2017-01-30,역적,"2,000+",역적 박나래 차력사로 깜짝 등장어린 홍길동과 호흡,30일 오후 첫 방송된 MBC 새 월화드라마 역적  백성을 훔친 도적에서 박나래는 차력사 역할로 출연해 눈길을 끌었다 이날 역적 첫 회에서는 아기 장수 홍길동윤균상 분의 탄생에 대한 이야기가 그려졌다 어린 시절부터 돌짐을 짓고 장독을 옮기는 등 힘이
65211,20170130,2017-01-30,임수향,"2,000+",꽃놀이패 임수향 김제동은 용감한데 외로운 사람 시적 비유,아시아경제 송윤정 인턴기자 꽃놀이패 임수향의 직진 멘트가 서래마을 독거노인 김제동의 마음을 심쿵하게 만들었다 29일 방송된 SBS 일요일이 좋다꽃놀이패에서는 배우 임수향이 출연해 서장훈과 함께 김제동의 집을 찾아가는 모습이 그려졌다
65212,20170130,2017-01-30,채수빈,"2,000+",오빠생각 조혜정 채수빈 지인으로 깜짝 등장길쭉한 남자 좋아하더라,이날 조혜정의 지인들은 30일 오후 방송된 MBC 예능프로그램 오빠생각에서 채수빈에 대해 이야기했다 채수빈의 친구는 채수빈에 대해 술을 잘 못먹는다 근데 술을 먹으면 갑자기 운다 조개탕을 안주삼아 술을 먹었는데 갑자기 울길래 왜 우냐고 했더니
65213,20170130,2017-01-30,피고인,"5,000+",SHOT 지성 피고인 비하인드 사진 공개훈훈한 팀워크,OSEN지민경 기자 배우 지성이 드라마 피고인 촬영 현장 사진을 공개했다 지성은 30일 자신의 인스타그램에 피고인 깜방 식구들과 감독님 간식 먹는 시간 민석이랑 대환이가 웃고는 있지만 매우 힘들어하고 있음 싫다는 내색은 못하고라는 글과
65214,20170131,2017-01-31,성소,"2,000+",트럼프에 맞서 이민자 지키는 성소 도시들,존 크랜리 신시내티 시장은 30일현지시간 기자회견에서 우리 도시는 이민자와 무슬림 그리고 자유롭게 숨쉬기를 갈망하는 시리아 난민들과 함께할 것이라면서 지금부터 신시내티는 성소 도시Sanctuary City라고 선언했다 그는 자유의 여신상의 이상에
65215,20170131,2017-01-31,아육대,"2,000+",영상 아육대 성소 리듬체조서 실수딛고 동메달누리꾼 다른 선수와 급이 달라,30일 방송된 MBC 설 특집 2017 아이돌스타 육상 양궁 리듬체조 에어로빅 선수권대회이하 아육대에서는 피에스타 차오루 러블리즈 정예인 트와이스 미나 우주소녀 성소 여자친구 유주 오마이걸 유아가 리듬체조 경기를 펼쳤다 성소는 아육대
65216,20170131,2017-01-31,위택스,"10,000+",2017년 자동차세 연납 내일까지 하루 연장위택스 접속 지연 여전,행자부 관계자는 설 연휴로 자동차세 및 등록면허세 납부가 사실상 31일 하루만에 처리되는데 따른 위택스 등 관련시스템 접속지연 등으로 인한 불편을 해소하고 납세자에 기한의 이익을 부여하기 위한 것이라고 설명했다 사진위택스 홈페이지 캡처
65217,20170201,2017-02-01,강봉균,"2,000+",강봉균 前장관 별세 정치로 인한 불확실성만 제거된다면 눈 감을때까지 경제 걱정한 꾀주머니,지난달 31일 향년 74세로 고인이 된 강봉균 전 재정경제부 장관은 병색이 짙던 지난해 12월에도 서울경제신문과 신년 인터뷰를 하겠다는 의사를 밝힐 만큼 의욕을 갖고 있었다 그가 마지막으로 모습을 드러낸 것은 지난해 11월30일 역대 정부의 경제성장 회고록
65218,20170201,2017-02-01,김과장,"2,000+",2PM 준호 오늘 와일드비트 시작이어서 김과장 보기,아시아투데이 디지털뉴스팀  그룹 2PM 멤버 준호가 김과장과 와일드비트를 동시 홍보했다 준호는 지난달 31일 자신의 인스타그램에 와일드비트 내일부터 방송 시작합니다 그거 보고 김과장 이어서 보면이라는 글과 함께 한 장의 사진을 게재했다
65219,20170201,2017-02-01,반기문,"10,000+",문재인 대항마는 황교안 반기문 낙마로 멘붕 빠진 범여권,범여권의 많은 의원들은 반기문의 귀국 뒤 행보를 보면서 낙마 가능성을 높게 내다봤지만 막상 이것이 현실화되자 멘붕멘탈 붕괴 정신적으로 충격을 받은 상황을 뜻하는 속어에 빠졌다 바른정당의 한 중진의원은 말 그대로 보수의 대혼란이라고 묘사했다
65220,20170201,2017-02-01,자이언티,"2,000+",자이언티 양화대교 지날 때 전화 좀 그만해,1일 오후 1시 서울 마포구 합정동 더블랙레이블 사무실에서 열린 새 앨범 OO 기자간담회에 자이언티ZionT는 안경을 벗고 나왔다 자이언티는 이번 앨범의 제목을 자신의 트레이드마크 안경을 닮은 OO로 지었다 제 시야 시각으로 만든 앨범이라는 뜻
65221,20170202,2017-02-02,사임당 빛의 일기,"2,000+",아이웨어 브랜드 폴휴먼 드라마 사임당 빛의 일기 제작지원,아이웨어 브랜드 폴휴먼Paul Hueman은 SBS 수목드라마 사임당 빛의 일기연출 윤상호극본 박은령를 제작지원 한다고 2일 밝혔다 사임당 빛의 일기는 방영 전부터 사전제작 시스템과 이영애 송승헌 오윤아 최철호 등 화려한 캐스팅으로 화제가 되며 웰
65222,20170202,2017-02-02,안희정,"5,000+",안희정 대연정 새누리당과도 할 수 있다,안희정 기존의 여야 구도에서 나는 반대하겠다라고 하는 야당을 상존시켜서는 의회는 작동하지 않습니다 가장 반대 진영의 사람들과 대화와 타협을 통해서 함께 국가의 목표를 합의할 때라야만 국민들이 지금 요구하고 있는 시대적 개혁을 추진할 수 있습니다
65223,20170202,2017-02-02,예정화,"10,000+",라스김구라김정민예정화 깔끔한 스캔들 해명feat마블리 종합,해명과 폭로의 연속이었다 화끈한 입담을 지닌 김정민과 예정화 그리고 김나영과 최은경은 쉴 새 없이 폭로를 이어가며 웃음을 자아냈다 또한 예정화를 위해서 마동석이 깜짝 전화 연결을 하면서 감동까지 선물했다 1일 오후 방송된 MBC 라디오스타에서는
65224,20170202,2017-02-02,유웨이어플라이,"2,000+",대학원서 접수 진학사어플라이유웨이어플라이 접속 폭주시뮬레이션 서비스 굿,한편 4년제 대학교 정시모집 원서 접수는 1월4일 마감되었는데 진학사어플라이는 정시 지원자 점수 공개 서비스를 통해 이용자가 자신이 지원한 대학에 같이 원서를 접수한 다른 학생들의 환산점수와 타군 지원 대학 등 다양한 정보를 확인할 수 있게 하고 있다
65225,20170202,2017-02-02,한진해운,"2,000+",한진해운 끝내 역사 속으로,서울중앙지법 파산6부재판장 김정만는 2일 한진해운에 대한 기업회생절차법정관리 폐지를 결정했다 재판부는 주요 자산 매각이 마무리된 만큼 회생절차를 중단하고 이달 17일 파산을 선고할 예정이라고 밝혔다 한진해운을 실사한 삼일회계법인은 지난해
65226,20170203,2017-02-03,급성구획증후군,"2,000+",급성구획증후군으로 수술 활동중단 문근영 이때만 해도 깨발랄,아시아경제 김윤주 인턴기자 배우 문근영이 건강 적신호로 활동을 중단해 안타까움을 더하고 있는 가운데 문근영의 과거 일상모습에 눈길이 간다 문근영은 지난달 1일 자신의 인스타그램에 짧은 동영상과 함께 흥 넘치는 아카문스시 2017년에는 모두가 꽃길
65227,20170203,2017-02-03,박수홍 군대 선임,"2,000+",박수홍의 못된 군대 선임 찾기에 네티즌수사대 총출동 영상,지난 2일 방송된 KBS 해피투게더3에는 박수홍 김용만 지석진 김수용 손헌수가 출연해 토크 드림팀 특집 2탄으로 웃음와 감동을 전했다 지난 2일 방송된 KBS 해피투게더3에는 박수홍 김용만 지석진 김수용 손헌수가 출연해 토크 드림팀 특집 2탄으
65228,20170203,2017-02-03,브리트니 스피어스,"2,000+",브리트니 스피어스 공연 도중 가슴 노출 사고,팝가수 브리트니 스피어스가 공연 도중 가슴이 노출된 영상이 유튜브를 통해 알려졌다 유튜브에는 지난 2일 라스베이거스에서 열린 공연에서 가슴이 노출된 채 공연을 하고 있는 브리트니 스피어스의 영상이 잇따라 올라왔다
65229,20170203,2017-02-03,선화예고,"5,000+",선화예술고등학교의 학교 시설이 임시 폐쇄된 이유는 정말 끔찍하다,제보글이 올라온 지 한 시간이 지나지 않아 선화예고에는 경찰들이 도착했다 그러나 일베 원본 게시물에 적힌 것과 같은 종류의 차는 보이지 않았으며 글쓴이가 누군지도 파악되지 않았다 학생들은 앞으로도 계속 경찰이 순찰해야 하는 것이 아니냐고 주장하고
65230,20170203,2017-02-03,유승민,"2,000+",대통령의 자격 유승민 공동체 지키는 따뜻한 보수,JTBC 뉴스현장에서는 대선출마를 공식선언한 대선주자들과 대통령의 자격이라는 타이틀로 인터뷰를 진행하고 있습니다 지난주에 남경필 경기지사 어제2일 안희정 충남지사에 이어서 오늘은 바른정당의 유승민 의원과 함께 하겠습니다 어서오세요
65231,20170203,2017-02-03,유승민딸,"10,000+",유승민 딸 예쁘다는 얘기 몇 번을 우려먹나,305건 2월1일부터 2월3일 오후 3시까지 유승민 딸로 검색되는 기사 수다 관련 기사는 실시간으로 추가되고 있다 기사 대부분이 유승민 의원 딸의 외모를 칭찬하는 내용이다 유승민 딸 유담 씨는 누구 누리꾼 아이돌급 미모동아일보 유승민 딸 유담 미모
65232,20170203,2017-02-03,인터파크티켓,"2,000+",인터파크티켓 3일 오후 8시 인피니트 팬미팅 무한대집회3 티켓 오픈,아시아투데이 디지털뉴스팀  그룹 인피니트 팬미팅 무한대집회3 팬미팅 소식에 인터파크티켓이 화제다 3일 오후 7시 30분을 넘어 포털사이트 실시간 검색어에는 인터파크티켓이 등장했다 인터파크티켓이 등장한 것은 그룹 인피티니트의 팬미팅 무한대
65233,20170204,2017-02-04,내일 그대와,"2,000+",통통영상 로코퀸 신민아의 내일 그대와영어로 파헤쳐보자,서울연합뉴스 장동우 기자 정보경 인턴기자  한동안 시청자들을 공유앓이에 빠트린 tvN 인기드라마 도깨비의 후속작 내일 그대와가 첫 방송을 앞두고 있습니다 TT Girls NEW Tomorrow With You 내일 그대와 tvN Kdrama통통
65234,20170204,2017-02-04,도깨비 소환 스페셜,"5,000+",도깨비 소환 스페셜 이엘 내레이션 도중 공유김고은 이별신서 눈물,3일 방송한 tvN 드라마 도깨비 소환스페셜 1부에서는 삼신할매 역의 이엘이 김신공유 분과 은탁김고은 분의 러브스토리를 소개했다 이날 방송에서 이엘은 내가 점지한 특별한 아이들이 있다며 마음 아팠지만 내 아이들을 위해 이들의 사랑에 개입할
65235,20170204,2017-02-04,로또740회당첨번호,"5,000+",740회 로또 1등 18명당첨금 각 9억3천만원종합,당첨번호 5개와 보너스 번호가 일치한 2등은 43명으로 6천536만원씩 당첨번호 5개를 맞힌 3등은 2천447명으로 114만원씩 받는다 당첨번호 4개를 맞힌 4등고정 당첨금 5만원은 11만5천722명 당첨번호 3개가 일치한 5등고정 당첨금 5천원은 186만4
65236,20170204,2017-02-04,신혼일기,"20,000+",신혼일기 안재현구혜선 현실 부부판 삼시세끼 종합,일명 안구커플 안재현구혜선이 9개월 차 신혼부부답게 달달함의 극치를 보여줬다 3일 오후 첫 방송된 tvN 예능 신혼일기는 안재현 구혜선 부부를 주인공으로 삼고 우리는 왜 여기에 와 있을까 편으로 꾸몄다 이날 방송분에는 두 사람이 강원도 오지로 와서
65237,20170204,2017-02-04,엄정화,"2,000+",불후의명곡 가인 엄정화 위해 김종민 직접 섭외동료애 뭉클,가인은 종민 오빠가 나오면 정화 언니가 되게 반가워하겠다 해서 내가 종민 오빠한테 연락을 직접 드렸다며 바쁘신데 정화 언니라서 나와주신 것 같다 정화 언니가 너무 기뻐해주셔서 그것만으로 성공했다고 말했다 이에 엄정화는 가인아 고마워라고 해
65238,20170204,2017-02-04,입춘,"2,000+",반가운 봄아쉬운 겨울포근한 입춘 전국서 건강행운 기원,전국종합연합뉴스 봄이 시작된다는 입춘立春인 4일 전국적으로 포근한 날씨를 보인 가운데 시민 관광객은 여유로운 주말을 보냈다 다만 수도권 등 일부 지역에서는 미세먼지 농도가 높아져 뿌연 하늘이 펼쳐지기도 했다 서울 남산골 한옥마을에서는 다양한
65239,20170204,2017-02-04,입춘대길,"5,000+",지주연 한복 차려 입고 봄 맞이 입춘대길 건양다경,서울포커스뉴스 입춘立春을 맞아 배우 지주연이 한복을 곱게 차려 입고 화사한 미모를 뽐냈다 지주연은 4일 입춘을 맞아 자신의 인스타그램에 입춘대길 건양다경立春大吉 建陽多慶 올 한해 좋은 일 많이 생기시고 가정에 행복이 가득하시길 바랍니다
65240,20170204,2017-02-04,정소민,"2,000+",아는 형님 정소민 이상형으로 김영철 꼽았다알고 보니 배우 김영철,4일 방송된 JTBC 예능 프로그램 아는 형님에서는 방송인 조우종과 배우 정소민이 새로운 전학생으로 등장했다 이날 강호동은 평소 아는 형님의 애청자라는 정소민에게 멤버들 중에 좋아하는 사람이 있는 것 같다고 의심의 눈초리를 보냈다
65241,20170205,2017-02-05,고민정,"2,000+",문재인 캠프 합류 고민정 남편과 데이트할 때 정치경제사회 얘기 많이 했다,문재인 캠프에 합류 고민정 전 아나운서의 과거 인터뷰가 주목받고 있다 인스타그램 고민정 전 KBS 아나운서가 문재인 전 더불어민주당 대표 캠프에 합류한 가운데 고씨가 과거 인터뷰에서 밝힌 내용이 주목받고 있다 고민정은 지난 2014년 한 매체와 인터뷰
65242,20170205,2017-02-05,고민정 아나운서,"2,000+",문재인 캠프 합류한 고민정 아나운서에 남편 조기영 시인 편지,아나운서 14년 짧다면 짧고 길다면 긴 시간이오 당신이 KBS에 입사한 뒤 방송 출연으로 밤 늦게야 나오는 모습을 보며 내가 제일 먼저 한 일은 뜬금없게도 운전면허 따는 거였소 운전할 일 없으리란 생각으로 살다 당신의 늦은 귀가에 필요하겠다 싶어 잡기
65243,20170205,2017-02-05,그것이알고싶다,"2,000+",그것이 알고 싶다 흔적없이 사라진 신혼부부그들의 마지막 발자취,이번 주 SBS 그것이 알고 싶다에서는 2016년 5월 숱한 의문만을 남긴 채 흔적도 없이 사라져버린 신혼부부의 행방을 추적해보고 그들을 둘러싼 미스터리를 파헤쳐본다  연기처럼 사라진 신혼부부 한창 신혼의 단꿈에 빠져있어야 할 결혼 6개월 차의 신혼부부
65244,20170205,2017-02-05,역적,"2,000+",역적 장녹수 실제로는 평균 이하 외모 이하늬와 비교불가,KNS뉴스통신황인성 기자 MBC월화드라마 역적 백성을 훔친 도적을 통해 다시금 재조명되고 있는 장녹수가 사실은 평균에도 미치지는 못 하는 외모를 가진 것으로 실록에는 기록돼 있는 것으로 알려졌다 역적 장녹수는 조선 3대 요부 중 하나로 거론되는
65245,20170205,2017-02-05,전인범,"2,000+",특전사령관 출신 전인범도문재인 캠프 전방위 수혈,문재인 전 더불어민주당 대표가 대선 캠프에 진보보수를 가리지 않고 전방위적으로 새 인물들을 영입하고 있다 문 전 대표는 지난 4일 경희대 평화의전당에서 연 대담집 대한민국이 묻는다 북콘서트에서 전인범 전 특전사령관과 고민정 전 한국방송KBS
65246,20170205,2017-02-05,정찬성,"10,000+",정찬성 어퍼컷 3년6개월 만의 UFC 복귀전서 KO승,정찬성30코리안좀비MMA이 5일한국시각 미국 텍사스 휴스턴의 도요타센터에서 열린 유에프시UFC 파이트 나이트 104에서 페더급 9위 데니스 버뮤데즈31미국를 상대로 1라운드에 통렬한 어퍼컷 케이오KO승을 거두고 환호하고 있다 군 복무 등으로
