index,dayId,date,name,traffic,newsTitle,newsSnippet
65020,20161223,2016-12-23,조순제 녹취록,"10,000+",19금이라는 조순제 녹취록 무엇이 담겼을까,조순제씨는 박 대통령이 이사장을 지낸 정수장학회와 영남대 육영재단 살림을 도맡았지만 2007년 당시 한나라당 대선주자 경선 청문회에서 박근혜 후보가 조순제를 모른다고 말하자 이에 격분해 박근혜와 최태민 일가를 폭로하는 장문의 녹취록을 만든
65021,20161224,2016-12-24,너의 이름은,"5,000+",실시간 검색어 점령 너의이름은 신카이 마코토 감독 크리스마스 영상 공개,아시아 5개국 박스오피스 1위 제42회 LA 비평가 협회상 애니메이션상 수상에 이어 국내 뜨거운 호평으로 새해 첫 흥행 대작 탄생을 예고하고 있는 영화 너의 이름은이 주말 실시간 검색어 1위를 기록했다 뜨거운 호평 속 1월 4일 개봉을 앞둔 애니메이션 대작
65022,20161224,2016-12-24,던파,"5,000+",루크가 사라진 후의 스토리 던파에 새로운 위협이 찾아온다,10주년을 맞이하는 던파 페스티벌 2016에는 유저들의 오랜 염원이 이루어진 그리고 다채로운 시도들이 이루어진 자리였다 4년 만에 공개된 여 프리스트 그리고 어떠한 외부 이벤트 없이 오로지 던전앤파이터 콘텐츠를 주제로 한 다양한 행사들이 곳곳
65023,20161224,2016-12-24,로또734,"2,000+",로또 734회 1등 9명1인당 19억4939만원,서울뉴시스임종명 기자  24일 제731회 나눔로또 추첨 결과 6 16 37 38 41 45가 1등 당첨번호로 결정됐다 2등 보너스 번호는 18이다 6개 번호를 모두 맞춘 1등 당첨자는 9명으로 19억4939만원을 받는다 5개 번호와 보너스 번호를 맞힌 2등은 36명
65024,20161224,2016-12-24,성탄절,"2,000+",성탄절 북극은 천년에 한번 찾아올 이상고온 찍는다,서울연합뉴스 김아람 기자  올 크리스마스에 북극은 기온이 평년보다 최대 20도 높은 기록적 폭염을 겪을 수 있다고 영국 BBC 방송이 23일현지시간 보도했다 지난달부터 북극 일부 지역에서 기온이 평년보다 20도 이상 올라가는 고온 현상이 이어졌다
65025,20161224,2016-12-24,자로,"2,000+",네티즌 수사대 자로 세월호 침몰 원인은 외부 충격 재조사 촉구,네티즌수사대 자로가 세월호 진실을 담은 다큐 공개를 하루 앞두고 세월호는 외부 충격에 의해 침몰한 것이라고 주장했다 24일 JTBC에 따르면 자로는 세월호의 침몰 원인을 새로운 각도로 다룬 8시간 49분짜리 필리버스터 다큐 세월엑스SEWOLX를
65026,20161224,2016-12-24,크리스마스,"20,000+",메리 크리스마스 하야 크리스마스 9차촛불 막올라,크리스마스이브인 24일 오후 1시30분께 서울 종로구 광화문광장에서 방송인 김제동씨가 시민들 앞에 모습을 드러냈다 박근혜정권퇴진 비상국민행동이하 퇴진행동이 주최하는 박근혜 정권 즉각 퇴진조기탄핵적폐청산 행동의날 9차 범국민행동 촛불집회
65027,20161224,2016-12-24,크리스마스 캐롤,"5,000+",크리스마스 캐롤 1위는 역시 머라이어 캐리크리스마스 이브 차트 정상 이어가,한편 멜론 팝차트에는 머라이어 캐리 외에 여성 팝가수 아리아나 그란데의 캐럴 산타 텔 미가 2위를 웸의 라스트 크리스마스가 6위를 각각 차지하는 등 다수의 팝가수들이 크리스마스 캐롤로 역주행을 하고 있다
65028,20161225,2016-12-25,Jtbc,"10,000+",단독 최순실 수사 독일 수사경찰 투입교민 계좌 추적도,최순실씨 일가의 돈세탁 혐의를 수사하고 있는 독일 당국이 계좌 추적 등을 담당하는 수사 경찰까지 동원해서 우리 교민을 상대로 조사를 확대하는 것으로 확인됐습니다 최씨의 딸 정유라씨의 행방이 여전히 드러나지 않고 있는데 속도를 내는 독일 검찰과 경찰
65029,20161225,2016-12-25,연예대상,"10,000+",1박2일 김종민 KBS 연예대상 대상,김종민은 24일 오후 여의도 KBS 신관 공개홀에서 열린 2016 KBS 연예대상 시상식에서 함께 후보에 오른 유재석이휘재신동엽김준호를 제치고 대상을 차지했다 김종민은 현재 KBS 2TV 주말 예능프로그램 1박2일 시즌3에서 출연 중이다 그는 2007년
65030,20161225,2016-12-25,유인영,"5,000+",아는 형님 유인영 김희철과 러브라인 언제부터 그렇게 예뻤어,아는 형님 유인영 김희철과 러브라인 언제부터 그렇게 예뻤어 아는 형님 유인영이 당돌한 매력으로 화제를 모으고 있다 지난 24일 오후 방송한 JTBC 아는 형님은 메이저리거 김현수와 배우 유인영이 게스트로 출연했다 이날 방송에서 강호동은 김현수에
65031,20161225,2016-12-25,전소미,"5,000+",전소미 우신 양측 신체 접촉 논란에 해명의혹 전혀 사실 아냐,그룹 업텐션 우신과 전소미 측이 신체 접촉 논란에 대해 해명했다 SBS MTV 더 쇼 측은 25일 공식 트위터를 통해 촬영 당시 양 MC측 스태프들이 동석하여 모니터를 한 상황이었고 실제로 두 MC 간에 적정한 거리를 유지하여 촬영을 진행하였다며 논란이 된
65032,20161226,2016-12-26,김새롬,"10,000+",김새롬 이찬오와 이혼발표 후 SNS비공개근황영상서 괜찮은 것 알지,스포츠투데이 김은애 기자 방송인 김새롬이 이찬오 셰프와 이혼소식을 발표한 가운데 에어키스 캠페인 영상으로 근황을 전했다 26일 네이버TV캐스트에서는 김새롬의 에어키스 캠페인 참여 영상이 공개됐다 김새롬은 평소 절친한 양재진 원장의 추천으로 영상
65033,20161226,2016-12-26,낭만닥터 김사부,"2,000+",낭만닥터 김사부 유연석과 서현진도 모르는 낭만닥터 X파일 전격 공개,SBS 월화 미니시리즈 낭만닥터 김사부극본 강은경 연출 유인식 박수진제작 삼화 네트웍스는 제목 그대로 의사로서의 낭만과 진정한 가치와 아름다움에 대한 메시지가 있는 전례 없는 의학 드라마로 첫 방송부터 지난 14회까지 단 한 번도 월화극 1위 자리
65034,20161226,2016-12-26,조윤선,"2,000+",조윤선 블랙리스트 몰라 정무수석실서 하달,유진룡 전 문체부 장관은 26일 CBS 라디오 시사자키 정관용입니다와의 인터뷰에서 블랙리스트 작성을 청와대 정무수석실에서 했다고 밝혔다 당시 정무수석은 조윤선 현 문화체육관광부 장관이다 때문에 지난 10월 진행된 국정감사에서 조 장관이 문화
65035,20161226,2016-12-26,조지마이클,"10,000+",조지 마이클의 위대했던 순간들,25일현지시각 크리스마스 조지 마이클이 53살 나이로 갑자기 세상을 떠났다는 소식이 전해지자 가수 마돈나는 트위터를 통해 이렇게 탄식했다 마돈나는 트위터에 자신이 조지 난 당신과 자고 싶어요조지 마이클의 곡 아이 원트 유어 섹스에서 따온 농담
65036,20161226,2016-12-26,청문회,"2,000+",한계 드러낸 청문회 개선 방안 마련돼야,국조특위는 26일 최 씨가 수감된 서울구치소에서 현장 청문회를 열 계획이었다 하지만 최 씨를 비롯해 안종범 전 청와대 정책조정수석 정호성 전 부속비서관 등 핵심 증인 3명이 모두 불출석했다 국조특위는 앞선 두 차례 청문회를 포함해 이날까지 모든 청문회
65037,20161227,2016-12-27,가요대전,"2,000+",올해도 반복된 사고들 개판 5분전 SBS 가요대전,2016년 연말 가요 특집방송의 첫번째 주자는 26일 방영된 SBS 가요대전이었다 오랜만에 정규 음반을 내놓은 빅뱅 역시 무려 8년만에 컴백한 원조 섹시 디바 엄정화를 비롯해 엑소 방탄소년단 세븐틴 트와이스 여자친구 등 다양한 가수들이 총출연한 구성
65038,20161227,2016-12-27,낭만닥터 김사부 14회,"2,000+",낭만닥터 김사부 유연석과 서현진도 모르는 낭만닥터 X파일 전격 공개,SBS 월화 미니시리즈 낭만닥터 김사부극본 강은경 연출 유인식 박수진제작 삼화 네트웍스는 제목 그대로 의사로서의 낭만과 진정한 가치와 아름다움에 대한 메시지가 있는 전례 없는 의학 드라마로 첫 방송부터 지난 14회까지 단 한 번도 월화극 1위 자리
65039,20161227,2016-12-27,엄정화,"5,000+",엄정화의 멋진 도전음원 성적 아쉬워도 섹시 퀸,그러나 엄정화는 26일 방송된 SBS TV 2016 SAF 가요대전에서 원조 섹시 퀸다운 건재함을 보여줬다 짙은 화장에 섹시한 스팽글 의상을 입고서 빅뱅의 탑과 호흡을 맞추는 모습은 다음 날까지 온라인에서 화제가 됐다 그가 SNS에서 우리나라에서 여자 솔로
65040,20161228,2016-12-28,김정민,"5,000+",김구라의 열애설 해명에 김정민이 답장을 보냈다,TV조선의 원더풀데이 어제27일 방송에서 김구라가 방송인 김정민과의 열애설에 관해 얘기를 꺼내는 바람에 오늘 오전부터 김정민이 실시간검색에서 1위를 차지한 바 있다 TV 데일리에 따르면 얘기를 꺼낸 건 김구라다 이날 김구라는 얼마 전 예정화가 내게
65041,20161228,2016-12-28,안신애,"2,000+",필드 위 모델 안신애 일본 상륙작전,하지만 안신애가 외모만 뛰어난 골퍼라고 생각한다면 오산이다 안신애는 초등학생 시절 뉴질랜드로 이민을 떠나 뉴질랜드 청소년 국가대표로 출전한 실력파다 2008년 한국으로 다시 돌아온 안신애는 2009년 우승 없이 KLPGA 신인왕을 차지했고 2010년 2승
65042,20161228,2016-12-28,외부자들,"2,000+",외부자들 혹평 강적들보다 낫지만 썰전 보다 재미 없다,외부자들은 개그맨 남희석이 MC를 맡고 정봉주 전 의원 진중권 동양대 교수 안형환 전 의원 전여옥 전 의원 등 소위 좌파와 우파를 대변하는 출연진이 나온다 밖에서 바라보는 날카로운 시선을 기치로 현재 혼돈의 정국을 묵직한 입담과 날 서린 풍자를 통
65043,20161228,2016-12-28,캐리 피셔,"2,000+",스타워즈 레아 공주 캐리 피셔 심장마비 치료중 숨져,가수 에디 피셔와 뮤지컬 영화 사랑은 비를 타고에서 여주인공으로 열연했던 가수 겸 배우 데비 레이놀즈 사이에서 태어난 피셔는 1977년 개봉한 영화 스타워즈에서 레아 공주역을 맡아 열연하며 인기를 끌었다 북미 박스오피스 집계 누리집인 박스오피스
65044,20161229,2016-12-29,김광석,"5,000+",환생한 가객 김광석은 어떻게 시청자를 울렸나,환생의 제작을 총괄한 김상무 책임프로듀서CP는 한국일보와의 전화 통화에서 설문에서 김광석이 청년들의 아픔을 공감했을 것이란 답변이 많이 나왔다며 김광석은 시대와 호흡했던 가객이고 살아 있다면 분명 시대의 아픔이 있을 때 노래를 만들어 위로해
65045,20161229,2016-12-29,반기문 신천지,"5,000+",반기문 신천지 홍보 영상에 등장무슨 관계,다음 달 중순 귀국을 앞둔 반기문 유엔 사무총장과 관련된 의혹들이 계속 불거지고 있습니다 뇌물수수 의혹에 이어 이번에는 종교단체인 신천지와 연루됐다는 얘기가 나와습니다 이동석 기자의 보도입니다  기자  반기문 유엔 사무총장이 주요 기독교 교단들
65046,20161229,2016-12-29,설리,"2,000+",설리 쩍벌 포즈로 송년파티 하얗게 불태우겠어,배우 설리가 흥겨운 송년회를 보내는 모습을 인스타그램에 공개했다 28일 오전 설리는 자신의 사회관계망서비스SNS 인스타그램에 흥겨운 모습이 담긴 사진 여러장을 공개했다 사진 속 설리는 소파에 등을 대고 누워 양 발을모아 뽀얀 발바닥을 보이며 머리
65047,20161230,2016-12-30,Mbc 연예대상 2016,"2,000+",2016 MBC 연예대상 유재석 대상 품었다무도 4관왕 종합,OSEN박현민 기자 이변은 없었다 지난해 SBS 연예대상의 대상 트로피를 품었던 유재석은 올해는 2년만에 MBC 연예대상 대상 트로피를 품에 안았다 함께 경쟁했던 정준하와 김성주는 최우수상을 수상했다 올해의 예능 인기상양세형까지 무한도전은
65048,20161230,2016-12-30,가요대축제,"2,000+",2016 KBS 가요대축제 박보검부터 엑소까지 재미와 감동 모두 전한 대세들의 특별한 선물종합,2016 KBS 가요대축제는 그 어느 때보다 알찬 구성이 돋보이는 무대와 함께 박보검과 설현의 진행이 어우러져 볼거리와 감동이 공존하는 풍성한 축제로 마무리했다 특히 MC를 맡은 박보검은 KBS 뮤직뱅크 MC를 맡았던 경험을 십분 발휘해 시종일관 안정적
65049,20161230,2016-12-30,새해인사말,"5,000+",새해 인사말 모음정유년 새해 행복한,2017년 정유년 새해에 눈 앞으로 다가왔다 옛 것은 지나가고 새 것을 맞이하는 송구영신의 새해 인사말이 주목을 받고 있다 아래는 다음포탈에서 제공한 새해 인사말 단문들 2017년 정유년 행복한 한 해 되기를 기원합니다 2017년 새해에도 가정에 사랑과
65050,20161230,2016-12-30,설현,"2,000+",설현박보검 대세의 만남 비주얼은 훈훈하지만 설현 국어책 읽는 느낌,그룹 레드벨벳의 무대가 끝난 후 설현은 박보검씨가 뮤직뱅크 파트너인 아이린 씨가 계셔서 그런지 더 집중하는 것 같더라고요라며 운을 떼자 박보검은 아니에요라고 부인하며 지금 설현 씨와 함께 MC를 보고 있어서 너무너무너무 행복하고 즐겁습니다
65051,20161230,2016-12-30,송해,"2,000+",난데 없는 송해 사망설송해 측 헛소문경찰에 수사 의뢰,30일 방송인 송해89가 별세했다는 소문이 소셜미디어를 중심으로 돌았으나 사실이 아닌 것으로 밝혀졌다 이날 온라인과 여러 소셜미디어에는 한때 송씨가 사망했다는 루머가 돌았다 원로 방송인인 송씨가 사망했다는 소식에 많은 네티즌이 애도를 표했고
65052,20161231,2016-12-31,2017,"5,000+",IABI 2017년 대한민국 브랜드 가치 높이는 견인차 역할 선포,IABI는 지난달 23일 협회의 글로벌 분야 사업인 AICI KOREA서울지회에서 AICI 국제이미지컨설턴트협회가 공식적으로 지정한 이미지컨설턴트의 날을 기념하는 특강을 열고 IABI를 알리기 시작했다 최근 국내외 불안정한 정세 도래에 따른 2017년 전화위복
65053,20161231,2016-12-31,김동현,"5,000+",김동현 아시아 선수 최다승 타이 달성 장면하이라이트,김동현은 31일한국시간 미국 네바다주 라스베이거스의 T모바일 아레나에서 열린 UFC 207 타렉 사피딘30벨기에과 웰터급 경기에서 3라운드 판정승21을 거뒀다 이날 UFC에서 13승째를 거둔 김동현은 오카미 유신35일본이 보유했던 아시아 선수
65054,20161231,2016-12-31,론다 로우지,"20,000+",세계 최강 론다 로우지를 48초 만에 격파한 아만다 누네스의 키스영상,UFC 207의 메인이벤트에서 브라질의 현 챔피언 아만다 누네스가 전 여자 세계 최강 론다 로우지29미국를 압도적으로 꺾은 후 여자 친구와 뜨겁게 키스했다영상이 재생되지 않으면 이곳 링크를 클릭 연합뉴스에 따르면 현 여자 밴텀급 챔피언 아만다
65055,20161231,2016-12-31,새해,"500,000+",세월호에 새해소망 담아송박영신 촛불집회 이모저모,송박영신 국민토크 종이배접기 행사에 참여한 시민들은 각자 꿈꾸는 새해 소망을 종이배에 썼다 시민들의 소원을 담은 작은 종이배들이 광장 소원마당에 모여 거대한 세월호 모양을 이뤘다 고등학생 딸과 광화문 광장을 찾은 이은희45씨는 종이배에 세월호
65056,20161231,2016-12-31,새해 복 많이 받으세요,"5,000+",새해 복 많이 받으세요 스타들 새해 인사,김윤석  배우  저희 참 모진 겨울 힘든 겨울 어수선한 겨울들을 보냈는데요 그러나 여러분들 가슴속에 따뜻함과 인간에 대한 사랑과 희망이 있다면 우리는 또 행복한 미래를 개척해 나갈 수 있 지 않겠습니까 여러분 모두 새해 복 많이 받으시고 가정
65057,20161231,2016-12-31,새해인사,"10,000+",새해 복 많이 받으세요 스타들 새해 인사,김윤석  배우  저희 참 모진 겨울 힘든 겨울 어수선한 겨울들을 보냈는데요 그러나 여러분들 가슴속에 따뜻함과 인간에 대한 사랑과 희망이 있다면 우리는 또 행복한 미래를 개척해 나갈 수 있 지 않겠습니까 여러분 모두 새해 복 많이 받으시고 가정
65058,20161231,2016-12-31,서하준,"10,000+",정말 다사다난한 해였다 우수상 받은 서하준의 수상 소감,상을 받기 위해 나온 서하준은 상을 받을 줄 모르고 왔는데 상을 받게 돼 소감을 준비하지 못해 후회가 막심하다며 수상 소감을 시작했다 본인이 출연한 드라마 관계자들과 배우들에게 감사의 인사를 전한 서하준은 2016년 정말 다사다난한 해였던 것 같다고
65059,20161231,2016-12-31,연기대상,"2,000+",이종석 생애 첫 연기대상 영예,이종석이 30일 서울 상암동 MBC에서 열린 2016 MBC 연기대상에서 대상을 수상한 뒤 소감을 밝히고 있다 MBC 제공 드라마 W로 올해 시청자들을 사로잡은 한류스타 이종석이 MBC에서 생애 첫 연기대상을 수상했다 이종석은 30일 오후 서울 마포구 상암동
65060,20161231,2016-12-31,이종석,"2,000+",이종석 더 낮은 자세로 주신 상 무게 보답,이종석은 수상 직후 감사 인사와 더불어 벅찬 기쁨 속 떨리는 감정을 숨기지 못했다 짧지만 담백하고 솔직한 수상 소감을 밝힌 그는 청심환 두 알을 먹었는데도 가슴이 뛴다고 고백했다 그는 무대에서 내려올 때 깊은 숨을 내쉬며 가슴을 쓸어 내렸다 이미 앞
65061,20161231,2016-12-31,정유년,"5,000+",정유년 붉은 닭의 해전국 닭 관련 지명 어디가 있나,다사다난했던 병신년丙申年이 가고 정유년丁酉年이 하루 앞으로 다가왔다 정유년은 닭의 해다 그것도 60갑자 중에서 34번째에 해당하는 붉은 닭의 해다 닭은 새 아침과 시대의 시작을 알린다 정丁은 적赤 즉 붉다는 의미와 통한다 붉다는 예부터
65062,20170101,2017-01-01,KBS연기대상,"20,000+",송송커플 KBS 연기대상 눈물 쏟은 송중기,배우 송중기와 송혜교가 KBS 올해의 연기대상을 거머쥐었다 지난 4월 막을 내린 드라마 태양의 후예에서 송송커플로 활약하며 가장 뜨거운 한 해를 보낸 두 사람은 사랑스러운 커플 연기로 국내는 물론 해외 팬들의 마음까지 사로잡은 공로를 인정 받아 공동
65063,20170101,2017-01-01,MBC,"2,000+",3 타사는 정호성 말 바꾸기에 초점 MBC만 태블릿PC 집착,타사의 보도는 어떨까요 JTBC는 그동안 검찰 수사에서 정보 유출 혐의를 인정해왔는데 갑자기 이를 부인하면서 JTBC가 입수해 보도한 태블릿 PC의 증거 능력을 문제 삼고 나섰다면서 정 전 비서관이 13번의 조사에 걸쳐 이런 사실들을 인정했는데 갑자기 말
65064,20170101,2017-01-01,Sbs 연기대상 2016,"5,000+",2016 SBS 연기대상 한석규 대상 영예 우린 엉뚱한 생각하는 사람들,서울포커스뉴스 배우 한석규가 2016 SBS 연기대상에서 대상의 영예를 안았다 31일 오후부터 1일까지 SBS를 통해 방송된 2016 SAF 연기대상에서는 이변없이 한석규가 낭만닥터 김사부로 대상을 수상했다 2011년 뿌리 깊은 나무로 대상을 받았던
65065,20170101,2017-01-01,너의 이름은,"10,000+",변칙 개봉한 너의 이름은 미야자키 하야오 뛰어넘을까,너의 이름은은 2014년 감독 자신이 만든 학습지 CF 애니메이션 크로스로드와 일본의 고전 와카집인 만요슈에 실린 그 사람을 생각하며 잠들었기 때문에 꿈에서 나온 걸까 꿈이라고 알고 있었다면 눈을 뜨지 않았을 것을이라는 구절에서 영감을 얻어 만든
65066,20170101,2017-01-01,떡국,"2,000+",직무정지 朴대통령 靑참모들과 떡국 조찬으로 새해맞이,서울연합뉴스 강병철 기자  박근혜 대통령이 새해 첫날인 1일 청와대 관저에서 참모들과 떡국 조찬을 한다 2013년 취임 후 매년 1월 1일에는 국립현충원을 참배하고 국무위원 및 청와대 참모들과 떡국으로 아침을 먹었으나 올해는 참배 없이 참모들과만
65067,20170101,2017-01-01,무한도전,"10,000+",지난 31일 방영한 MBC 무한도전위대한 유산   MBC,박근혜 정부 비선실세 최순실의 딸 정유라의 시험을 자신의 조교에게 대리로 보게 한 혐의로 지난 31일 긴급 체포된 이화여대 콘텐츠융합합과 류철균 교수는 이인화라는 필명으로 영원한 제국1993을 발표한 유명한 소설가였다 조선왕조 정조의 독살설을
65068,20170101,2017-01-01,복면가왕 아기천사,"2,000+",복면가왕 아기천사 정체는 김명훈,복면가왕 아기천사에 대한 관심이 뜨겁다 다수의 누리꾼들은 그를 울랄라세션의 김명훈으로 추측하고 있다 MBC 일밤복면가왕에서는1일 1라운드 듀엣곡 대결에서 승리한 4인 복면 가수들의 2라운드 솔로곡 경연이 펼쳐졌다 하얀시 눈이군 쌓이면 우리마을
65069,20170101,2017-01-01,새해복많이받으세요,"2,000+",새해 복 많이 받으세요,추 감독은 회견장을 들어서며 새해 복 많이 받으세요라고 인사했다 졌지만 평소 패했을 때보다 어둡지 않았다 그는 열심히 준비했는데 아쉽다 그래도 SK가 잘한 경기다 내용 면에서 우리가 완패했다고 했다 그러면서 오늘 경기는 정말 뜻 깊은 점이 많다
65070,20170101,2017-01-01,새해인사말,"20,000+",손비야여민정 2017년 정유년 새해 인사말 계획한 모든 일 이루세요,KNS뉴스통신황인성 기자 배우 겸 중국어전문가 손비야여민정가 2017년 정유년 새해 인사말을 전했다 손비야는 지난 한 해는 이룬 것이 많은 한 해였다 상해유학을 하고 돌아와서 중국어교육사업을 시작했고 이화여대 석사에도 합격하여 내년 진학을
65071,20170101,2017-01-01,이인화,"2,000+",영원한 제국의 몰락이인화 절대권력 미화소설에 셀프평론도,서울연합뉴스 김계연 기자  비선 실세 최순실의 딸 정유라의 과제를 대신해준 혐의로 지난달 31일 긴급체포된 작가 이인화51본명 류철균는 박정희 군사독재를 미화하고 국가주의를 지지하는 역사관을 소설 속에 드러냈다 주로 역사적 상상력에 기반한
65072,20170101,2017-01-01,이휘재,"10,000+",무례한 진행 사과한 이휘재,전날 이휘재는 시상식에 점퍼를 입고 출연자석에 앉아 있던 성동일을 향해 PD인가 연기자인가 헷갈린 의상이라 놀랐다 배우시죠 등의 농담을 던졌고 이에 성동일이 무표정한 얼굴로 당황스러움을 내비쳤음에도 같은 지적을 이어가 비매너 진행이란 비판을
65073,20170101,2017-01-01,일출시간,"5,000+",기상청 일출 전국 어디서나 하지만 아차산 일출 오전8시21분에도 오리무중,김용연씨가 일출을 보며 애국가를 부르기 위해 태극기까지 준비했으나 아쉬워하고 있다 이호형 기자 수많은 인파가 오전 7시 47분 일출을 기다렸지만 아쉽게도 먹구름과 짙은 안개로 장엄한 해돋이 보지 못하고 하산했다
65074,20170101,2017-01-01,제야의 종소리,"2,000+",촛불과 제야의 종이 만나 송박영신 정유년 시작,일부 시민들은 제야의 종소리에 맞춰 박근혜는 퇴진하라를 외쳤고 기차놀이를 하며 박근혜 구속 조기 탄핵의 구호를 외치기도 했다 제야의 종 행사가 끝난 뒤에도 많은 시민들이 보신각 사거리에서 꽹과리와 북을 치고 박근혜를 구속하라고 외치며 축제
65075,20170101,2017-01-01,해돋이,"2,000+",충북 맑고 온화해돋이 볼 수 있어요,청주연합뉴스 이승민 기자  2017년 새해 첫날일 1일 충북은 맑은 날씨를 보여 대부분 지역에서 해돋이를 볼 수 있을 전망이다 연합뉴스 DB 이날 해돋이 시간은 영동 오전 7시 39분 충주 오전 7시 41분 청주 오전 7시 42분이다 일부 지역에는 짙은 아침
65076,20170101,2017-01-01,해돋이 명소,"2,000+",해돋이 명소 반기문평화랜드 큰산 해맞이 AI여파로 대폭 축소,한편 반사모 3040은 우선 전국에서 오는 반기문 팬클럽 회원등에게 자제를 요구 행사장 입구에는 발판 소독조를 설치하는 등 방역차단에 만전을 기하고 큰산보덕산 정상에는 자율의사로 오는 해맞이 손님들을 위해 해돋이 후 북을 치며 소원을 비는 대북정도만
