index,dayId,date,name,traffic,newsTitle,newsSnippet
72996,20170323,2017-03-23,23,"2,000+",ไทย ย23 40 มาเลเซย  ชางศกรนเลกฟอรมแรงเกบชย 2 นดรวด,ตามเวลาประเทศไทย การแขงขนฟตบอลดไบ คพ นดทสองทสนาม ยเออ เอฟเอ ฟตบอลชายทมชาตไทยรนอายไมเกน 23 ป ทชนะมาในเกมแรก พบกบ ทมชาตมาเลเซย เกมน วรวธ ศรมะฆะ จดทพทดทสดลงสนามในระบบ 4231 ผรกษาประต อภรกษ วรวงษ แนวรบ 4 คนจากขวาไปซาย
72997,20170323,2017-03-23,กรมบงคบคด,"5,000+",กรมบงคบคดเปดสอบพนกงานราชการจำนวน 127 อตรา,กรมบงคบคด เปดสอบพนกงานราชการ จำนวน 127 อตรา โดยสามารถสมครทางอนเทอรเนตไดตงแตวนท 29 มค4 เมยน สำหรบตำแหนงทเปดรบสมครไดแก 1นตกร อตราเงนเดอน 18000 บาท ตำแหนงวาง 35 อตรา คณสมบตเฉพาะสำหรบตำแหนง ไดรบวฒการศกษาปรญญาตร
72998,20170323,2017-03-23,กลบมา,"10,000+",ชมคลป เลกกนแลวกลบมาแตงงานกน ฟลค ลนววาห แอปเปล 3 พย ป,ปน เปนโหราศาสตรคำนวณตวเลขกออกมาเปนเลขทด ถาแตงวนนจะมชวตครอบครวทด เรากลนและรอมานานกวาจะไดฤกษมา ตองเอาวนเดอนปของทงครอบครวเราและครอบครวเขามาดเลย เรากตนเตน ชวตทผานมาเรากผานอะไรกนมาเยอะ เจอเรองหนกหนามาเยอะ ทงเรองชวตค ครอบครว
72999,20170323,2017-03-23,บอลไทย,"20,000+",ตรวางกำลงเขมดจราจรบอลไทยพบซาอฯเยนน,อยางไรกตาม ผกำกบการสถานตำรวจนครบาลหวหมาก ยนยนวา ทผานมาทางสมาคมฟตบอลแหงประเทศไทยไดประชมรวมกบหนวยงานทเกยวของ สงการใหมความเขมงวดรดกม และเพมมาตราการรกษาความปลอดภยทงในและนอกสนาม เพอปองกนไมใหเกดเหตความวนวายเชนทผานมาอก
73000,20170323,2017-03-23,บอลไทย ซาอ,"20,000+",ตรวางกำลงเขมดจราจรบอลไทยพบซาอฯเยนน,อยางไรกตาม ผกำกบการสถานตำรวจนครบาลหวหมาก ยนยนวา ทผานมาทางสมาคมฟตบอลแหงประเทศไทยไดประชมรวมกบหนวยงานทเกยวของ สงการใหมความเขมงวดรดกม และเพมมาตราการรกษาความปลอดภยทงในและนอกสนาม เพอปองกนไมใหเกดเหตความวนวายเชนทผานมาอก
73001,20170323,2017-03-23,หนากากทเรยน,"200,000+",เจานาย ลกพเจ ยงเชยรและบอกวาหนากากทเรยนคอ ทอม room39,งานนตอกยำวา หนากากทเรยน คอ ทอม กบอกหนงเสยงจาก นองเจานาย ลกชายคนโตของพเจ โดยเจาตวไดโพสตวา ทเรยน เปนใครไปไมไดนอกจาก เราวา ท39 รายการ The Mask Singer ตอนนกำลงถายทอดสดอย หลายคนจงจบจองดวาเปนเขาจรงๆ หรอไม
73002,20170323,2017-03-23,องกฤษ,"5,000+",องกฤษรวบผตองสงสย 7 คน เอยวเหตกอการรายลอนดอน,ผสอขาวรายงานวา ความคบหนาเหตกอการรายทสะพานขามแมนำเทมสเมอวานน วา ตำรวจองกฤษจบกมผตองสงสยทคาดวาเกยวของกบเหตการณกอการราย ทอาคารรฐสภาองกฤษเพมอก 7 ราย ทำใหมผเสยชวตทงหมด 4 คนจากเหตการณน แบงเปน ประชาชน 2 ราย ตำรวจ 1 นาย และ
73003,20170323,2017-03-23,เอะ จรากร,"200,000+",ลวงลบ รองแชมป เอะ จรากร กระชากหนากากอกาดำ ถารอายจะอง,ถอดหนากากกนไปเรยบรอยและควารองแชมป The Mask Singer หนากากนกรอง สำหรบ หนากากอกาดำ บทสรปกตามคาด เอะ จรากร นกรองแสบเสนห บนเทงไทยรฐ พามาทำความรจก ถอดหนากากอกาดำ ดเรองลบๆ ของเขากน 1เอะ จรากร ม โจ วงพอสเปนไอดอล
73004,20170324,2017-03-24,ไทย,"2,000+",สปดาหหนาหนไทย บวก,โดยวนน หนไทยแกวงตวผนผวนองไปทางบวกเลกนอย เนองจากมแรงซอหนของนกลงทนตางชาต หลงผดหวงกบกฎหมาย อเมรกนเฮลธแคร ซงเสยงสนบสนนของพรรครพบลกนยงไมมากพอใหสภาผแทนราษฎรสหรฐฯเหนชอบได แตดชนฯ ยงไปไมไดไกล เพราะหนไทยยงไรปจจยบวกโดดเดน
73005,20170324,2017-03-24,ไทยรฐทว,"5,000+",ไทยรฐทว ถายสดมวยไทยรฐ 25 มค คเอก เพชรตดเพชร,มวยคเอก ศกยอดมวยไทยรฐ ประจำวนเสารท 25 มนาคมน เพชรเมองชล ภสวนทอง ดวลเดอดกบ เพชรสพรรณ ปดาวรงเรอง ไทยรฐทว ชอง 32 ถายทอดสดตงแตเวลา 1400 น เปนตนไป พลาดของดแลวจะเสยใจ วนท 24 มค 60 การแขงขนศกยอดมวยไทยรฐ สปดาหท 72 ประจำวนเสารท
73006,20170324,2017-03-24,ไอซ,"2,000+",ฮน ไมขอตอบเรอง ไอซ อก เชอฝายหญงอาจมหนมใหมแลว คลป,แมจะเลกรากนไปสกพกแลว แตเมอวนเกดของนางเอกสาวหนาใส ไอซ ปรชญา พงษธนานกร อดตคนรใจของนกรองหนมสดแซบ ฮน อสรยะ ภทรมานพ ยงเฟซไทมไปอวยพรวนเกดใหสาวไอซอกดวย ไดเจอ ฮน มารวมงาน Joox Thailand Music Awards ณ เซนเตอรพอยทสตดโอ ลาซาล ถ
73007,20170325,2017-03-25,กามเทพออกศก,"10,000+",กามเทพออกศก ตอนท 4,ทงหมดกนอาหารฝรงเศสกนเสรจ เมอบรกรเอาบลมาใหพดดวง เขาดแลวหนาเจอน ออกตววา เออวนนเงนสดในกระเปาเปนเงนดอลทงนน ผมรบกวนคณหอมจายกอนคงไมวากนนะครบ เฮยซงกบเจเนยชกสหนาถามวาใหลกตนจายหรอ พดดวงอางวาตนเพงบนมาถงวนนบญชตนยงไมเรยบรอย
73008,20170325,2017-03-25,ครส หอวง,"2,000+",ชอกเด มาชา ถอนตว เดอะเฟส กลางอากาศ เต รบมน โบยถามเหตผลเอง,ทำเอางงงวยกนไปเลยทเดยว หลงจากท รายการเดอะเฟสไทยแลนด ซซน 3 ออกอากาศวนท 25 มค สรางความตะลงดวยการประกาศแจงแฟนคลบ ระบวา มาชา วฒนพานช ยตการทำหนาทกลางอากาศ และให ครส หอวง มาทำหนาทแทน ทำแฟนๆ พากนชอกและงงไปตามๆ กน
73009,20170325,2017-03-25,จยอน,"5,000+",วนวานของ จยอน กอนจะถงวนนทมชอเสยงโดงดง,วนวานของนกแสดงสาวเชอสายเกาหล จยอน หรอชอเตมๆ ของเธอคอ ซอ จยอน เธอยายมาอยประเทศไทยเมอตอนอาย 11 ป เรมเขาวงการตงแตป 2552 จากนนกมผลงานออกมาใหเหนบางทงงานเพลง งานถายแบบ เลนมวสกวดโอ จนกระทงเธอไดมาเลนซทคอม นดกบนด
73010,20170325,2017-03-25,หลวงปสรวง,"2,000+",หลวงปสรวง สรปญโญ ละสงขาร สรอาย 86 ป,หลวงปสรวง สรปญโญ วดศรฐานใน ตศรฐาน อปาตว จยโสธร พระอรยสงฆสายหลวงปมน ภรทตโต ซงนองชายของอดตพระเทพสงวรญาณ หลวงตาพวง สขนทรโย พระอรยสงฆเชนกน แหงวดศรธรรมมาราม ตในเมอง อเมอง จยโสธร ไดละสงขารหลงอาพาธมานาน สรอาย 86 ป 9 เดอน 19 วน
73011,20170325,2017-03-25,เบล ปทมราช,"2,000+",ยนภาพหลดไมใชผม เบล ปทมราช หลดชม ไซสพเขากไดอย รบผดเปาตง,เปนลกทงดงทคนรจกเพลงมากกวาหนาซะอก สำหรบ เบล ปทมราช อารสยาม เจาของเพลงฮต เฟสกหายไลนกเงยบ อายมเหตผล ฯลฯ แถมในระยะหลงๆ มานถกโฟกสแตเปาเวลาขนเวทคอนเสรต แตททำเอาฮอฮาเพราะมคนปลอยภาพหลดอางเปนเจาตวกำลงแหกอาซาบนเกาอ
73012,20170326,2017-03-26,โสภณ ซารมย,"2,000+",กระบะพงชนทายสบลอ สจเตง ลกชายโสภณ ซารมย เสยชวต,นอกจากนน ยงมนายอาณตพณ ซารมย หรอ สจเตง อาย 30 ป ซงเปนสมาชกสภา อบจบรรมย เขต อคเมอง เขต 2 เปนบตรชายคนโตของ นายโสภณ ซารมย อดตรฐมนตรวาการกระทรวงคมนาคม ตดอยบรเวณทนงดานคหนากบคนขบ อาการสาหส เจาหนาทกชพตองใชเวลานานกวา 30 นาท
73013,20170327,2017-03-27,Voice TV,"2,000+",มตกสทพกใบอนญาตVoiceTVรวม7วนมผลเทยงคน28มคเหตขดคำสงคสช,มตทประชมคณะกรรมการ กสทมมต สงพกใชใบอนญาต ชองวอยซทว Voice TV รวม 7 วน มผล ตงแต 0001 น วนท 28 มค2560 ดานวอยซทว แถลงจะมการปรบรปแบบออกอากาศไปออกทางเวบไซตของ Voice TV แทน เมอวนท 27 มค2560 พลโทพระพงษ มานะกจ
73014,20170327,2017-03-27,ฟตบอลทมชาตไทย,"5,000+",วนฟรดยอมรบทมชาตไทยตอนนมทรพยากรชนเยยม,เชเฟอรถกจบภาพไดวา เดนทางเขามาชมการแขงขนฟตบอลในศกไทยลก2 เกมท แอรฟอรซ เซนทรล เอฟซ เปดบานเสมอ กระบ เอฟซ ทเหลอ 10 คน ดวยสกอร 11 ทสนามธปะเตมย เมอวนท 26มคทผานมา หลงจบเกม ทางผสอขาวไดซกถามถงเรองอนาคตในการกลบมาคมทมชาตไทย
73015,20170328,2017-03-28,คลปหวาย,"5,000+",ไมแครสอ หวาย โพสตคลปเลฟซนกบแฟนลง IG คลป,งานเขาเตมๆ สำหรบนกรองสาวหวาย ปญญรสาเธยรประสทธหรอหวาย กามกาเซทเกดดรามาเดอด หลงจากทเธอได โพสตคลปในสตอรไอจสวนตว เปนชอตทแฟนหนม มโน ลกครงไทยอตาล เขามาจบเธอ อกทงยงชอตทเผดรอนสดๆ เมอแฟนหนมบบหนาอกของเธอ แตหลงจากเกดดรามา
73016,20170328,2017-03-28,บอลไทย,"20,000+",สบอลไทย ลงนาม MOU รวมกบเจเอฟเอ,ดาน นายกสมาคมฟตบอลแหงประเทศญปน กลาววา ณ ตอนนมนกเตะญปนกวา 70 คน ทไปคาแขงในประเทศไทย ขอขอบคณทงสโมสรและแฟนบอลไทย ทตอนรบและดแลนกฟตบอลญปนอยางดและอบอน สำหรบปน มนกกฬาไทยเขามาเลนท คาโงชมา และ ชนาธป สรงกระสนธ ทจะไปเลนกบ
73017,20170329,2017-03-29,Samsung S8,"2,000+",เผยสเปก Samsung Galaxy S8 และ Galaxy S8 Plus จากหนวยงาน,หนวยงาน TENAA ในประเทศจน ททำหนาทคลาย สำนกงาน กสทช ของไทย เปดเผยสเปกสมารทโฟน Galaxy S8 และ Galaxy S8 Plus ออกมาแลว กอนท Samsung จะเปดตวอยางทางการในวนน 29 มนาคม 2017 โดยมขอมลทสำคญคอ Galaxy S8 ในประเทศจน จะมเวอรชน RAM 6GB
73018,20170329,2017-03-29,Yamaha QBIX,"2,000+",กรงเทพฯ29 มคไทยยามาฮามอเตอร,โซนตอมา คอโซน WHITE CUBIC ควบกซสขาว สะทอนความลำสมย ในรปแบบแฟชนดไซน พรอมเทคโนโลยสดลำ เพอตอบโจทยคนรนใหมสไตล Gadgetster ดวยการเปดตว Yamaha QBIX รถจกรยานยนตแบบดจตอลเมตก ครงแรกในโลก ดวยรปทรงทลำสมย พรอมนำเสนอผาน VR
73019,20170329,2017-03-29,ครสภา,"10,000+",ศาลออกหมายจบมอยงสาวซ4ตายครสภา,ภายหลงจากทพนกงานสอบสวนสถานตำรวจนครบาลดสต ไดขอศาลออกหมายจบ นายจำลอง พมมาย อายประมาณ 40 ป ผตองหาใชอาวธปน 38 ยง นางวาสนา บระคร อาย 37 ป เจาหนาทระดบ 4 ฝายเจาหนาททะเบยนการเงนการคลง สกสคเสยชวต บรเวณสนามหญาครสภาฯ เมอชวงเยนวาน
73020,20170329,2017-03-29,จฑามาศ ศรวรรณ,"2,000+",ยอนรอย คด จฑามาศ  ลกสาว รบสนบน,ชมลความผด และสงสำนวนใหอยการซงนายตระกล วนจนยภาค อยการสงสด ซงดำรงตำแหนงในป 2558 ไดมคำสงเดดขาดใหฟอง จากนนอยการสำนกงานคดพเศษ 2 ไดยนฟอง นางจฑามาศ ศรวรรณ อดตผวา ททท และ จตตโสภา บตรสาว ตอศาลอาญาคดทจรตและประพฤตมชอบกลาง
73021,20170329,2017-03-29,สเตฟาน,"5,000+",ยงจำไดมย สเตฟาน เปลยนไปเยอะ ประกาศเลกเปนดารา ชมคลป,อดตแฟน กลบมาเจอกนในสถานะทเปลยนไป แตแฮปปเหมอนเดม สวนเรองสเตตสแตงงานกบสาวเซกซแลวไมขอตอบเรองน ไมกลวคนจบตามองเพราะไมใชดาราแลว เปนแคอดตพระเอก จงขอเปนเรองสวนตว ถาวนนนเกดขนกรเอง เผยชวงนใชชวตปกตทวไปสวนมากทำงานมากกวา
73022,20170330,2017-03-30,ทอม,"5,000+",โคตรเกง บม หนากากมงกร อวยแรง ทอม หนากากทเรยน,เปนนางงามตวแม ทมหลายเรองราวดรามาหนกๆ นำตาแตก ถงเวลารองเพลงกรองไดโดนใจคนดไมนอย บม ปนดดา วงษผด หนากากมงกร ชนชมดงๆ ไปถง ทอม อศรา หนากากทเรยน ดงๆ เปดไปแลวหนากากทเรยน อยากจะบอกอะไรไปบาง ตองขอแสดงความยนดกบหนากากทเรยน
73023,20170330,2017-03-30,ทอม Room39,"100,000+",สองความนารก ทอม Room39 ชวตจรงตะมตะมไมแพ หนากากทเรยน,ซงนกรองหนมภายใตหนากาก ทอม อศรา หรอ ทอม Room39 ในวย 28 ป ชวตจรงแมจะไวเคราใหดเขม แตบคลกเจาตวเปนผชายนารกสดใส มอารมณขน มมมแบว ออนโยน ชอบเลยงสตว กนไอศกรม โดยเฉพาะเวลาอยกบภรรยาคนสวย ฟลม วณชยา ทจะมความนารกออนเปนพเศษ
73024,20170331,2017-03-31,ซโก,"5,000+",บกออด ปดขาวปลด ซโก พนกนซอยนมความชดเจนกอน 10 เมย,สมยศ พมพนธมวง นายกสมาคมกฬาฟตบอลฯ เกยวกบกระแสขาวลอวาจะมการปลด ซโก ออกจากการทำหนาท ซงนายกสมาคมกฬาฟตบอลฯ กลาววา ขาวดงกลาวไมเปนความจรง ไมมการพดคยเรองน ตนเองไดอานขาวจากเลขาธการสมาคมฯ สงมาใหทมขาวลงในสอออนไลนตางๆ รสกแปลกใจ
73025,20170331,2017-03-31,ซโก ลาออก,"2,000+",โคชเฮง แยม ซโก เปรยลาออกหลงพายญปน เสนอ แบน คมตอ,วทยา เลาหกล ประธานเทคนคสมาคมกฬาฟตบอลแหงประเทศไทยฯ เผยผานสอวา ซโก เกยรตศกด เสนาเมอง ไดสงสญญาณขอลาออกจากตำแหนงตงแตจบเกมแพ ญปน 04 รอบคดเลอก ฟตบอลโลก แตตนยงอยากใหทำตอ พรอมมองกนซอใหมอยากใหเปนคนไทยมาสานงาน เลง โคชแบน
73026,20170331,2017-03-31,พระเทพ,"2,000+",ทหารเพชรบรณจดพธถวายราชสกการะพระเทพฯ,เพชรบรณ อยางไรกตามหลงเสรจสนพธบรรดากำลงพลยงรวมกนบรจาคโลหต เพอถวายเปนพระราชกศลแดสมเดจพระเทพรตนราชสดาฯ สยามบรมราชก มาร เนองในโอกาสทรงเจรญพระชนมายครบ 62 พรรษาในวนท 2 เมษายน พศ2560 ทแหลงสมาคมนายทหารคายพอขนผาเมอง
73027,20170331,2017-03-31,เลขเดด,"20,000+",เลขเดดเชยงใหมมาอก เซยนมาเองคำนวณแลวอาจมตวสอดแทรก เจามออน,องศมาลน พลอยไพรนทร เจาแมคำนวณหวยดวงดาวและคำนวณหวยตอยอดเลขดง เปดเผยวา จากการคำนวนเลขดงจากสำนกตางๆ ผานระบบการคำนวณตวเลขดวงดาว พบวาเลขเดดงวดน จากการคำนวณออกมาแลว ม 497 897 170 150 944 21 และใหระวงเลข 357 337 ดวยอาจมสอด
73028,20170401,2017-04-01,1 เมษายน,"10,000+",เรยงคนมาเปนขาว  ภาพขาวสงคม  น4 ประจำวนท 1 เมษายน 60,Thailand 2017 Economics Outlook  กอบศกด ภตระกล ผชรฐมนตรประจำสำนกนายกรฐมนตร เปนวทยากรบรรยายในหวขอ Thailand 2017 Economics Outlook  Effect from Trumps  Other Global Policies จดขนโดยสมาคมคณะกงสลกตตมศกด ประเทศไทย โดยม อมรนทร
73029,20170401,2017-04-01,GSL 2017,"2,000+",Garena Star League 2017 GSL 2017 มหกรรมกฬาอสปอรตสดยงใหญ ทเหลาคอเกมหามพลาด,การนา ออนไลน ประเทศไทย จดงานมหกรรมกฬาอสปอรตทยงใหญระดบอาเซยน Garena Star League 2017 GSL 2017 ภายใตคอนเซปต Universal eSports Arena ณ ฮอลล 9899 ไบเทค บางนา วนท 12 เมษายน 2560 พบกจกรรมการแขงขนกฬาอสปอรต
