index,dayId,date,name,traffic,newsTitle,newsSnippet
17971,20170406,2017-04-06,Patria,"2,000+",Pozor na internetové podvodníky Imunní vůči nim nejsou ani,Americké ministerstvo spravedlnosti obžalovalo Litevce kterému se podařilo podvést dvě americké technologické společnosti Ty mu následně poslaly celkem 100 milionů dolarů Evaldas Rimasauskas kterému je 48 let toho dosáhl tak že se vydával za
17972,20170406,2017-04-06,Pomeje,"2,000+",Jiří Pomeje má rakovinu Manželka prozradila co se teď děje u nich,Rakovina hrtanu Takto děsivou diagnózu si vyslechl od lékařů herec Jiří Pomeje 52 Aby byl zase v pořádku si nepřeje jen on ale také jeho manželka Andrea 29 Jak celou situaci zvládá ona Herec musel nedávno na operaci kvůli výrůstku na hlasivkách
17973,20170406,2017-04-06,Spalničky,"1,000+",V Ostravě propukla epidemie spalniček O dětské i dospělé pacienty,V Ostravě propukla epidemie spalniček zatím se nemoc potvrdila u dvou desítek dospělých a dětí Všichni byli hospitalizovaní na klinice infekčního lékařství ostravské fakultní nemocnice Hygienici už plánují preventivní očkování u vybraných skupin
17974,20170406,2017-04-06,Velaa Private Island,"1,000+",Šmejc prodal Křetínskému část letoviska na Maledivách,Podnikatel Jiří Šmejc prodal čtvrtinový podíl v luxusním hotelovém resortu Velaa Private Island na Maledivách Danielu Křetínskému Cena transakce dosáhla 495 milionu dolarů 12 miliardy korun Luxusní hotelový komplex s 45 vilami otevřel Šmejc pro
17975,20170406,2017-04-06,kurz eura,"2,000+",Konec oslabování koruny Co nás teď čeká a kdy koupit eura na,Konec režimu intervencí mohl nyní přijít kdykoliv uvedl v rozhovoru pro Bleskcz europoslanec Luděk Niedermayer za TOP 09 A ve čtvrtek se tak také stalo S okamžitou platností ukončila ČNB intervence které držely kurz eura na 27 korunách
17976,20170406,2017-04-06,Čnb Kurzy,"2,000+",Rozbřesk Přinese dnešek konec intervencí ČNB,Klíčovou otázkou ale nakonec je zda čekat rozhodnutí ČNB již dnes My na konkrétní načasování konce intervencí v tuto chvíli nemáme silný názor Věříme že poslední čísla a aktuální prognóza centrální banky již konec intervencí ospravedlňují a ten tak
17977,20170407,2017-04-07,Asad,"1,000+",Asad Pokud tuto válku nevyhrajeme bude Sýrie vymazána z mapy,Syrský prezident Bašár Asad  před americkým útokem na základnu Šajrát  prohlásil že v občanské válce která už šest let sužuje Sýrii není jiná možnost kromě vítězství Asad tato slova pronesl v rozhovoru pro chorvatský deník Večernji list z
17978,20170407,2017-04-07,Intervence Čnb,"1,000+",Rozbřesk ČNB pouští intervence vzhůru šly výnosy krátkých,Česká národní banka ukončila intervenční režim a přestává bránit úroveň 2700 EURCZK Obchodování s korunou bylo bezprostředně po vypnutí intervencí volatilní ale koruna si postupně připsala zisky a během dne posílila o zhruba 40 haléřů S posílením
17979,20170407,2017-04-07,STOCKHOLM,"5,000+",Ve Stockholmu vjel náklaďák do davu Čtyři mrtví policie má,Nejméně čtyři lidé zemřeli v centru Stockholmu kde nákladní automobil vjel do davu lidí u obchodního domu Asi 15 lidí je zraněných upřesnila v pátek v podvečer policie Ta žádá obyvatele města aby se vyhnuli centru vyklidila i řadu veřejných budov
17980,20170407,2017-04-07,Sputnik,"2,000+",Raketový úder byl zasazen jednomu z mála bezpečných syrských,Sputnik Česká republika všechna vydání VstupRegistraceVýstup 2049 07 dubna 2017 Hlavní  Svět  ČR  Politika  Byznys  Názory  Světový tisk  Multimédia  Videoklub  Foto  Infografika  Karikatury  Video Vyhledávání Následky útoku USA
17981,20170407,2017-04-07,Syrie,"2,000+",Sýrie věděla o útoku od Rusů Trump asi dostal nové informace říká,PRAHA Kdyby Rusové Syřany zavčasu nevarovali americký útok mohl být daleko ničivější V rozhovoru pro server Lidovkycz to říká vojenský analytik Lukáš Visingr Útok na leteckou základnu v Sýrii v považuje za symbolický Prezident USA Donald Trump
17982,20170407,2017-04-07,Sýrie,"2,000+",A je to tady Několik hodin po americkém bombardování Sýrie,Podle aktuálních informací rovněž Rusko v reakci na vzdušné údery amerických sil v Sýrii pozastavilo platnost dohody o bezpečnosti vzdušného prostoru v Sýrii Kromě Vladimira Putina a ruské diplomacie v čele se Sergejem Lavrovem se neméně odmítavě
17983,20170407,2017-04-07,Tomahawk,"2,000+",Střely Tomahawk zničí cíl na 2500 kilometrů Co umí léty prověřená americká zbraň,Střely Tomahawk mají několik verzí a mohou být vypuštěny z ponorek z hladinových válečných lodí z odpalovacích ramp a z letadel Podle toho se liší jejich dolet  od 450 do 2500 kilometrů nejkratší mají střely odpalované z ponorek Jejich bojová
17984,20170407,2017-04-07,sarin,"2,000+",Kde vzal Asad sarin když mu před třemi roky zlikvidovali chemický arzenál,Spojené státy a jejich západní spojenci mají jasno nervový plyn který zabíjel v syrské provincii Idlib je sarin pocházející ze skladů syrské armády Ale jak je to možné když Organizace pro zákaz chemických zbraní OPCW všechny nervové plyny v
17985,20170408,2017-04-08,Kometa,"1,000+",Kometa je ve finále Hynek Zohorna vystřelil postup v prodloužení,Hokejisté brněnské Komety postoupili do finále české extraligy a potřetí za posledních šest let si zahrají o mistrovský titul Stejně jako v roce 2014 posunul Moravany do bitvy o Pohár T G Masaryka Hynek Zohorna Tentokrát svým gólem vyřadil v
17986,20170408,2017-04-08,Kometa Brno,"2,000+",NEJ z Kometa  Mountfield HK Otřesy Němce i sudího výtečný,To byla jízda Šesté semifinále Generali play off Tipsport extraligy mezi Kometou Brno a Mountfieldem HK 21pp nabídlo strhující podívanou Brňané vděčí za postup Hynku Zohornovi a zejména výtečnému Marku Čiliakovi Vítězný zápas ovšem nedokončil
17987,20170408,2017-04-08,Lucie Bila,"1,000+",Bílá si hledá chlapy jako přes kopírák Takhle si Noid s novým,Zpěvačka Lucie Bílá 51 vychází se svým exmanželem Vaškem Noidem Bártou tak skvěle že nemá problém ho seznámit se svým současným partnerem A vypadá to že spolu kluci dobře vycházejí Nelze si také nevšimnout podoby obou mužů Bílá si
17988,20170408,2017-04-08,Lucie Bílá,"2,000+",Bílá si hledá chlapy jako přes kopírák Takhle si Noid s novým,Zpěvačka Lucie Bílá 51 vychází se svým exmanželem Vaškem Noidem Bártou tak skvěle že nemá problém ho seznámit se svým současným partnerem A vypadá to že spolu kluci dobře vycházejí Nelze si také nevšimnout podoby obou mužů Bílá si
17989,20170408,2017-04-08,Real Madrid,"2,000+",Barcelona dotahuje vedoucí Real Madrid ten remizoval s Atléticem,Fotbalisté Realu Madrid remizovali 31 kole španělské ligy v derby s Atléticem 11 Na Pepeho gól odpověděl pět minut před koncem Antoine Griezmann V čele tabulky má Bílý balet na jehož lavičce dnes odkoučoval 50 ligový zápas Zinedine Zidane
17990,20170408,2017-04-08,spalničky,"2,000+",V Ostravě řádí spalničky hrozivá epidemie se rychle šíří PŘÍZNAKY,V minulých letech se spalničky v kraji nevyskytovaly Teď už dvacítku vyléčených z nemocnice propustili Spalničky jsou ovšem vysoce nakažlivou nemocí která se přenáší vzduchem Nemocní jsou tak už i mezi lékaři Hygienici raději nařídili očkování 600
17991,20170409,2017-04-09,Adéla Gondíková,"2,000+",Langmajer o odchodu od manželky Za Adélu jsem to pěkně schytal,Zlomila to až Adéla Gondíková V té našel to co celý život hledal Rozumí si s ní mnohem víc než se svou manželkou a to bylo důvodem jejich rozchodu Moje žena učí matematiku na soukromém gymnáziu což je něco co jde absolutně mimo mě Ona má
17992,20170409,2017-04-09,Egypt,"1,000+",Útoky na kostely v Egyptě mají 45 obětí Prezident zavede výjimečný,Dva kostely se v Egyptě staly na Květnou neděli terčem bombového útoku Výbuch ve městě Tanta severně od Káhiry si vyžádal 29 mrtvých sebevražedný atentátník zabil v Alexandrii 16 lidí K útokům se přihlásil Islámský stát Prezident Abdal Sísí oznámil
17993,20170409,2017-04-09,Formule 1,"1,000+",Formule 1 v Číně bouračky strkanice i odvážné manévry,Mokro bouračky a drama do posledních chvil Druhý podnik sezony Velká cena Číny nabídl krásnou podívanou Divácky atraktivní závod a jezdecky velmi náročný ovládl Lewis Hamilton Za ním dojel Sebastian Vettel a třetí překvapivě skončil Max
17994,20170409,2017-04-09,Hc Kometa,"1,000+",Potřetí už chceme ve finále vyhrát řekl majitel Komety,Poslední největší posilou byl na konci ledna příchod obránce Jakuba Krejčíka z KHL Právě ten výrazně pomohl k cestě do finále Dvěma góly a jednou asistencí posunul Kometu po výhře v pátém duelu v Hradci Králové k prvnímu semifinálovému mečbolu
17995,20170409,2017-04-09,Jiří Ornest,"10,000+",Ve věku 70 let zemřel herec a režisér Jiří Ornest,PRAHA V 70 letech zemřel v neděli dopoledne herec a režisér Jiří Ornest oznámila jeho manželka herečka Daniela Kolářová Ornest stál u zrodu řady alternativních divadelních projektů známý byl i z filmu a televize
17996,20170409,2017-04-09,Květná neděle,"2,000+",Slaví se Květná neděle začínají Velikonoce,Palm Sunday neboli Květná neděle otevírá velikonoční pašijový týden nejdůležitější křesťanské svátky Připomíná Kristův slavný vjezd do Jeruzaléma kde byl vítán lidmi mávajícími palmovými listy Podobný obřad se na Květnou neděli odehrává i nyní
17997,20170409,2017-04-09,Modrá Velryba,"1,000+",Denis se zabil kvůli Modré velrybě Děsivá hra už je na Slovensku,Internetem se rychle šíří nebezpečná hra která nabádá mladé lidi k sebevraždám V Rusku si už vyžádala desítky dětských životů nyní se dostala k našim hranicím Šestnáctiletý Denis ze Slovenska skočil pod vlak Podle mladíkových přátel stála za jeho
17998,20170409,2017-04-09,Mordparta,"1,000+",Seriál Mordparta se vrací Plánková vyvázne z kriminálu Fiala tam,Neumím si představit že bych tam strávila několik měsíců nebo dokonce let Možná den to by si tam člověk hezky vyčistil hlavu Seděl by sám se svými myšlenkami a pocity říká herečka Když mě v první sérii Mordparty zavřeli do vězení nepočítal
17999,20170409,2017-04-09,NOVA Sport,"1,000+",Zápas večera v UFC skončil šokem Rumble oznámil že končí,Historicky teprve druhá UFC návštěva Buffala je již historií Očekávaný galavečer s hlavním tahákem v podobě titulové zápasu mezi Danielem Cormierem a Anthonym Johnsonem ale nabídl mnohem více než se čekalo Po úvodní trojici zápasu měl dnešní
18000,20170409,2017-04-09,Patrik Eliáš,"1,000+",VIDEO Loučení s Ďábly Patrik Eliáš odchází jako nejproduktivnější,Patrik Eliáš byl New Jersey draftován v roce 1994 jako celková 51 volba V NHL debutoval v sezóně 199596 a už po dvou letech se zařadil mezi důležité články sestavy Devils V červených barvách dvakrát zvedl nad hlavu prestižní Stanley Cup pod tituly
18001,20170409,2017-04-09,Tina Turner,"2,000+",HUSÍ KŮŽE Milan Peroutka jako Tina Turner zvedl diváky ze židlí,Milan Peroutka který nedávno oslavil své 27 narozeniny je zatím jediný komu se ve třetí řadě show Tvoje tvář má známý hlas podařilo zvítězit hned dvakrát Tentokrát se do toho pořádně obul jako Tina Turner a proměna to byla opravdu dokonalá Už
18002,20170409,2017-04-09,zádušní oběť,"2,000+",Je zádušní oběť rituální vražda ČT odvysílá ponurou detektivku s,Láska nenávist touha po pomstě i spravedlnosti provází hrdiny detektivního příběhu z počátku 20 století Ve filmu Zádušní oběť se sešli tvůrci dramatu Zánik samoty Berhof Snímek podle scénáře Vladimíra Körnera s Milanem Kňažkem v roli komisaře
18003,20170410,2017-04-10,Irina Shayk,"2,000+",A JE TO VENKU Ronaldova bývalka Irina Shayk je maminkou Neuvěříte jak dlouho porod tajila,Vztah se vždycky nevyvíjí tak jak bychom si představovali Ruská modelka Irina Shayk 31 to před několika málo lety zjistila po boku Cristiana Ronalda 32 jednoho z nejslavnějších fotbalistů současnosti Náhradu za něj nemusela krásná modelka
18004,20170410,2017-04-10,Koule,"1,000+",Vyhrajte s Koulecz CD Aspiring Child kapely The Complication,Aspirují na rockový objev sezóny The Complication mají drive dělají hudbu po svém a výsledek zní skvěle Talentovaná čtveřice The Complication si se svou druhou nahrávkou Aspiring Child říká důrazně o pozornost Jejich nasazení které z nich prýští
18005,20170410,2017-04-10,Martin Dolenský,"20,000+",Režisér Vyprávěj Martin Dolenský tragicky zahynul 47 Aspoň už,Režisér Martin Dolenský zemřel při těžké autonehodě minulý čtvrtek 6 dubna Smutnou zprávu na sociální síť napsal jeho kamarád Petr Wajsar Zemřel Martin Dolenský můj kamarád a skvělej režisér Tak už aspoň víš jaký to je Dobrou noc chlape
18006,20170410,2017-04-10,Sarin,"1,000+",Někdejší Schwarzenbergův náměstek má jasno Sarin nad syrské město přinesla ta Asadova letadla,Sarin tam přinesla ta letadla slyšel prý Pojar a odmítl tak de facto verzi že by šlo o útok na sklady s chemickými zbraněmi Zmínil také to že o útoku v Chán Šajchúnu asi syrský prezident Bašár Asad věděl ale jasně to nikdy nezaznělo Vím že
18007,20170410,2017-04-10,Spalničky,"2,000+",Moravskoslezský kraj hlásí 38 případů spalniček Situace se zhoršuje,Sedmadvacet případů onemocnění spalničkami bylo laboratorně potvrzeno na laboratorní potvrzení 11 klinických případů se čeká uvedla krajská hygienička Helena Šebáková Na území Ostravy bylo zaznamenáno 32 nakažených další tři případy jsou
18008,20170410,2017-04-10,Thor Ragnarok,"1,000+",TRAILER TÝDNE Marvelovský Thor hýří osmdesátkami Zfackuje i Hulka,Úkol zněl jasně Než se Avengeři a Strážci galaxie spojí napřesrok v ultimátní týmové sešlosti Avengers Infinity War je potřeba začít stírat plochy mezi usazenější a rozvernější částí komiksového vesmíru Marvelu Thor Ragnarok zdá se být ideální
18009,20170411,2017-04-11,Andrej Kiska,"1,000+",Slovenský prezident Andrej Kiska bude popáté otcem,Často dáváme ruku na maminčino bříško a s napětím čekáme koho z nás kopne napsal Kiska ke společné fotce s těhotnou manželkou A jestli víme zda to bude kluk nebo holka a jak se bude jmenovat Ano víme ale ještě to neprozradíme Držte nám
18010,20170411,2017-04-11,Audi Q8,"1,000+",Audi chystá dvě nová SUV Q4 a Q8 jejich rodištěm bude střední,V hlavním městě Slovenska má továrnu Volkswagen v tom druhém pak přímo Audi Právě luxusnější koncernová značka chystá pro nejbližší období SUV ofenzivu Do portfolia automobilky přibudou dva nové modely Q4 a Q8 Koncept toho většího jsme
18011,20170411,2017-04-11,Dortmund,"5,000+",Exploze zasáhly autobus fotbalistů Dortmundu Cílený útok tvrdí policie,Autobus fotbalistů Borussie Dortmund cestou na domácí zápas čtvrtfinále Ligy mistrů poškodily tři exploze výbušnin ukryté v křoví u silnice Hráči se měli v úterý večer v Signal Iduna Parku utkat s Monakem Krizový štáb ale rozhodl že se duel přesune
18012,20170411,2017-04-11,FC Barcelona,"2,000+",FC Barcelona  Juventus FC,Barcelona chtěla začít na hřišti soupeře mnohem lépe než proti Paris SaintGermain O co nejmenší příděl branek se proti domácím měli starat ter Stegen Piqué Roberto Umtiti a Mathieu Nechyběla samozřejmě ani legendární útočná trojka Messi Suárez a
18013,20170411,2017-04-11,FEJETON,"1,000+",FEJETON České prostitutky posílí naše vztahy s Němci,Všímám si už delší dobu toho jak se v Česku neustále nadává na co ta EU dává peníze Popravdě se tomu ani příliš nedivím Obvinění z nesprávného užívání evropských dotací by se dalo nalézt bezpočet Pár příkladů za všechny Zvedací most který se
18014,20170411,2017-04-11,Juventus,"1,000+",Juventusu se odplata povedla Barcelona je po debaklu znovu na,Odplata za dva roky starou finálovou tryznu se fotbalistům turínského Juventusu povedla dokonale V červnu roku 2015 prohráli v Berlíně s Barcelonou 13 a o trofej pro vítěze Ligy mistrů opět přišli v úterním prvním čtvrtfinále letošního ročníku ovšem
18015,20170411,2017-04-11,Juventus Barcelona,"2,000+",Juventusu se odplata povedla Barcelona je po debaklu znovu na,Odplata za dva roky starou finálovou tryznu se fotbalistům turínského Juventusu povedla dokonale V červnu roku 2015 prohráli v Berlíně s Barcelonou 13 a o trofej pro vítěze Ligy mistrů opět přišli v úterním prvním čtvrtfinále letošního ročníku ovšem
18016,20170411,2017-04-11,Liga mistrů,"1,000+",Odměna za bronzový úspěch Hradec Králové jde do Ligy mistrů,Sami tomu už pomoci nemohli ale vyšlo to Hokejový Hradec Králové je od nedělního večera kdy Liberec v extraligovém semifinále vyřadil Chomutov poprvé v historii účastníkem Ligy mistrů Do nové podoby soutěže v níž se bude od podzimu hrát vyrazí
18017,20170411,2017-04-11,Martin Valenta,"2,000+",Záhadná smrt v jilemnickém bazénu Zemřela hvězda sportovního,Máme smutnou povinnost oznámit freediverské komunitě že nás 9 dubna 2017 opustil skvělý kamarád a špičkový freediver Martin Valenta Martin patřil k největším talentům světového freedivingu píše se v oznámení Co přesně smrt nadějného sportovce
18018,20170411,2017-04-11,Mt Nábytek,"2,000+",MTnábytek je v insolvenci Největší eshop s nábytkem nezvládl,Největší český eshop s nábytkem a bytovými doplňky na sebe podal návrh na insolvenci Vyplývá z úterního podání v insolvenčním rejstříku MTnábytek který je i jedničkou na slovenském trhu provozuje brněnská firma Exiteria V loňském roce měl eshop
18019,20170411,2017-04-11,United Airlines,"5,000+",VIDEO Američan nechtěl uvolnit zaplacené místo v letadle surově,CHICAGOPRAHA Americká letecká společnost United Airlines zažívá skandál Ochranka vytáhla z letadla muže který se odmítl vzdát svého místa na palubě za které zaplatil Ochranka společně s policií muže násilně vyvlekla proti jeho vůli Stalo se tak
18020,20170411,2017-04-11,Zonky,"1,000+",Zonky míří do skupiny Home Credit Tvarůžkovou střídá Novák z,Startupový inkubátor CreativeDock po roce a půl ostrého provozu převedl půjčkovou platformu Zonky do skupiny Home Credit Novinkám to sdělil tiskový zástupce Zonky Radim Jung Současně se mění šéf projektu Lucii Tvarůžkovou vystřídá Pavel Novák z
18021,20170412,2017-04-12,Cermat 2017,"1,000+",Cermat měl v den písemných maturit výpadek Zkoušku to,Systém organizace Cermat do něhož střední školy nahrávají hotové maturitní slohovky studentů v úterý zkolaboval Někteří ředitelé škol tak práce mohli do systému nahrát až ve středu ráno Informaci televize Prima potvrdil iDNEScz mluvčí Cermatu Jan
18022,20170412,2017-04-12,Charlie Murphy,"2,000+",Eddie Murphy v slzách Zemřel mu starší brácha,Murphy se rovněž věnoval herectví a standup comedy Zatímco mladší brácha Eddie je ale hvězdou filmů o Policajtovi z Beverly Hills či originální hlas Oslíka ze Shreka zesnulý Charlie se příliš proslavit nestihl Objevil se například ve filmu Už jsme
18023,20170412,2017-04-12,Clay Adler,"2,000+",Fešák   27 z reality show spáchal sebevraždu Před přáteli se střelil,Clay Adler snil o hereckého kariéře ale významné role se bohužel nedočkal Upozornil na sebe v reality show Newport Harbor The Real Orange County a v televizním filmu The Fish Tank Atraktivní muž byl přesto zván na večírky kde se sblížil se
18024,20170412,2017-04-12,Jana Vopěnková,"1,000+",Pamatujete na ramlici od Schwarzenberga Bourala opilá v,V médiích ji proslavila přezdívka ramlice a údajný intimní vztah s čestným předsedou TOP 09 Karlem Schwarzenbergem 79 Teď má ale Jana Vopěnková 27 vážnější starosti Jak zjistil Blesk opilá zcizila známému auto bourala a teď jí hrozí soud
18025,20170412,2017-04-12,Lejla Abbasová,"1,000+",Lejla Abbasová je podruhé těhotná Dítě čeká s tureckým přítelem,Lejla Abbasová je momentálně v šestém měsíci Ona i partner miminko chtěli a řekli si že nemá cenu čekat Oba dva nejsme nejmladší akorát jsme nečekali že si to jeden den řekneme a za čtrnáct dní budu těhotná prohlásila Moderátorka která se s
18026,20170412,2017-04-12,Libuše Havelková,"2,000+",Pohřeb babičky z Kouzelné školky Havelkové 92 Rakev s,Maminku herce a zpěváka Ondřeje Havelky Libuši Havelkovou která byla představitelkou babičky Libušky z dětmi milované Kouzelné školky dlouhé roky pronásledovala Meniérova nemoc Nakonec zdravotním potížím podlehla ve velmi požehnaném věku
18027,20170412,2017-04-12,Přijímací Zkoušky 2017,"2,000+",Valachová zahájila první jednotné přijímačky školám přibyla,Ministryně školství Kateřina Valachová ve středu na Smíchovské střední průmyslové škole v Praze otevřením boxů se zadávací dokumentací symbolicky zahájila jednotné přijímací zkoušky na střední školy Po dvou letech pilotního testování se letos konají
18028,20170412,2017-04-12,zápřednice,"1,000+",Jedovatá zápřednice pokousala mladíka v Podsedicích,Jedovatá zápřednice pokousala mladíka v Podsedicích FOTOGALERIE Pořádný šok zažil na začátku týdne František Rauch z Podsedic na Lovosicku Když na zahradě rodinného domu opravoval auto a chtěl si do připraveného hadru utřít od oleje
18029,20170413,2017-04-13,Jude Law,"1,000+",Fantastická zvířata Jude Law obsazen jako mladý Brumbál,Slavnou postavu z kouzelnického světa v mládí ztvární herec Jude Law který se v druhém dílu tohoto spinoffu postaví proti svému úhlavnímu nepříteli Grindewaldovi jehož jste již minule mohli vidět v podání Johnnyho Deppa Autorka předlohy a
18030,20170413,2017-04-13,Lidl Otevírací Doba Velikonoce,"5,000+",Otevírací doba přes Velikonoce V pátek ještě lidé nakoupí v,Třeba Lidl ale o Velikonočním pondělí neotevíral ani před tím Chtěli jsme totiž umožnit našim zaměstnancům strávit sváteční chvíle se svými rodinami vysvětlila mluvčí Lidlu Zuzana Holá Kromě pondělí mají velké obchody přes prodloužený víkend
18031,20170413,2017-04-13,MOAB,"2,000+",Američané svrhli na IS Matku všech bomb Obrovskou GBU43 MOAB poprvé použili v boji,KANDAHÁRPRAHA V době vývoje to byla největší nejaderná bomba kterou kdo kdy vyrobil GBU43B Massive Ordnance Air Blast bomb MOAB nyní Američané poprvé použili v boji když ji svrhli ve východním Afghánistánu na teroristy Islámského státu
18032,20170413,2017-04-13,Slavia,"1,000+",O finále poháru budou hrát Slavia se Zlínem a Boleslav s Opavou,Praha  V semifinále domácího fotbalového poháru MOL Cupu se utkají Slavia Praha se Zlínem a obhájce trofeje Mladá Boleslav s druholigovou Opavou Rozhodl o tom dnešní los v Praze Semifinále které se odehraje opět jednokolově bude na programu
18033,20170413,2017-04-13,Velký pátek,"5,000+",Větší obchody přes Velikonoce zavřou jen v pondělí Velký pátek v,Běžně prodávat lze kromě Velkého pátku i 1 května 5 a 6 července nebo 17 listopadu Senátoři vedení Františkem Bublanem ČSSD kteří zákaz prosadili připouštějí že jde zatím o kompromis protože všechny svátky najednou by zřejmě neprošly
18034,20170413,2017-04-13,zelené pivo,"5,000+",Začínají Velikonoce Kam v Praze vyrazit na zelené pivo,Milovníci piva vítají Velikonoce jako příležitost dát si speciální půllitr v zelené barvě Bleskcz vybral podniky v Praze kam se rozhodně vyplatí zajít Již dvanáctým rokem připravuje na Zelený čtvrtek akci Starobrno které najdete v nejvíce hospodách
18035,20170413,2017-04-13,Špunti na vodě,"1,000+",Langmajer se chlubí zrzkou Liška málem nestihl pojmenovat dceru,premiéru i se svým přítelem A bylo vidět že si všichni tři rozumí Čermák má s expartnerkou Danielou Choděrovou kterou opustil kvůli mladší přítelkyni Veronice Mackové 23 dvě děti Dceru Hedviku a syna Bořivoje Oba potomky vzal na svou premiéru
18036,20170414,2017-04-14,Bílá sobota,"2,000+",Průvodce Velikonocemi co je Bílá sobota proč se koupe venku a,Průvodce Velikonocemi co je Bílá sobota proč se koupe venku a chodí klapači Velikonoce jsou nejvýznamnějším křesťanským svátkem po celém světě Je s nimi spojeno velké množství tradic z nichž některé mají své kořeny až v dobách pohanských
18037,20170414,2017-04-14,Eliška Bučková,"2,000+",Úsměv Elišky Bučkové odhalil chybějící zub Proč žije s dírou v puse,Na první pohled má Eliška Bučková dokonalý chrup ale když se rozesměje není tomu tak Vlevo nahoře jí chybí jeden zub Už rok a půl tam mám navrtaný šroub na který se nasadí nový zub Ale nejsem schopná si udělat čas a dojít k zubaři A to už mi
18038,20170414,2017-04-14,KLDR,"2,000+",Válka s KLDR je na spadnutí tvrdí Čína Korea hrozí že v případě,Podle Číny je třeba zastavit napětí kolem KLDR než dosáhne nezvratného a nezvladatelného stavu Do oblasti míří americká letadlová loď a s ohledem na americké nálety na Sýrii není pochyb o tom že nový americký prezident by neváhal sáhnout ani po
