index,dayId,date,name,traffic,newsTitle,newsSnippet
50695,20161129,2016-11-29,Chapecoense,"2,000+",Who are Brazils Chapecoense football club,A plane carrying Brazilian football club Chapecoense and an accompanying delegation of trainers and journalists crashed in Colombia on Tuesday on its way to Medellin A first division football club in Brazil the Chapecoense team was travelling to
50696,20161129,2016-11-29,Final Fantasy XV,"2,000+",Food and photos the simple things that connect you to Final Fantasy XV,Final Fantasy XVs world is a fantastical place filled with magicpowered robots flying cars towering monsters and powerful weapons locked away in ancient tombs But its also a game where you can sit by a campfire and slurp some instant ramen with
50697,20161129,2016-11-29,Louisa May Alcott,"500,000+",Louisa May Alcott on Little Women I grow tired of providing moral pap for,Louisa May Alcott whose 184th birthday is the subject of todays Google Doodle by all accounts did not enjoy writing Little Women Its her most famous  and least favorite  work I plod away though I dont enjoy this kind of thing Alcott
50698,20161129,2016-11-29,V for Vendetta,"2,000+",My 350 on Donald Trump on remembering November 8 2016,Reading Alan Moore and David Lloyds 1988 comic V for Vendetta  or watching James McTeigues adaptation on screen for the laziest  has perhaps never been more appropriate than today V for Vendetta tells the story of the fight by a mysterious
50699,20161130,2016-11-30,Aamir Khan,"2,000+",Aamir Khans Dangal Transformation Inspires Hilarious Memes On Twitter,By now youve probably seen the incredible transformation Aamir Khan underwent for his upcoming sports drama Dangal The 51yearold actor who plays the younger and older versions of wrestler Mahavir Singh Phogat first put on and then dropped nearly
50700,20161130,2016-11-30,Bonifacio Day,"10,000+",DOLE issues pay rules for Bonifacio Day,MANILA Philippines  Labor and Employment Secretary Silvestre Bello III advised employers to observe pay rules for the observance of Andres Bonifacio Day a regular holiday on November 30 I urge our private sector employers to observe the pay rules
50701,20161130,2016-11-30,Cheryl Cole,"10,000+",Cheryl Cole shows off baby bump with Liam Payne,Cheryls open display of her bump comes after weeks of disguising her figure on various TV shows and personal appearances In promotional pictures for her upcoming appearance on the genealogy show Who Do You Think You Are the star covered up in a
50702,20161130,2016-11-30,Elementalist Lux,"2,000+",League of Legends Latest News  Update Elementalist Lux Finally Released How,Lux can change into a total of ten elements in the game Keep in mind that players should pay attention to the small icon on top of the champions face during battle Depending on which branch of element starts and chooses the combination of previous
50703,20161130,2016-11-30,Jagdish Chandra Bose,"2,000+",Who Is Jagdish Chandra Bose Google Doodle Honors Indian Scientist,Google has often used its homepage Doodle to celebrate famous but perhaps lesser known figures from science and world history and Wednesday it stayed true to form by honoring scientist and pioneer Jagdish Chandra Bose on his 158th birthday Bose
50704,20161130,2016-11-30,Jung Il Woo,"10,000+",Jung Il Woo Enlisting In National Service Despite Cerebral Aneurysm,Following news of Jung Il Woo starting his mandatory national service in December it has been revealed that the actor has a cerebral aneurysm which is a weakened blood vessel wall that results in an enlarged artery Though only some people with
50705,20161130,2016-11-30,Nokia,"5,000+",Nokia VC arm invests in an app that tracks womens menstrual cycles in 20,Clue an app that tracks womens menstrual cycles and predicts when they may be in pain has raised 20 million led by the venture capital VC arm of Finnish network equipment maker Nokia Users can input details about their menstrual cycles then
50706,20161130,2016-11-30,Super Parental Guardians,"5,000+",Coco Martin and Vice Ganda Lets be positive this Christmas,MANILA Philippines  On this early evening encounter at a Resorts World Manila restaurant the cast and director of the new Star Cinema release The Super Parental Guardians are surprisingly positive about a lot of developments in local cinema
50707,20161130,2016-11-30,the visit,"2,000+",Man put bomb on bus during Queens visit,The Special Criminal Court has heard details of bomb threats and a bomb find on a bus from Ballina to Dublin during the visit of Queen Elizabeth to Ireland five years ago Donal Billings of St Bridgets Court Drumlish Co Longford was found guilty
50708,20161201,2016-12-01,Chapecoense players,"2,000+",Colombia plane crash Chapecoense players weep with family and fans during tribute,This is the heartbreaking moment footballers broke down in tears as they gathered with family and fans to remember teammates wiped out in a devastating plane crash in Colombia Grieving Chapecoense players huddled together in front of tens of thousands
50709,20161201,2016-12-01,Christmas,"5,000+",Bostons Christmas Tree Tradition Rooted In A Canadian Thank You,Bostons official 2016 Christmas tree like others that have come before it is a thank you gift for events a century ago in the Nova Scotias Canadian provinces coastal capital of Halifax On Dec 6 1917 a French ship the Mont Blanc was preparing
50710,20161201,2016-12-01,December,"5,000+",SpaceX eyes December 16th for first Falcon 9 launch since September explosion,SpaceX reportedly has a date for the first Falcon 9 rocket launch since Septembers launchpad explosion Iridium Communications Inc announced today that SpaceX plans to launch 10 small satellites into orbit for the company at 336PM ET on December
50711,20161201,2016-12-01,December Quotes,"10,000+",December 2016 Quotes 15 Sayings To Celebrate The Holiday Month,Thursday is the first day of December a month that holds the start of winter Christmas Hanukkah and New Years Eve Its a time for treats scarves and carols but if youre feeling sad about the end of summer dont stress Simply reading these
50712,20161201,2016-12-01,Karel Marquez,"2,000+",Karel Marquez marries fiance Sean Fariñas,MANILA  Actress Karel Marquez finally tied the knot with her fiancé Sean Fariñas at the Sanctuario de San Antonio Forbes Park in Makati on Thursday Marquez looked stunning in a white lace gown while Fariñas was dashing in a navy blue tuxedo
50713,20161201,2016-12-01,Legend Of The Blue Sea Episode 5 Eng Sub,"2,000+",Watch Legend Of The Blue Sea episode 6 live online Promo reveals shocking,The Legend Of The Blue Sea will be back with episode 6 this Thursday December 1 at 10 pm KST on SBS The sequel will be delving deeper into the love story of conman Heo Joonjae and his mermaid lover Shim Chung Episode 5 of the period drama
50714,20161201,2016-12-01,Victoria Secret Fashion Show 2016,"20,000+",Backstage the 2016 Victorias Secret Fashion Show,I followed the Victorias Secret Angels all the way to Paris to find out at the 2016 Victorias Secret Fashion Show From Grammywinning performances by The Weeknd Lady Gaga and Bruno Mars to jawdropping wings and bionic bodies the show is one of
50715,20161201,2016-12-01,terror alert level 3,"2,000+",PH on alert level 3 for possible terror attackPNP,Philippine National Police chief Director General Ronald Bato dela Rosa on Thursday said the entire country has been placed under terror alert level 3 a warning that a deadly terror attack is imminent within a short period of time Dela Rosa made
50716,20161202,2016-12-02,Irina Shayk,"2,000+",Irina Shayk Is Pregnant So Here Are DaddytoBe Bradley Coopers Thoughts on,E News was first to report last night that Coopers girlfriend Victorias Secret model Irina Shayk is pregnant with what will be the first child for both of themand judging by what weve heard so far from sources close to the couple the happy
50717,20161202,2016-12-02,John Legend Darkness And Light,"2,000+",John Legend  Darkness and Light review full of ideas,More focused than 2013s sprawling Love in the Future Legends fifth album is full of ideas without diluting his talent While the piano and towering vocal on power ballad I Know Better may feel familiar hes equally adept at throbbing club tunes
50718,20161202,2016-12-02,MAMA 2016,"10,000+",MAMA 2016 When And Where To Watch Live Stream For Mnet Asian Music Awards,The 2016 Mnet Asian Music Awards MAMA is set to air in just a few hours and award the biggest and most popular acts in Asia this year MAMA 2016 will feature performances from the top Kpop groups and solo artists this year which include EXO BTS
50719,20161202,2016-12-02,Mama 2016 Live Stream,"20,000+",Mnet Asian Music Awards 2016 live stream Where to watch MAMA online and,In just a few hours the winners of the one of the biggest Kpop music award show Mnet Asian Music Awards MAMA 2016 will be revealed live at the Hong Kongs AsiaWorldExpo The Mnet Asian Music Awards will take place live on December 2 in Hong
50720,20161204,2016-12-04,Boston Major,"2,000+",Boston Major  Group Stage Day 1  Groups A and B,The Boston Major is underway and Day 1 of the Group Stage has wrapped up It was a doozy too If youre just catching up and youre looking for the shorthand notes Ive got your back Group A Wings Gaming took on Malaysian hopefuls WarriorsGaming
50721,20161204,2016-12-04,Leni Robredo,"5,000+",Leni Robredo quits Duterte Cabinet,Vice President Leni Robredo is stepping down as chair of the Housing and Urban Development Coordinating Council HUDCC The decision was announced on Sunday night with Robredo to tender her resignation on Monday We had hoped this day
50722,20161204,2016-12-04,Maria Schneider,"2,000+",Last Tango in Paris director admits Maria Schneider butter rape rape was non,Last Tango in Paris director says Maria Schneider did not consent to butter rape scene Bernardo Bertolucci says he wanted Maria Schneider 19 to feel humiliation as a girl not an actress Alex Taylor By Alex Taylor December 4 2016 1152 GMT
50723,20161204,2016-12-04,Rosamund Pike,"2,000+",Rosamund Pike moved to tears by her new movie role,English actress Rosamund Pike has said she was moved to tears when she first saw pictures of the real life couple she and her costar David Oyelowo play in their new film A United Kingdom The film tells the story of how African Prince Seretse Khama
50724,20161204,2016-12-04,The Last of Us,"5,000+",The Last of Us 2 trailer Sony officially announce sequel to critically,Despite the Xbox 360 outselling thePlayStationn 3 many gamers were convinced late into the consoles lifespan to purchase Sonys machine for one very good reason The Last of Us Following two unlikely companions  Ellie and Joel  in a post
50725,20161205,2016-12-05,Chloe Moretz,"2,000+",Chloe Moretz reveals postbreakup makeover as she transforms herself with a,CHLOE Grace Moretz proved shes just like the rest of us when it comes to coping with a relationship split and has headed to the hairdressers in an attempt to heal her heartbreak The actress and Brooklyn Beckham called time on their love earlier this
50726,20161205,2016-12-05,Karel Marquez,"2,000+",WATCH Karel Marquez Sean Fariñas in romantic wedding video,MANILA Philippines  The wedding video of actress Karel Marquez and businessman Sean Fariñas was posted by Treehouse Story on Monday December 5  and its the stuff of wedding dreams In the video we get a glimpse of Karel and Seans heartfelt
50727,20161205,2016-12-05,The Mummy,"2,000+",Five things we learned from the first trailer for The Mummy,Universals classic monsters are all returning to the big screen and this time they will all be part of a single Marvelstyle shared universe  with stars such as Johnny Depp The Invisible Man Tom Cruise The Mummy and Javier Bardem Frankenstein
50728,20161206,2016-12-06,Klay Thompson,"5,000+",Warriors highlights Everything you need to know about Klay Thompsons 60,On Monday night history was made Klay Thompson became the first player in NBA history since the implementation of the shot clock to score more than 50 points in less than 30 minutes Thompson finished with a mindblowing 60 points in 29 minutes as
50729,20161206,2016-12-06,PTSD,"5,000+",Lady Gaga says she has PTSD after being raped at 19,US pop star Lady Gaga says she has been suffering from posttraumatic stress disorder PTSD since being raped at the age of 19 She revealed her mental illness during a visit to a homeless shelter for young LGBT people last month In a TV interview
50730,20161206,2016-12-06,Transformers The Last Knight,"2,000+",In the first Transformers The Last Knight trailer Optimus Prime goes rogue,Whether you want it or not the next Transformers movie Transformers The Last Knight is well on its way and we just got our first trailer Here Sir Anthony Hopkins now free from his duties on Westworld introduces us to the idea that the race of
50731,20161208,2016-12-08,Boston Major,"5,000+",Evil Geniuses get redemption at Boston Major,On the first day of the Boston Major eight teams fought for their metaphorical lives in Bostons Wang Theatre After a heated group stage filled with upsets and surprises Wednesdays elimination matches were set to be dramatic with rivalries and
50732,20161208,2016-12-08,December 8,"2,000+",Looking back December 8 2016,Dec 8 1991  Five times a day Wendy Dais clips a leash on her dog opens her apartment door creeps outside on her hands and knees and slides bellyfirst down the six wooden steps of her apartment complex Dragging her paralyzed legs behind her
50733,20161208,2016-12-08,Kristen Stewart,"2,000+",Kristen Stewart and St Vincent Are Working on a Movie Together,Kristen Stewart and St Vincent née Annie Clarkallaround Cool Girls and one of this years hottest coupleshave teamed up for an upcoming film The project Come Swim was selected to premiere under the shorts program at the 2017 Sundance Film
50734,20161208,2016-12-08,plunder,"2,000+",SC junks Bong Revillas plea in connection with plunder suit,MANILA Philippines  The Supreme Court on Wednesday dismissed the petition of detained former senator Ramon Bong Revilla Jr and four others including alleged pork barrel scam mastermind Janet Lim Napoles in connection with the plunder charges
50735,20161209,2016-12-09,Chloe Grace Moretz,"5,000+",Chloe Grace Moretz surprised by viral Filipina lookalike,Philippines  After photos of young Filipina tagged by netizens as Filipinaversion of Chloe Grace Moretz went viral the Hollywood actress herself recognized her lookalike In a series of tweets Chloe was surprised to see a Filipina who
50736,20161209,2016-12-09,December 12 2016 Holiday,"2,000+",EidelMaulud FG Declares Monday Dec 12 Public Holiday,The federal government has declared Monday Dec 12  as public holiday to mark the EidelMaulud celebration The Minister of Interior Lt Gen AbdulrahmanDambazau rtd made the declaration on behalf of the federal government yesterday in Abuja
50737,20161209,2016-12-09,Fifty Shades Darker,"2,000+",Zayn Malik and Taylor Swift release surprise duet for Fifty Shades Darker,Taylor Swift and former One Direction member Zayn Malik have redeemed 2016 for their fans releasing a surprise new song together for the soundtrack to Fifty Shades Darker I Dont Wanna Live Forever unexpectedly appeared in the US iTunes Store just
50738,20161209,2016-12-09,I Don T Wanna Live Forever,"2,000+",Taylor Swift and Zayn surprisedrop new collaboration I Dont Wanna Live,The Fifty Shades Darker films release may be two months away but a bombshell about its soundtrack has just dropped Taylor Swift and Zayn Malik have collaborated on a new song called I Dont Wanna Live Forever Fifty Shades Darker which went for
50739,20161209,2016-12-09,Kaye Abad Wedding,"10,000+",IN PHOTOS Paul Jake Castillo Kaye Abad wed in Cebu,NEWLYWEDS Paul Jake Castillo and Kaye Abad wed in Cebu on December 9 Screengrab from Instagramthejasonabalos MANILA Philippines  Kaye Abad and Paul Jake Castillo are married The couple got married on Friday Decmber 9 in Cebu and
50740,20161209,2016-12-09,PTSD,"5,000+",Sad ending for Iraq War vet who shed light on PTSD,For many whove been through war the battles continue long after the guns go silent Through the years weve come to know a veteran who owed his life to his best friend Luis Carlos Montalvan and Tuesday his Golden Retriever service dog have been
50741,20161209,2016-12-09,PewDiePie,"2,000+",PewDiePie Says Hes Deleting His YouTube Channel Tomorrow,A few days ago PewDiePie made an ominous promise once he reached 50 million subscribers on his YouTube channel he said he was going to delete it And today he hit 50 million subscribers On Twitter now hes doubling down on his promise saying
50742,20161209,2016-12-09,Spider Man Homecoming,"5,000+",Watch the first SpiderMan Homecoming trailer,The first trailer for Marvels SpiderMan Homecoming debuted on Jimmy Kimmel Live giving us a clear look at how well leading man Tom Holland can handle himself in the ol red and blue pajamas The trailer follows SpiderMan as he interrupts a bank
50743,20161209,2016-12-09,amber,"2,000+",Once in a lifetime find Dinosaur tail discovered trapped in amber,The tail of a 99million year old dinosaur has been found entombed in amber an unprecedented discovery that has blown away scientists Xing Lida a Chinese paleontologist found the specimen the size of a dried apricot at an amber market in northern
50744,20161210,2016-12-10,Haikyuu Season 3 Episode 10,"10,000+",Haikyuu Season 3 Episode 10 Finale Recap Karasuno Beats Shiratorizawa,Haikyuu Season 3 Episode 10 which is the final episode titled The Volleyball Idiots just aired Find out how Karasuno won and what happens next to the team CreditTheNarutoOPYouTube Haikyuu Season 3 has just aired its 10th and the final
50745,20161210,2016-12-10,John Glenn,"2,000+",Postscript John Glenn 19212016,John Glenn radioed from the threshold of outer space Do you have a reason The date was February 20 1962 and the fortyyearold Glennthen circling Earth at more than seventeen thousand miles per hour in Friendship 7 a capsule about the size of
50746,20161210,2016-12-10,Louis Tomlinson,"5,000+",Louis Tomlinsons ex Briana Jungwirth shares heartfelt tribute to his mum Johannah,Meanwhile Cheryl has reached out to Louis Tomlinson with a touching message following his mother death Taking to Twitter on Friday after the news was released the pop star  who is expecting a baby with Louis One Direction bandmate  wrote My
50747,20161210,2016-12-10,Pinoy Boyband Superstar Vote,"20,000+",Niel Murillo is first Pinoy Boyband Superstar winner,MANILA  Niel Murillo a 17yearold boy from Cebu is the first winner of Pinoy Boyband Superstar the talent show announced Saturday night Murillo received the highest combined scores culled from the judges ratings and the number of text votes
50748,20161210,2016-12-10,Zendaya,"2,000+",Zendaya Reveals Why She Became a Vegetarian Its Definitely Not Because I,Zendaya is explaining why she chose to eliminate meat from her diet My main reason for being a vegetarian is that Im an animal lover  definitely NOT because I love vegetables the singer and actress 20 shared on her app Zendaya said she
50749,20161211,2016-12-11,Ad Finem,"2,000+",OG defeats Ad Finem at Boston Major for its third Major title,Underdog Ad Finem of Greece meanwhile would face its greatest challenge yet in Digital Chaos a team that was yetundefeated in the playoffs Ad Finems draft in Game 1 took quick aggression to DC though with Omar Madara Dabachachs Lifestealer
50750,20161211,2016-12-11,Finland,"2,000+",Stunning Northern Lights display over Finland,can be closed by pressing the Escape key or activating the close button Environment Dec 11 2016 Tourists just south of the Arctic Circle were treated to a spectacular display as the Northern Lights lit up the night sky in Rovaniemi Finland on
50751,20161211,2016-12-11,UFC 206,"2,000+",UFC 206 Results And Bonuses Biggest Winners And Losers From Toronto Card,TORONTO ON  DECEMBER 10 Max Holloway of the United States defeats Anthony Pettis of the United States for the Interim Featherweight Title during the UFC 206 event at Air Canada Centre on December 10 2016 in Toronto Canada Photo by Vaughn
50752,20161212,2016-12-12,December Supermoon,"5,000+",When is Decembers supermoon and how can you see it,If you look up to the sky tomorrow night you are likely to see a rather huge spectacle The final supermoon of 2016 will grace the nights sky on Tuesday December 13 into Wednesday December 14 Providing the weather is clear it is sure to be quite
50753,20161212,2016-12-12,Dota 2 700,"20,000+",Embracing The Change Initial impressions on Dota 2 700,I love the changes brought by Dota 2s 700 patch Thats not to say of course that the changes will be good or that they will be healthy Well need hours and hours of the entire community playing and testing things out multiple tournaments and weeks
50754,20161212,2016-12-12,Fast and Furious 8,"2,000+",Fast  Furious 8 trailer review a reassuring obscene platter of murder,The official title of Fast  Furious 8 is actually The Fate of the Furious possibly because they held a competition to name it and the only entry they received was this one and they felt ethically bound to go with it even though its such a truly
50755,20161212,2016-12-12,Terrence Romeo,"2,000+",Terrence Romeo shoots GlobalPort past Ginebra,Terrence Romeo fired 35 points to lead GlobalPort to a huge bounce back win at the expense of Barangay Ginebra 9184 Sunday in the 2017 PBA Philippine Cup at Smart Araneta Coliseum Catching fire late the super scorer uncorked 15 of his
50756,20161213,2016-12-13,Aleppo,"2,000+",Aleppo People want safe passage,In 2012 rebels pushed to take Aleppo once Syrias largest city and commercial capital in the hope of turning it into a rival capital to Damascus and using it as a base to expand opposition control Instead the city had been roughly divided into two
50757,20161213,2016-12-13,BIGBANG,"2,000+",BIGBANG Releases MADE How To Listen To KPop Bands New Album Watch Latest,Kpop band BIGBANG released its third Korean studio album and fifth Japanese studio album MADE on Monday almost 10 years after the group got together The full album marked BIGBANGs comeback following a threeyear hiatus and their first Korean
50758,20161213,2016-12-13,Taylor Swift,"5,000+",Zayn Malik and Taylor Swift team up for some 50 Shades Darker action,Lets see the year out with an unlikely collaboration Zayn and Taylor teaming up for the 50 Shades Darker soundtrack For such a moody and sultry movie this track is weirdly reserved Instead of sweeping passion theres an disconnect  as Taylor
50759,20161213,2016-12-13,Weather Update,"5,000+",Weather Update Rain forecast for Eastern Cape Free State KZN,Cape Town  The South Africa Weather Service has issued an alert for severe thunderstorms expected over the eastern interior of the Eastern Cape and the southeastern parts of the Free State on Tuesday 13 December A 60 chance of rain can be
50760,20161213,2016-12-13,weather forecast,"2,000+",Ottawa weather forecast calls for more snow Tuesday afternoon,Its pretty official now with less than two weeks to go that were having a white Christmas in Ottawa Gatineau and the surrounding area More than 20 centimetres of snow fell in Ottawa with 26 falling in nearby Dunrobin from Sunday afternoon to
50761,20161214,2016-12-14,Alan Thicke,"5,000+",Sitcom dad Alan Thicke dies at 69,Actor Alan Thicke arrives at the 2008 premiere of National Lampoon Presents One Two Many in Los Angeles Alan Thicke the star of the popular 1980s sitcom Growing Pains died Tuesday after reportedly suffering a heart attack while playing hockey
50762,20161214,2016-12-14,Bruno Mars,"2,000+",Watch Bruno Mars Sing Elvis Talk Spanx on Carpool,Bruno Mars helped James Corden get to work last night in the Late Late Show hosts Carpool Karaoke The duo sang a over a dozen Mars songs  24K Magic Locked Out of Heaven Grenade Versace on the Floor If I Knew Uptown Funk and
50763,20161214,2016-12-14,CNN Philippines,"2,000+",Alaska completes comefrombehind victory over Meralco 8179,Metro Manila CNN Philippines  The Alaska Aces grinded out a hardearned win against the Meralco Bolts 8179 on Wednesday evening at the SmartAraneta Coliseum Vic Manuel posted a doubledouble performance with 22 points and 10 rebounds for
50764,20161214,2016-12-14,Camille Guide,"2,000+",Camille Build Guide to Best Runes Masteries Items,Our Camille build guide follows her release just a couple of days ago Here are the best runes masteries and items for the new League of Legends champion While the following Camille build guide caters to the top lane the same suggestions should
50765,20161214,2016-12-14,December 26 2016 Holiday,"20,000+",Palace declares Dec 26 Jan 2 as special nonworking holidays,Malacañang has declared Dec 26 2016 and January 2 2017 as special nonworking days in the country to give the people full opportunity to celebrate the holidays with their families and loved ones The declaration was made through Proclamation No
50766,20161214,2016-12-14,First expedition to the South Pole,"2,000+",First expedition to the South Pole Five facts you may not know about Roald,But he would go on to become a hero in his home country at the height of a British empire that was convinced that it was Scotts right to become the first person at the South Pole Many were unable to accept that loss and Scott became a hero that
50767,20161214,2016-12-14,Jackie Chan,"5,000+",Jackie Chan Disha Patani and Sonu Sood in Kung Fu Yogagroup hug check photo,Jackie Chan Disha Patani and Soonu Sood the cast of the multicultural flick Kung Fu Yoga seem to be really close if the latest pic of them getting in on a group hug is anything to go by The heartwarming photo show Jackie beaming from ear to ear as
