index,dayId,date,name,traffic,newsTitle,newsSnippet
48807,20170324,2017-03-24,Cynthia Osokogu,"2,000+",5 years after 2 to die over Cynthia Osokogus killing,A Lagos State high court in Igbosere yesterday sentenced Okwumo Nwabufo and Olisaeloka Ezike to death by hanging for killing Cynthia Osokogu who they lured from Nasarawa State to Lagos before strangling her to death at a hotel in Festac Town Lagos
48808,20170326,2017-03-26,Mother S Day,"5,000+",A Memorable Mothers Day,The first thing that is ideal for your mother on mothers day is not to send a message but actually make a celebratory call Express how good your mother has been to you and wish her well all the good things in life If it has been a while you spoke
48809,20170326,2017-03-26,Mothers Day Messages,"2,000+",Grieving mum remembers son lost to brain tumour in heartbreaking Mothers Day,Jackie opened his birthday cards he never got the chance to read and has now brought out the Mothers Day cards Scott sent her in previous years And at this poignant time of year she is sending out a heartfelt message to parents asking them to tell
48810,20170326,2017-03-26,mothers day,"5,000+",Furious Moonpig and Interflora customers slam firms for delivering wilting,FURIOUS customers have slammed gift companies for delivering wilting Mothers Day flowers in broken packaging  as others claim theirs wont arrive until tomorrow Moonpig and Interflora were among those criticised for sending dead flowers
48811,20170327,2017-03-27,Jamb Profile,"2,000+",JAMBs registration Candidates lament poor internet services in Ekiti,The candidates told the journalists in Ado Ekiti said that since the registration started on March 20 they have not been able to log into the JAMBs website They said that after each candidate had paid N6 200 for the examination form to the bank
48812,20170328,2017-03-28,Dino Melaye,"5,000+",How Dino Melaye celebrated exoneration from certificate scandal on academic,The Senator representing Kogi West at the 8th Senate Dino Melaye on Tuesday made a dramatic appearance at the plenary by wearing full academic gown of an institution This is coming on the heels of the open investigation into certificate scandal
48813,20170329,2017-03-29,Samsung Galaxy S8,"2,000+",Samsung launches the Galaxy S8 with its own Apple Siri rival called Bixby,Samsung unveiled the Galaxy S8 on Wednesday its latest flagship smartphone boasting a new voice assistant and larger display as the technology titan looks to steal a march on Apple and regain ground after the embarrassing Note 7 saga The device
48814,20170330,2017-03-30,Kemi Olunloyo,"2,000+",Kemi Olunloyo granted bail,A Magistrates court in Port Harcourt today granted bail to popular blogger Kemi Omolulu Olonloyo and Samuel Walson publisher of a local tabloid in Port Harcourt Rivers State The two publishers are facing four count charges of publishing
48815,20170331,2017-03-31,Data Processing,"2,000+",NetworkNewsWire Announces Publication on Solutions for the Health Care,The publication is entitled Health Care Industry in Need of Unitary Data Processing Solution over Existing Legacy Systems It provides an overview of issues with the health care industrys existing approach to data and the need for an overarching
48816,20170331,2017-03-31,Ibadan,"2,000+",Chilling Story of Ritual Killing in Ibadan,Scores of people who thronged the Oyo State police headquarters Eleyele Ibadan to catch a glimpse of four suspected ritualists could not hold back their tears as one of the suspects Tunde Jimoh gave a chilling description of how they tricked their
48817,20170331,2017-03-31,Meningitis,"2,000+",Meningitis NCDC confirms 109 deaths in 5 states as cases hit 1966,He also said there was an interagency response supporting the states to contain the outbreak through the primary mode of vaccination However Ihekweazu explained that a new strand of meningitis called Stereotype C has emerged in place of the previous
48818,20170331,2017-03-31,Nigerian Airforce,"2,000+",Air force now free of corrupt practicesGovernor Bello,He spoke on Thursday in Jos Plateau State at the closing ceremony of the Nigerian Air Force Second Inter Command Combat Sports Competition Jos 2017 He lamented that indiscipline and corruption nearly drowned the Air Force stating that the Air
48819,20170331,2017-03-31,Wizkid Ft Drake Come Closer,"2,000+",Wizkid Officially Releases Come Closer Featuring Drake,It first leaked back in Januaryat the time it was called Hush Up the Silence Wizkid teased that track again in February during an episode of OVO Sound Radio and earlier this week he took to Instagram to hint atwhat looked likea possible music
48820,20170401,2017-04-01,April Fool,"2,000+",Pornhub April Fools Day prank tricks visitors into thinking theyve shared,BritMetalQueen wrote Pornhubs April Fools joke is all kinds of messed up but I commend it While TheLastOfUsJoel said Pornhub definitely had the best april fools joke today masonjackson194 said Almost had a heart attack after seeing the
48821,20170401,2017-04-01,April Fool Message,"2,000+",Pornhub wins the award for scariest April Fools Day prank of all time,Pornhub known for being good sports were not about to let April Fools Day pass them by without catching out their users in a bit of light ribbed ribbing When users clicked on a video on the site they were greeted with this message although were
48822,20170401,2017-04-01,Chelsea Vs Crystal Palace,"5,000+",Chelsea team news Injuries suspensions and lineup vs Crystal Palace,Chelsea can take two significant steps towards the Premier League title over the course of the next week with backtoback home matches against Crystal Palace and Manchester City Antonio Contes men are 10 points clear at the top of the table and go
48823,20170401,2017-04-01,EPL,"5,000+",EPL Review Chelsea suffer shock defeat as Ndidi scores wonder goal,The fine run of Chelsea Football Club in the English Premier League was halted on Saturday as relegation battlers Crystal Palace handed them a shock 21 defeat at Stamford Bridge The development has seen the Blues lead at the top of the Premier
48824,20170401,2017-04-01,Epl Live Scores,"2,000+",Man Utd v West Brom EPL LIVE score,JOE BERNSTEIN Manchester United slumped to their eighth draw in 15 Premier League games at Old Trafford this season as their patchedup team failed to overcome dogged resistance from West Brom Albion came closest to scoring when Darren Fletcher
48825,20170401,2017-04-01,Laliga,"2,000+",Zifa  La Liga join forces,Antonio Barradas who is La Ligas representative in Africa signed the deal with Zifa president Philip Chiyangwa in Harare that will see among other things Zifa benefit through the football exchange programme grassroots development train the
48826,20170401,2017-04-01,Manchester United,"2,000+",You think thats a question  Mourinho in spiky mood after Man Utd draw,Jose Mourinhos frustrations appeared to get the better of him as he delivered a withering response in an interview following Manchester Uniteds 00 draw with West Brom United were held at Old Trafford for the eighth time in 15 Premier League games
48827,20170401,2017-04-01,Premier League,"10,000+",Fabregas loses faultless Premier League record in Chelsea defeat,Cesc Fabregas found himself on the losing side in a Premier League fixture in which he has scored for the first time as Chelsea came unstuck against Crystal Palace The Spain international had previously netted in 42 English topflight games without
48828,20170401,2017-04-01,SuperSport,"2,000+",Matlakala fires Baroka past SuperSport,Johannesburg  Supersport United were dealt a shock defeat at the hands of Baroka with a 10 loss in their Premiership clash at the Mbombela Stadium on Saturday afternoon After a goalless firsthalf striker Maboke Matlakala broke the deadlock with a
48829,20170402,2017-04-02,Barcelona,"5,000+",Granada 14 Barcelona LIVE score and goal updates from La Liga clash,Barcelona need three points to stay on the coattails of Real Madrid as they travel to strugglers Granada in La Liga Real beat Alaves 30 earlier on Sunday to stretch their lead at the top of La Liga to five points and they will have a game in hand
48830,20170402,2017-04-02,Premier League standings,"2,000+",Lautoka tops Premier League standings after beating Rewa,The Lautoka soccer team is now leading the Vodafone Premier League standings with 9 points after they beat Rewa 10 yesterday Both teams were locked nilall at the half time Lautoka substitute Sakauve Finau scored the lone goal in the second half
48831,20170402,2017-04-02,WrestleMania 33,"2,000+",WrestleMania 33 5 Possible Surprise Appearances During Show of Shows,With WWE WrestleMania 33 receiving so much hype heading in the event is bound to be a blockbuster and full of fun matches and moments That said fans have high hopes and the show will need to deliver in order to live up to the lofty expectations
48832,20170402,2017-04-02,meningitis,"2,000+",41 people die of meningitis in Sokoto  Health Commissioner,The death toll as a result of the meningitis epidemic in Sokoto State has now risen to 41 Health Commissioner Balarabe Kakale has said Mr Kakale disclosed this to journalists in Sokoto on Sunday when he gave an update on the state of high alert
48833,20170403,2017-04-03,13 Reasons Why,"2,000+",Did 13 Reasons Why Tease A Season 2,But though Clay and Tony Christian Navarro quite literally drove off into the sunset at the end of season 1 of 13 Reasons Why not all is well at Liberty High School Someone plans to cause devastating destruction and much like Hannahs suicide we
48834,20170403,2017-04-03,John Cena,"2,000+",Watch John Cena Propose to Nikki Bella at WrestleMania 33,John Cenas relationship with his girlfriend Nikki Bella was put under the spotlight once again in the leadup to Wrestlemania 33 Prior to their mixed tagteam match The Miz said Cena was jealous of his relationship with Maryse and Maryse said Bella
48835,20170403,2017-04-03,autism,"2,000+",Photographer changes face of autism,Over the past few years Girardin has been building a reputation as a goto photographer of children with autism Im curious about who they are and what makes them tick she says No surprises in Girardins studio Im coming closer she informs
48836,20170404,2017-04-04,Funke Akindele,"2,000+",Photo Of The Day Funke Akindele and her king,Today is JJC Skillz birthday and in celebration of his day wife Funke Akindele shared this photo Calling him her King Funke was full of praises for her husband of eight months She wrote If I had to do it all again baby it will be with you happy
48837,20170404,2017-04-04,Manchester United,"5,000+",Ibrahimovics Man United future not reliant on Champions League spot,United lie fifth in the Premier League ahead of Ibrahimovics return from a threegame domestic ban against Everton on Tuesday and will face Anderlecht in the quarterfinals of the Europa League later this month Lifting that trophy or a topfour
48838,20170405,2017-04-05,Chelsea vs Man City,"10,000+",Chelsea vs Man City Kurt Zouma handed rare start by Antonio Conte,Kurt Zouma has been handed a rare start for Chelseas clash with Manchester City at Stamford Bridge The 22yearold starts a Premier League game for the first time this season and forms part of Antonio Contes threeman defence alongside Gary Cahill
48839,20170405,2017-04-05,EPL,"5,000+",EPL We scored two legal goals  Mourinho reacts to Ibrahimovichs offside goal,Manchester United manager Jose Mourinho said while he is not angry with the assistant referee for adjudging Zlatan Ibrahimovichs decisive equalizer against Everton on Tuesday night as offside goal the replays should have been used to judge if the
48840,20170405,2017-04-05,Epl Results,"2,000+",EPL game week 31 Roundup and results,Here are the results from EPL game week 31 Watford 20 West Bromwich Albion Burnley FC 10 Stoke City Leicester City 20 Sunderland Manchester United 11 Everton Thursday April 6 Swansea City Vs Tottenham Hotspur Arsenal Vs West Ham United
48841,20170405,2017-04-05,Epl Table 2017,"2,000+",Manchester United fixtures for 2017 Premier League and the Europa League,depending on TV scheduling and Uniteds progression in cup competitions but here is a full list of current United fixtures for the 201617 season The club has also announced that season ticket prices for 201718 will be the same price as they
48842,20170405,2017-04-05,FC Barcelona,"2,000+",FC Barcelona news Luis Suarez scores overhead kick,Lionel Messi and Luis Suarez destroyed Sevilla in eight deadly firsthalf minutes in Barcelonas 30 win over Jorge Sampaolis side on Wednesday With a little help from the third amigo Neymar they put the game beyond doubt inside the first 33 minutes
48843,20170405,2017-04-05,Modupe Oyekunle,"2,000+",Nollywood actress Modupe Oyekunle dies after childbirth,Fast rising Nollywood actress Modupe Oyekunle died Tuesday after giving birth to her third child a baby girl Her baby survived Popularly called Oyinbo because of her complexion Modupe gave birth to her baby before giving up the ghost She played
48844,20170405,2017-04-05,Premier League table,"20,000+",Where would YOUR team be without their top scorer Premier League table if,Chelsea are on course for the Premier League title but without Costas 17 goals they would be 12 points worse off  and in second So who would capitalise and take top spot Get excited Liverpool fans  you would be heading for the Premier League title
48845,20170405,2017-04-05,Prison Break season 5,"5,000+",When does Prison Break season 5 start Irish release date TV channel and all,That means  spoiler alert  Michael played by Wentworth Miller  is alive and has been since the last season ended despite what fans were shown Fans had questioned in the past whether the show would pull a Dallas and pretend Michaels death was fake
48846,20170405,2017-04-05,meningitis,"10,000+",Medical practitioner gives preventive tips on meningitis,Meningitis typically begins with headache nausea and vomiting stiff neck chills and fever As the disease progresses the patient becomes less rational decrease the level of consciousness and lapses into coma he said Ibrahim noted that
48847,20170406,2017-04-06,Armed Forces,"2,000+",Wasps to sign Armed Forces Covenant this Sunday,The club will officially pledge its support to the British Armed Forces at halftime in the game against Northampton Saints this Sunday April 9 kick off 3pm In Wasps annual Stinger fixture deputy chairman Nick Eastwood will join Lieutenant
48848,20170406,2017-04-06,Arsenal Vs West Ham,"2,000+",Why it would be wrong if West Ham sack Slaven Bilic  the owners need to get,Five defeats in a row some truly terrible performances and a tendency to collapse certainly dont back up my case or his but hear me out Last year the Croatian led West Ham into the Europa League they finished just four points behind fourth place
48849,20170406,2017-04-06,Civil Societies,"2,000+",Civil Society groups condemn attempts to kill the legislature,By   Publish Date Apr 6 2017 756PMA group of civil society organisations on Thursday marched against an attempt to kill the legislature while urging Nigerians to rise up in defence of democracy and condemn the latest affront against the National
48850,20170406,2017-04-06,Free Press,"5,000+",Detroit Free Press marathon runner of week Kathleen Smith,Each week the Detroit Free PressChemical Bank Marathon chooses a runner to spotlight Whether youre training for a full marathon going out on the weekend for a long run or getting back into the swing of running the race loves to showcase its runners
48851,20170406,2017-04-06,La Liga,"2,000+",La Liga Results 2017 Scores and Updated Table After Wednesdays Week 30 Matches,A muchchanged Real Madrid stayed top of La Liga after beating Leganes 42 at the Estadio Municipal de Butarque on Wednesday Bitter rivals Barcelona had temporarily leapfrogged Los Blancos into first place earlier in the day after beating Sevilla 30
48852,20170406,2017-04-06,Nigerian National Anthem,"2,000+",Big Brother Naija Nigerians blast Tboss for failing to recite National Anthem,The inability of Tboss to recite the National Anthem on Wednesday has generated mixed reactions As the housemates in the ongoing Big Brother Naija show lounged around Debierise asked Tboss to sing Nigerias national anthem but she failed to get
48853,20170406,2017-04-06,constitution,"2,000+",Thai king endorses new constitution 20th since 1932,Thailands King Maha Vajiralongkorn endorsed the countrys new constitution on Thursday an essential step towards holding an election to restore democracy after the 2014 coup detat The constitution is the nations 20th since the absolute monarchy
48854,20170407,2017-04-07,JAMB mock,"2,000+",UTME 2017 7 vital things candidates need to know about JAMB mock examination,The Joint Admissions and Matriculation Board JAMB will be conducting a mock examination for candidates that registered for the 2017 computer based Unified Tertiary Matriculations Examinations UTME on Saturday April 8 The aim of the mock
48855,20170407,2017-04-07,Syria,"2,000+",How Is The Rest Of The World Reacting To The US Strike On Syria,Hours after President Trump ordered a missile strike on a Syrian air base responses from the rest of the world are beginning to stack up The US military operation which fired 59 Tomahawk missiles at the Shayrat air base was conducted in
48856,20170408,2017-04-08,Barcelona,"5,000+",Neymars straight red and a clear penalty  Barcelonas title hopes dashed by,Barcelonas Liga title hopes were left in tatters after a shock 20 loss to Malaga that was marred by a number of terrible calls by the match officials The Blaugranas primary gripe came with the referees decision to dismiss Neymar for a late
48857,20170408,2017-04-08,Chelsea vs Bournemouth,"2,000+",Bournemouth 13 Chelsea Blues reinstate sevenpoint gap in Premier League,It was an even start but Chelsea took the advantage in the 17th minute A ball forward from David Luiz picked out Moses on the right and his cross reached Diego Costa who sliced his attempted shot But it nestled into the back of the net after being
48858,20170408,2017-04-08,La Liga Table,"20,000+",This is how the Premier League table would look if only 2017 results counted,Chelsea continue to lead the Premier League title race having racked up a whopping 72 points so far this season While down at the other end of the table Sunderland continue to dice with relegation alongside Middlesbrough and Swansea However would
48859,20170408,2017-04-08,Laliga,"10,000+",Real Madrid 11 Atlético Madrid La Liga  as it happened,Real Madrid 11 Atlético Madrid La Liga  as it happened Antoine Griezmanns goal five minutes from time earns Atlético a point and gives Barcelona hope in the title race Follow Bournemouth v Chelsea live here with Simon Burnton Updated 4h ago
48860,20170409,2017-04-09,BBNaija,"10,000+",4 potent reasons why Bisola might win BBNaija 2017,The BBNaija 2017 is not the first reality TV show which Bisola has been a part of MTN project fame She finished in the final 5 on that music show and here she is again with all the experience and the fans who know her from way back voting to see
48861,20170409,2017-04-09,Janet Jackson,"2,000+",Inside the marriage of fiercely private Janet Jackson and Wissam Al Mana,After the news that Janet Jackson and husband Wissam Al Mana are splitting after five years of marriage we look at the lives of the superstar couple  from them meeting to their marriage and the birth of the son  before them eventually parting ways
48862,20170409,2017-04-09,Manchester United,"5,000+",Manchester United cruise to victory at Sunderland,LONDON  Manchester United put a spate of recent draws behind them to boost their topfour hopes with a routine 30 victory at bottom club Sunderland to move fifth in the Premier League on Sunday Once again it was veteran Swede Zlatan Ibrahimovic who
48863,20170409,2017-04-09,Palm Sunday,"5,000+",ISIS Claims Responsibility for Egypts Palm Sunday Church Bombings 43 People,ISIS claimed responsibility for bombings that killed 43 at two Coptic churches in Egypt on Palm Sunday  brazen strikes against a vulnerable minority on one of the most important days on the Christian calendar Aftermath images after a powerful
48864,20170409,2017-04-09,Payporte,"5,000+",BBNaija Day 76 Housemates Get A Visit From The CEO Of Payporte,The BBNaija Housemates were informed by Biggie in an unusual step to prepare for the visit of the CEO of Payporte Mr Eyo Bassey The BBNaija Housemates had spent a greater part of the day conceptualizing their radio play for their meningitis
48865,20170409,2017-04-09,TBoss,"2,000+",2017 BBFinale TBoss Debbie Rise Marvis to shock Nigeria,TBoss has been up for eviction a record 7 times and still was never evicted she cried and cried like a child but somehow all her travails seem to have made her stronger At the last eviction show when Bally was evicted it became clear that the
48866,20170409,2017-04-09,big brother naija 2017,"20,000+",Breaking Efe is the winner of big brother naija 2017,The Big Brother Naija reality show has finally come to an end after 77 days and five Housemates surviving to the last day and the winner of Big Brother Naija 2017 is Efe Big Brother Naija 2017 last contestants The race for victory was between
48867,20170410,2017-04-10,Agbani Darego,"2,000+",Agbani Darego marries TY Danjumas son in Morocco,Agbani helms her eponymous readytowear denim and leisurewear fashion company AD by Agbani Darego which she launched in 2010 According to media reports little is known of her husband Ishaya except for his active involvement in his family
48868,20170410,2017-04-10,Arsenal Fc,"2,000+",Arsenal FC news Alisher Usmanov says Arsene Wenger should help handpick the,Arsene Wenger should have his say on the person who will replace him as Arsenal manager according to the clubs secondlargest shareholder Russian billionaire Alisher Usmanov has hit out at owner Stan Kroenke in mounting a defence of manager
48869,20170410,2017-04-10,Bbn Winner,"2,000+",Efe Ejeba Wins 2017 Big Brother Nigeria,For projecting the menace of poverty the advocacy for girl education the winner was Aiyeola and she will travel to New York to speak to the United Nations Assembly and world leaders on the issue of girl education The BBN is a reality TV show based
48870,20170410,2017-04-10,Benjamin Button,"2,000+",Agedefying Ibrahimovic feels like Benjamin Button,Zlatan Ibrahimovic compared himself to Benjamin Button after spearheading a victory which according to Jose Mourinho keeps Manchester Uniteds topfour hopes alive Backtoback home draws increased the pressure as the Red Devils headed to
48871,20170410,2017-04-10,Efe Bbnaija,"2,000+",Bauchi governor offers BBNaija winner Efe holiday treat at Yankari,Gov Mohammed Abubakar of Bauchi State on Monday offered Efe Ejeba Michael Efe winner of Big Brother Naija 2017 BBnaija some relaxation time at the famous Yankari Game Reserve Efe who had been tipped as the shows favourite raked in about
48872,20170410,2017-04-10,based on logistics,"5,000+",Big Brother Naija Presidency copies Efe reveals Buhari based on logistics,Based on Logistics PMB is committed to delivering on the 3 key areas that he promised Tackling Corruption fixing the Economy  Security Big Brother Naija See Gobbe edition ended Sunday April 9 2017 Efe Ejeba Micheal beat Tboss Tokunbo
48873,20170411,2017-04-11,Barcelona,"20,000+",Juventus vs Barcelona as it happened Paulo Dybala and Giorgio Chiellini put,Paulo Dybala scored two superb firsthalf goals as Juventus took complete control of their Champions League quarterfinal against Barcelona It took Dybala just seven minutes to open the scoring curling home a low shot from the edge of the sixyard box
48874,20170411,2017-04-11,Champions League,"10,000+",Blasts hit Borussia Dortmund team bus ahead of Champions League quarterfinal,Borussia Dortmund goalkeeper Roman Buerki has revealed the shock suffered by his football team as a series of explosions struck their bus while taking them to their Champions League match There was a huge bang literally an explosion Swiss
48875,20170412,2017-04-12,Charlie Murphy,"5,000+",Charlie Murphy Comedian and Chappelles Show Star Dead at 57,Charlie Murphy the older brother of Eddie Murphy a Chappelles Show star and an accomplished comedian in his own right died Wednesday in New York City He was 57 Murphys publicist confirmed the comedians death to Rolling Stone adding that the
48876,20170412,2017-04-12,Real Madrid,"10,000+",Bayern Munich v Real Madrid Champions League quarterfinal first leg  as it,Peep Peep Peeeeeeeep Its all over at the Allianz Arena but theres another 90 minutes to come at the Bernabeu next season In a weird game of two halves Real Madrid were fairly fortunate to be just one goal behind at the break but they roared
48877,20170412,2017-04-12,United Airlines,"2,000+",United Isnt Alone in Treating Its Passengers Like Garbage,Last week most travelers thought the only involuntary bump they needed to worry about was one from the man in sweatpants on the morning commute Then on Sunday United Airlines decided to channel its inner hockey goon and forcibly remove a
48878,20170412,2017-04-12,What Are Rights,"2,000+",What are your rights as an airplane passenger,However theres what he calls the passengers bill of rights a set of protections that apply to all airline passengers Most involve getting reimbursed When you are asked to be bumped from a flight you can demand up to 1300 dollars to be removed
48879,20170412,2017-04-12,What Is Foreign Policy,"2,000+",The Trump Administration Is Heading for a 100 Day Train Wreck,The selection of reasonable men for the cabinets national security portfolios and fortuitous immolation of the deeply compromised national security advisor Mike Flynn has attenuated concern about the Trump administrations handling of foreign policy
