index,dayId,date,name,traffic,newsTitle,newsSnippet
18039,20170414,2017-04-14,Kometa Brno,"2,000+",Liberec  Kometa 34 Brno zařídilo skvělý obrat a ve finálové sérii,Hokejisté Komety Brno vstoupili úspěšně do finálové série play off extraligy v úvodním duelu vyhráli na ledě mistrovského Liberce 43 Vítěznou branku vstřelil ve 30 minutě ve vlastním oslabení kanadský útočník Alexandre Mallet Druhý zápas série
18040,20170414,2017-04-14,Modrá Velryba Ukoly,"5,000+",Modrá velryba Co stojí za hrou jaké úkoly vedou děti k sebevraždě,Internetem se šíří smrtící hra Modrá velryba Hra která má účastníky dohnat k sebevraždě dosud byla především v zemích bývalého SSSR ale v nedávné době kvůli hře zemřel chlapec na Slovensku Podle varování české policie se dostala i na český
18041,20170415,2017-04-15,Kometa,"2,000+",Kometa získala i druhé finále v Liberci prodloužení ukončil Kvapil,Kometa třikrát vedla Liberec pokaždé vyrovnal Po úvodním tlaku hostů se Bílí Tygři vzpamatovali a drželi s Kometou krok po každém inkasovaném gólu Rozhodnutí přineslo až prodloužení ve kterém výhru 43 vystřelil Marek Kvapil Brno získalo obě
18042,20170416,2017-04-16,Anastacia,"1,000+",Ondřej Ruml si jako dračice Anastacia odnesl v Tvojí tváři své první,Zatímco v sedmém díle Tvojí tváře se Ondřej divákům představil jako černošský zpěvák Seal v dnešním díle roztančil diváky jako americká zpěvačka s příznačně chraplavým hlasem Anastacia Zpěvák opět ukázal že se dokáže poprat s každou výzvou
18043,20170416,2017-04-16,Clifton James,"1,000+",Zemřel americký herec Clifton James šerif ze dvou bondovek,Herec Clifton James  foto AP Clifton James se narodil v roce 1920 vyrůstal v oregonském Portlandu a za druhé světové války strávil pět let na frontové linii v Jižním Pacifiku kde si vysloužil několik vyznamenání dvě Purpurová srdce a Stříbrnou
18044,20170416,2017-04-16,Erdogan,"1,000+",Turecko se těsně rozhodlo pro silnějšího Erdogana Opozice chce,Erdogan poděkoval lidu že ukázal svou vůli uvedl prezidentský úřad Referendum jež posílí jeho pravomoce označil za historické Vyzval všechny včetně zahraničí aby výsledek respektovali Ústavní změny hájí s tím že přinesou stabilitu a
18045,20170416,2017-04-16,Hody Hody Doprovody,"1,000+",Oslavy Z kotle Sigmy zněl pískot a nadávky Jsem rozčarovaný,Hody hody doprovody dejte góly malovaný Dva a půl tisíce diváků na Andrově stadionu si v pátek vykoledovalo pětigólovou přestřelku se šťastným koncem pro Sigmu dnes 1403 SDÍLEJ Fanoušci Sigmy Ilustrační foto  Sigma  Varnsdorf 30 ZOBRAZIT
18046,20170416,2017-04-16,Markéta Vondroušová,"2,000+",Tolik peněz žasla šampionka Vondroušová Co s nimi Mamka mi,Tenistka Markéta Vondroušová se ocitla v říši divů Díky osmi vítězstvím dokráčela v Bielu z kvalifikace až k premiérové trofeji na WTA Tour Na žebříčku poskočí z 222 místa do Top 120 Vydělala si 43 tisíc dolarů 91 příspěvků Ty jo tolik peněz
18047,20170416,2017-04-16,Papež František,"1,000+",Papež František ve velikonočním poselství prosil o mír na Blízkém,Před desítkami tisíc lidí k nimž František hovořil z balkonu baziliky svatého Petra prosil papež Boha aby přinesl mír na celý Blízký východ a aby pomáhal těm kteří aktivně poskytují úlevu civilistům v Sýrii a obětem války jež nepřestává šířit
18048,20170416,2017-04-16,Pomlázka,"2,000+",Muži v Němčičkách na Břeclavsku upletli obří pomlázku má 17 metrů,Němčičky Břeclavsko  Členové tanečního souboru Krúžek z Němčiček na Břeclavsku v obci během víkendu upletli obří pomlázku Je šestnáctiprutová a měří 1716 metru V pondělí ji budou muset nést čtyři lidé řekl dnes ČTK za pletače Adam Sláma
18049,20170416,2017-04-16,Velikonoční neděle,"2,000+",OBRAZEM Velikonoční neděle v katedrále Božského Spasitele,OBRAZEM Velikonoční neděle v katedrále Božského Spasitele Biskup František Václav Lobkowicz byl hlavním celebrantem nedělní slavnosti Zmrtvýchvstání Páně která se dopoledne uskutečnila v katedrále Božského Spasitele v Ostravě dnes 2100
18050,20170416,2017-04-16,Velikonoční pondělí,"1,000+",Na Velikonoční pondělí budou letos poprvé velké obchody zavřené,Na Velikonoční pondělí budou letos poprvé velké obchody nad 200 metrů čtverečních zavřené Řada nákupních center kde jsou i menší obchody ale zůstane otevřena Velký pátek který je od roku 2015 také uznán jako státní svátek zákonem o prodejní
18051,20170417,2017-04-17,Raego,"1,000+",Známý český rapper přiznal že se málem ufetoval k smrti Zachránili,A má duše byla zamčena protože kdybych měl počítat kolikrát jsem se obrátil na temnou stranu abych na tebe zapomněl nikdy bych to neřekl hrdě ale to číslo by bylo větší než ta největší hora na světě přiznal Dnes je Raego rád že tuhle životní
18052,20170417,2017-04-17,Red Bull Air Race,"1,000+",Šonka po pátém místě v San Diegu dál vede Red Bull Air Race,San Diego USA  Martin Šonka skončil ve druhém závodu seriálu Red Bull Air Race v akrobatickém létání v San Diegu na pátém místě a celkově dál vede Další český pilot Petr Kopfstein byl šestý Vítězství v Kalifornii vybojoval Japonec Jošihide Muroja
18053,20170417,2017-04-17,S čerty nejsou žerty,"2,000+",V pohádce S čerty nejsou žerty jsou dvě velké chyby Všimli jste si,O tom že uhlídat ve filmu každý detail je po čertech těžké by mohli vyprávět i tvůrci pohádky S čerty nejsou žerty 1984 Leckdy stačí jen drobný přešlap skriptky či rekvizitáře a povede se bota nad kterou divák pobaveně kroutí hlavou Všimli jste
18054,20170417,2017-04-17,Slavia,"1,000+",Slavia  Hradec 40 domácí mají jisté poháry a dorážejí na lídra,Slavia má už nyní  šest kol před koncem soutěže  víc bodů než za celou minulou sezonu Větší bodový zisk zaznamenala naposledy v mistrovském ročníku 20082009 Zároveň si zajistila evropské poháry protože v tabulce už nemůže klesnout na horší než
18055,20170417,2017-04-17,Turecko,"1,000+",Turecké referendum neodpovídalo normám tvrdí OBSE Jen,Pozorovatelé z Organizace pro bezpečnost a spolupráci v Evropě OBSE kritizovali průběh nedělního tureckého referenda Podmínky hlasování podle nich neodpovídaly mezinárodním normám Turecký prezident Recep Tayyip Erdogan na výroky
18056,20170417,2017-04-17,Velikonocni Pondeli,"1,000+",Čarování pro Velikonoční pondělí Rituál s vajíčky a tarotovými kartami,Je zajímavé že i když se v lidové kultuře vyskytují různá vajíčka  barvená malovaná zlatá a často i černá bíle zdobená  málokdy uvidíte jarní či velikonoční vajíčko pomalované klasickými magickými pentagramy a jmény ochranných přírodních duchů
18057,20170418,2017-04-18,Augustin Bubník,"2,000+",Sbohem šampione Zemřela hokejová legenda Augustin Bubník,Předtím jsme byli nejslavnější lidé celého národa pak největší vyvrhelové popisoval Bubník v roce 2008 v rozhovoru pro MF DNES Trest Práce v uranových dolech v Jáchymově Bylo to tam strašné Chtěl jsem mít fyzickou sílu a ne si sednout a bědovat
18058,20170418,2017-04-18,Ct Sport,"10,000+",HOKEJ ONLINE Dlouhé rozhodování u videa A Kometa vede,Teď mají oba zájemci o titul před sebou dva souboje na Moravě V případě dvou vítězství domácích může mít extraliga nového vládce Úterní duel stav 10 po dlouhém rozhodování u videa můžete sledovat v podrobné online reportáži na Sportcz ČT Sport
18059,20170418,2017-04-18,Den Země,"1,000+",Nová Akropolis Pomozte uklidit Velký háj Je Den Země,Nová Akropolis Pomozte uklidit Velký háj Je Den Země 18 dubna 2017  Nová Akropolis Autor Ing Dana Gabrielová tel 608 501 040 Nová Akropolis a skupina aktivní ekologie GEA ve spolupráci s MČ Praha 4 vás zvou na ekologickou akci která probíhá
18060,20170418,2017-04-18,Dukla Jihlava,"1,000+",Jihlava opět porazila České Budějovice a je blízko extralize,Jihlava svého dnešního soupeře porazila ve všech osmi zápasech v sezoně jen jednou byl přitom rozdíl ve skóre více než jednogólový Slavný klub se tak výrazně přiblížil postupu do nejvyšší soutěže Dvě kola před koncem má na Pardubice a Karlovy Vary
18061,20170418,2017-04-18,Google Earth,"1,000+",Google představil novou verzi Google Earth Co přináší nového,Po téměř dvou letech ve vývoji byla spuštěna nová verze Google Earth Pomocí ní chce Google nabídnout nové možnosti jak poznat svět Nově bude Google Earth mít různé zajímavé příběhy z celého světa které doplní prohlížení virtuálního glóbu
18062,20170418,2017-04-18,Hokej Online,"1,000+",HOKEJ ONLINE Power play Kometa přidává pojistku,Lepší pozici si hokejisté Komety Brno nemohli přát před prvním finálovým utkáním na svém stadiónu V sérii s Libercem vedou 20 na zápasy Teď mají oba zájemci o titul před sebou dva souboje na Moravě V případě dvou vítězství domácích může mít
18063,20170418,2017-04-18,Jiří Ornest,"2,000+",Mrazivé vztahy na pohřbu Jiřího Ornesta 70 Nevlastní sestra,Ani poslední rozloučení s Jiřím Ornestem 70 rodinu nespojilo Jeho nevlastní sestra Ester Janečková 44 na pohřeb přišla ale po celou dobu stála úplně vzadu S rodinou se nesetkala ani po skončení protože vdova Daniela Kolářová 70 odmítla
18064,20170418,2017-04-18,Kometa,"2,000+",Kometa je krok od vytouženého titulu Liberec porazila jasně 30,Kamil Pokorný KometaMěli jsme dobrý vstup do zápasu dostali jsme se do vedení 20 Hrálo se ve velkém nasazení s obrovskou bojovností z obou stran Atmosféra byla famózní a diváci nám dodávali velkou energii My jsme se samozřejmě soustředili na
18065,20170418,2017-04-18,Kometa Zapasy,"1,000+",HOKEJ ONLINE Kometa drží slibné vedení S mistrem to není dobré,Lepší pozici si hokejisté Komety Brno nemohli přát před prvním finálovým utkáním na svém stadiónu V sérii s Libercem vedou 20 na zápasy Teď mají oba zájemci o titul před sebou dva souboje na Moravě V případě dvou vítězství domácích může mít
18066,20170418,2017-04-18,Ondřej Vaněk,"1,000+",Kdo je tajemný Meišner se kterým se fotbalisté radili o drogách,No a Meišner byl zase dobrý kamarád Ondřeje Vaňka a když bylo potřeba půjčit peníze dokázal si říct o půl milionu třeba Janu Kopicovi Meišner u motocyklu Ondřeje Vaňka Zdroj Instagram Meišner u motocyklu Ondřeje Vaňka Bohužel pro fotbalovou
18067,20170418,2017-04-18,Přijímací Zkoušky 2017,"5,000+",Cermat má právní analýzu Zveřejnění zadání přijímacích zkoušek,PRAHA Centrum pro zjišťování výsledků vzdělávání Cermat má právní analýzu podle které bylo zveřejnění zadání jednotných přijímacích zkoušek které se konaly 12 dubna na internetu neoprávněné Zadání testových otázek a formulace možných
18068,20170418,2017-04-18,Real Madrid,"5,000+",Bayern Mnichov  Real Madrid,Real Madrid na půdě slavného Santiaga Bernabéua využil dalšího vyloučení Bayernu Mnichov Hosté tentokrát hráli o poznání nebezpečnější part ale krátce před koncem se nechal vyloučit opět Vidal a Cristiano Ronaldo svým hattrickem zničil soupeře v
18069,20170418,2017-04-18,Uber,"2,000+",Uber v Brně dojezdil Zakázal ho krajský soud,Služba na rozdíl od běžných taxi nepoužívá taxametr ale cenu transparentně vypočítává mobilní aplikace Uber používá systém automatické úpravy cen podle aktuální poptávky takzvaný surge pricing Ten je mířen především na řidiče Vyšší cena zakázky v
18070,20170419,2017-04-19,Aaron Hernandez,"2,000+",Sebevražda Fotbalista Hernandez odsouzený na doživotí se oběsil,Bývalý fotbalový hráč známého týmu NFL New England Patriots Aaron Hernandez spáchal sebevraždu Stalo se tak ve vězení kde si odpykával doživotní trest za vraždu Podle policie byl Hernandez nalezen ve své cele v nápravném zařízení v
18071,20170419,2017-04-19,Barcelona Juventus,"5,000+",Barcelona v Lize mistrů končí Juventus neinkasoval ani na Nou,BarcelonaMonako  Fotbalisté Juventusu a Monaka postoupili do semifinále Ligy mistrů Turínský tým v odvetném čtvrtfinále s Barcelonou nepřipustil další drama a po domácí výhře 30 uhrál na Nou Campu remízu 00 Monako doma zdolalo Dortmund 31
18072,20170419,2017-04-19,Barcelona Vs Juventus,"5,000+",LM ONLINE Barcelona vs Juventus 00 Monaco  Dortmund 20,Fotbalisté Barcelony se po úvodní porážce 03 pokouší v dnešní odvetě čtvrtfinále Ligy mistrů proti Juventusu o podobný obrat jaký předvedli o kolo dříve s Paris St Germain V druhém dnešním zápase Monako přivítalo Dortmund a hájí náskok 32 z
18073,20170419,2017-04-19,Fc Barcelona,"2,000+",Zázrak se nekonal Barcelona končí S Juventusem postupuje Monako,Barcelona to měla s vypracováváním příležitostí složité turínští zdvojovali až ztrojovali domácí hvězdy Jakmile Neymar udělal kličku jednomu protihráči už na jeho další kroky čekali dva další Nejblíž ke gólu měl v úvodním poločase Jordi Alba po
18074,20170419,2017-04-19,Serena Williams,"2,000+",Gratulace Serena Williams se na podzim stane maminkou,Tenisová hvězda Serena Williamsová oznámila na sociálních sítích že je těhotná Pětatřicetiletá Američanka jež se v pondělí vrátí na místo světové jedničky tak zřejmě v čele žebříčku nezůstane dlouho Prostřednictvím snapchatu se totiž pochlubila
18075,20170419,2017-04-19,Speed marathon,"2,000+",Speed marathon Podívejte se kde všude policisté měří rychlost,Na základě naší výzvy občané od 1 února do 28 února na mapě Speed marathonu označili více než sedmdesáti sedmi tisíci hlasy celkem 10 796 míst nacházejících se po celé České republice která považují za riziková a problematická Policisté označená
18076,20170420,2017-04-20,Hc Kometa Brno,"1,000+",FOTO To nej z oslav posměšky a přání k titulu Komety Brno,Snad každý už u nás ví že Kometa Brno vyhrála po 51 letech mistrovský titul S nadsázkou se tak v Brně dnes asi nepracuje a bujaré oslavy neberou konce Spousta momentů z oslav i fandění uvízla na sociálních sítích Ty nejlepší jsme pro vás vybrali a
18077,20170420,2017-04-20,Jana Dudková,"5,000+",Zemřela Jana Dudková scenáristka Hanele a dramaturgyně Sanitky,V 85 letech zemřela Jana Dudková jejíž dramaturgická i autorská dráha byla spjatá zejména s Československou poté Českou televizí včetně seriálů Byl jednou jeden dům či Sanitka Zprávu pro iDNEScz potvrdil scenárista Ivan Hubač Z televizní krimi
18078,20170420,2017-04-20,O2 TV Free,"2,000+",Máte doma Xbox Settop box k O2TV už kupovat nemusíte,V současné době je možné prostřednictvím konzole pustit jakýkoliv právě vysílaný pořad z nabídky tarifů O2 TV MLXL O2 TV Air MLXL anebo O2 TV Sport na den V řádu dnů připravujeme i zpřístupnění O2 Videotéky s více než tisícovkou filmů
18079,20170420,2017-04-20,Překotný porod,"2,000+",Překotný porod doma dopadl špatně Novorozenec je po smrti a,Žena která plánovala porod v porodnici a docházela na pravidelné prohlídky do porodnice začala mít dnes nad ránem kontrakce Jednalo se o takzvaný překotný porod takže se dítě narodilo doma velice rychle uvedla pro ČTK výkonná ředitelka Unie
18080,20170420,2017-04-20,StarCraft,"1,000+",Blizzard vydal první StarCraft i s datadiskem Brood War zdarma,Osm let Taková doba nás dělí od předchozího patche pro StarCraft Brood War zatímco od vydání hry uplynuly téměř dvě dekády Mezitím ušel herní průmysl obrovský kus cesty ale jedna z nejpopulárnějších strategií se pořád drží a teď dostala nový patch
18081,20170420,2017-04-20,Vlastimil Brodský,"1,000+",Před 15 lety spáchal sebevraždu Vlastimil Brodský   81 Co ho k,20 dubna 2002 šokovala celou Českou republiku zpráva že zemřel herecký bard Vlastimil Brodský 81 Bylo to jako blesk z čistého nebe nikdo netušil proč k tomu došlo Nejprve se dokonce veřejnost houfně domnívala že došlo k vraždě Až pak přišlo
18082,20170421,2017-04-21,Aneta Krejčíková,"2,000+",Nebezpečně odhalená blondýnka Vyzývavá hvězda Ulice vystavila,Herečka Aneta Krejčíková 25 kterou diváci znají například ze seriálu Ulice patří k zástupkyním žen které se pyšní parádními ženskými křivkami A právě své nejlepší přednosti Aneta předvede i na prknech Divadla na Fidlovačce kde společně s kolegy
18083,20170421,2017-04-21,Christian Panucci,"1,000+",REAKCE Panucci nahradí Radu Trenér Sparty o tom ví až od nás,Že by Sparta už sehnala nového trenéra do nadcházejícího ročníku Podle spekulací z různých zdrojů by jim měl být Ital s českými kořeny Christian Panucci Klub z Letné vede ale od března Petr Rada který se exkluzivně pro Novasport reagoval na dané
18084,20170421,2017-04-21,Gessica Notaro,"5,000+",Italská modelka ukázala co jí s tváří provedla kyselina Tou na ni,Když mi kyselina požírala obličej klečela jsem na kolenou a prosila boha Vezmi si mou krásu ale ponech mi alespoň zrak vzpomíná Gessica která čeká až se jí tvář zahojí alespoň do té míry aby mohla podstoupit zákrok u plastického chirurga O
18085,20170421,2017-04-21,Ibrahimovic,"1,000+",Ibrahimovic řval bolestí koleno se ošklivě prohnulo Je zle tuší,Jeho Manchester United slavil výhru a postup do semifinále Evropské fotbalové ligy na úkor Anderlechtu ale pro hvězdného útočníka Rudých Ďáblů Zlatana Ibrahimovice to nebyl vůbec šťastný zápas Nejenže spálil několik šancí ale navíc si přivodil
18086,20170421,2017-04-21,Manchester United,"1,000+",Velká tragédie Desítky fanoušků Manchesteru United zemřely,Více než třicet fanoušků Manchesteru United zemřelo v Nigérii Příznivci anglického celku sledovali ve městě Calabar utkání Evropské ligy ve kterém rudí ďáblové vyhráli nad Anderlechtem 21 Během fandění je však zasáhl elektrický proud z kabelu
18087,20170421,2017-04-21,Saints Row 2,"1,000+",Městská akce Saints Row 2 je k mání zdarma ale jen na 24 hodin,Saints Row 2 je skvělou městkou akcí s tou pravou špetkou šílenství a ačkoliv už máme na trhu i několik novějších dílů stále patří mezi ty oblíbenější Určitě tedy uvítáte fakt že je nyní dvojka ke stažení zcela zdarma a to na Steamu i GOGu Máte
18088,20170421,2017-04-21,Sapho,"1,000+",Pražské Sapho získalo investici 14 milionů dolarů v Česku,Z velké části pražská společnost Sapho v novém investičním kole série B získala investici ve výši 14 milionů dolarů Celkově už posbírala 2785 milionu dolarů tedy kolem 700 milionů korun O firmě jsme nedávno na Lupě podrobněji psali Sapho
18089,20170422,2017-04-22,Fed Cup,"2,000+",Fed Cup ONLINE Vondroušová padla o vyrovnání hraje Siniaková,České tenistky prohrávají v semifinále Fed Cupu v USA 01 na zápasy Sedmnáctiletá Markéta Vondroušová nezaskočila v úvodní dvouhře v Tampě světovou čtyřiadvacítku Coco Vandewegheovou a na zelené antuce prohrála jasně 16 46 První bod
18090,20170422,2017-04-22,Michele Scarponi,"2,000+",Nechápu to Teď chci jen brečet Cyklisté se loučí s Michelem,Ještě v pondělí Michele Scarponi vyhrál úvodní etapu klání Kolem Alp porazil ve finiši i tak silné protivníky jakými byli Geraint Thomas Thibaut Pinot nebo Sergio Henao Nedlouho poté se dozvěděl že se vzhledem ke zranění týmového kolegy Fabia Arua
18091,20170422,2017-04-22,NOVA Sport,"1,000+",Buffon promluvil o konci vztahu se Šeredovou Bylo to utrpení,Gólman italské reprezentace Gianluigi Buffon žil dlouhých devět let s českou modelkou Alenou Šeredovou svůj vztah dokonce stvrdili svatbou na Vyšehradě Jenže to budou dva roky co se pár oficiálně rozešel Buffon teď pro italský magazín Corriere
18092,20170422,2017-04-22,Uzavírka D1,"1,000+",Velká uzavírka na D1 Silničáři odřízli 70 kilometrů dálnice,Po odpoledním omezení dopravy stavaři kompletně uzavřeli dálnici D1 Během noci strhnou tři mosty Uzavření se týká více než 70 kilometrů dálnice Hlavní tah mezi Prahou a Brnem by měl být neprůjezdný až do nedělních devíti hodin ráno Do normálu se v
18093,20170422,2017-04-22,Volby Francie,"1,000+",Francouzské prezidentské volby již začaly na zámořských územích,PAŘÍŽ V zámořských oblastech začaly v sobotu francouzské prezidentské volby které v kontinentální Francii proběhnou v neděli Výsledky posledních průzkumů potvrzují minimální rozdíly mezi čtyřmi hlavními kandidáty Podle informace agentury AFP je
18094,20170423,2017-04-23,Alena Šeredová,"1,000+",Světová fotbalová star Buffon o manželství s Alenou Šeredovou,Ilaria je člověk kterého jsem celý život hledal a chtěl řekl italskému magazínu Corriere Della Sera zamilovaný Gigi který se do italské krásky zakoukal v roce 2014 Nyní už s ní má ročního syna Leopolda Mattiu A co řekl Buffon o konci manželství
18095,20170423,2017-04-23,Barcelona,"1,000+",ONLINE Real  Barcelona Kdo ovládne slavné El Clásico v boji o,Přímá bitva o titul Ve slavném El Clásiku mezi Realem Madrid a Barcelonou jde ve španělské lize o hodně Bílý balet má na svého soupeře v čele tříbodový náskok a zápas k dobru Šest kol před koncem si tak svěřenci Luise Enriqueho nemůžou dovolit
18096,20170423,2017-04-23,El Clasico,"5,000+",Ještě jednou a definitivně Neymar si El Clásico nezahraje,Barcelona se v Neymarově případu obrátila na národní sportovní arbitráž ale nakonec se bude muset v utkání proti Realu Madrid obejít bez brazilského útočníka Neymar si odpykává trest za vyloučení v Málaze Barcelona  Fotbalisté Barcelony se v
18097,20170423,2017-04-23,Lenka Pastorčáková,"1,000+",Mluvčí Drahoše bude Lenka Pastorčáková redaktorka ČT,Tiskovou mluvčí prezidentského kandidáta Jiřího Drahoše bude Lenka Pastorčáková Dosavadní redaktorka České televize se funkce ujme na začátku května Populárním se stal její rozhovor s prezidentem Milošem Zemanem kdy jí předváděl aligátora
18098,20170423,2017-04-23,Lionel Richie,"2,000+",NESKUTEČNÉ Lionel Richie má tajné dvojče Ne to byla Martha,Martha jako známý americký zpěvák Lionel Richie rozvlnila s písní All Night Long boky nejen atraktivních tanečnic ale celého sálu včetně nadšené poroty 8 bodů tedy plný počet si vysloužila i od hostujícího porotce Zdeňka Piškuly Martha tak svým
18099,20170423,2017-04-23,Macron,"20,000+",Z 1 kola postupují Macron a Le Penová ukazují průběžné výsledky,PAŘÍŽ V první kole francouzských prezidentských voleb zvítězil centristický kandidát Emmanuel Macron do druhého kola postupuje i kandidátka krajní pravice Marine Le Penová Shodují se na tom první odhady výsledků voleb několika společností
18100,20170423,2017-04-23,Moto Gp,"1,000+",Motocyklová VC Ameriky 2017 Marc Márquez nenašel přemožitele,Dopolední zahřívací tréninky na Circuit of the Americas vyhráli Marc Márquez MotoGP Takaaki Nakagami Moto2 a Arón Canet Moto3 Tedy samozřejmě podle místního času jinak začínaly v 1540 středoevropského letního a končily přesně v pět
18101,20170423,2017-04-23,MotoGP,"2,000+",MotoGP Poslednímu tréninku kraloval Márquez,MotoGP Poslednímu tréninku kraloval Márquez 22 4 2017  Michaela Neumannová Marc Márquez opanoval čtvrtý volný trénink Hned za něj se zařadil jeho týmový kolega Dani Pedrosa I na třetím místě je Španěl  Maverick Viňales V závěrečném
18102,20170423,2017-04-23,Rajtoral,"20,000+",Fotbalista Rajtoral spáchal sebevraždu Oběsil se v bytě v Turecku,Rajtoral je odchovancem Příbrami hrával za Ostravu ale nejlepší léta prožil v Plzni Dva tituly dva postupy do Ligy mistrů Vykopal si angažmá v Hannoveru byť jen na půl roku Pak se zase vrátil do Plzně odkud loni v létě přestoupil do Turecka Ve
18103,20170423,2017-04-23,Real Madrid Vs Barcelona,"10,000+",ONLINE Real  Barcelona Kdo ovládne slavné El Clásico v boji o,Přímá bitva o titul Ve slavném El Clásiku mezi Realem Madrid a Barcelonou jde ve španělské lize o hodně Bílý balet má na svého soupeře v čele tříbodový náskok a zápas k dobru Šest kol před koncem si tak svěřenci Luise Enriqueho nemůžou dovolit
18104,20170423,2017-04-23,Sparta Plzen,"5,000+",Sparta  Plzeň 20 obhájce titulu nestačil domácí rozhodli v první půli,Fanoušci na tribunách šíleli nadšením záložník Vácha máchal rukama a hecoval je Sparta vedla 20 a užívala si chvíle jarní slávy Blížil se konec poločasu a s obhájcem titulu to nevypadalo dobře Plzeňští vyjma prvních pěti minut kdy byli aktivnější
18105,20170423,2017-04-23,Vlastimil Brodský,"2,000+",15 let od sebevraždy Vlastimila Brodského 81 Před smrtí napsal,Vlastimil Brodský 81 navždy odešel z tohoto světa již před 15 lety Přesto se dodnes téměř neví že den předtím napsal dopis herecké kolegyni a kamarádce Stelle Zázvorkové 83 v němž mnohé své úmysly naznačoval Herečka si proto ještě dlouho
