index,dayId,date,name,traffic,newsTitle,newsSnippet
72518,20161129,2016-11-29,Final Fantasy XV,"5,000+",สาวกหามพลาด Walkman Final Fantasy XV Edition จาก Sony เตรยม,กลายเปนหนงในเกมฝงคอนโซลประจำปนทนาจบตามองไมใชเลนสำหรบ Final Fantasy XV ภาคลาสดทปลอยใหแฟนๆ รอมาอยางยาวนานเพราะใชเวลาการพฒนามากวา 10 ป ซงในวนน 29 พฤศจกายน กไดฤกษวางจำหนายอยางเปนทางการเปนทเรยบรอย
72519,20161129,2016-11-29,พระบรม,"2,000+",สนชอญเชญ สมเดจพระบรมฯขนเปนพระมหากษตรย เรมรชกาลใหม,นร050344549 ลงวนท 29 พฤศจกายน 2559 เรอง แจงเรองการสถาปนาแตงตงพระรชทายาทไวแลวตามกฎมณเฑยรบาลวาดวยการสบราชสนตตวงศ พระพทธศกราช 2467 แจงวา บดนราชบลลงกวางลงและพระมหากษตรยไดทรงแตงตงสมเดจพระบรมโอรสาธราช เจาฟามหาวชราลงกรณ
72520,20161129,2016-11-29,อยากดงเดยวจดให,"2,000+",เพจดงเปดคลปแกงดาราอยครบ กอนเกดเหตตบลกนายพล,เฟซบกแฟนเพจ อยากดงเดยวจดให V4 เผยคลปเหตการณในรานมาลนสกาย แกงดาราอยครบ กอนเกดเหตตบลกนายพล หลงจากกรณเหตการดสถานบนเทงชอดงของเมองเชยงใหมรมทำราย นายอศราชนวฒภ หรอ เจมสบอนด อาย 23 ป โดยมชอดารานกแสดงกลมหนงเขาไปพวพนดวยนน
72521,20161130,2016-11-30,Motor Expo 2016,"10,000+",Trending Today,ทมาในชดไทยสขาวเชนกน ขณะทพรตตบธอนตางกรวมใจแตงชดโทนสดำขาวดเรยบรอย จนเรยกไดวาแปลกตาไปเยอะทเดยว งานมอเตอรเอกซโป 2016 Motor Expo 2016 จะจดรอบบคคลทวไประหวางวนท 212 ธนวาคม 2559 น หากใครอยากมาเหนกบตาวาพรตตปนจะสวยขนาดไหน
72522,20161130,2016-11-30,ฉตรสดา นาค,"2,000+",สองความแซบแฟน จน ธรต หรอ ฉตรสดา แหงนาค ออหอเจอแบบนเจาแมม,ภายหลงจากทละครเรอง นาค ยอนกลบมาใหแฟน ๆ ไดดกนอกครง กทำใหกระแส นาคฟเวอร ไหลทะลกเขามาอกรอบ พรอมกนนยงมการแนะนำตวละครใหม ๆ อยาง ฉตรสดา ทเปนบรวารเจาแมนาค ซงตวละครฉตรสดาน ได จน ธรต บตรดหงษ หรอ จน สตรอเบอรร ชสเคก strawberry
72523,20161130,2016-11-30,พอลล พรพรรณ,"2,000+",พอลล พรพรรณ แตงงาน เขาพธหมนแฟนหนม หวานชนมน,หลงจากทปลอยนำจมเปนภาพพรเวดดงหวานๆ กบแฟนหนม สรางความประหลาดเลกนอยใหกบแฟนๆ เพราะเปนการสละโสดทฉบพลนไปหนอย สำหรบดาราสาว พอลล พรพรรณ ทไดควงแขนแฟนหนม เบนซ รฐพงศ ทายาทธรกจไทยสตล เขาสประตววาห เมอวานน 29 พย
72524,20161130,2016-11-30,เลขเดด,"20,000+",คอหวยแหโรยแปงทาถตะเคยนทองวดสนกำแพง หาเลขเดดคกคก,เชยงใหม  คอหวยทงใกลทงไกลแหจดธปกราบไหว เจาแมพวงผกาเจาแมสายสมร กอนโรยแปงทาถตะเคยนทอง 2 ตนในวดสนกำแพง เชยงใหม หาเลขเดดกนตอเนอง หลงขาวแพรสะพดใหโชคคนถกหวยหลายงวดตด วนน 30 พย ผสอขาวรายงานวา
72525,20161130,2016-11-30,โครงการลงทะเบยนเพอสวสดการแหงรฐ,"5,000+",เลอนจายเงนผมรายไดนอย เรม 3 ธค เชกชอทางเวบสรรพากร,ผมรายไดนอยทลงทะเบยนเพอสวสดการแหงรฐ ตรวจชอไดทเวบสรรพากรแบงกรฐทยนลงทะเบยน ดาน ปลดคลง เผย มาตรการลดภาระคานำไฟ อยระหวางพจารณา สวน ชอปชวยชาต ลดหยอนภาษไมเกน 15000 จอเขา ครมเรวๆน  นอกจากน ไดเสนอมาตรการ ชอปชวยชาต ใหทประชมคณะรฐมนตร พจารณา
72526,20161130,2016-11-30,โดง อรรถชย อนนตเมฆ,"2,000+",โดง อรรถชย สอนนองดาราอยาเอาชอเสยงไปเสยง รหาผวเปนมาเฟย,โดง อรรถชย อนนตเมฆ อดตดารานกแสดง ไดโพสตขอความลงในเฟซบกสวนตว กลาวถงดาราสาวคนหนง พรอมกบสอนนองดวยวลเดด อยาเอาชอเสยงไปเสยง รหาผวมาเฟย ควรยดหลกปฏบตตามหลกธรรมคำสอนในการใชชวต อดตดารานกแสดงไดโพสตขอความถงดาราสาวคนหนง
72527,20161201,2016-12-01,1ธนวาคม2559,"5,000+",สรปสภาวะตลาดทองคำแทง วนท 1 ธนวาคม 2559,สภาวะตลาดวนท 01 ธนวาคม 2559 ราคาทองคำแกวงตวในกรอบทระดบ 116345117669 ดอลลารตอออนซ ขณะทราคาทองคำแทง 965 ภายในประเทศขายออกอยท 19850 บาทตอบาททองคำ โดยราคาปรบตวลดลง 200 บาท จากวนกอนหนาทระดบ 20050 บาทตอบาททองคำ
72528,20161201,2016-12-01,ตรวจ,"10,000+",วลาศ จ บกหม กลาผาตด กปภ หลงตรวจสอบพบทจรตมากสด,ประกอบกบนายเสร ศภราทตย ผวา กปภเองเปนคนใหมทไมใชลกหมอของ กปภ และไมกลาตดสนใจผาตดองคกรเอาเนอรายออก ทมผบรหารระดบสงของ กปภ เชน รองผวา กปภ เทาทตรวจสอบพบวามสวนพวพนในการทจรตมไมนอยกวา 4 คน รวมถงระดบ ผอสำนกงานเขต กปภ และผจดการ
72529,20161201,2016-12-01,ถายทอดสด,"5,000+",ศาลใหประกนบอล กบพวกคดตบลกนายพลแลว,ในฐานะททรงเปนพระมหากษตรยนกพฒนา เพอเทดพระเกยรตพระอจฉรยภาพ และพระราชกรณยกจดานการพฒนา โดยเฉพาะอยางยงในเรองการอนรกษดน ทงน จะมการถายทอดการจดกจกรรมวนดนโลกประจำป 2559 ทาง webcast ของสหประชาชาต  ในคนวนศกรท
72530,20161201,2016-12-01,ปญญาสมวาร,"2,000+",อหลงสวนบำเพญกศลปญญาสมวารถวายร9,ทสนามกฬาอำเภอหลงสวน วาทรอยตรกตตภพ รอดดอน นายอำเภอหลงสวน นำสวนราชการ ตำรวจ ผนำองคกรปกครองสวนทองถน กำนนผใหญบาน อสม นกเรยนจากโรงเรยนตางๆ และประชาชนทวไป ไดรวมประกอบพธทำบญตกบาตรบำเพญพระราชกศลเนองในพระราชพธปญญาสมวาร
72531,20161201,2016-12-01,พระบรม,"5,000+",สมเดจพระบรมฯเสดจฯทรงบำเพญพระราชกศลปญญาสมวาร,สมเดจพระบรมโอรสาธราชฯ สยามมกฎราชกมาร พรอมดวย พระบรมวงศานวงศเสดจพระราชดำเนนโดยรถยนตพระทนงจากพระทนงอมพรสถาน พระราชวงดสต ไปยงพระบรมมหาราชวง เพอทรงบำเพญพระราชกศลปญญาสมวารถวายพระบรมศพ พระบาทสมเดจพระปรมนทรมหาภมพลอดลยเดช
72532,20161201,2016-12-01,รชกาลท 10,"10,000+",ประมวลภาพ กราบบงคมทลอญเชญขนทรงราชย รชกาลท 10,1 ธนวาคม พทธศกราช 2559 กราบบงคมทลอญเชญเสดจขนทรงราชยเปนพระมหากษตรย รชกาลท 10 แหงราชอาณาจกรไทย สมเดจพระบรมโอรสาธราช เจาฟามหาวชราลงกรณ สยามมกฏราชกมาร องคพระรชทายาท ทรงรบอญเชญขนทรงราชยเปนพระมหากษตรยของปวงชนชาวไทย
72533,20161201,2016-12-01,รางวลท1,"10,000+",ชางซอมรถบรรทกชอกถกรางวลท 1 รบเละ 6 ลานบาท,ค59 ผสอขาวรายงานวา หลงสลากกนแบงรฐบาล ไดประกาศผลรางวลเปนทเรยบรอย ผใช เฟสบคชอ Worapot Boonpiam หรอมชอจรงวา นายวรพจน บญเปยม อาย 34 ป ศษยเกาโรงเรยนอสสมชญ ระยอง เสยธรกจถมดน ชาวอำเภอเมอง จงหวดระยอง ไดโพสรปตวเองถอสลากกนแบงรฐบาล
72534,20161201,2016-12-01,หวย,"500,000+",คอหวยแหโรยแปงทาถตะเคยนทองวดสนกำแพง หาเลขเดดคกคก,จนทรรตน มานโล อาย 31 ป เจาของรานอาหารแหงหนง เปดเผยวา ตนเองเลนสลากกนแบงรฐบาลไมเคยถกรางวลมากอน จนมากราบไหวขอกบเจาแมกถกหวยตดตอกนมาหลายงวดแลว งวดละหมนบาทบาง สองหมนบาทบาง หลงจากถกรางวลกนำชดเสอผาสวยงาม เครองเซนไหวตางๆ
72535,20161201,2016-12-01,ไทยรฐทว,"2,000+",หามพลาด ศกมวยไทยลก 5 คสดมน ไทยรฐทวยงสด 2 ธคน,5 แสนบาท กบรถกระบะ 1 คน พรอมหาควไปตอยโชวในตางประเทศ เพอสรางเงนสรางรายไดตามคอนเซปตโครงการ ตอยมวยกรวยได สวนกตกาการแขงขนยดตาม พรบมวย พศ 2542 ทงน ไทยรฐทว ชอง 32 HD ถายทอดสดจากเวทมวยลมพน รามอนทรา ตงแตเวลา 1600 น เปนตนไป
72536,20161202,2016-12-02,ทรงพระเจรญ,"2,000+",ทรงพระเจรญ คนบนเทงถวายพระพรรชกาลท 10,ทรงพระเจรญ คนบนเทงถวายพระพรรชกาลท 10 แนวหนา  2 ธนวาคม 2559  คนอาน 64 คน 2 ธค59 คนบนเทงรวมถวายพระพรชยมงคลแด สมเดจพระเจาอยหวมหาวชราลงกรณ บดนทรเทพยวรางกร รชกาลท 10 อาท ชมพ อายา นก สนจย แอน ทองประสม แอฟ ทกษอร ใหม ดาวกา
72537,20161202,2016-12-02,ร10,"2,000+",นายกฯเผยพระเจาอยหวร10ทรงราชยสบสานพระปณธาน,ขอพระราชทานกราบบงคมทลพระกรณาทราบฝาละอองธลพระบาท ขาพระพทธเจามความยนดทไดทราบวา สมเดจพระเจาอยหวมหาวชราลงกรณ บดนทรเทพยวรางกร ไดขนทรงราชยเปนพระมหากษตรยแหงราชอาณาจกรไทย ในนามของรฐบาลประชาชนของประเทศสาธารณรฐประชาชนจน
72538,20161202,2016-12-02,รางวล,"2,000+",พอคานำปนเฮ ถกหวยรางวลท 1,จากการสอบถามนายสมชาย เลาวา ตนมอาชพขายนำปนอยทบาน พอหวยออกกนำลอตเตอรมาตรวจ พอรวาถกรางวลท 1 ดใจมาก ตอนแรกทำอะไรไมถก พอลกสาวกลบมาจากสอนหนงสอกพากนไปแจงความลงบนทกประจำวนไวกอน สำหรบลอตเตอรนซอมาจากรานคาในตลาดโพธทอง
72539,20161202,2016-12-02,ลงทะเบยนผมรายไดนอย,"10,000+",กคลง ประกาศเลอนกำหนดโอนเงนผมรายไดนอย,เลอนโอนเงนใหผมรายไดนอยรายละ 1500 3000 บาท ในวนท 3 ธนวาคมน ไมมกำหนด หลงพบหลกฐานผลงทะเบยนแสดงรายไดเกนเกณฑ ปละ 1 แสนบาท แถมใชสทธหลายธนาคาร โครงการโอนเงนโครงการสวสดการแหงรฐ ซงเดมมกำหนดจายเงนใหผมรายไดนอยวนท 3
72540,20161202,2016-12-02,สมเดจพระบรม,"5,000+",สมเดจพระบรม ทรงบำเพญพระราชกศลพระบรมศพ50วน,สมเดจพระบรมโอรสาธราชฯ สยามมกฎราชกมาร เสดจพระราชดำเนนโดยรถยนตพระทนงจากพระทนงอมพรสถาน พระราชวงดสตถงพระทนงดสตมหาปราสาท ในพระบรมมหาราชวง พรอมดวยสมเดจพระเทพรตนราชสดาฯ สยามบรมราชกมาร สมเดจพระเจาลกเธอ เจาฟาจฬาภรณวลยลกษณ
72541,20161202,2016-12-02,สมเดจพระเจาอยหวมหาวชราลงกรณ บดนทรเทพยวรางกร,"2,000+",อยธยาอางทองลนฆองเจรญชยมงคลคาถาฉลองรชกาลท 10 สมเดจพระเจาอยหวมหาวชราลงกรณ บดนทรเทพยวรางกร,พระนครศรอยธยาอางทอง  ผวาราชการจงหวดพระนครศรอยธยา นำขาราชการลนฆองเจรญชยมงคลคาถา ฉลองในโอกาสท สมเดจพระเจาอยหวมหาวชราลงกรณ บดนทรเทพยวรางกร ทรงเสดจขนครองราชสมบต เปนพระเจาอยหว รชกาลท 10 เชนเดยวกบทอางทอง มการลนฆอง
72542,20161202,2016-12-02,สายโลหตตอนจบ,"2,000+",ฟดแบคคนด สายโลหต ตอนจบ,นำตานองจอเตมตนในอกกนทวเมอง กบตอนจบของละครองประวตศาสตรเรองเยยม สายโลหต ททางชอง 7 นำกลบมารรนอกครงในรอบ 21 ป ทำใหนกแสดงนำในเรองอยาง หนม ศรราม และ กบ สวนนท คขวญในตำนาน กลบมาเปนทพดถงของแฟนๆอกครง แถมพระเอกหนมยงไดฉายา
72543,20161203,2016-12-03,เชลซ,"10,000+",เดอดทายเกม เชลซ ฟอรมด บกอด เรอใบ 31 นำฝงตอ,สงโตนำเงน เชลซ โชวฟอรมเกงอยางตอเนอง บกมาเอาชนะ เรอใบสฟา แมนเชสเตอร ซต ไป 31 เกบ 3 คะแนนสำคญ นำเปนจาฝงศกพรเมยรลก องกฤษ ตอไป การแขงขนฟตบอลพรเมยรลก องกฤษ ฤดกาล 201617 เมอชวงคำวนเสารท 3 ธค ทผานมา เรอใบสฟา แมนเชสเตอร ซต
72544,20161204,2016-12-04,5 ธนวาคม 2559,"2,000+",รบจดงาน 5 ธคสำนกในพระมหากรณาธคณ,และสวนราชการตางๆ นายสวพนธ กลาววา ขณะทในสวนของรฐบาลจะจดกจกรรม รวมสำนกในพระมหากรณาธคณ 5 ธนวาคม 2559 ทบรเวณสะพานภมพล โดยพลอธนะศกด ปฏมาประกร รองนายกรฐมนตร จะเปนประธานในพธเปดงาน รวมถงมการทำบญมหาสงฆทานแกพระสงฆจำนวน 999 รป
72545,20161204,2016-12-04,บาซา มาดรด,"10,000+",บารซาสดเซงชดขาวไลตนาททาย11นำฝงทง6แตม,เจาบญทม บารเซโลนา สดเซง แม หลยส ซวเรซ จะโหมงใหทมขนนำไปกอน แตมาเจอทเดดของ เซรคโอ รามอส โขกตเสมอชวงนาทสดทายให ราชนชดขาว เรอล มาดรด บกมาแบงแตมถงถนคมป น 11 ทำสถตยงไมแพในลกตอไปนำเปนจาฝงทงบารเซโลนา 6 คะแนนเชนเดม ในเกม เอล
72546,20161204,2016-12-04,ฟตบอลทมชาตไทย,"20,000+",สบอลเตรยมเงนอดฉดชางศกแบงสดสวน8020,หลงจากทมขาวกอนหนานวา สมาคมกฬาฟตบอลแหงประเทศไทย เตรยมจะใหเงนอดฉด 10 ลานบาท หากทมชาตไทยควาแชมป เอเอฟเอฟ ซซก คพ 2016 รวมทงมเงนแชมปจากรายการดงกลาวใหอก 2 แสนดอลลาหสหรฐ หรอราว 7 ลานบาท ทำใหรวมเปน 17 ลานบาทท ชางศก จะไดรบ
72547,20161204,2016-12-04,อน สราวฒ ลาลา,"10,000+",อน สราวธ ขอแตง ลาลา ในIG ทแทแคแซวเลน,ซงกมแฟนคลบเขาไปคอมเมนตถามกนยกใหญ งานน สาวลาลา กเลยเขามาตอบกลบแบบนารกๆ วา  ยอมทกอยาง ออ ขอบคณพอนเหมอนกนคะ ทชวยสอนเทคนคดดใหในการแสดง งนคนนขอไปเรยนแบบตวตอตว เดวจาเลาเรองแซบๆ ใหฟง ออ นอกจากนกมคนบนเทงเขามารวมแจมอก
72548,20161204,2016-12-04,แมนซ เชลซ,"2,000+",ชมคลปเดอด เฟอรนนดนโญอเกวโร โดนใบแดงเกมพายเชลซ,วนท 3 ธค ชมคลปจงหวะวนวายทายเกม เฟอรนนดนโญ กบ เซรคโอ อเกวโร 2 นกเตะของแมนเชสเตอร ซต ถกใบแดงไลออกจากสนามไปในชวงทดเจบของเกมพรเมยรลก องกฤษ คบกแมตช นดทเรอใบสฟา เปดบานแพ สงโตนำเงน เชลซ 13 เมอชวงคำวนเสารทผานมา
72549,20161205,2016-12-05,พอ,"2,000+",ลกสาวกตญญ บรจาคไตใหพอ ในวนเฉลมพระชนมพรรษาร9,นายแพทยยอดชาย ปลอดออน กลาววา การผาตดดงกลาวถอวาเปนการทำดของลกเพอพอ และการผลการผาตดกถอวาเปนทนาพอใจ โดยกรณของลกสาวเจาของไตเดมนนไมมปญหาใดๆ โดยจะพกฟนทโรงพยาบาลอกเพยงแค 1 วนกคงจะใหกลบบานได
72550,20161205,2016-12-05,รชกาลท9,"5,000+",ออมสน นอมรำลกในพระมหากรณาธคณ รชกาลท9 แจกกระปกครองราชย70ป,สำหรบสารคดชด ตามรอยเสดจฯ ประเทศสวตเซอรแลนด ธนาคารออมสนไดจดทำดวยการรวบรวมพระบรมฉายาลกษณและภาพบรรยากาศทหาชมไดยากของพระบาทสมเดจพระเจาอยหวรชกาลท 9 เมอครงทรงพระเยาว และเจรญพระชนม รวมถงบนทกเรองราวตางๆ ขณะยงทรงประทบ ณ
