index,dayId,date,name,traffic,newsTitle,newsSnippet
50914,20170107,2017-01-07,Jordan Clarkson,"2,000+",Lakers feed off Jordan Clarksons ejection in 127100 victory over Heat,Lakers guard Jordan Clarkson and Miami guard Goran Dragic received ejections after the two tussled nearly underneath the basket Shortly after Miami guard James Johnson tried approaching the Lakers bench While the sequence sparked ejections for
50915,20170107,2017-01-07,Legend Of The Blue Sea Episode 16,"2,000+",The Legend Of The Blue Sea Behindthescene images tease shocking twist for,Fans of the Legend Of The Blue Sea will have to wait for the telecast of episode 16 to know more about it Until then you can catch up with the previous episodes online here Meanwhile a few of the behindthescene images portray Shin Rinahs
50916,20170107,2017-01-07,Sandford Fleming,"2,000+",Sandford Fleming just wanted everyone to agree on what time it is,Sandford Fleming wanted to make the world a less chaotic place and for everyone to agree on one thing what time it was He did it by convincing countries around the world to adopt Greenwich Mean Time as its universal standard and to split up into 24
50917,20170107,2017-01-07,Tilikum,"2,000+",How Tilikum the Orca Changed the Conversation About Animals in Captivity,Tilikum the orca at the center of the 2013 documentary Blackfish has died at SeaWorld Orlando the marine park announced Friday Jan 6 According to SeaWorld Tilikum died early in the morning The cause of death is officially unknown but the
50918,20170108,2017-01-08,Awra Briguela,"10,000+",Awra Briguela impersonates Dionesia Pacquiao sings Wrecking Ball,MANILA  Awra Briguela also known as Makmak in FPJs Ang Probinsyano entertained the audience of ABSCBNs Your Face Sounds Familiar Kids in its premier Saturday January 7 as he sang Wrecking Ball as Mommy Dionesia Pacquiao Dionesia
50919,20170108,2017-01-08,Camille Prats Wedding,"2,000+",IN PHOTOS Celebrity guests at Camille Prats VJ Yambaos wedding,MANILA Philippines  Camille Prats and VJ Yambao are married The couple wed on Saturday January 7 in Batangas in the presence of their close friends and family Among their guests were a few famous faces including Camilles brother John Prats and
50920,20170108,2017-01-08,Epiphany,"2,000+",Dont lose hope Tagle tells drug dependents at Epiphany Mass,Luis Antonio Cardinal Tagle of Manila Bishop Jose Bantolo of Masbate and other priests sing with former drug dependents and volunteers from the Fazenda de Esperança drug rehabilitation center in Masbate City after the Mass of Hope at the Manila
50921,20170108,2017-01-08,Michael Martinez,"2,000+",Look Filipino olympic skater Michael Martinez hunk transformation,In addition he is the first skater in the Winter Olympics to come from Southeast Asia Martinez was also the only athlete representing the Philippines at the 2014 Winter Olympics What can you say about Michael Martinez hot transformation Share your
50922,20170108,2017-01-08,Nokia 6,"10,000+",Androidpowered Nokia 6 marks the brands return to smartphones,The Nokia brand is finally back in the smartphone game as today HMD Global which holds the rights to the name announced the Android 70 Nougatpowered Nokia 6 The bad news is that its a midrange device for the Chinese market so well have to wait
50923,20170108,2017-01-08,Typhoon Auring,"5,000+",Auring prompts LTFRB to suspend bus trips to Cebu,UPDATED The Land Transportation Franchising and Regulatory Board LTFRB on Sunday has temporarily suspended bus trips to the province of Cebu due to Typhoon Auring Bus trips in Liloan Santander Toledo Tabuelan and Hagnaya Bogo were
50924,20170108,2017-01-08,Your Face Sounds Familiar,"5,000+",Your Face Sounds Familiar Elha Nympha wows as Beyonce,What a voice Elha Nympha did plenty of justice to Beyonces hit Love on Top during the premiere of the celebrity kids edition of Your Face Sounds Familiar On Saturday Nympha reminded everyone why she won the second season of The Voice Kids as
50925,20170109,2017-01-09,AirAsia,"20,000+",AirAsia named Most Influential Airline in China at Beijing awards ceremony,KUALA LUMPUR AirAsia was named The Most Influential Airline in China at the 2016 New Power of Travel Awards held in Beijing on Friday The awards hosted by Sina Travel and Youku Travel websites review the development and trends of Chinas travel
50926,20170109,2017-01-09,Andrew Garfield,"10,000+",Bet You Missed This Amazing Ryan ReynoldsAndrew Garfield Kiss at the Golden,Ryan Reynolds who was nominated for Deadpool took the loss in stride by kissing fellow Golden Globe nominee Andrew Garfield for Best ActorMotion Picture Drama as Gosling walked to the stage Reynolds wife actress Blake Lively was laughing
50927,20170109,2017-01-09,Auring,"2,000+",Tropical Depression Auring weakens into low pressure area,MANILA Philippines  Tropical Depression Auring weakened into a low pressure area LPA on Monday morning January 9 after making landfall in the country twice Aurings 1st landfall was over Siargao Island on Sunday afternoon January 8 while its
50928,20170109,2017-01-09,Black Nazarene,"20,000+",Black Nazarene devotees pray for end to extrajudicial killings,MANILA  Devotees of the Black Nazarene flocked to this years Traslacion with the hope that their devotion to the crossbearing Christ would not only free their families of diseases but also put an end to the scourge of vigilante killings that has
50929,20170109,2017-01-09,G Dragon,"5,000+",Sandara Park Love Life Seen With GDragon In Concert Relationship Gossips,Shipping in the KPop world is a common thing for fans to do One of the most popular ships is Daragon which is a combination of Dara and GDragon The two remain quiet regarding the ship But it looks like Daragon shippers are determined to find out
50930,20170109,2017-01-09,LBC,"2,000+",The Nigel Farage Show Watch His First Show Live From 7pm,Nigel Farage hosts the first of his nightly shows on LBC this evening  and you can watch it live The former Ukip leader presents his brand new show every Monday to Thursday from 78pm live on LBC Watch it live on the video above
50931,20170109,2017-01-09,La La Land,"20,000+",La La Land why this magical musical will transport you from TrumpWorld,I fully expected to loathe La La Land being as I am rather proprietorial about my beloved hometown of 25 years and having been robustly dismissive of director Damien Chazelles last movie Whiplash But to my delight Chazelle had me in the palm
50932,20170109,2017-01-09,LandBank,"2,000+",Former LandBank OIC assumes office as DBP president,Stateowned Development Bank of the Philippines DBP on Monday saw a change in leadership with the new president and chief executive officer starting her first day in office Cecilia C Borromeo assumed her post after having been sworn into office by
50933,20170109,2017-01-09,LinkedIn,"5,000+",Russia gets LinkedIn banned on Android and iOS,THE RUSSIAN GOVERNMENT is continuing to make it difficult for locals to use LinkedIn and has now ensured that the application is not available through either the Apple or the Google app stores This is bad news for anyone in the country that hasnt
50934,20170109,2017-01-09,SSS,"5,000+",SSS hike finance with no numbers,1 Inquirernet report Stop using bankruptcy as scare tactic vs SSS pension hikesolons Colmenares argued that by 2015 the SSS had increased its fund life to 2042 in only 14 years He added the UK and Canada pension fund lives are only up to
50935,20170110,2017-01-10,A Love To Last,"2,000+",A Love To Last breaks hearts on premiere episode,But just when Anton is finally ready to make up to his mistakes Grace realizes that she is no longer in love with him and demands an annulment While Anton is busy persuading his wife to come home with him Alonzos character Andrea is busy pursuing
50936,20170110,2017-01-10,Badi del Rosario,"5,000+",Arci Munoz admits breakup with Badi del Rosario,10 Jan  Actress Arci Munoz recently admitted that she and boyfriend Badi del Rosario have called it quits on their relationship As reported on Push the actress who appeared at the press conference of her upcoming film Extra Service alongside
50937,20170110,2017-01-10,Derrick Rose,"5,000+",Derrick Rose missing from Knicks said to have Chicago family issue,Knicks point guard Derrick Rose went missing from the team Monday without permission but later reached team officials telling them he had a family situation and had returned to his hometown of Chicago sources told ESPN Rose missed Monday nights
50938,20170110,2017-01-10,Earthquake,"2,000+",Earthquake measuring 73 hits Philippines island Jolo,struck the region a number of times in the past The Philippine archipelago lies in the Pacific Ring of Fire where earthquakes and volcanic activities are common A magnitude 77 quake killed nearly 2000 people on the northern island of Luzon
50939,20170110,2017-01-10,the walk,"2,000+",Nigerian oil gas workers walk out over salary arrears,Oil and gas workers in southern Nigeria downed tools on Tuesday over the alleged nonpayment of salaries with the walkout hitting production and threatening electricity supplies At least 12 flow compressor and pumping stations operated by the
50940,20170111,2017-01-11,Altaba,"2,000+",Its Not Just Altaba Here Are the 7 Worst Company Name Changes,Yahoo announced Monday that following the sale of its core business to Verizon Communications the leftover assets would placed under a holding company termed Altabaa name that sounded more like infantile babble than the remnants of a
50941,20170111,2017-01-11,Alzheimer Disease,"2,000+",Antidepressant use doubles hip fracture risk among elders with Alzheimers disease,Antidepressant use nearly doubles the risk of hip fracture among communitydwelling persons with Alzheimers disease according to a new study from the University of Eastern Finland The increased risk was highest at the beginning of antidepressant use
50942,20170111,2017-01-11,Jeff Horn,"2,000+",Who is Jeff Horn Get to know Pacquiaos next opponent,MANILA Philippines  Filipino boxing icon Manny Pacquiao still one of the most popular athletes in the world will return to the ring on April 22 against Australias Jeff Horn The news reported by ESPNs Dan Rafael early Wednesday was met with
50943,20170111,2017-01-11,Maxine Medina,"5,000+",Maxine Medina confident of backtoback PH win for Miss Universe,HOST COUNTRY Miss Universe Philippines 2016 Maxine Medina is ready to welcome contestants from more than 80 countries for the Miss Universe pageant on January 30 2017 Maxine also confirms she will be wearing Rhett Eala for her national costume
50944,20170111,2017-01-11,weather today,"2,000+",Auckland weather today,Auckland weather today Last updated 0659 January 11 2017 A sticky day is in store for Aucklanders MetService A sticky day is in store for Aucklanders Auckland should be back to its summery  if muggy  self by Wednesday afternoon Showers are
50945,20170112,2017-01-12,Beauty and the Beast,"5,000+",Ariana Grande  John Legend to Record Beauty and the Beast Duet for Live,The liveaction Beauty and the Beast stars Emma Watson and Dan Stevens as Beauty and the Beast respectively Ewan McGregor Ian McKellen Stanley Tucci Audra McDonald and Emma Thompson voice the films inanimate characters Kevin Kline stars as
50946,20170112,2017-01-12,Legend of the Blue Sea Episode 16,"10,000+",The Legend Of The Blue Sea Episode 16 Recap And News Lee Min Ho To,The Legend of the Blue Sea Episode 16 started on a happy note as Heo Joon Jae and his mom reunited at last This is of course with the help of Shim Cheong who has been crossing paths with her several times in the past until theyve become good friends
50947,20170112,2017-01-12,Selena Gomez,"10,000+",Selena Gomez Poses in Just a Towel and Thong to Tease New Photoshoot,Selena Gomez may have only just made her official return to Instagram and the red carpet but her 2017 is already picking up steam and unbelievably seems poised to be her biggest year yet After once again being named the mostfollowed and mostliked
50948,20170112,2017-01-12,Zayn Malik,"2,000+",How Zayn Malik Transformed From Boy Band Member to Stylish Solo Star,Over the past few years weve seen Zayn Malik transform from a floppyhaired boy band member to an edgy solo artist with a supermodel girlfriend As Malik turns 24 today FN is taking a look back at his style from the start Malik first came onto the
50949,20170113,2017-01-13,Friday the 13th,"10,000+",Friday the 13th why is it unlucky and other facts about the worst day in the,Psychologists have even come up with a word for how youre feeling  paraskavedekatriaphobia or fear of Friday the 13th One option is to stay tucked up in bed all day to avoid any potential Friday the 13th bad luck that may come your way or
50950,20170113,2017-01-13,Joe Biden,"2,000+",Joe Bidens tears send MSM into emotional meltdown,Joe Biden won a place in the heart of the mainstream media when President Barack Obama awarded him the Presidential Medal of Freedom the highest civilian award in the US previously given to dignitaries including Margaret Thatcher and Tony Blair
50951,20170113,2017-01-13,Nintendo Switch,"5,000+",The 5 biggest announcements from the Tokyo Nintendo Switch event,Nintendo announced a whole bunch of details about the upcoming Switch console last night in Tokyo including the price release date and new games that are coming to the console And while we may still have questions about Nintendos new hardware we
50952,20170113,2017-01-13,Shinzo Abe,"2,000+",Japans Abe enjoys Dutertes folksy diplomacy in Philippines,Japanese Prime Minister Shinzo Abe had a morning to remember on Friday Duterte a charismatic politician known at home for his folksy charm dropped many of the formal protocols normally associated with visits by a head of government as he took
50953,20170114,2017-01-14,A Series of Unfortunate Events,"10,000+",A Series of Unfortunate Events appears to make one major change from the,A Series of Unfortunate Events is as you might have guessed from the title not a happy story Its about three children  Violet Klaus and Sunny Baudelaire  whose parents die in a fire that burned down their home and live in a series of
50954,20170114,2017-01-14,Adam Sandler,"5,000+",Adam Sandler and David Spade to play Belly Up Aspen,Actor and comedian Adam Sandler is coming to Belly Up Aspen for two performances in February the club announced Thursday night Sandler performing with fellow Saturday Night Live alum David Spade will perform a show at 7 and a 1030 pm Feb 17
50955,20170114,2017-01-14,Spice Girls,"2,000+",Spice Girls 2017 reunion axed after Geri pulls out to focus on family,Christian Horner SKIPPED his daughters third birthday party to debut Geris pregnancy after ditching his former partner for the Spice Girl Photo Rex features Getting all the girls in the studio at the same time proved a tough task What they
50956,20170116,2017-01-16,13 Hours,"2,000+",Open the Cage Gear Partners with Mark Oz Geist of 13 Hours for Hero Line,NASHVILLE Tenn AmmolandCom  Open the Cage Gear LLC a multifaceted lifestyle company and Mark OZ Geist member of the Benghazi Annex Security Team and coauthor of the book 13 Hours have partnered to release the first apparel items in
50957,20170116,2017-01-16,Australian Open,"2,000+",W2W4Serena Williams Novak Djokovic seek strong start,MELBOURNE Australia  Day 2 at the Australian Open finds a pair of former No 1s  now No 2s  beginning their 2017 quest to return to the top Serena Williams and Novak Djokovic whom history says may be challenged mightily in these firstround
50958,20170116,2017-01-16,Cagayan de Oro,"5,000+",Thousands stranded as flash floods hit Cagayan de Oro,CAGAYAN DE ORO CITY Philippines UPDATED  Two weather systems  a low pressure area LPA and the tailend of a cold front  caused heavy flooding on Monday January 16 leaving thousands of students and workers stranded in some areas of the
50959,20170116,2017-01-16,James Arthur,"2,000+",James Arthur has bonded with Louis Tomlinson and talked about collaborating,Theyve famously feuded in the past but James Arthur is hoping to collaborate with One Directions Louis Tomlinson now theyre both on the same management label The former X Factor winner told The Sun hes already reached out to Louis about burying
50960,20170116,2017-01-16,Nba Vote Lakers,"10,000+",Jordan Clarkson and this Basketball Crazy Nation,Los Angeles Lakers guard Jordan Clarkson right celebrates after hitting a 3point shot as Portland Trail Blazers guard Allen Crabbe stands in the background during the first half of an NBA basketball game Tuesday Jan 10 2017 in Los Angeles AP
50961,20170116,2017-01-16,Sinulog 2017 Winners,"2,000+",Sinulog street dance winners announced,SINULOG 2017 GRAND MADRIGAJAN152017 The contingent from the Province of Lanao Del Norte perform during the Sinulog 2017 Grand Mardigras at Mango avenue in Cebu City PHOTO BY LITO TECSON  CDN CEBU CITY  The winners of the
50962,20170117,2017-01-17,BJ Penn,"2,000+",Watch the moment BJ Penn was stopped by Yair Rodriguez as UFC legend loses to,Watch the moment BJ Penn was stopped by Yair Rodriguez as UFC legend loses to rising star Penn took a beating at the hands of the young Mexican Share Comments ByMartin Domin 0905 16 JAN 2017 Updated 0915 16 JAN 2017 Sport
50963,20170117,2017-01-17,Bianca Umali,"5,000+",Actress Bianca Umalis no filter and no makeup post gets flak online,By now we should already know how to embrace all forms of beauty au naturel or not but social media has a magical way of making us argue about anything including what we put on our faces Teenage actress Bianca Umali posted a seemingly innocent
50964,20170117,2017-01-17,Donna Villa,"5,000+",Movie producer Donna Villa dies,MANILA Philippines  Movie producer Donna Villa died of cancer on Tuesday January 17 She was 57 years old According to a report from Pep Donna who heads Golden Lion Films with husband director Carlo J Caparas died at the UST hospital
50965,20170117,2017-01-17,Golden State Warriors,"50,000+",With authority Warriors get their points across,Golden State began in search of a kill shot The Warriors were eager possibly too ambitious but it was hard to find much fault in their early execution Stephen Curry blew past Kyrie Irving for the opening bucket He went on to miss four straight
50966,20170117,2017-01-17,Kim Tae Hee,"20,000+",Kpop stars Rain Kim Tae Hee to tie the knot,Korean pop singer Rain will be tying the knot with actress Kim TaeHee after four years of dating Rain made the announcement on his Instagram account on Tuesday I am ready to be a good husband and a man as the head of a household She Kim stood
50967,20170117,2017-01-17,Martin Luther King,"2,000+",Actor criticised for Martin Luther King tweet,He was one of the Big Six leaders of civil rights groups who organised the 1963 march on Washington and was sidebyside with Martin Luther King during the historic Selma march of 1965 The backlash appeared on Twitter shortly after Schneiders post
50968,20170117,2017-01-17,Nbacom,"5,000+",Inside the NBA Henry Thomas,Inside crew talks with Henry Hank Thomas a freedom rider about buses full of people getting burned Inside the NBA 419 Inside crew talks with Henry Hank Thomas a freedom rider about buses full of people getting burned Play Now Playing Inside
50969,20170117,2017-01-17,rain,"2,000+",Freezing rain could cause road conditions to change very rapidly,A freezing rain warning has been cancelled for the City of Toronto but remains in effect for other parts of the GTA and southern Ontario as commuters were warned to prepare for a treacherous trek to work Environment Canada cancelled the warning for
50970,20170118,2017-01-18,Chelsea Manning,"2,000+",Chelsea Mannings prison sentence commuted by Barack Obama,Chelsea Manning the US army soldier who became one of the most prominent whistleblowers of modern times when she exposed the nature of warfare in Iraq and Afghanistan and who then went on to pay the price with a 35year military prison sentence
50971,20170118,2017-01-18,Joo Won,"2,000+",BoA and Actor Joo Won Are Dating Reps Confirm,Love is in the air among South Korean celebrity royalty BoA Queen of KPop and actor Joo Won are officially dating reps confirm Following an exclusive by TV Report this week Jan 18 which claimed that the couple started dating in the second
50972,20170118,2017-01-18,Legend Of The Blue Sea Ep 18,"2,000+",Legend Of The Blue Sea Episode 18 Spoilers Is Joon Jaes Life In Danger A,Legend of the Blue Sea Episode 18 spoilers are making waves online as fans speculate about a forthcoming danger to Heo Joon Jaes life brought about by a betrayal of someone close to him Exciting twists are coming for TLOTBS fans to enjoy in the
50973,20170118,2017-01-18,Split,"2,000+",Split This MultiplePersonality Thriller May Scare,James McAvoy acts the hell out of 23 roles in Split the story of Kevin a psychiatric patient afflicted with dissociative identity disorder DID Actually the actor introduces us to only a handful of these personalities Too many alters as they
50974,20170118,2017-01-18,Xia Vigor,"10,000+",WATCH Adorable Xia Vigor sings while dad plays guitar,With all the limelight and attention child actress Xia Vigor has been receiving at the moment for her impersonation of pop star Taylor Swift its easy to forget that shes just a kid who loves to sing Heres a little throwback video to remind you of
50975,20170119,2017-01-19,The Legend Of The Blue Sea Episode 18,"10,000+",The Legend Of The Blue Sea Ep 18 Recap And News Whats Next For Lee Min Ho,The Legend of the Blue Sea has only two episodes left in its run Episode 18 brought the drama to third and second place in the rankings race at 183 nationwide and 199 in Seoul respectively according to AGB Nielson Previously Heo Joon Jae tried
50976,20170119,2017-01-19,Xia As Taylor Swift,"2,000+",Mum of 7yearold Taylor Swift impersonator hits back at Piers Morgan as she,7yearold Xia Vigors performance of Taylor Swift s You Belong With Me on Philippines programme Your Face Sounds Familiar went viral this week when it was accused of being too sexualised by the likes of Piers Morgan and Loose Womens Nadia
50977,20170120,2017-01-20,Donald Trump,"5,000+",Donald Trump Inauguration Trump Meets at White House with President Obama,The president met his successor on the gracious front steps on a red carpet and shortly thereafter the first awkward moment came  Melania Trump handing Michelle Obama what looked like a large Tiffany and Co box and leaving the Obamas wondering
50978,20170120,2017-01-20,Gloria Diaz,"2,000+",Isabelle Daza channels her mom Gloria Diaz Miss Universe 1969,At first people thought it was really Gloria Diaz in the black and white photo but in reality it was her daughter Isabelle who dressed up as her mom for Tim Yaps 40th birthday bash Isabelle wore her moms actual Miss Universe crown When your mom
50979,20170120,2017-01-20,Kim Tae Hee,"50,000+",Surprise Kpop stars Rain Kim TaeHee tie the knot,After dating for more than four years Korean pop singer Rain tied the knot with actress Kim TaeHee on Thursday in a small private ceremony said a report from The Korean Herald The wedding was held at Gahoedong Cathedral in Seoul and was attended
50980,20170120,2017-01-20,Legend Of The Blue Sea episode 19,"2,000+",Watch The Legend Of The Blue Sea episode 19 live online Its time for Shim,Although the promo for episode 19 hints at the silvertailed mermaids demise the followers of the show are hoping to see a happy ending for the onscreen couple The video features Shim Cheong at hospital and it ends by showing the nursing staff
50981,20170120,2017-01-20,Logan,"5,000+",Logan Does Not Feature Mr Sinister Director Confirms,Following the release of yesterdays final Logan trailer Mangold spoke to Cinemablend and explained that the films gritty tone meant there was no place for a more traditional supervillain Thats exactly the kind of thing this movie avoids he said
50982,20170120,2017-01-20,Melania Trump,"2,000+",In Reem Acra and Norisol Ferrari Melania Trump gives the first hint at her,Today Melania Trump will take Michelle Obamas place as Americas First Lady Obama has used fashion to help make the role her own so all eyes are now on Melania as she creates her own FLOTUS template We got the first inkling of what her strategy
50983,20170120,2017-01-20,Miguel Ferrer,"2,000+",Miguel Ferrer star of NCIS Los Angeles and Iron Man 3 dies aged 61,Actor Miguel Ferrer who starred in the US crime dramas NCIS Los Angeles and Crossing Jordan has died He died Thursday of cancer at his Los Angeles home He was 61 He had played assistant director Owen Granger on NCIS Los Angeles since 2012
50984,20170120,2017-01-20,Nadine Lustre,"5,000+",Nadine Lustre posts kissing photo with James Reid,A snapshot of Nadine Lustre kissing her hunky boyfriend James Reid comes as a surprise She has been reluctant to share their intimate moments in social media but here Nadine herself posted the photo on Instagram
50985,20170120,2017-01-20,Nba All Star 2017,"5,000+",AllStar Top10 Anthony Davis,10 plays from Western Conference AllStar Anthony Davis of the New Orleans Pelicans 4 hours ago  137 The Inside the NBA crew look at the guards starting in the West for the 2017 AllStar game and discuss whether Russell Westbrook was snubbed
50986,20170120,2017-01-20,Power Rangers,"2,000+",Latest Power Rangers trailer gives us a first glimpse at Zordon and the Megazord,The liveaction Power Rangers reboot is about two months away from release and its second official trailer dropped earlier today with some muchneeded cameos from franchise favorites Not only is this the first glimpse at Bryan Cranstons Zordon the
50987,20170120,2017-01-20,Tim Yap,"5,000+",Tim Yap proposes to boyfriend Javi Pardo,Host and TV personality Tim Yap proposed to his boyfriend events director Javi Martinez Pardo during his Miss Universethemed birthday party on Thursday Actress Lovi Poe caught the sweet moment on camera and shared it on Instagram When you have
