index,dayId,date,name,traffic,newsTitle,newsSnippet
52901,20170215,2017-02-15,Idol,"10,000+",Idol w Polsacie UCZESTNICY Pierwszy odcinek nowej edycji talent,Idol 2017 Dzisiaj pierwszy odcinek UCZESTNICY Ponad dekadę musieliśmy czekać na nową odsłonę kultowego programu Idol Program który otworzył drzwi do kariery min Ani Dąbrowskiej czy Monice Brodce już dzisiaj wieczorem powraca na antenę
52902,20170215,2017-02-15,Idol 2017,"10,000+",Elżbieta Zapendowska ocenianie innych to dla mnie chleb powszedni,Elżbieta Zapendowska ponownie zasiądzie w jury Idola Polakom dobrze znana jest z tego że ocenia początkujących wokalistów  Ocenianie innych to dla mnie chleb powszedni  przyznała Pierwszy odcinek Idola 2017 zostanie wyemitowany 15 lutego
52903,20170215,2017-02-15,Kim Dzong Un,"5,000+",Kim Dzong Un zlecił zabójstwo brata To banalna zemsta za grzechy,Kim Dzong Un chciałby aby świat wiedział że nie ma z nim żartów Właśnie  twierdzą wywiady Korei Południowej i USA  wysłał dwie zabójczynie by zamordowały jego przyrodniego brata Pierwsze doniesienia wskazują że Kim Dzong Nam został otruty
52904,20170215,2017-02-15,Natalie Portman,"10,000+",Oscary 2017 Natalie Portman czy Emma Stone A może to Meryl,Natalie Portman która z najdrobniejszymi szczegółami oddała sposób mówienia i zachowania Jackie Kennedy targanej emocjami po zabójstwie JFK a obok niej śpiewająca i tańcząca Emma Stone z La la land Obie panie mają nie lada konkurencję w
52905,20170215,2017-02-15,Puchar Świata w skokach narciarskich,"20,000+",Puchar Świata w skokach Konkurs w Pjongczangu na żywo,Będzie miał jednak szansę na poprawienie się w serii finałowej bo już po skoku mógł być pewnym awansu Mimo niesprzyjającego wiatru sędziowie nie podwyższyli belki startowej i nie oglądaliśmy dalekich skoków Nie zaimponował Peter Prevc 1315 m
52906,20170215,2017-02-15,ShowMax,"50,000+",ShowMax ma kilka asów w rękawie,Patryk Vega Wojciech Smarzowski i Ucho Prezesa mają przyciągnąć widzów do serwisu ShowMax To dobry początek  oceniają eksperci Wczorajszy start pochodzącego z RPA serwisu VoD ShowMax zdominował nowy odcinek internetowego serialu
52907,20170215,2017-02-15,Skijumping,"5,000+",Wypowiedzi Jana Ziobry i Dawida Kubackiego po kwalifikacjach w,Jan Ziobro i Dawid Kubacki rozpoczynają walkę o czwarte miejsce w polskiej reprezentacji na konkurs drużynowy który odbędzie się już za niespełna trzy tygodnie w ramach Mistrzostw Świata w narciarstwie klasycznym w fińskim Lahti We wtorkowych
52908,20170215,2017-02-15,Skoki,"5,000+",Polacy skaczą najładniej na świecie Kombinezony nam pomagają,Kilka zdań na ten temat jeszcze podczas zmagań w Polsce dodał również Niemiec Andreas Wellinger Skoki zmierzają w zupełnie nowym kierunku Zdecydowanie więcej czasu poświęca się na dobranie nowego sprzętu Konkurencja nie śpi a my musimy
52909,20170215,2017-02-15,Skoki narciarskie,"50,000+",Polacy skaczą najładniej na świecie Kombinezony nam pomagają,Kilka zdań na ten temat jeszcze podczas zmagań w Polsce dodał również Niemiec Andreas Wellinger Skoki zmierzają w zupełnie nowym kierunku Zdecydowanie więcej czasu poświęca się na dobranie nowego sprzętu Konkurencja nie śpi a my musimy
52910,20170215,2017-02-15,UCHO PREZESA 5,"100,000+",Ucho Prezesa 5 Nowy odcinek już w sieci A w nim prezes spotyka,Ucho Prezesa powróciło  na razie na nowej platformie Showmax Piąty odcinek to niewidziani dotąd przy Nowogrodzkiej goście Chaos w gabinecie wprowadza zwłaszcza dawna znajoma Jolanta Ucho Prezesa serial stworzony przez Roberta Górskiego
52911,20170215,2017-02-15,Wampir z Bytowa,"5,000+",Wampir z Bytowa Przyznał się do kilkudziesięciu okrutnych zbrodni,Areszt śledczy w Starogardzie Gdańskim chce aby wobec wampira z Bytowa zastosować tzw ustawę o bestiach i uznać go za osobę stwarzającą zagrożenie Pękalski odbywa karę w Areszcie Śledczym w Starogardzie Gdańskim w której to placówce
52912,20170215,2017-02-15,Województwa,"50,000+",Mateusz Wrotny przewodniczący Forum Młodzieży Województwa,Jestem w trakcie przygotowywania projektu regulaminu a myślę że na następnym posiedzeniu będziemy ten regulamin przyjmować  powiedział Mateusz Wrotny przewodniczący Forum Młodzieży Województwa Opolskiego Forum zostało powołane przy
52913,20170215,2017-02-15,Zbiorka Na Seicento,"20,000+",Wypadek premier Szydło Zebrali kilkadziesiąt tysięcy na nowe,Od poniedziałku trwa zbiórka na stronie pomagampl na nowy samochód dla mężczyzny oskarżonego o spowodowanie wypadku premier Beaty Szydło Początkowo założono zebranie 5 tys zł ale w niecałe dwa dni kwota ta została przekroczona o przeszło
52914,20170215,2017-02-15,smog,"5,000+",W Krakowie w czwartek darmowa komunikacja Wszystko przez smog,Jakość powietrza w wielu miastach jest zła Stężenie zanieczyszczeń w Krakowie było na tyle wysokie że z powodu smogu w czwartek będzie obowiązywała darmowa komunikacja miejska To już drugi dzień z kolei
52915,20170216,2017-02-16,Chmury Warszawa,"10,000+",Zamaskowani kibice zdemolowali klub Chmury w Warszawie,Wzywam władze klubu Legia Warszawa do pomocy finansowej klubokawiarni Chmury i zaangażowania się w odbudowę lokalu To wasi kibice zniszczyli to miejsce to wasi fanatycy regularnie terroryzują Warszawę Jeśli jesteście przeciw to udowodnijcie to
52916,20170216,2017-02-16,Czesław Niemen,"2,000+",Dziś 78 rocznica urodzin legendy  Czesława Niemena,Czesław Juliusz Wydrzycki czyli Czesław Niemen przyszedł na świat w 1939 roku Był jednym z najważniejszych twórców okresu bigbitu w Polsce a zespoły NiebieskoCzarni Akwarele czy Niemen Enigmatic z którymi był związany na stałe zapisały się w
52917,20170216,2017-02-16,Daria Ładocha,"10,000+",Daria Ładocha  nowa dziewczyna na salonach Kim jest,Wśród 14 uczestników jest szczupła blondynka Daria Ładocha To blogerka i dziennikarka kulinarna miłośniczka zdrowego żywienia która właśnie została twarzą nowej kampanii Lidla Ładocha ma 34 lata jest trenerką kulinarną z zakresu kuchni tajskiej
52918,20170216,2017-02-16,Dzień Kota,"2,000+",Dzień Kota 2017 adopcja porady i spotkania LISTA IMPREZ,Światowy Dzień Kota już 17 lutego Z tej okazji Wydawnictwo EMG wraz z zaprzyjaźnionymi księgarniami galeriami i sklepami plastycznymi zaprasza na akcję Dzień kota w księgarniach  Poza najnowszym Kot tajemniczy i poprzednimi notesami z
52919,20170216,2017-02-16,Eleven,"2,000+",Bundesliga w Eleven Sports Network,Bundesliga w Eleven Sports Network Eleven Sports Network od przyszłego sezonu będzie pokazywał rozgrywki pierwszej i drugiej Bundesligi oraz Superpucharu Niemiec Umowę podpisano na cztery lata Kamil Kołsut 16 Lutego 2017 1423 Udostępnij 74
52920,20170216,2017-02-16,Eugenie Bouchard,"5,000+",Eugenie Bouchard dotrzymała słowa i poszła na randkę z kibicem,Na miejsce randki tenisistka i zachwycony student wybrali mecz koszykówki w lidze NBA pomiędzy Brooklyn Nets i Milwaukee Bucks 125129 Króciutki filmik nagrany z wysokości trybun spodobał się ponad 310 tys fanów pięknej Bouchard
52921,20170216,2017-02-16,Francuska bajadera,"10,000+",Kuchenne rewolucje w Czeladzi 16022017 Francuska bajadera z,Kuchenne rewolucje w Czeladzi Francuska Bajadera w najnowszym odcinku programu Magdy Gessler TVN W Czeladzi po raz kolejny pojawiła się Magda Gessler Tym razem kuchenną rewolucję przeszedł Lawendowy Dom Teraz jest Francuską
52922,20170216,2017-02-16,Kate Upton,"2,000+",Kate Upton chwali się biustem na okładce,Kate Upton sławę zdobyła w sposób podobny do Natalii Siwiec W 2011 wideo z 18letnią wówczas modelką na widowni meczu koszykówki obiegło internet Mimo że Upton miała już wtedy na koncie pierwsze sesje to właśnie viralowy filmik zapewnił jej
52923,20170216,2017-02-16,Kinga Duda,"2,000+",Kinga Duda się zaręczyła Kancelaria Prezydenta odpowiada,Dzień po Walentynkach media obiegła informacja jakoby córka prezydenta Andrzeja Dudy Kinga Duda zaręczyła się ze swoim partnerem Bartłomiejem Staszczakiem Dyrektor Biura Prasowego Kancelarii Prezydenta Marek Magierowski w rozmowie z
52924,20170216,2017-02-16,Legia Ajax,"200,000+",Liga Europy Legia Warszawa  Ajax Amsterdam na żywo,Wtedy lepszy okazał się reprezentant Holandii Legia jest obecnie trzecim zespołem Lotto Ekstraklasy Ajax to wicelider Eredivisie Początek meczu Legia Warszawa  Ajax Amsterdam 2100 Transmisja TV Canal Sport i TVP 1 Stream online Canal Sport
52925,20170216,2017-02-16,Manchester United,"5,000+",Liga Europy mecz Manchester United  SaintEtienne Gdzie,Manchester United nie ma już praktycznie żadnych szans na mistrzostwo Premier League więc poza Pucharem Ligi Angielskiej w którym Czerwone Diabły doszły do finału Liga Europy jest jedyną okazją na sięgnięcie po trofeum Tymczasem faza grupowa
52926,20170216,2017-02-16,Mistrzostwa Świata W Skokach Narciarskich,"2,000+",Mistrzostwa świata w Lahti Gregor Schlierenzauer w kadrze Austrii,Austriak który ma na koncie 53 zwycięstwa w Pucharze Świata w skokach narciarskich uszkodził w Oberstdorfie więzadło poboczne w prawym kolanie W środę 15 lutego okazało się że ma jeszcze dodatkowo naderwany mięsień w udzie Mimo tego Heinz
52927,20170216,2017-02-16,Radovic,"2,000+",Miroslav Radović Nie spodziewałem się że dostanę drugą szansę,Jest rok 2015 Legia Warszawa mierzy się z Ajaxem Amsterdam w 116 finału Ligi Europy Nagle jak grom z jasnego nieba spada wiadomość że lider warszawskiej drużyny Miroslav Radović nie zagra w wyjściowej jedenastce Mało tego  nie zasiądzie
52928,20170216,2017-02-16,Superstacja,"5,000+",TVP o słowach które padły w Superstacji przykład mowy nienawiści,Za przykład mowy nienawiści która godzi w dobre imię dziennikarzy Telewizji Polskiej uznała TVP wypowiedzi Jakuba Wątłego i Tomasza Jastruna w programie Krzywe zwierciadło wyemitowanego 14 lutego na antenie telewizji Superstacja
52929,20170216,2017-02-16,mrównik,"10,000+",Niezwykłe urodziny w zoo we Wrocławiu Na świat przyszedł mrównik,Zwierzę to rzadko występuje w ogrodach zoologicznych a jeszcze rzadziej się tam rozmnaża W zeszłym roku w europejskich ogrodach zoologicznych urodziło się tylko pięć mrówników MrównikiFoto MontageManWikimedia CommonsCC  W tej chwili
52930,20170217,2017-02-17,17 Luty,"2,000+",Transfery z Przeglądem Sportowym  17 lutego 2017 r,Transfery z Przeglądem Sportowym  17 lutego 2017 r Zapraszamy do śledzenia relacji na żywo z plotek transferowych i doniesień ze świata transferów Z nami nie przegapisz żadnej informacji Poleć 0  Tweetnij Skomentuj 9 appendvalue
52931,20170217,2017-02-17,Dolberg,"5,000+",Kasper Dolberg pójdzie śladami piłkarskich legend Ajaxu Amsterdam,Dolberg został wypatrzony przez legendarnego skauta amsterdamskiego klubu  Johna Steena Olsena Ten 74letni zwiadowca Ajaxu ma wyjątkowego nosa do wynajdywania nieoszlifowanych piłkarskich diamentów Od lat ściąga ze Skandynawii na
52932,20170217,2017-02-17,Dzień Kota 2017,"5,000+",Dzień Kota 2017 MEMY,17 lutego obchodzimy Światowy Dzień Kota ang World Cat Day National CatDay International Cat Day wł Giornata mondiale del gatto Polscy miłośnicy Puszków i Mruczków świętują od roku 2006 pierwsi byli Włosi zapoczątkowali to święto w roku
52933,20170217,2017-02-17,Ewa Swoboda,"2,000+",Ewa Swoboda Chciałabym pójść do Mc Donaldsa ale nie mogę,Mam nadzieję że w sobotę w Toruniu uzyskam przynajmniej 715  powiedziała sprinterka Ewa Swoboda AZS AWF Katowice I przyznała  Chciałabym pójść do McDonaldsa ale nie mogę W weekend 20letnia sprinterka będzie walczyć o drugi w karierze
52934,20170217,2017-02-17,Ewa Tylman,"5,000+",Zabójstwo Ewy Tylman Zeznania złożył partner 26latki Sąd,Podczas piątkowej rozprawy w procesie Adama Z oskarżonego o zabójstwo Ewy Tylman sąd poinformował że sprawa może być także rozstrzygnięta pod kątem innej kwalifikacji prawnej  nieudzielenia pomocy za co grozi kara do 3 lat pozbawienia
52935,20170217,2017-02-17,Hearthstone,"2,000+",Hearthstone  duże zmiany w grze i aż trzy nowe dodatki w 2017 roku,A to nie koniec Do Hearthstone zmierzają też nagrody za codzienne logowanie się do gry które zostaną wprowadzone na kilka tygodni przed debiutem pierwszego tegorocznego dodatku Oprócz tego otrzymamy też nowego bohatera  Maiev Pieśń Cienia
52936,20170217,2017-02-17,Jagiellonia,"5,000+",LOTTO Ekstraklasa Jagiellonia nie dała szans Górnikowi,Jagiellonia zmazała plamę z poprzedniej serii spotkań i wysoko pokonała Górnika Łęczna na swoim stadionie 50 20 Bohaterem był Konstantin Vassiljev który zdobył dwie bramki i zanotował dwie asysty Przyjezdni natomiast w dwóch ostatnich meczach
52937,20170217,2017-02-17,Kourtney Kardashian,"2,000+",Kim Kardashian obraziła swoje siostry na Snapchacie Khloe i Kourtney nieźle jej podpadły,Kim Kardashian ostatnio nieźle wkurzyła się na swoje siostry i oczywiście pożaliła się na nie fanom na Snapchacie Co takiego się stało Otóż Kourtney i Khloe spóźniły się prawie godzinę na zajęcia z trenerem personalnym przez co Kim spędziła godzinę
52938,20170217,2017-02-17,Lechia Gdańsk,"5,000+",LOTTO Ekstraklasa Lechia Gdańsk straciła trzy punkty w ostatnich,Lechia Gdańsk była o krok od zdobycia kolejnych trzech punktów prowadziła 10 po golu Sławomira Peszki jednak w ostatnich sekundach doliczonego czasu gry sędzia podyktował rzut karny dla BrukBet Termaliki Nieciecza Do siatki trafił Vladis
52939,20170217,2017-02-17,Marilyn Monroe,"2,000+",Niepublikowane zdjęcia ciężarnej Marilyn Monroe trafiły do sieci,Zdjęcia zostały wykonane 8 lipca 1960 roku przed studiem Fox w Nowym Jorku po próbach charakteryzacji do filmu Skłóceni z życiem w którym obok Monroe wystąpili Clark Gable i Montgomery Clift Na fotografiach Marilyn Monroe jest w pierwszych
52940,20170217,2017-02-17,Pogba,"2,000+",Ciągłe rozmowy braci Pogba zirytowały Roya Keanea,W mecz Ligi Europy pomiędzy Manchesterem United a SaintEtienne po raz pierwszy naprzeciw siebie stanęli Florentin i Paul Pogba Bracia na boisku dość często wymieniali między sobą uwagi co zirytowało część obserwujących na czele z byłym graczem
52941,20170217,2017-02-17,Pokemon GO,"10,000+",Zamiast spać łapałem Pokemony 2 generacji Oto efekty i zmiany,Niantic od tygodni dawało sygnały że druga generacja Pokemonów trafi do Pokemon GO W kodzie gry już od dawna można było znaleźć odniesienia do nowych gatunków ale dopiero kilka dni temu firma oficjalne zapowiedziała ich wprowadzenie do gry
52942,20170217,2017-02-17,Potop,"2,000+",Pamiętacie jak kręcono Potop na Jasnej Górze,Jest to krótki film dokumentalny z okresu kręcenia w Częstochowie Potopu Jerzego Hoffmana  mówi Krzysztof Kasprzak organizator pokazu  Są to ujęcia nieżyjącego już Feliksa Krajewskiego które udostępniła jego wnuczka Agnieszka Gephard
52943,20170217,2017-02-17,Scarlett Byrne,"5,000+",Scarlett Byrne gwiazda Harryego Pottera rozebrała się dla,Rok temu w redakcji Playboya zapadła decyzja która wywołała niemałe kontrowersje Postanowiono że ze stron magazynu dla panów zniknie zupełnie nagość 14 lutego Cooper Hefner syn Hugh ogłosił jednak że Playboy wraca do publikowania
52944,20170217,2017-02-17,Wynik meczu Legia Ajax,"5,000+",Legia  Ajax Lasse Schoene rozczarowany wynikiem,Ajax Amsterdam stworzył w czwartkowy wieczór więcej sytuacji od warszawskiej Legii jednak nie zdołał ich wykorzystać Swoje dołożył też arbiter który nie uznał prawidłowo zdobytego gola Davyego Klaassena Nieskuteczny byli też gospodarze dlatego
52945,20170217,2017-02-17,Zelandia,"2,000+",Naukowcy ogłosili mamy nowy kontynent 94 proc znajduje się pod,Zelandia znajduje się w południowozachodniej części Pacyfiku i mierzy 49 mln km kwadratowych Jak oszacował zespół naukowców pod przewodnictwem dr Nicka Mortimera obszar ten oderwał się od Australii 6085 milionów lat temu Wtedy też ponad 90
52946,20170217,2017-02-17,Zerwany Kłos,"5,000+",Do kin wchodzi film Zerwany Kłos o błogosławionej Karolinie,Reżyser i scenarzysta filmu Witold Ludwig stwierdził że Zerwany Kłos jest odpowiedzią na postmodernistyczną cywilizację  Jest wyzwaniem rzuconym współczesnej cywilizacji postmodernizmowi i nihilizmowi Ten film pokazuje to co jest piękne i mądre
52947,20170217,2017-02-17,na granicy,"5,000+",Kosztowne selfie na granicy Polski z Rosją,W pobliżu granicy z Rosją patrol Straży Granicznej z Barcian zauważył dwóch mężczyzn podróżujących audi na mazowieckich numerach rejestracyjnych  Funkcjonariusze sprawdzili pas drogi granicznej i znaleźli tam ślady dwóch osób które dochodziły
52948,20170218,2017-02-18,Agata Nizińska,"10,000+",Eurowizja 2017 wnuczka Wojciecha Pokory w Krajowych,Kim jest Agata Nizińska  jedna z 10 uczestników Krajowych Eliminacji do Eurowizji 2017 Do tej pory znana była przede wszystkim z określenia wnuczka Wojciecha Pokory Jednak trzeba przyznać że Agata Nizińska to prawdziwie artystyczna dusza
52949,20170218,2017-02-18,Carmell,"20,000+",Krajowe Eliminacje do Eurowizji 2017 Carmell zaprezentuje piosenkę Faces,Carmell wokalistka autorka tekstów i muzyki a prywatnie córka aktorki Ewy Kasprzyk Carmell czyli Gosia Bernatowicz swoją muzyczną podróż rozpoczęła tworząc muzykę w duecie MASHMISH z którym dotarła do finału muzycznego show Must Be The
52950,20170218,2017-02-18,Charlotte McKinney,"2,000+",23letnia modelka zapewnia MOJE PIERSI SĄ PRAWDZIWE Mam je od 14 roku życia,Charlotte McKinney to kolejna modelka z Instagrama która popularność zyskała dzięki zamieszczaniu w sieci odważnych zdjęć Ze względu na swoją pełniejszą jak na standardy panujące w branży modowej figurę została okrzyknięta nową Kate Upton
52951,20170218,2017-02-18,Doda,"10,000+",Doda na Eurowizji 2017 Zaśpiewała piosenki zwycięzców konkursu,Doda wystąpiła na polskich preselekcjach do Eurowizji 2017 Najpierw na scenie zaprezentowali się artyści którzy walczyli o bilet do Kijowa a w trakcie głosowania jako gość specjalny koncertu wystąpiła królowa Doda Gwiazda na początku zaprezentowała
52952,20170218,2017-02-18,Helena Kmieć,"2,000+",Pogrzeb Heleny Kmieć wolontariuszki zamordowanej w Boliwii,Wieczorem w sanktuarium Matki Bożej Fatimskiej w Trzebini rozpocznie się msza święta w intencji Heleny Kmieć wolontariuszki zamordowanej w Boliwii Pogrzeb który będzie miał charakter państwowy zaplanowano na niedzielę Uroczystości odbędą się
52953,20170218,2017-02-18,Jared Leto,"2,000+",Jared Leto i Angelina Jolie mają romans Spotykali się już kiedyś,Jak czytamy na Hollywood Life sytuację wykorzystał dawny kochanek Jolie Jared Leto Jared i Angelina mieli romans wiele lat temu  podaje portal  To była przyjaźń z korzyściami Jak czytamy na stronie para nigdy nie była oficjalnie razem bo
52954,20170218,2017-02-18,Kasia Moś,"100,000+",Eurowizja 2017 Kasia Moś wygrała polskie eliminacje do konkursu,Kasia Moś wygrała polskie preselekcje do Eurowizji 2017 Wokalistka zwyciężyła wraz ze swoją konkursową propozycją Flashlight Reprezentantka Polski na Eurowizji 2017 zmierzy się w pierwszym półfinale konkursu który odbędzie się 9 maja Jeżeli uda
52955,20170218,2017-02-18,Kinga Rusin,"2,000+",Kinga Rusin i Piotr Kraśko pokłócili się w Dzień Dobry TVN,Kinga Rusin i Piotr Kraśko znają się jak łyse konie Ich przyjaźń rozpoczęła się jeszcze w dzieciństwie gdyż oboje wychowywali się na tym samym osiedlu Gdy po odejściu z TVP Piotr Kraśko przyjął pracę prowadzącego Dzień Dobry TVN Kinga bardzo się
52956,20170218,2017-02-18,Lanberry,"10,000+",EUROWIZJA 2017 Małgorzata Lanberry Uściłowska Only Human,Małgorzata Lanberry Uściłowska ma 29 lat Pochodzi z Wyszkowa Singiel Małgorzaty Lanberry Uściłowskiej Podpalimy świat pojawiał się w 2015 roku na playlistach największych stacji radiowych Piosenka Only Human to anglojęzyczna wersja utworu
52957,20170218,2017-02-18,Logan,"2,000+",Logan Wolverine jeździec znikąd RECENZJA,W tym ukrywający się Logan Hugh Jackman który wraz z Calibanem Stephen Merchant opiekuje się zniedołężniałym Charlesem Xavierem Patrick Stewart i usiłuje zapić się na śmierć gdzieś przy meksykańskiej granicy W realizacji tego ambitnego planu
52958,20170218,2017-02-18,Michał Szpak,"5,000+",Michał Szpak zachwycił podczas preselekcji do Eurowizji Jego,Michał Szpak zachwycił swoim występem Podczas polskich preselekcji do Eurowizji nie mogło zabraknąć naszego zeszłorocznego reprezentanta w międzynarodowym konkursie piosenki Michał Szpak pojawił się na scenie i wykonał swój hit Color Of Your
52959,20170218,2017-02-18,Oskar,"5,000+",Siatkówka Transfer medyczny nie dla ZAKSY Oskar Kaczmarczyk,USA  Francja 31 Taylor Sander Maxwell Holt i Micah Christenson oraz Kevin Tillie SERGIO MORAESREUTERS Zobacz zdjęcia 2 Od 20 kolejki PlusLigi ZAKSA KędzierzynKoźle gra bez kontuzjowanego Kevina Tillie i na razie nie wiadomo czy
52960,20170218,2017-02-18,Paul Walker,"2,000+",Córka Paula Walkera oskarża Porsche Pracownicy śmiali się z,Przypominamy że córka Paula Walkera obwinia koncern Porsche za śmierć ojca Zdaniem dziewczyny firma wiedziała że model Carrera GT jest ciężki w prowadzeniu Aż 200 z 1280 sprzedanych modeli rozbiło się dwa lata po sprzedaży Jednak firma nie
52961,20170218,2017-02-18,Pokot,"10,000+",Berlinale 2017 Pokot Agnieszki Holland nagrodzony Srebrnym Niedźwiedziem,Pokot Agnieszki Holland zdobył Nagrodę im Alfreda Bauera dla filmu otwierającego nowe perspektywy artystyczne  Jak wygląda bohater albo złoczyńca w klasycznym thrillerze  pytała ze sceny Berlinale Palast wręczająca Nagrodę im Bauera aktorka
52962,20170218,2017-02-18,Ranking FIFA,"2,000+",Ranking FIFA Reprezentacja Polski awansuje na historyczne 12,Dopiero co reprezentacja Polski awansowała na 14 miejsce w rankingu FIFA najwyższe w historii tego notowania a już wiadomo że na tym nie koniec Branżowy portal footballrankingsinfo poinformował że w nowym zestawieniu Białoczerwoni znajdą
52963,20170218,2017-02-18,UFG,"5,000+",Chcesz tańszego ubezpieczenia Dbaj o jego historię w UFG,Wraz ze wzrostem cen ubezpieczenia OC zwiększyła się też lista osób odwiedzających portal UFG pozwalający zapoznać się z ubezpieczeniową historią danego kierowcy To właśnie ona w dużej mierze decyduje o wysokości składek naliczanych przez
52964,20170218,2017-02-18,Śląsk Wrocław,"2,000+",Śląsk Wrocław sprowadzi nowego napastnika,Węgier Bence Mervo do Śląska Wrocław trafił w lutym 2016 roku W poprzednim sezonie 21letni napastnik rozegrał dla WKSu dziesięć meczów i strzelił w nich cztery gole W bieżących rozgrywkach tak skuteczny już nie był Piłkarz wystąpił w jedenastu
52965,20170219,2017-02-19,Bonus BGC,"5,000+",Błyskawiczny nokaut Bonus BGC zalicza pierwsze zwycięstwo w MMA ZDJĘCIA,Piotr Witczak czyli Bonus BGC zanotował pierwsze zwycięstwo w mieszanych sztukach walki Początkujący muzyk oraz celebryta potrzebował zaledwie kilkunastu sekund żeby rozprawić się z Krzysztofem Ciesielskim Pojedynek był jedną z głównych
52966,20170219,2017-02-19,Cracovia,"2,000+",Piątek czyli najskuteczniejszy młody Polak Remis Cracovii z Pogonią,Cracovia wprawdzie ściągnęła w lecie dwóch snajperów ale Mateusza Szczepaniaka szkoleniowiec częściej wystawiał na skrzydle a Krzysztof Piątek za którego krakowianie zapłacili Zagłębiu Lubin ponad dwa miliony złotych  drugi najwyższy transfer w
52967,20170219,2017-02-19,Danuta Szaflarska,"200,000+",Danuta Szaflarska nie żyje Wybitna aktorka miała 102 lata,Danuta Szaflarska urodziła się 6 lutego 1915 roku w odciętej od świata wiosce Kosarzyska na Sądecczyźnie Już jako nastolatka lubiła występować na scenie ale jak sama przyznawała wtedy nawet nie śmiała marzyć o profesjonalnej karierze  To było dla
52968,20170219,2017-02-19,Doda Eurowizja,"2,000+",Doda największą gwiazdą polskich preselekcji do Eurowizji,Wczoraj wieczorem odbył się finał polskich preselekcji do Eurowizji 2017 W siedzibie Telewizji Polskiej zaprezentowało się 10 artystów którzy walczyli o bilet do Kijowa To właśnie tam 9 11 i 13 maja 2017 odbędą się półfinały i finał konkursu
52969,20170219,2017-02-19,Elvis Kokalovic,"2,000+",Lech Poznań finalizuje kolejne wzmocnienie Elvis Kokalović na,Lech Poznań finalizuje kolejne wzmocnienie Elvis Kokalović na testach medycznych Elvis Kokalović będzie kolejnym wzmocnieniem Lecha Poznań Do finalizacji transferu brakuje już tylko pozytywnego przejścia testów medycznych które rozpoczną się w
52970,20170219,2017-02-19,Hertha Bayern,"5,000+",Gol Roberta Lewandowskiego w 96 minucie Hertha  Bayern 11,Bayern wciąż był bezradny w ataku i nie minęło dziesięć minut drugiej części a trener wysłał Lewego na rozgrzewkę Polak zmienił Arturo Vidala w 61 minucie i już po chwili zarobił żółtą kartkę Pierwszą dobrą okazję miał w 70 minucie ale
52971,20170219,2017-02-19,Jennifer Grey,"2,000+",Jennifer Grey wspomina słynną scenę w wodzie z Dirty Dancing,Swayze zmagał się z bolesną raną nogi przez co cierpiał istne katusze  zdradziła Grey w najnowszym wywiadzie udzielonym Sunday People Podczas kręcenia sceny panowały bardzo niskie temperatury co szczególnie doskwierało Grey Najbardziej
52972,20170219,2017-02-19,Justyna Kowalczyk,"5,000+",Justyna na piątkę Kowalczyk tuż za podium w Otepaeae,Najlepsza polska biegaczka nie weszła na podium w Otepää ale w Lahti będzie się liczyła w walce o medal Justyna Kowalczyk zajęła piąte miejsce w biegu na 10 km techniką klasyczną w Otepaeae Zdecydowane zwycięstwo odniosła Marit Bjoergen która
