index,dayId,date,name,traffic,newsTitle,newsSnippet
17904,20170326,2017-03-26,Ivanka Trump,"1,000+",Ivanka Trump dělá sousedům peklo Hnijící odpadky kolony aut,Bydlení v luxusní washingtonské čtvrti Kalorama se pomalu stává nesnesitelným kvůli novým nájemníkům Ivance Trumpové a Jaredu Kushnerovi dceři a zeti nového prezidenta Napsala to agentura AP s odvoláním na stížnosti sousedů Po ulicích se válejí
17905,20170326,2017-03-26,Lucie Hunčárová,"5,000+",Tanečnice Hunčárová a kuchař Ridi Po rozchodu s Onderem,Nikdo třetí v tom není Jako mantra tahle slova zněla podobně jako u mnohých hvězdných párů také při rozpadu osmiletého partnerství tanečníků ze StarDance Jana Ondera 31 a Lucie Hunčárové 31 Teď se zdá že opak asi je pravdou a že se potvrzuje
17906,20170326,2017-03-26,Martin Dejdar,"2,000+",Martin Dejdar má druhé Vánoce V trenýrkách rozžhavil diváky,Martin Dejdar je prostě dokonalý showman pro kterého jsou taneční kreace hračka Jako Billy Mack strhl neuvěřitelnou show která vygradovala když shodil svršky i spodky a píseň Christmas is All Around z filmu Láska nebeská dozpíval jen v trenýrkách
17907,20170326,2017-03-26,Moto Gp,"1,000+",Velká cena Kataru  MotoGP,I přes počáteční problémy s počasím máme závod královské třídy MotoGP zdárně za sebou a rozhodně se jednalo o skvělou podívanou V úvodu to vypadalo na velkou senzaci když se dostal do vedení nováček Johann Zarco jenž na satelitní Yamaze všem
17908,20170326,2017-03-26,Nova Sport,"1,000+",Detroit přemohl Minnesotu v prodloužení Vyrovnával Tatár,Diváci v detroitské Joe Louis Areně sledovali velmi disciplinovaný hokej Rozhodčí v něm rozdali na každé straně jen po dvou trestech K vidění byl naopak napínavý hokej který dospěl až do prodloužení V něm o výhře Detroitu nad Minnesotou rozhodl
17909,20170326,2017-03-26,Zachraňte vojína Ryana,"2,000+",TOP 3 I geniální Spielbergův film Zachraňte vojína Ryana má,Hvězdně obsazené drama režiséra Stevena Spielberga vypráví silný příběh poskládaný ze vzpomínek vojína Ryana Matt Damon Ten se odehrává během druhé světové války kdy se válečná jednotka kapitána Millera Tom Hanks vyloďuje 6 června 1944
17910,20170326,2017-03-26,hodiny,"1,000+",Barokní hodiny se v Praze nevydražily prodej mohl být rekordní,Praha  Unikátní barokní astronomické hodiny z doby Ludvíka XV se dnes v Praze nevydražily Hodiny které by podle odborníků mohly zdobit ty nejprestižnější světové muzejní sbírky mířily do aukce s nejvyšší vyvolávací cenou na tuzemském trhu se
17911,20170327,2017-03-27,Spinarova Zemrela,"5,000+",Špinarová 65 před smrtí mluvila o Heidi Janků Někdy z ní mám,Zpěvačka Věra Špinarová 65 v neděli zemřela v motolské nemocnici Žena s nepřekonatelným hlasem se před nečekanou smrtí rozhodla ukázat televizi svoje bydlení Televizní štáb přivedla do své chalupy ve vesnici u Ostravy kde léta žila a nedala na ni
17912,20170327,2017-03-27,Věra Špinarová,"100,000+",Zemřela Věra Špinarová zpěvačka hitů Bílá jawa 250 či Jednoho,Praha  Ve věku 65 let zemřela v neděli v pražské motolské nemocnici Věra Špinarová Minulý týden ve středu zkolabovala při koncertu v Čáslavi měla zástavu srdce Zpráva o úmrtí zpěvačky která se se svým nenapodobitelným chraplavým hlasem
17913,20170328,2017-03-28,Den učitelů,"200,000+",Valachová na Den učitelů ocenila plaketou šikanovanou kantorku z,Ministryně školství Kateřina Valachová v úterý při Dni učitelů ocenila v Senátu in memoriam Ludmilu Vernerovou šikanovanou učitelku Střední průmyslové školy Na Třebešíně v Praze která zemřela loni v lednu Medaile za svou práci dostaly čtyři desítky
17914,20170328,2017-03-28,Jan Amos Komenský,"2,000+",Před 425 lety se narodil Jan Ámos Komenský na jeho počest se v,Do rodiny člena Jednoty bratrské se 28 března 1592 na Moravě narodil Jan Ámos Komenský Přesvědčení zděděné po rodičích hrálo v životě budoucího reformátora školství výraznou roli zejména po vypuknutí třicetileté války Tehdy hledal klid před násilně
17915,20170328,2017-03-28,Jiří Drahoš,"5,000+",Drahoš kandiduje na Hrad Politici to uvítali Ovčáček ho začal urážet,Bývalý předseda Akademie věd Jiří Drahoš se příští rok zúčastní klání o prezidentskou funkci Své rozhodnutí sdělil na besedě v kulturním domě v Jablunkově odkud pochází Drahošovu kandidaturu přivítali lídři KDUČSL hnutí STAN a TOP 09 zatímco
17916,20170328,2017-03-28,Polární záře,"1,000+",Na Slunci byla bouřka Češi ale zřejmě výslednou polární záři neuvidí,Silné sluneční erupce mohou vyvolat problémy některých elektronických systémů ale přinést i zajímavou podívanou Polární záře Aurora Borealis jak již název vypovídá je nejčastěji k vidění v mnohem severnějších oblastech Polární záře je
17917,20170328,2017-03-28,Seznam Cz,"20,000+",Nová libra je v oběhu Británie razí dosud nejzabezpečenější minci,Nejvíce zabezpečenou mincí budou platit ve Velké Británii Podle Královské mincovny lze novou jednolibrovou minci jen velmi těžko falzifikovat Prvky jsou v minci skryté a tak je dokáže odhalit pouze elektronický scan Kromě toho je na ní velmi těžce
17918,20170328,2017-03-28,Šárka Strachová,"2,000+",Je konec už žádná olympiáda Lyžařka Strachová ukončila kariéru,Ve druhém kole jela perfektně nestačila jen na suverénku Mikaelu Shiffrinovou a posunula se z deváté příčky na konečnou pátou O další medaili už bojovat nebude Ve dvaatřiceti letech Šárka Strachová  královna českého lyžování  svou bohatou kariéru
17919,20170329,2017-03-29,BREXIT,"1,000+",BREXIT Den B,Ode dne historického referenda uplynulo devět měsíců a pár dní brexit je tedy mírně přenošeným dítětem Zdržení bylo způsobeno zejména právní nejistotou co vlastně v případě výsledku Leave přesně dělat Zákon o referendu totiž řešil spoustu drobností
17920,20170329,2017-03-29,Kelly Family,"1,000+",Legendární Kelly Family vystoupí v Praze,The Kelly Family ale zahrají také písně ze své nové desky We Got Love kterou vydali po dlouhých dvanácti letech Svou kariéru odstartovala rodinka v roce 1974 ale po mnoha letech se nakonec vydalo několik členů vlastní cestou Oficiálně se rozpadli v
17921,20170329,2017-03-29,Kometa Brno,"1,000+",Nečas první duel rozsekl pro Kometu bruslí Nechtěl jsem to kopnout,Suverenitu klid při rozehrávce a produktivitu si brněnský hokejový klenot Martin Nečas přenesl v play off i do semifinále a po Spartě svým gólem na úvod série šokoval i hradecký Mountfield v prvním semifinále Při výhře Komety 20 byla jeho úvodní
17922,20170329,2017-03-29,Krajta mřížkovaná,"1,000+",Sedmimetrová krajta pozřela dospělého muže našli ho v jejích,Neobvyklý případ usmrcení dospělého člověka krajtou oznámila místní policie z indonéského ostrova Sulawesi Při pátrání po nezvěstném zemědělci na palmové plantáži nalezli vesničané sedmimetrovou krajtu mřížkovanou která zjevně zažívala rozměrnou
17923,20170329,2017-03-29,Samsung Galaxy S8,"10,000+",Samsung Galaxy S8 Chtěli jste revoluci Tady ji máte,Čekání je u konce Samsung v Londýně představil špičkové modely pro nadcházející sezónu Galaxy S8 a větší S8 Revoluce je hojně zneužívané slovo ale jestli tak mám označit některou z jarních premiér pak je to právě S8 Jaké jsou její největší
17924,20170330,2017-03-30,Eva Samková,"1,000+",Samková na olympiádu nemyslí Je to strašně daleko,Možná se o tom doma hádáte kdo byl českou královnou zimy Je to těžká volba Opět zářila biatlonová kráska Gabriela Koukalová Rychlobruslařka Martina Sáblíková sklízela tituly Snowboardistka Ester Ledecká nadchla medailemi celkovým triumfem ve
17925,20170330,2017-03-30,Forum Karlín,"1,000+",LIVE Parkway Drive a spol rozmetali Forum Karlín na padrť Jejich,Kdo je vlastně nejlepší Parkway Drive Asking Alexandria nebo Stick To Your Guns Všechny tři party mají něco do sebe a protože si spolu rozumí vyrazily na turné které může znít příznivcům žánru jako splněný sen Jak se jim v Praze dařilo
17926,20170330,2017-03-30,Intervence,"1,000+",Zeman Intervence snad brzo skončí a exportéři přestanou lenošit,Prezident Miloš Zeman je rád že snad v nejbližší době skončí intervence České národní banky proti silné koruně Za hlavní přínos považuje to že čeští exportéři už nebudou lenošit na nafouknutém kurzovém polštáři budou muset zlepšit produktivitu
17927,20170330,2017-03-30,Mironet,"1,000+",Mironet má nárok na odškodné za zátah policie tvrdí odvolací soud,Stát může po více než sedmnácti letech přijít o více než 600 milionů korun kvůli zásahu policie který počátkem roku 2000 takřka zlikvidoval raketově rostoucí firmu Mironet Ta byla tehdy největším prodejcem počítačů přes internet jenže policie u ní
17928,20170330,2017-03-30,Stavka Autobusů,"2,000+",Stávka bude masivní Na jižní Moravě se zapojí osmdesát procent,Stávka bude masivní Na jižní Moravě se zapojí osmdesát procent řidičů autobusů Jižní Morava  Masivní Taková má být stávka řidičů autobusů na jižní Moravě která se uskuteční příští čtvrtek 6 dubna Do stávky se zapojí osmdesát procent řidičů
17929,20170331,2017-03-31,Emir Kusturica,"1,000+",Neuvěřitelný rozhovor Emira Kusturici s Emmou Smetana Hlasitě se,Srbský filmový režisér hudebník a aktivista Emir Kusturica poskytl rozhovor internetové televizi DVTV Vysvětlil v něm proč podporuje ruského prezidenta Vladimira Putina Rusko označil za jednu z menších zemí ve světě ačkoli jde o největší stát na
17930,20170331,2017-03-31,Kateřina Němcová,"1,000+",Rosnička Novy Katka Němcová na čas zmizí z obrazovky Kvůli,Ono už se ve druhém měsíci začalo spekulovat o tom jestli jsem přibrala nebo jsem byla na plastice prsou svěřila se Katka Němcová webu Tncz Šťastný páreček pomalu ale jistě začíná plánovat život s miminkem a už dokonce ví co se jim narodí
17931,20170331,2017-03-31,Patrik Eliáš,"1,000+",Eliáš si už v NHL nezahraje Jeho výjimečná mise u Ďáblů skončila,Český hokejový útočník Patrik Eliáš ukončil svou kariéru v NHL v níž strávil 20 sezón výhradně v dresu New Jersey Devils S Ďábly vyhrál dvakrát Stanleyův pohár V pátek se tato informace objevila na stránkách klubu Český útočník v letošní sezóně
17932,20170331,2017-03-31,Půlmaraton Praha,"1,000+",Půlmaraton a fotbalové derby Praha čeká na dopravní kolaps,Víkend nebude pro řidiče v Praze zrovna nejpříjemnější Hlavní město totiž bude svědkem dvou velkých sportovních akcí V sobotu se běží v centru každoroční půl maraton v neděli se hraje fotbalové derby mezi pražskou Spartou a Slavií Policie radí aby
17933,20170331,2017-03-31,SpaceX,"1,000+",Revoluce v letech do vesmíru SpaceX dnes v noci použil opakovaně první stupeň rakety,Americká společnost SpaceX si připsala další obrovský úspěch  jako první na světě opakovaně použila první stupeň nosné rakety k vynesení nákladu na oběžnou dráhu Země Do vesmíru vynesla komunikační družici která má zajišťovat televizní vysílání pro
17934,20170401,2017-04-01,Aprílové Žerty,"2,000+",aprilove zerty 2017,Kancelářské žertíky jsou nejen zábavné ale mohou také zlepšit vztahy ve vaší společnosti Pokud to s nimi přepísknete v nejhorším případě budete vyhozeni Pokud tedy nemáte šéfa který by měl pro takové žertíky pochopení raději si naše tipy nechte
17935,20170401,2017-04-01,Mapycz,"10,000+",Zazobaná Stověžov aneb Apríl českých mapových stránek,Aprílovou podobu uživatelům internetu nabízejí dvě hlavní české mapové stránky Zatímco Seznamcz převedl svoje Mapycz do textové podoby a někdy jen přesmyčkou jindy i s ironií přejmenoval česká města Google umožňuje lidem hrát ve svých mapách
17936,20170401,2017-04-01,Pohreb Very Spinarove,"5,000+",Na pohřeb Věry Špinarové míří davy Poklonit se jí přišel i Nohavica,Takové poslední rozloučení se známou osobností tu už dlouho nebylo Obřadní síň ostravského krematoria v němž se v sobotu od rána koná pohřeb Věry Špinarové 65 jež nedávno zesnula po srdečním kolapsu na koncertě je obsypaná stovkami jejich
17937,20170401,2017-04-01,Pražský půlmaraton,"5,000+",Rekordní Jepkosgeiová Pražský půlmaraton zažil zápis do historie,Pražský půlmaraton zatřásl historickými tabulkami Keňanka Joyciline Jepkosgeiová se v ulicích české metropole jako první žena dostala pod hranici hodiny a pěti minut Nové světové maximum má nyní její zásluhou hodnotu 10452 hodiny Mužům vládl
17938,20170402,2017-04-02,Ac Sparta Praha,"5,000+",PŘÍMÝ PŘENOS Slavia  Sparta Za domácí hraje Tecl za hosty,Odrazí se Slavia k vysněnému titulu nebo se do boje o čelo fotbalové ePojistenicz ligy ještě vrátí Sparta Vyhrocené pražské derby je tu a půjde v něm o hodně Domácí kouč Slavie Jaroslav Šilhavý poslal do základní sestavy Stanislava Tecla nechybí
17939,20170402,2017-04-02,Bethenny Frankel,"1,000+",Tyto dokonalé křivky patří dámám ve věku babiček Světové krásky mají v bikinách těla hezčí než mnohé dvacítky,Anglické moderátorce Melanii Sykes 46 i její stejně staré americké kolegyni Bethenny Frankel je skutečně co závidět Obě bedlivě dbají na zdravý životní styl A zatímco první zmiňovaná  moderátorka televizních pořadů Today with Des and Mel a Lets
17940,20170402,2017-04-02,Kometa Brno,"1,000+",Osm gólů a nula pro Čiliaka Kometa rozdrtila ve třetím semifinále,Brno Čiliak  O Němec Krejčík Kováčik Gulaši Bartejs Malec od 41 navíc F Král  M Erat J Hruška M Kvapil  Vincour L Čermák Dočekal  Haščák V Němec Zaťovič  H Zohorna Nečas Mallet  Vondráček Trenéři L Zábranský st
17941,20170402,2017-04-02,Michal Neuvirth,"1,000+",Český brankář Neuvirth při zápase NHL zkolaboval Měl by být v,V přerušeném čase sobotního zápasu NHL proti New Jersey se zničehonic zhroutil na led padl na záda a zůstal nehybně ležet Český hokejový brankář ve službách Philadelphie Michal Neuvirth se ihned ocitl v péči zdravotníků po nekonečných desítkách
17942,20170402,2017-04-02,Sparta Slavia,"20,000+",Slavia  Sparta 11 Škoda vyrovnal v nastavení z nafilmované penalty,Sparta přitom kvůli kartám Michala Kadlece a zranění Mazucha musela sestavit úplně novou stoperskou dvojici Mareček Holek A především zkušenější Holek předvedl zodpovědný výkon když slávistického útočníka Škodu nepustil vůbec do ničeho
17943,20170402,2017-04-02,Sport,"5,000+",HOKEJ ONLINE Pardubice v baráži poprvé vyhrály Jihlava hostí,V druhém utkání se poslední Pardubice dočkaly první výhry když v Karlových Varech vyhrály duel plný zvratů 54 po samostatných nájezdech a vykřesaly naději na záchranu Utkání z Jihlavy můžete sledovat v podrobné online reportáži na Sportcz
17944,20170403,2017-04-03,Gibraltar,"1,000+",Diplomaté se přou o Gibraltar někdejší lídr konzervativců hrozí,Jen několik dní po zahájení jednání o brexitu naplno propukla očekávaná diplomatická bitva o Gibraltar Španělsko území hodlá vybojovat za podpory Evropské unie Británie však ubezpečuje že poloostrov ochrání Bývalý předseda konzervativců situaci
17945,20170403,2017-04-03,Huawei P10,"2,000+",Přihlaste se prosím pod svým uživatelským jménem a heslem z,Huawei P10 je celokovový smartphone s úhlopříčkou displeje 51 palce který je vybaven druhou generací duálního fotoaparátu na jehož vývoji se opět podílela společnost Leica Hlavní fotoaparát 12MPx barevný snímač a 20MPx černobílý snímač nově
17946,20170403,2017-04-03,Kometa,"1,000+",NEJ z Kometa  Mountfield Jarůšek složil Malce Hruška mstil Erata,Vyhrocené čtvrté semifinálové utkání nabídlo spoustu zajímavých momentů už v 11 minutě dokonce napínavou bitku Brněnský Tomáš Malec během hromadné šarvátky vyprovokoval Richarda Jarůška který shodil rukavice a přesným pravým hákem ho
17947,20170403,2017-04-03,Miloš Zeman,"1,000+",Prezident Miloš Zeman navštíví Benešov dárek starosta zatím,Jak dlouho se prezident ČR Miloš Zeman zdrží při své návštěvě v Benešově Dorazit by měl ve čtvrtek 6 dubna kolem čtvrté odpolední Už v 1605 má naplánované setkání s představiteli města K setkání s prezidentem vyzýval zastupitele města starosta
17948,20170403,2017-04-03,Petrohrad,"5,000+",Výbuch v Petrohradu 11 mrtvých podle vyšetřování šlo o teror,6 listopadu 2008  Exploze minibusu ve Vladikavkazu metropoli Severní Osetie na jihu Ruska si vyžádala 12 mrtvých a 41 zraněných 17 srpna 2009  Při útoku dvou sebevražedných atentátníků na policejní stanici zahynulo v metropoli jihoruského
17949,20170403,2017-04-03,Pocasi Idnes,"2,000+",Čeká nás teplotní skok Ochladí se na 10 stupňů na horách může,Neobvykle vysoké teploty ze závěru března vystřídá v první dubnový týden chladnější počasí Na začátku týdne se sice teploty na řadě míst udrží nad 20 stupni v průběhu týdne ale klesnou k 10 C na horách bude i sněžit Během víkendu se mohou objevit
17950,20170403,2017-04-03,Tvoje tvář má známý hlas,"10,000+",Tvář mu vzala hlas Martin Dejdar už jen sípá,S velkými problémy se během třetí řady show Tvoje tvář má známý hlas potýká už několik týdnů Martin Dejdar 52 Maraton si vybral svou daň na jeho hlasivkách Herec sotva sípá Je to hrozně náročný Byl jsem teď delší dobu nemocný a přišel jsem
17951,20170404,2017-04-04,BBC,"1,000+",Trenér Moyes vyhrožoval reportérce BBC fackou pak se jí omluvil,Dnes 1049  VIDEO Trenér fotbalistů Sunderlandu David Moyes si zadělal na problém když reportérce BBC Vicki Sparksové vyhrožoval fackou Reagoval tak podrážděně na dotaz ohledně obav o svou pozici po bezbrankové remíze s Burnley v anglické lize
17952,20170404,2017-04-04,Hana Holišová,"1,000+",Český muzikál vykročil špatným směrem říká Hana Holišová,To jsou jen některé z inscenací ve kterých Hana Holišová hrála excelovala a také sbírala zkušenosti Dnes patří k největším hvězdám české muzikálové scény Přesto ji nevidí jen skrz růžové brýle Muzikál jde v Česku špatným směrem naznačuje
17953,20170404,2017-04-04,Idsjmk,"1,000+",Stávka bude potvrdili odboráři Ochromí autobusy v Jihomoravském,Samotní cestujcí si budou moci v den stávky najít informace nejrychleji přes mobilní aplikaci IDS JMK POSEIDON nebo iRIS které poskytují odjezdy ze zastávek Cestující mohou využít i speciálně zřízenou webovou stránku wwwidsjmkczodjezdy kde po
17954,20170404,2017-04-04,Magnesia Litera,"1,000+",Magnesia Litera Knihou roku je román o drsném dospívání v,PRAHA Knihou roku se v soutěži Magnesia Litera stal román Jezero který napsala Bianca Bellová Próza je drsným příběhem o dospívání a zároveň postapokalyptickým podobenstvím o zničení přírody po kterém následuje zpustošení lidských vztahů i duší
17955,20170404,2017-04-04,Mapa Exekucí,"1,000+",Nejčastěji jsou v exekuci lidé v Ústeckém kraji ukazuje mapa sítě,Lidé v exekuci jsou především na severu Čech Vyplývá to z unikátní webové Mapy exekucí zveřejněné dvěma nevládními organizacemi Nejhůře z jejich průzkumu vyšel kraj Ústecký stejně tak i okresy v tomto kraji Nejlépe si naopak vedou lidé na Vysočině
17956,20170404,2017-04-04,Meghan Markle,"1,000+",Herečka 36 která utáhla prince Harryho káže v Indii o menstruaci,Je nejen překrásnou ženou ale i bojovnicí za ženská práva a šiřitelkou osvěty Přítelkyně britského prince Harryho herečka Meghan Markle nyní vnáší světlo do tak tabuizovaného problému jakým je menstruace u indických žen Na první pohled pro
17957,20170404,2017-04-04,Wedos,"1,000+",Wedos má problémy s DNS na řadu webů se nedostanete,Aktuálně řešíme nedostupnost DNS z některých sítí Situaci analyzujeme Budeme informovat Děkujeme za pochopení Stručná informace která se večer objevila na facebookovém profilu hostingové firmy Wedos oficiálně potvrdila problémy které ve
17958,20170405,2017-04-05,Patrik Eliáš,"1,000+",Krásné loučení Eliášovi tleskala aréna odešel z NHL jako legenda,Se zámořskou NHL se rozloučila další velká hvězda Patrik Eliáš byl srdcař nikdy nezměnil dres a vždy bojoval za New Jersey Devils Dvakrát zvedal nad hlavu Stanley Cup letos ale byl nucen ukončit kariéru Měl na to právo to bez debat kdyby chtěl
17959,20170405,2017-04-05,Stanislava Jachnická,"2,000+",Sex v Ulici Denisa a Robert si to rozdají na stole Exkluzivní ukázka,Kdyby zdi mohly mluvit A zvláště pak ty radniční v Ulici Na povrch by jistě vyšlo nejedno politické tajemství a po dnešním díle i jedno milostné Mezi referentkou Denisou Mastnou a tiskovým mluvčím Robertem Bláhou totiž už dnes večer dojde k vášnivém
17960,20170405,2017-04-05,Stavka Autobusů Brno,"1,000+",Stávka řidičů nejvíc ochromí Blansko Brna či Znojma se skoro,Na jižní Moravě ve čtvrtek kvůli stávce řidičů autobusů zřejmě nevyjedou spoje na 67 autobusových linkách z 225 částečně pojedou na 71 linkách Spoje MHD v Brně a linky z Brna do okolních vesnic s označením do čísla 99 pojedou bez omezení naopak v
17961,20170405,2017-04-05,sarin,"2,000+",Lékaři bez hranic o chemickém útoku v Sýrii Děti zřejmě zabíjel sarin a chlór,Bezvládná těla dětí dospělých a proud vody z hadice která má z lidských tváří smýt neznámou látku Ta zabila jedenáct dětí a kolem šesti desítek dospělých Tým Lékařů bez hranic který poskytuje podporu urgentnímu příjmu v nemocnici Bab Al Hawa v
17962,20170406,2017-04-06,Alena Borůvková,"1,000+",Zeman Pokud manželka dělá ostudu pak ostudu dělá i velvyslanec,Alena Borůvková útočí například na sociální síti twitter na Zaorálka a další politiky státní úředníky a novináře Na twitter píše i desítky hanlivých příspěvků denně v některých případech jde o osobní a vulgární urážky Ministr zahraničí kvůli tomu
17963,20170406,2017-04-06,Dávid Hodek,"2,000+",FOTO Monika Bagárová má nového přítele a září štěstím Je to,Monika na smutek zapomněla a štěstí našla v novém příteli kterým je slovenský hudebník Dávid Hodek Ano je to pravda Gratuluji vám že jste to jako první zjistili přiznala Monika pro topkysk Známe se celý život On je intelektuálně velmi
17964,20170406,2017-04-06,FlixBus,"1,000+",Zelení proti žlutým FlixBus přidává v Česku další linky,Autobusový dopravce FlixBus dál zahustí konkurenci na dálkových linkách z Česka Bojovat o cestující bude hlavně s RegioJetem Od čtvrtka spustí nové trasy z Brna do své sítě nově zahrnuje Ostravu a Olomouc Další expanzi oznámila firma ve středu v
17965,20170406,2017-04-06,Geoffrey Rush,"1,000+",Einstein byl jako Chaplin představuje hollywoodská hvězda,Chaplin se proslavil tím jak ovlivnil němý a později i mluvený fim Einstein napsal obecnou teorii relativity které sice nikdo nerozuměl ale i přesto se stal ikonou usmívá se Geoffrey Rush Právě on ztvárnil postavu Alberta Einsteina v seriálu
17966,20170406,2017-04-06,Kajinek,"5,000+",Zázraky se snad dějí řekl Kajínek k možné milosti od prezidenta,Doživotně odsouzený Jiří Kajínek by si případné milosti od prezidenta Miloše Zemana prý velmi vážil Právu aktuální reakci samotného Kajínka zprostředkovala jeho velmi blízká přítelkyně která je s ním v pravidelném osobním a telefonickém kontaktu
17967,20170406,2017-04-06,Kurz Euro,"20,000+",ČNB ukončila intervence koruna začala posilovat,Koruna se po oznámení konce režimu devizových intervencí pohybuje pod hranicí 27 KčEUR Nejvýrazněji byl kurz rozkolísaný v prvních pěti minutách Do 1330 bylo maximem 2673 KčEUR naopak minimem téměř 2713 KčEUR Vyplývá to z údajů Patria
17968,20170406,2017-04-06,Libuše Havelková,"10,000+",Zemřela herečka Libuše Havelková babička z Kouzelné školky,V dvaadevadesáti letech zemřela herečka Libuše Havelková Matka herce a zpěváka Ondřeje Havelky působila v Národním divadle Uplatnila se však i v rozhlase televizi dabingu i filmu Televizní veřejnost ji zná třeba jako babičku z Kouzelné školky
17969,20170406,2017-04-06,Lucie Bílá,"1,000+",Lucie Bílá vždycky chtěla umřít jako Špinarová na jevišti teď to,Rozloučila jsem se svým způsobem zapálila jsem svíčku řekla Supercz Bílá která však se Špinarovou neměla tak blízký vztah jak by se mohlo zdát Měla jsem ji moc ráda vážila jsem si jí Ale v životě jsme se potkaly jen dvakrát Jednou na jevišti
17970,20170406,2017-04-06,Martina Randová,"1,000+",Z nevkusné uklízečky elegantní milionářkou Hvězda Ordinace,Herečka Martina Randová se divákům Ordinace v růžové zahradě do paměti zapsala jako uklízečka s prořízlou pusou a výrazným módním nevkusem S tím je teď konec Ruku v ruce s milióny které seriálová Heluš zdědila jde její nová vizáž Když jsem se
